Tweet Id,Ticker,Datetime,Text,Favs,RTs,Followers,Following,Is a RT,Sentiment
730125123789934592,pcar,2016-05-10 19:59:00,nasdaq100 performance trip wdc ntes akam bmrn amzn pcar endp tmus aal regn mu ctxs,0.0,0.0,854.0,7.0,False,1
730111722036576256,pcar,2016-05-10 19:06:00,paccar inc pcar stock rating reaffirmed credit suisse,0.0,0.0,396.0,10.0,False,1
730105133028106240,pcar,2016-05-10 18:40:00,pcar bid size see greater pcar av smh,0.0,0.0,33.0,20.0,False,0
730062827478765572,pcar,2016-05-10 15:51:00,p500 performance dnb agn uri dvn akam amg wdc amzn oi glw sti ms pcar zion gs,0.0,0.0,854.0,7.0,False,1
730062757526159360,pcar,2016-05-10 15:51:00,nasdaq100 trend ctsh mdlz fb lvnta tmus esrx ntes adbe intu tsco ebay dish pcar qcom,0.0,0.0,854.0,7.0,False,0
730062688584380417,pcar,2016-05-10 15:51:00,nasdaq100 performance akam wdc amzn ntes lvnta pcar endp stx aal pcln ctxs nvda sbac,0.0,0.0,854.0,7.0,False,0
730024278511472640,pcar,2016-05-10 13:18:00,rt paccar pcar eli lilly co lly added us1 list bofa pfizer pfe removed,0.0,1.0,347.0,851.0,True,1
730024186207346689,pcar,2016-05-10 13:18:00,paccar pcar eli lilly co lly added us1 list bofa pfizer pfe removed,0.0,1.0,19188.0,242.0,False,1
729991386167058432,pcar,2016-05-10 11:08:00,esv last price see greater esv oxy pcar,0.0,0.0,57.0,40.0,False,1
729984592506052608,pcar,2016-05-10 10:41:00,mrk ideas see greater mrk ghl pcar,0.0,0.0,34.0,20.0,False,1
729966910616444928,pcar,2016-05-10 09:30:00,paccar fin europe publication listing particulars read,0.0,0.0,15.0,2.0,False,1
729960920231882752,pcar,2016-05-10 09:07:00,paccar inc pcar shares bought mason street advisors llc,0.0,0.0,1009.0,11.0,False,0
729960332618289152,pcar,2016-05-10 09:04:00,paccar inc pcar shares bought mason street advisors llc,0.0,0.0,6222.0,2293.0,False,1
729956767103373313,pcar,2016-05-10 08:50:00,united services automobile association boosts stake paccar inc pcar,0.0,0.0,396.0,10.0,False,0
729820504736018432,pcar,2016-05-09 23:49:00,pcar bullish analyst action bank america paccar,0.0,0.0,289.0,0.0,False,1
729795131792982016,pcar,2016-05-09 22:08:00,pcar us paccar inc pcar upgraded buy bank america inc,0.0,0.0,3349.0,249.0,False,1
729784457679515648,pcar,2016-05-09 21:25:00,paccar inc pcar earns hold rating credit suisse,0.0,0.0,712.0,8.0,False,1
729770249889796096,pcar,2016-05-09 20:29:00,analyst upgrades,0.0,0.0,4643.0,2565.0,False,0
729757891071090688,pcar,2016-05-09 19:40:00,analyst upgrades,0.0,0.0,4644.0,2565.0,False,0
729753806024507392,pcar,2016-05-09 19:24:00,amazing day another 10 trading idea laid premarket nailed vrx agle hznp nugt prgo pcar ddd ssys bidu ntla,0.0,0.0,5754.0,45.0,False,0
729739102073982978,pcar,2016-05-09 18:25:00,analyst upgrades,0.0,0.0,4644.0,2565.0,False,1
729728527939997697,pcar,2016-05-09 17:43:00,pcar market cap see greater pcar din ern,1.0,0.0,37.0,40.0,False,1
729727434640265216,pcar,2016-05-09 17:39:00,peak asset management llc raises position paccar inc pcar,0.0,0.0,1008.0,11.0,False,0
729727078220898304,pcar,2016-05-09 17:37:00,peak asset management llc raises position paccar inc pcar,0.0,0.0,6216.0,2293.0,False,0
729725324355772416,pcar,2016-05-09 17:30:00,paccar inc upgraded buy neutral bank america read,0.0,0.0,15.0,2.0,False,0
729713526709719040,pcar,2016-05-09 16:43:00,analyst upgrades,0.0,0.0,4643.0,2566.0,False,0
729712569288560641,pcar,2016-05-09 16:40:00,bank america upgrades paccar buy labels best breed cat de pcar,1.0,0.0,49679.0,1499.0,False,1
729701525480673280,pcar,2016-05-09 15:56:00,leahanne volume alert pcar 56.01 paccar inc pcar hit,0.0,0.0,2838.0,4278.0,False,0
729700751992193029,pcar,2016-05-09 15:53:00,volume alert pcar 56.01 paccar inc pcar hit high today 57.50 closing day 0 56.01 positive 0.47 positive 0.8,0.0,0.0,741.0,448.0,False,0
729683565923930113,pcar,2016-05-09 14:44:00,rt analyst says buy paccar u class 8 truck orders bottom pcar nav cmi cnhi full story,0.0,2.0,15583.0,6111.0,True,0
729683388903235584,pcar,2016-05-09 14:44:00,― analyst says buy paccar u class 8 truck orders bottom pcar nav cmi cnhi …,0.0,0.0,81115.0,80934.0,False,1
729683010845552640,pcar,2016-05-09 14:42:00,rt analyst says buy paccar u class 8 truck orders bottom pcar nav cmi cnhi full story,0.0,2.0,12647.0,4598.0,True,1
729682560561905664,pcar,2016-05-09 14:40:00,analyst says buy paccar u class 8 truck orders bottom pcar nav cmi cnhi full story,2.0,2.0,12692.0,130.0,False,1
729680881728643072,pcar,2016-05-09 14:34:00,analyst upgrades,0.0,0.0,4643.0,2566.0,False,0
729676593447084032,pcar,2016-05-09 14:17:00,― fly top five analyst upgrades glng slb pcar ozrk depo mo full story,0.0,0.0,81115.0,80934.0,False,1
729676004763918336,pcar,2016-05-09 14:14:00,fly top five analyst upgrades glng slb pcar ozrk depo mo full story,0.0,0.0,12692.0,130.0,False,1
729666866407460864,pcar,2016-05-09 13:38:00,monday top analyst upgrades downgrades point 3 oke pcar pgti snn tx tcbi wy wec,1.0,0.0,196851.0,271.0,False,0
729665448334139397,pcar,2016-05-09 13:32:00,analyst upgrades bncn bokf cma cnp cof comm cwst depo fis glng hbhc msl ozrk pb pcar tcbi zion,0.0,0.0,733.0,62.0,False,1
729661091173687296,pcar,2016-05-09 13:15:00,monday top analyst upgrades downgrades point 3 oke pcar pgti snn tx tcbi wy wec,0.0,0.0,834.0,46.0,False,0
729661066490220544,pcar,2016-05-09 13:15:00,analyst upgrades,0.0,0.0,4643.0,2567.0,False,0
729655627576795137,pcar,2016-05-09 12:53:00,may 9 analyst upgrades downgrades depo fisv mo pcar cnp fis ulta fang wday vale bbt,0.0,0.0,1338.0,44.0,False,1
729654454262235138,pcar,2016-05-09 12:49:00,top upgrades mo msl oke pb pcar snn strl tcbi wec zion,0.0,0.0,19178.0,243.0,False,1
729639724944654336,pcar,2016-05-09 11:50:00,rt snn cnp depo comm wec fis glng cof pcar oke fisv mo cma hbhc bokf pb zion msl tcbi bncn …,0.0,1.0,214815.0,10799.0,True,0
729639344210763778,pcar,2016-05-09 11:49:00,snn cnp depo comm wec fis glng cof pcar oke fisv mo cma hbhc bokf pb zion msl tcbi bncn cwst,4.0,1.0,15820.0,332.0,False,1
729639184395206660,pcar,2016-05-09 11:48:00,upside seen paccar european business improved,0.0,0.0,308.0,1.0,False,1
729639183203999744,pcar,2016-05-09 11:48:00,upside seen paccar european business improved,0.0,0.0,1355.0,29.0,False,1
729639181878579200,pcar,2016-05-09 11:48:00,upside seen paccar european business improved,0.0,0.0,21407.0,30.0,False,1
729636880816345088,pcar,2016-05-09 11:39:00,paccar upgraded bank america buy,0.0,0.0,4158.0,0.0,False,1
729634572808245249,pcar,2016-05-09 11:30:00,paccar inc upgrade bank america ranked 46 buy pcar,0.0,0.0,542.0,45.0,False,1
729634439257567234,pcar,2016-05-09 11:29:00,paccar upgraded bank america buy,0.0,0.0,4546.0,2839.0,False,0
729632204985262080,pcar,2016-05-09 11:20:00,bofa merrill lynch upgrades paccar pcar buy,0.0,0.0,3015.0,1.0,False,1
729286323090100224,pcar,2016-05-08 12:26:00,bnp paribas arbitrage sa sells 128945 shares paccar inc pcar,0.0,0.0,717.0,8.0,False,1
729027154231451652,pcar,2016-05-07 19:16:00,pcar financials see greater pcar xone ovas,0.0,0.0,50.0,40.0,False,1
728971812692885504,pcar,2016-05-07 15:36:00,elli stock forum see greater elli rf pcar,0.0,0.0,41.0,40.0,False,0
728906711906422784,pcar,2016-05-07 11:17:00,rt strongest con goods trends stz leg tap cl mjn cce nwl coh ip adm pcar pep cag mdlz ecl,0.0,1.0,42.0,165.0,True,1
728716971756400640,pcar,2016-05-06 22:43:00,rt 1234 bullish,0.0,1.0,596.0,687.0,True,0
728714301205319680,pcar,2016-05-06 22:33:00,1234 bullish,0.0,1.0,4636.0,2572.0,False,1
728637570913996800,pcar,2016-05-06 17:28:00,strongest con goods trends stz leg tap cl mjn cce nwl coh ip adm pcar pep cag mdlz ecl,0.0,1.0,14641.0,108.0,False,1
728590728184487940,pcar,2016-05-06 14:22:00,fin europe paccar inc form 10 read,0.0,0.0,15.0,2.0,False,1
728588316199759872,pcar,2016-05-06 14:12:00,pcar 57.5 puts buying activity expiring 20 may volume 390,0.0,0.0,1301.0,30.0,False,1
728584523017912320,pcar,2016-05-06 13:57:00,goldman upgrades machinery sector cautious neutral wbc pcar,0.0,0.0,957.0,2105.0,False,1
728577014467284993,pcar,2016-05-06 13:27:00,valueworks llc cuts stake paccar inc pcar,0.0,0.0,719.0,8.0,False,1
728520437966229505,pcar,2016-05-06 09:43:00,paccar inc pcar vp sells dollars 49174.75 stock,0.0,0.0,1138.0,40.0,False,1
728520293023649792,pcar,2016-05-06 09:42:00,paccar inc pcar ceo sells dollars 91897.76 stock,0.0,0.0,720.0,8.0,False,1
728520290746126336,pcar,2016-05-06 09:42:00,paccar inc pcar ceo sells dollars 91897.76 stock,0.0,0.0,720.0,8.0,False,1
728509127538806785,pcar,2016-05-06 08:58:00,fly bid see greater fly pcar lrcx,0.0,0.0,42.0,20.0,False,1
728489762919571456,pcar,2016-05-06 07:41:00,nati previous close see greater nati pcar snp,0.0,0.0,49.0,60.0,False,1
728484205957517312,pcar,2016-05-06 07:19:00,pcar percent change see greater pcar shrk sfe,0.0,0.0,52.0,40.0,False,1
728419150012370944,pcar,2016-05-06 03:00:00,cub eod data see greater cub pcar fls,0.0,0.0,46.0,40.0,False,0
728293525775847425,pcar,2016-05-05 18:41:00,paccar inc pcar shares bought mcdaniel terry co,0.0,0.0,372.0,10.0,False,1
728291147542573058,pcar,2016-05-05 18:31:00,pcar paccar inc shares bought mcdaniel terry co,0.0,0.0,625.0,5.0,False,1
728291031670771712,pcar,2016-05-05 18:31:00,pcar paccar inc shares bought mcdaniel terry co,0.0,0.0,160.0,0.0,False,1
728222853565386752,pcar,2016-05-05 14:00:00,busy new issue calendar today rdsaln efx twx bbt pcar el tapping market morning,0.0,0.0,1114.0,298.0,False,0
728099539664560131,pcar,2016-05-05 05:50:00,inc given hold rating credit suisse read,0.0,0.0,15.0,2.0,False,1
728081530359144448,pcar,2016-05-05 04:38:00,navistar international corp inc heres truck maker stocks down today read,0.0,0.0,15.0,2.0,False,0
728057645169410048,pcar,2016-05-05 03:04:00,pcar open see greater pcar grmn wafd,0.0,0.0,32.0,39.0,False,1
728043804138201089,pcar,2016-05-05 02:09:00,mnov pe ratio ratio see greater mnov gme pcar,0.0,0.0,33.0,40.0,False,0
728016779545448448,pcar,2016-05-05 00:21:00,paccar turns new wind tunnel develop fuel efficient trucks read,0.0,0.0,15.0,2.0,False,1
728016624322650112,pcar,2016-05-05 00:21:00,paccar turns new wind tunnel develop fuel efficient trucks read,0.0,0.0,15.0,2.0,False,1
727989428346494976,pcar,2016-05-04 22:32:00,parts opens new distribution center washington read,0.0,0.0,15.0,2.0,False,1
727988807098847233,pcar,2016-05-04 22:30:00,inc falls 3.4 percent may 04 read,0.0,0.0,15.0,2.0,False,1
727958330266796032,pcar,2016-05-04 20:29:00,pcar new sec filing pcar form 10 q no 0001193125 16 577596,0.0,0.0,104.0,6.0,False,1
727957737787662336,pcar,2016-05-04 20:27:00,paccar inc filed quarterly report marketable debt,0.0,0.0,286.0,27.0,False,0
727938361705402368,pcar,2016-05-04 19:10:00,nly news see greater nly szym pcar,0.0,0.0,52.0,40.0,False,1
727933797186965504,pcar,2016-05-04 18:51:00,ftr message board posts see greater ftr pcar prcp,0.0,0.0,31.0,39.0,False,1
727927137873895424,pcar,2016-05-04 18:25:00,rt truck makers dive report shows april class 8 orders down 16 percent sequentially nav pcar cmi full story,0.0,1.0,8651.0,7636.0,True,1
727926351701803008,pcar,2016-05-04 18:22:00,truck makers dive report shows april class 8 orders down 16 percent sequentially nav pcar cmi full story,0.0,1.0,12651.0,130.0,False,1
727785521968128003,pcar,2016-05-04 09:02:00,paccar parts taps east penn manufacturing supplier year read,0.0,0.0,15.0,2.0,False,1
727739403997687809,pcar,2016-05-04 05:59:00,paccar inc pcar shares bought e shaw co inc,0.0,0.0,712.0,8.0,False,1
727674865768124417,pcar,2016-05-04 01:43:00,pcar bullish analyst action baird paccar,0.0,0.0,285.0,0.0,False,1
727653085376446464,pcar,2016-05-04 00:16:00,ronald e armstrong sells 11783 shares inc stock read,0.0,0.0,15.0,2.0,False,1
727647454095650816,pcar,2016-05-03 23:54:00,insider selling paccar inc pcar vp sells 14405 shares stock,0.0,0.0,365.0,10.0,False,0
727647405722750976,pcar,2016-05-03 23:53:00,ronald e armstrong sells 11783 shares paccar inc pcar stock,0.0,0.0,1004.0,11.0,False,0
727646998875246592,pcar,2016-05-03 23:52:00,ronald e armstrong sells 11783 shares paccar inc pcar stock,0.0,0.0,6228.0,2295.0,False,1
727643821010505729,pcar,2016-05-03 23:39:00,bullish pullback,0.0,0.0,4629.0,2577.0,False,0
727632070361661440,pcar,2016-05-03 22:52:00,paccar inc pcar shares sold airain ltd,0.0,0.0,364.0,10.0,False,1
727619819135111168,pcar,2016-05-03 22:04:00,paccar inc chief executive officer picked up 1921 shares,0.0,0.0,283.0,27.0,False,0
727561180483600385,pcar,2016-05-03 18:11:00,pcar new insider transaction pcar vice president,0.0,0.0,478.0,0.0,False,0
727556453477789696,pcar,2016-05-03 17:52:00,pcar vice president reported purchase company stock valued dollars 06241,0.0,0.0,574.0,49.0,False,1
727520538822873088,pcar,2016-05-03 15:29:00,awesome looking bull flags drys pcar,0.0,0.0,355.0,67.0,False,1
727450741686833152,pcar,2016-05-03 10:52:00,commonwealth bank australia acquires 1226 shares paccar inc pcar,0.0,0.0,1000.0,11.0,False,1
727450194338533376,pcar,2016-05-03 10:50:00,commonwealth bank australia acquires 1226 shares paccar inc pcar,0.0,0.0,6221.0,2295.0,False,0
727393519615135745,pcar,2016-05-03 07:05:00,jbl stock forum see greater jbl pcar snc,0.0,0.0,35.0,40.0,False,1
727361062706630656,pcar,2016-05-03 04:56:00,ffg last price see greater ffg afmd pcar,0.0,0.0,31.0,40.0,False,1
727344831400308736,pcar,2016-05-03 03:51:00,umpq quotes see greater umpq pcar cray,0.0,0.0,37.0,20.0,False,1
727319524681248768,pcar,2016-05-03 02:11:00,pcar dividend see greater pcar ilmn aep,0.0,0.0,55.0,40.0,False,1
727314501918330882,pcar,2016-05-03 01:51:00,boh short sales see greater boh pcar wat,0.0,0.0,57.0,40.0,False,0
727308956020920321,pcar,2016-05-03 01:29:00,pcar bullish analyst action baird paccar,0.0,0.0,281.0,0.0,False,0
727266708067639296,pcar,2016-05-02 22:41:00,1234 bullish,0.0,0.0,4620.0,2578.0,False,1
727256096935530498,pcar,2016-05-02 21:58:00,vsat qqq pcar active hours seen speculatingstocks hours,0.0,0.0,735.0,617.0,False,0
727246653451698176,pcar,2016-05-02 21:21:00,seeing volume hours vsat qqq pcar qcom tlt,0.0,0.0,234.0,9.0,False,1
727223025792339968,pcar,2016-05-02 19:47:00,paccar inc pcar earns hold rating bmo capital markets,0.0,0.0,917.0,0.0,False,0
727214287874314241,pcar,2016-05-02 19:12:00,rbc capital reaffirms sector perform rating paccar inc pcar,0.0,0.0,1135.0,40.0,False,0
727213281501417472,pcar,2016-05-02 19:08:00,cummin hot cmi earnings preview,0.0,0.0,267.0,81.0,False,1
727177477190078464,pcar,2016-05-02 16:46:00,parts opens new dollars 2 million distribution center read,0.0,0.0,13.0,2.0,False,1
727064358547660800,pcar,2016-05-02 09:17:00,pcar chart see greater pcar ibm bcs,0.0,0.0,42.0,40.0,False,0
727000298393227264,pcar,2016-05-02 05:02:00,tcp stock message board see greater tcp pcar finl,0.0,0.0,31.0,40.0,False,0
726929944043868161,pcar,2016-05-02 00:22:00,overbought,1.0,0.0,4616.0,2579.0,False,1
726786605327998976,pcar,2016-05-01 14:53:00,weekly nasdaq100 trend mnst expe amzn mar lvnta bidu fb chtr pcar ulta sbac esrx tsco,0.0,0.0,851.0,7.0,False,1
726786535958417408,pcar,2016-05-01 14:53:00,weekly nasdaq100 performance mnst expe chtr amzn fb ntes mar lvnta pcar fast bidu mdlz,0.0,0.0,851.0,7.0,False,0
726767775595782144,pcar,2016-05-01 13:38:00,q4 2016 earnings forecast paccar inc pcar issued jefferies group,0.0,0.0,1138.0,40.0,False,1
726683690496069633,pcar,2016-05-01 08:04:00,q2 2016 earnings forecast paccar inc issued bb corp pcar,0.0,0.0,355.0,10.0,False,1
726681041621102592,pcar,2016-05-01 07:53:00,paccar inc pcar forecasted post second quarter 2016 earnings dollars .03 per share,0.0,0.0,1137.0,40.0,False,1
726468726518894592,pcar,2016-04-30 17:50:00,paccar inc pcar expected post fourth quarter 2016 earnings dollars .11 per share,0.0,0.0,716.0,8.0,False,1
726332906134708224,pcar,2016-04-30 08:50:00,paccar inc pcar post second quarter 2016 earnings dollars .02 per share bb corp forecasts,0.0,0.0,714.0,8.0,False,1
726222943865430016,pcar,2016-04-30 01:33:00,jefferies group weighs paccar inc’s fourth quarter 2016 earnings pcar,0.0,0.0,999.0,11.0,False,1
726222199804289024,pcar,2016-04-30 01:30:00,jefferies group weighs paccar inc’s fourth quarter 2016 earnings pcar,0.0,0.0,6210.0,2295.0,False,0
726215214375571456,pcar,2016-04-30 01:02:00,elder blue,0.0,0.0,4604.0,2583.0,False,0
726184845886537728,pcar,2016-04-29 23:02:00,nasdaq100 trend mnst amzn expe lvnta mar bidu fb chtr pcar ulta sbac siri tsco esrx dish,0.0,0.0,849.0,7.0,False,1
726175282009395200,pcar,2016-04-29 22:24:00,pcar new sec filing pcar form 8 k no 0001193125 16 570149,0.0,0.0,102.0,0.0,False,0
726173042544533504,pcar,2016-04-29 22:15:00,election,0.0,0.0,287.0,27.0,False,0
726139013657202688,pcar,2016-04-29 20:00:00,nasdaq100 trend mnst amzn expe bidu lvnta mar fb pcln pcar esrx sbac tsco dish chtr ulta,0.0,0.0,849.0,7.0,False,0
726138638694813696,pcar,2016-04-29 19:58:00,paccar inc forecasted post second quarter 2016 earnings dollars .03 per share pcar,0.0,0.0,999.0,11.0,False,1
726138136590430208,pcar,2016-04-29 19:56:00,paccar inc forecasted post second quarter 2016 earnings dollars .03 per share pcar,0.0,0.0,6209.0,2295.0,False,0
726100239418068992,pcar,2016-04-29 17:26:00,pcar bullish analyst action baird paccar,0.0,0.0,280.0,0.0,False,1
726078129744138241,pcar,2016-04-29 15:58:00,leahanne volume alert pcar 59.15 paccar inc pcar hit,0.0,0.0,3519.0,1996.0,False,1
726078120369881089,pcar,2016-04-29 15:58:00,leahanne volume alert pcar 59.15 paccar inc pcar hit,0.0,0.0,13489.0,421.0,False,0
726077586317688833,pcar,2016-04-29 15:56:00,volume alert pcar 59.15 paccar inc pcar hit high today 60.00 closing day 0 59.15 0.43 0.7,0.0,0.0,744.0,448.0,False,1
726077512904761344,pcar,2016-04-29 15:55:00,nasdaq100 trend mnst amzn expe bidu mar fb lvnta pcar dish esrx pcln mdlz sbac tsco fast,0.0,0.0,848.0,7.0,False,1
726041318179348482,pcar,2016-04-29 13:31:00,capital world investors increases position paccar inc pcar,0.0,0.0,348.0,10.0,False,1
726039723953672197,pcar,2016-04-29 13:25:00,golden cross 50 200 mas think pcar direction,0.0,0.0,331.0,512.0,False,1
726038602279346176,pcar,2016-04-29 13:21:00,golden cross slb rrc pcar upside come see chart,0.0,0.0,331.0,512.0,False,0
726028420921102336,pcar,2016-04-29 12:40:00,kcm investment advisors llc sells 808 shares paccar inc pcar,0.0,0.0,348.0,10.0,False,0
725988532242751488,pcar,2016-04-29 10:02:00,weekly nasdaq100 trend mu chtr mar pcar fb adsk fast esrx dish mdlz csx ebay vrsk tsco,0.0,0.0,847.0,7.0,False,0
725988462759915521,pcar,2016-04-29 10:01:00,weekly nasdaq100 performance mu pcar wdc stx dish chtr fast mdlz fb mnst adsk esrx csx,0.0,0.0,847.0,7.0,False,0
725871735388672003,pcar,2016-04-29 02:18:00,pcar bullish analyst action baird paccar,0.0,0.0,280.0,0.0,False,0
725822447933599744,pcar,2016-04-28 23:02:00,nasdaq100 trend chtr mar mu fb pcar adsk fast esrx dish mdlz csx ebay vrsk tsco nxpi,0.0,0.0,846.0,7.0,False,1
725817782596689922,pcar,2016-04-28 22:43:00,pcar us victory capital management inc cuts position paccar inc pcar inc,0.0,0.0,2743.0,276.0,False,1
725776585064865792,pcar,2016-04-28 19:59:00,nasdaq100 trend mu chtr mar pcar mdlz akam fb csx esrx txn siri adsk ebay fast qcom,0.0,0.0,846.0,7.0,False,0
725761127737614336,pcar,2016-04-28 18:58:00,call put highest percent volume changes calls kcg exc alxn fnv pcar puts pcar amba yndx dvax bhp,0.0,0.0,15094.0,2902.0,False,1
725745779961434112,pcar,2016-04-28 17:57:00,calvert investment management inc boosts position paccar inc pcar,0.0,0.0,710.0,8.0,False,0
725744979671408644,pcar,2016-04-28 17:54:00,paccar inc pcar receives sector perform rating rbc capital,0.0,0.0,997.0,11.0,False,0
725744976508899329,pcar,2016-04-28 17:54:00,paccar inc pcar receives sector perform rating rbc capital,0.0,0.0,997.0,11.0,False,1
725714788333002753,pcar,2016-04-28 15:54:00,nasdaq100 trend fb mu chtr mar siri nxpi txn pcar mdlz akam esrx bbby adsk ebay fast,0.0,0.0,846.0,7.0,False,0
725713326815088640,pcar,2016-04-28 15:48:00,bullish golden cross moving average cross pcar could sign strength thoughts…,0.0,0.0,329.0,512.0,False,1
725711338635333633,pcar,2016-04-28 15:40:00,good sign golden cross detected slb rrc pcar 50 moving average crossed above 200 moving average thoughts…,0.0,0.0,329.0,512.0,False,0
725711076667625475,pcar,2016-04-28 15:39:00,paccar inc pcar upgraded “outperform” robert w baird,0.0,0.0,996.0,11.0,False,1
725710511388631040,pcar,2016-04-28 15:37:00,paccar inc pcar upgraded “outperform” robert w baird,0.0,0.0,6203.0,2295.0,False,0
725706690125918213,pcar,2016-04-28 15:22:00,jim50 pcar gapped up positive 0.15 pcar last price 59.88 day,0.0,0.0,3515.0,1996.0,False,1
725673327835119616,pcar,2016-04-28 13:09:00,paccar inc pcar posts quarterly earnings results beats estimates dollars .03 eps,0.0,0.0,997.0,11.0,False,1
725672767673237504,pcar,2016-04-28 13:07:00,paccar inc pcar posts quarterly earnings results beats estimates dollars .03 eps,0.0,0.0,6203.0,2295.0,False,0
725665517852221440,pcar,2016-04-28 12:38:00,inc reports big loss first quarter key earnings takeaways read,0.0,0.0,13.0,2.0,False,0
725661636313280512,pcar,2016-04-28 12:23:00,inc reports big loss first quarter key earnings takeaways read,0.0,0.0,13.0,2.0,False,0
725653802536177664,pcar,2016-04-28 11:52:00,large call buying,0.0,0.0,4589.0,2585.0,False,0
725635584245518337,pcar,2016-04-28 10:39:00,nwam llc dollars 466000 position paccar inc pcar,0.0,0.0,996.0,11.0,False,1
725635054890848257,pcar,2016-04-28 10:37:00,nwam llc dollars 466000 position paccar inc pcar,0.0,0.0,6202.0,2295.0,False,0
725626132654088193,pcar,2016-04-28 10:02:00,weekly nasdaq100 trend mu akam pcar tsco csx nxpi ctxs ulta esrx adsk bbby ebay mdlz rost,0.0,0.0,846.0,7.0,False,1
725626062592462848,pcar,2016-04-28 10:01:00,weekly nasdaq100 performance viab mu akam pcar tsco stx wdc dish biib csx nxpi fast,0.0,0.0,846.0,7.0,False,0
725616134934827012,pcar,2016-04-28 09:22:00,paccar parts opens new dollars 2 million renton distribution center read,0.0,0.0,13.0,2.0,False,0
725600113754693632,pcar,2016-04-28 08:18:00,rt wednesdays top analyst upgrades downgrades part 1 aapl cmg ebay jblu lb lp nov pcar tss urbn,0.0,1.0,299.0,1289.0,True,0
725583810503532544,pcar,2016-04-28 07:13:00,paccar inc pcar sees unusually high trading volume following better expected earnings,0.0,0.0,1132.0,40.0,False,1
725575418053578752,pcar,2016-04-28 06:40:00,pcar us victory capital management inc cuts position paccar inc pcar inc,0.0,0.0,2744.0,276.0,False,1
725508725528625152,pcar,2016-04-28 02:15:00,large call buying,0.0,0.0,4580.0,2583.0,False,1
725474254066728960,pcar,2016-04-27 23:58:00,new uptrend,0.0,0.0,4577.0,2583.0,False,0
725460052988026880,pcar,2016-04-27 23:02:00,nasdaq100 trend akam mdlz ebay nxpi esrx pcar ulta bbby rost tsco ctxs csx adsk sbac mu,0.0,0.0,847.0,7.0,False,1
725459983064793088,pcar,2016-04-27 23:01:00,nasdaq100 performance akam wdc mdlz ebay nxpi mar esrx nvda pcar ulta fast trip bbby,0.0,0.0,847.0,7.0,False,0
725452473121529856,pcar,2016-04-27 22:32:00,pcar us robert w baird upgrades paccar inc pcar outperform inc,0.0,0.0,2744.0,276.0,False,1
725452317420576768,pcar,2016-04-27 22:31:00,pcar new insider transaction pcar director,0.0,0.0,476.0,0.0,False,1
725448924090228736,pcar,2016-04-27 22:17:00,pcar us robert w baird upgrades paccar inc pcar outperform inc,0.0,0.0,3354.0,249.0,False,0
725428828177199105,pcar,2016-04-27 20:58:00,taking care sick girlfriend week late reports sold bac 15.09 positive 2.89 sold pcar 60.54 positive 16.16,0.0,0.0,165.0,31.0,False,0
725420427913261056,pcar,2016-04-27 20:24:00,large call buying,0.0,0.0,4577.0,2584.0,False,1
725414907609387008,pcar,2016-04-27 20:02:00,new distribution center serve western canada read,0.0,0.0,13.0,2.0,False,1
725414173576929284,pcar,2016-04-27 19:59:00,nasdaq100 trend akam ebay mdlz esrx bbby pcar ulta nxpi tsco adsk mu sbac siri csx txn,0.0,0.0,847.0,7.0,False,1
725414103188119552,pcar,2016-04-27 19:59:00,nasdaq100 performance akam ebay mar mdlz esrx bbby wdc fast pcar ulta nvda nxpi tmus,0.0,0.0,847.0,7.0,False,1
725413692968308737,pcar,2016-04-27 19:57:00,analyst upgrades,0.0,0.0,4576.0,2584.0,False,0
725406081481117697,pcar,2016-04-27 19:27:00,paccar inc pcar sees strong trading volume earnings beat,0.0,0.0,705.0,8.0,False,0
725395587143585792,pcar,2016-04-27 18:45:00,paccar inc reiterated rating bmo capital markets ranked 12 hold pcar,0.0,0.0,525.0,45.0,False,0
725394779039776769,pcar,2016-04-27 18:42:00,analysts offer predictions paccar inc’s fourth quarter 2016 earnings pcar,0.0,0.0,911.0,0.0,False,1
725391905257865216,pcar,2016-04-27 18:31:00,paccars hold rating reiterated bmo capital markets,0.0,0.0,4543.0,2838.0,False,0
725390688246968320,pcar,2016-04-27 18:26:00,paccars hold rating reiterated bmo capital markets,0.0,0.0,4118.0,0.0,False,1
725376083818770432,pcar,2016-04-27 17:28:00,clayton pcar 59.51 paccar inc pcar added watch clayton,0.0,0.0,798.0,1440.0,False,1
725376080584925184,pcar,2016-04-27 17:28:00,clayton pcar 59.51 paccar inc pcar added watch clayton,0.0,0.0,181.0,384.0,False,1
725375873587671040,pcar,2016-04-27 17:27:00,analyst upgrades,0.0,0.0,4574.0,2584.0,False,0
725375021980504065,pcar,2016-04-27 17:24:00,pcar 59.51 paccar inc pcar added watch list right pcar watching last price 59.51 hig,0.0,0.0,906.0,441.0,False,1
725358381704204290,pcar,2016-04-27 16:18:00,releases allison tc10 transmission peterbilt kenworth chassis read,0.0,0.0,13.0,2.0,False,0
725351339346124800,pcar,2016-04-27 15:50:00,leahanne xtremepicks alerts volume alert pcar 60.23 paccar inc pcar hit,0.0,0.0,613.0,419.0,False,1
725350691884113922,pcar,2016-04-27 15:47:00,volume alert pcar 60.23 paccar inc pcar hit high today 60.86 closing day 0 60.23 positive 1.30 positive 2.2,0.0,0.0,739.0,448.0,False,1
725350022900916224,pcar,2016-04-27 15:44:00,analyst upgrades price target increases,0.0,0.0,4573.0,2584.0,False,1
