Tweet Id,Ticker,Datetime,Text,Favs,RTs,Followers,Following,Is a RT,Sentiment
735842394336309248,pcar,2016-05-26 14:37:00,hedge funds losing interest big auto makers gm f fcau pcar tsla,0.0,0.0,301.0,13.0,False,0
735840433398382593,pcar,2016-05-26 14:30:00,chuy open see greater chuy psxp pcar,1.0,0.0,59.0,40.0,False,1
735825326987612160,pcar,2016-05-26 13:30:00,clny stock forum see greater clny pcar sco,0.0,0.0,45.0,40.0,False,1
735719300611219456,pcar,2016-05-26 06:28:00,adms previous close see greater adms hrt pcar,0.0,0.0,83.0,40.0,False,1
735635236378320900,pcar,2016-05-26 00:54:00,elder green,0.0,0.0,4747.0,2541.0,False,1
735634723578449920,pcar,2016-05-26 00:52:00,rt heed slump industrial stocks,0.0,3.0,17853.0,19590.0,True,0
735610783606804480,pcar,2016-05-25 23:17:00,5 dollars up stocks options ne ko epi disck de pcar rlj nice bottom,1.0,0.0,690.0,22.0,False,0
735606853430857729,pcar,2016-05-25 23:01:00,nasdaq100 performance wdc bbby stx biib pcar orly ulta nflx dish incy alxn amgn disca,0.0,0.0,861.0,7.0,False,1
735560960740581376,pcar,2016-05-25 19:59:00,nasdaq100 performance wdc bbby stx ulta pcar orly nflx dish disca cost mu wfm biib,0.0,0.0,860.0,7.0,False,1
735518549159084032,pcar,2016-05-25 17:11:00,pcar analyst action argus research paccar,0.0,0.0,285.0,0.0,False,1
735498528793862144,pcar,2016-05-25 15:51:00,nasdaq100 performance wdc bbby pcar stx wfm ntap aal biib orly lrcx csco dish foxa,0.0,0.0,860.0,7.0,False,1
735455000458072064,pcar,2016-05-25 12:58:00,rt heed slump industrial stocks,0.0,2.0,3118.0,4891.0,True,1
735408415510532096,pcar,2016-05-25 09:53:00,paccar inc pcar earns hold rating analysts argus,0.0,0.0,752.0,8.0,False,1
735399820077223936,pcar,2016-05-25 09:19:00,rt heed slump industrial stocks,0.0,1.0,82156.0,790.0,True,1
735397671393976320,pcar,2016-05-25 09:10:00,barronsonline heed slump industrial stocks,0.0,0.0,921.0,33.0,False,1
735396084126756864,pcar,2016-05-25 09:04:00,heed slump industrial stocks,3.0,3.0,84207.0,604.0,False,1
735345670081646592,pcar,2016-05-25 05:44:00,squarepoint ops llc acquires new stake paccar inc pcar,0.0,0.0,499.0,6.0,False,1
735345537134759936,pcar,2016-05-25 05:43:00,squarepoint ops llc acquires new stake paccar inc pcar,0.0,0.0,1149.0,58.0,False,1
735241099657240577,pcar,2016-05-24 22:48:00,dnb asset management dollars 698000 position paccar inc pcar,0.0,0.0,6303.0,2292.0,False,0
735237967661420545,pcar,2016-05-24 22:36:00,dnb asset management dollars 698000 position paccar inc pcar,0.0,0.0,1047.0,11.0,False,1
735235775130914816,pcar,2016-05-24 22:27:00,ichimoku,0.0,1.0,4750.0,2545.0,False,1
735206373210787840,pcar,2016-05-24 20:30:00,pcar volume see greater pcar chuy mic,0.0,0.0,52.0,40.0,False,1
735053354125103104,pcar,2016-05-24 10:22:00,paccar inc pcar coverage initiated argus,0.0,0.0,749.0,8.0,False,0
735028199847907328,pcar,2016-05-24 08:42:00,oishf ex div date see greater oishf pcar sdrl,0.0,0.0,51.0,40.0,False,0
734929319349354499,pcar,2016-05-24 02:09:00,royal london asset management ltd sells 2523 shares paccar inc pcar,0.0,0.0,2181.0,11.0,False,0
734880169329037312,pcar,2016-05-23 22:54:00,nr7 2,0.0,0.0,4747.0,2548.0,False,0
734859631802122241,pcar,2016-05-23 21:32:00,fed take heed slump industrial stocks,0.0,0.0,2981.0,285.0,False,1
734820467605798912,pcar,2016-05-23 18:57:00,saft company info see greater saft pcar elgx,0.0,0.0,55.0,58.0,False,1
734814884769193986,pcar,2016-05-23 18:34:00,crestpoint capital management llc invests dollars 23000 paccar inc pcar,0.0,0.0,747.0,8.0,False,1
734793399954472960,pcar,2016-05-23 17:09:00,pcar short sales see greater pcar adhd eqix,0.0,0.0,40.0,40.0,False,0
734752758490882050,pcar,2016-05-23 14:28:00,pcar analyst action argus research paccar,0.0,0.0,285.0,0.0,False,0
734746575159844865,pcar,2016-05-23 14:03:00,paccar hits 1 month low,0.0,0.0,25.0,0.0,False,1
734725986558869505,pcar,2016-05-23 12:41:00,paccar inc pcar trading down 3.5 percent,0.0,0.0,1045.0,11.0,False,1
734725924722212864,pcar,2016-05-23 12:41:00,umb bank n mo raises position paccar inc pcar,0.0,0.0,406.0,10.0,False,1
734725489475092481,pcar,2016-05-23 12:39:00,paccar inc pcar trading down 3.5 percent,0.0,0.0,6286.0,2292.0,False,1
734704386954399744,pcar,2016-05-23 11:15:00,paccar inc pcar receives new coverage analysts argus,0.0,0.0,974.0,0.0,False,1
734703325120221184,pcar,2016-05-23 11:11:00,paccar inc pcar receives new coverage analysts argus,0.0,0.0,406.0,10.0,False,0
734635771840364544,pcar,2016-05-23 06:43:00,rt daimler drags sector down lowering truck sales guidance ddaif pcar cnhi nav cmi alsn full story,0.0,2.0,7923.0,6348.0,True,1
734618632018399234,pcar,2016-05-23 05:35:00,qtmm short sales see greater qtmm pcar mtw,0.0,0.0,36.0,40.0,False,1
734421075166146560,pcar,2016-05-22 16:30:00,get say pcar speculatingstocks discovery engine,0.0,0.0,308.0,263.0,False,1
734377047674507264,pcar,2016-05-22 13:35:00,rt daimler drags sector down lowering truck sales guidance ddaif pcar cnhi nav cmi alsn full story,0.0,1.0,12921.0,7672.0,True,0
734353509622124545,pcar,2016-05-22 12:01:00,paccar inc pcar shares bought exxonmobil investment management inc tx,0.0,0.0,2178.0,11.0,False,0
734042757271048192,pcar,2016-05-21 15:26:00,paccar inc pcar stake cut pioneer investment management inc,0.0,0.0,501.0,6.0,False,0
734040695586062336,pcar,2016-05-21 15:18:00,paccar inc pcar stake cut pioneer investment management inc,0.0,0.0,1152.0,58.0,False,1
734027283795709952,pcar,2016-05-21 14:25:00,rt fly top five analyst initiations ice ndaq cme cboe aktx rl jnj pcar full story,0.0,4.0,2743.0,4286.0,True,1
734001440973303808,pcar,2016-05-21 12:42:00,rt fly top five analyst initiations ice ndaq cme cboe aktx rl jnj pcar full story,0.0,3.0,7897.0,6439.0,True,0
733979657612185600,pcar,2016-05-21 11:16:00,pcar analyst action argus research paccar,0.0,0.0,286.0,0.0,False,1
733937782796718080,pcar,2016-05-21 08:29:00,analysts set paccar inc pcar point dollars 8.33,0.0,0.0,972.0,0.0,False,0
733937781647495168,pcar,2016-05-21 08:29:00,analysts set paccar inc pcar point dollars 8.33,0.0,0.0,972.0,0.0,False,1
733881093934448640,pcar,2016-05-21 04:44:00,rt fly top five analyst initiations ice ndaq cme cboe aktx rl jnj pcar full story,0.0,2.0,14090.0,4965.0,True,1
733861334090190848,pcar,2016-05-21 03:25:00,paccar inc pcar stock price down 3.5 percent,0.0,0.0,1038.0,11.0,False,1
733860711118438400,pcar,2016-05-21 03:23:00,paccar inc pcar stock price down 3.5 percent,0.0,0.0,6283.0,2292.0,False,0
733827146335014913,pcar,2016-05-21 01:10:00,pcar sell signal 55.22 may 18 16,0.0,0.0,334.0,5.0,False,0
733798027404673024,pcar,2016-05-20 23:14:00,rt nr7 stocks,0.0,1.0,375.0,768.0,True,0
733795202398314496,pcar,2016-05-20 23:03:00,nr7 stocks,0.0,1.0,4724.0,2552.0,False,0
733782045873348608,pcar,2016-05-20 22:10:00,president cfo paccar inc nasdaq pcar selling shares pcar,0.0,0.0,458.0,214.0,False,0
733781612144525312,pcar,2016-05-20 22:09:00,president cfo paccar inc nasdaq pcar buying shares pcar,0.0,0.0,458.0,214.0,False,1
733778384254308354,pcar,2016-05-20 21:56:00,pcar new insider transaction pcar president cfo,0.0,0.0,500.0,0.0,False,1
733775315164659712,pcar,2016-05-20 21:44:00,paccar inc president percent 26 cfo disposed 165 shares,0.0,0.0,309.0,27.0,False,0
733768242519494659,pcar,2016-05-20 21:15:00,fjarde ap fonden fourth swedish national pension fund acquires 10617 shares paccar inc pcar,0.0,0.0,2173.0,11.0,False,0
733729765396480002,pcar,2016-05-20 18:43:00,pcar analyst action argus research paccar,0.0,0.0,286.0,0.0,False,1
733661869689331713,pcar,2016-05-20 14:13:00,― fly top five analyst initiations ice ndaq cme cboe aktx rl jnj pcar …,0.0,0.0,82486.0,82433.0,False,0
733661405258391553,pcar,2016-05-20 14:11:00,rt fly top five analyst initiations ice ndaq cme cboe aktx rl jnj pcar full story,0.0,1.0,13278.0,7251.0,True,0
733661381749145601,pcar,2016-05-20 14:11:00,fly top five analyst initiations ice ndaq cme cboe aktx rl jnj pcar full story,0.0,4.0,12836.0,130.0,False,1
733658766793531392,pcar,2016-05-20 14:00:00,paccar nasdaq pcar loses 3.24 percent dollars 3.34 thursday among top 10 losers p500,0.0,0.0,115.0,75.0,False,1
733643542632005632,pcar,2016-05-20 13:00:00,142.4 percent earnings 🌱growth🌱 3 years what’s opinion paccar pcar,0.0,0.0,402.0,431.0,False,1
733638858194202624,pcar,2016-05-20 12:41:00,paccar initiated argus hold,0.0,0.0,4570.0,2838.0,False,1
733636878126174208,pcar,2016-05-20 12:33:00,paccar inc pcar covered argus,0.0,0.0,6279.0,2292.0,False,0
733634611100684288,pcar,2016-05-20 12:24:00,paccar inc pcar covered argus,0.0,0.0,2172.0,11.0,False,0
733633328033730560,pcar,2016-05-20 12:19:00,paccar initiated argus hold,0.0,0.0,4190.0,0.0,False,1
733632152563126274,pcar,2016-05-20 12:15:00,paccar inc initiated coverage argus ranked 12 hold pcar,0.0,0.0,556.0,45.0,False,0
733622967670738944,pcar,2016-05-20 11:38:00,argus starts paccar pcar hold,0.0,0.0,3031.0,1.0,False,0
733621780582109184,pcar,2016-05-20 11:33:00,paccar nasdaq pcar loses 3.24 percent dollars 3.34 thursday among top 10 losers p500,0.0,0.0,51.0,28.0,False,0
733621023816355840,pcar,2016-05-20 11:30:00,paccar nasdaq pcar loses 3.24 percent dollars 3.34 thursday among top 10 losers p500,0.0,0.0,114.0,75.0,False,0
733540257296093184,pcar,2016-05-20 06:10:00,pcar sell signal 55.22 may 18 16,0.0,0.0,333.0,5.0,False,1
733519211817902084,pcar,2016-05-20 04:46:00,daimler cuts trucks outlook drags down sector ddaif pcar nav cnhi cmi alsn,0.0,0.0,283.0,542.0,False,0
733501709859708928,pcar,2016-05-20 03:36:00,pcar coming hot v,0.0,0.0,10.0,0.0,False,0
733499992397254657,pcar,2016-05-20 03:30:00,pcar sell signal 55.22 may 18 16,1.0,0.0,333.0,5.0,False,0
733494937342246912,pcar,2016-05-20 03:09:00,momentum stock watch fri dri pcar rlj,0.0,0.0,229.0,117.0,False,1
733479801676124160,pcar,2016-05-20 02:09:00,biggest losers today large caps lb negative 4.95 percent pbr negative 4.89 percent pbr negative 4.62 percent bax negative 4.26 percent ibn negative 3.64 percent bap negative 3.58 percent pcar negative 3.42 percent pypl negative 3.41 percent,0.0,0.0,181.0,29.0,False,1
733468478787592196,pcar,2016-05-20 01:24:00,rt 🏆todays top bets sti ttwo nflx mpc pcar cf,0.0,3.0,206.0,267.0,True,1
733445367677788160,pcar,2016-05-19 23:52:00,🏆todays top bets sti ttwo nflx mpc pcar cf,5.0,3.0,38879.0,9599.0,False,0
733434086358962176,pcar,2016-05-19 23:08:00,stochastic os,0.0,0.0,4720.0,2553.0,False,0
733419521969520642,pcar,2016-05-19 22:10:00,scan results expansion pivot sell setup today ttc sss fti h pypl pcar race gpi apo qure,0.0,0.0,688.0,45.0,False,0
733419090925084672,pcar,2016-05-19 22:08:00,rt jci chart,0.0,1.0,690.0,383.0,True,0
733417629424095233,pcar,2016-05-19 22:02:00,daimler cuts trucks outlook drags down sector,0.0,0.0,331.0,1.0,False,1
733417627884748804,pcar,2016-05-19 22:02:00,daimler cuts trucks outlook drags down sector,0.0,0.0,1377.0,29.0,False,1
733417626701991936,pcar,2016-05-19 22:02:00,daimler cuts trucks outlook drags down sector,0.0,0.0,21552.0,30.0,False,1
733417178733510657,pcar,2016-05-19 22:00:00,scan results fell below 50 dma today ttc fti ew iilg pcar gpi hcn iqnt amtd gs,0.0,0.0,688.0,45.0,False,0
733408706445086720,pcar,2016-05-19 21:27:00,rt paccar shares cross below 200 dma pcar sphd,0.0,1.0,1158.0,1138.0,True,1
733406948293402626,pcar,2016-05-19 21:20:00,latest kenworth features showcased ride drive event read,0.0,0.0,16.0,2.0,False,1
733402657071628289,pcar,2016-05-19 21:03:00,paccar shares cross below 200 dma pcar sphd,0.0,1.0,848.0,1189.0,False,1
733401724631711745,pcar,2016-05-19 20:59:00,jci chart,2.0,1.0,1062.0,51.0,False,1
733378218476998658,pcar,2016-05-19 19:26:00,pcar finally movement european price fixing charges,0.0,0.0,155.0,6.0,False,1
733377874661650432,pcar,2016-05-19 19:24:00,pcar unusual puts activity,0.0,0.0,1402.0,29.0,False,1
733377778637119488,pcar,2016-05-19 19:24:00,1500 pcar aug16 57.5 calls dollars .25 sto bid,0.0,0.0,255.0,3.0,False,1
733377463292551168,pcar,2016-05-19 19:23:00,1230 pcar aug16 50.0 puts dollars .85,0.0,0.0,255.0,3.0,False,1
733377372360151041,pcar,2016-05-19 19:22:00,pcar 50 puts buying activity expiring 19 aug volume 1230,0.0,0.0,1402.0,29.0,False,1
733367424087547904,pcar,2016-05-19 18:43:00,― daimler drags sector down lowering truck sales guidance ddaif pcar cnhi…,0.0,0.0,82410.0,82389.0,False,0
733366407098990592,pcar,2016-05-19 18:39:00,daimler drags sector down lowering truck sales guidance ddaif pcar cnhi nav cmi alsn full story,1.0,2.0,12845.0,130.0,False,0
733352894364319744,pcar,2016-05-19 17:45:00,jun 55 puts pcar,1.0,0.0,506.0,1175.0,False,1
733351527805386752,pcar,2016-05-19 17:40:00,pcar 52 week low see greater pcar abb xnet,0.0,0.0,62.0,40.0,False,1
733350207002279936,pcar,2016-05-19 17:34:00,wondering risks pcar 63 day volatility 12.7 percent,0.0,0.0,1366.0,1496.0,False,0
733349561666838528,pcar,2016-05-19 17:32:00,today short diversified machinery day cmi pcar flow could go,0.0,0.0,2520.0,120.0,False,0
733348834751975424,pcar,2016-05-19 17:29:00,pcar finally movement european price fixing charges,0.0,0.0,154.0,6.0,False,1
733348293854531584,pcar,2016-05-19 17:27:00,paccar pcar todays roof leaker stock pcar,0.0,0.0,2264.0,1221.0,False,1
733344492988825600,pcar,2016-05-19 17:12:00,moar useless garbage stocks r down therez put sweeperz im gunna pay dollars hiz service tsla pcar,1.0,0.0,379.0,28.0,False,1
733342013400207360,pcar,2016-05-19 17:02:00,rt daimler trucks sees 2016 ongoing ebit `significantly lower cmi pcar nav …,0.0,1.0,24.0,939.0,True,1
733341804813258752,pcar,2016-05-19 17:01:00,daimler trucks sees 2016 ongoing ebit `significantly lower cmi pcar nav,1.0,1.0,10073.0,470.0,False,1
733341381050015744,pcar,2016-05-19 16:59:00,pcar cmi puking brains,0.0,0.0,274.0,85.0,False,1
733340740445601792,pcar,2016-05-19 16:57:00,rt pcar cmi daimler making cautious comments truck business adding cmi put buyer mention najarians,0.0,1.0,1631.0,2020.0,True,0
733340620895440896,pcar,2016-05-19 16:56:00,rt daimler ag daimler trucks ebit unit sales seen significantly below 2015 ddaif alsn cmi pcar full story …,0.0,1.0,14109.0,7725.0,True,0
733340493816434688,pcar,2016-05-19 16:56:00,rt pcar june put sweeper detected,0.0,1.0,89.0,0.0,True,1
733340488984453121,pcar,2016-05-19 16:56:00,daimler ag daimler trucks ebit unit sales seen significantly below 2015 ddaif alsn cmi pcar full story,0.0,1.0,12813.0,130.0,False,1
733340234126004225,pcar,2016-05-19 16:55:00,pcar weird bought sold bought sold hmm,0.0,0.0,230.0,23.0,False,0
733340227180224512,pcar,2016-05-19 16:55:00,pcar cmi daimler making cautious comments truck business adding cmi put buyer mention najarians,1.0,1.0,19410.0,244.0,False,0
733339848174632962,pcar,2016-05-19 16:53:00,pcar whats paccar,0.0,0.0,3730.0,44.0,False,1
733339697854984192,pcar,2016-05-19 16:53:00,pcar below pivots353.18200 day sma 53. 5 days cl 9 3 nearlo prvclo 3 million mv 3 1 million mv 6 accel alltfs ch 3.7 percent,0.0,0.0,6755.0,271.0,False,0
733339628057550848,pcar,2016-05-19 16:52:00,pcar dip,0.0,0.0,232.0,93.0,False,1
733339546381737985,pcar,2016-05-19 16:52:00,pcar dumps jun 55 put buyers,0.0,0.0,19410.0,244.0,False,1
733339276683956224,pcar,2016-05-19 16:51:00,pcar june put sweeper detected,1.0,1.0,38872.0,9599.0,False,1
733339176028921856,pcar,2016-05-19 16:50:00,pcar dump,0.0,0.0,77.0,150.0,False,1
733339085113163776,pcar,2016-05-19 16:50:00,1828 pcar jun16 55.0 puts dollars .22,0.0,0.0,254.0,3.0,False,1
733339025050849280,pcar,2016-05-19 16:50:00,pcar 55 puts buying activity expiring 17 jun volume 1307,0.0,0.0,1401.0,29.0,False,0
733327994538725376,pcar,2016-05-19 16:06:00,kex last trade see greater kex afmd pcar,0.0,0.0,42.0,40.0,False,1
733302003292495873,pcar,2016-05-19 14:23:00,pcar spell jinx cmi nav wreckage sector,0.0,0.0,1340.0,44.0,False,1
733292609922314240,pcar,2016-05-19 13:45:00,paccar hits 1 month low,0.0,0.0,23.0,0.0,False,0
733273961736241152,pcar,2016-05-19 12:31:00,pcar paccar inc kurtosis 1.31 skew 0.42 correlation histogram,0.0,0.0,3217.0,3338.0,False,1
733192968191004672,pcar,2016-05-19 07:10:00,pcar sell signal 55.22 may 18 16,0.0,0.0,333.0,5.0,False,1
733135413154582529,pcar,2016-05-19 03:21:00,paccar inc pcar stake lowered ibm retirement fund,0.0,0.0,394.0,10.0,False,0
733093823417458688,pcar,2016-05-19 00:36:00,pcar 52 week low see greater pcar mnro finl,0.0,0.0,47.0,40.0,False,0
733076068580622336,pcar,2016-05-18 23:25:00,50 day support,0.0,0.0,4709.0,2554.0,False,0
733068673150115840,pcar,2016-05-18 22:56:00,vmw ideas see greater vmw pcar png,0.0,0.0,48.0,59.0,False,1
733020602974363648,pcar,2016-05-18 19:45:00,cyh eod data see greater cyh wppgy pcar,0.0,0.0,53.0,40.0,False,1
733018820869296129,pcar,2016-05-18 19:38:00,paccar inc pcar given consensus recommendation “hold” brokerages,0.0,0.0,742.0,8.0,False,1
733017856707858432,pcar,2016-05-18 19:34:00,paccar inc pcar given consensus recommendation “hold” brokerages,0.0,0.0,1033.0,11.0,False,1
732969067783524352,pcar,2016-05-18 16:20:00,paccar inc pcar position held baker boyer national bank,0.0,0.0,742.0,8.0,False,1
732966162347220992,pcar,2016-05-18 16:08:00,paccar inc pcar stake increased capital impact advisors llc,0.0,0.0,495.0,6.0,False,0
732965829822812160,pcar,2016-05-18 16:07:00,paccar inc pcar stake increased capital impact advisors llc,0.0,0.0,1140.0,58.0,False,0
732959755233337344,pcar,2016-05-18 15:43:00,heritage investors management corp buys 10959 shares paccar inc pcar,0.0,0.0,394.0,10.0,False,0
732929899133014017,pcar,2016-05-18 13:44:00,paccar inc pcar position lowered biltmore wealth management llc,0.0,0.0,2169.0,11.0,False,0
732915967475474432,pcar,2016-05-18 12:49:00,global industrial analyst kristine kuback read april truck data alsn cmi pcar wab,0.0,0.0,179.0,682.0,False,1
732888916932497409,pcar,2016-05-18 11:01:00,pcar paccar european unit offer eur300 mln fixed rate notes due 2019,0.0,0.0,17976.0,3377.0,False,0
732825658548727808,pcar,2016-05-18 06:50:00,5 revealing quotes inc ceo read,0.0,0.0,16.0,2.0,False,1
732804232219394048,pcar,2016-05-18 05:25:00,paccars hybrid trucks hold fuel prices climb read,0.0,0.0,16.0,2.0,False,0
732804076967198720,pcar,2016-05-18 05:24:00,paccars hybrid trucks hold fuel prices climb read,0.0,0.0,16.0,2.0,False,0
732802673074929664,pcar,2016-05-18 05:19:00,pcar ideas see greater pcar yge salt,0.0,0.0,70.0,40.0,False,1
732738067904274432,pcar,2016-05-18 01:02:00,elder blue,0.0,0.0,4699.0,2555.0,False,1
732723674625662976,pcar,2016-05-18 00:05:00,flxr high alert hearing big news coming mobileapp mini fridge oke pcar pgti snn tx fb,0.0,0.0,6551.0,1178.0,False,1
732686037575737344,pcar,2016-05-17 21:35:00,stifel financial corp decreases stake paccar inc pcar,0.0,0.0,1029.0,11.0,False,0
732683374846828545,pcar,2016-05-17 21:25:00,ver ask see greater ver pcar apam,0.0,0.0,34.0,39.0,False,1
732653941381468163,pcar,2016-05-17 19:28:00,ltnc last trade see greater ltnc atto pcar,0.0,0.0,40.0,20.0,False,0
732601593812684801,pcar,2016-05-17 16:00:00,today p5 mxim ncmi pcar pgd pool pvh rail recn rmax rmd sbsi slw spar spns,0.0,0.0,174.0,64.0,False,0
732528746750705664,pcar,2016-05-17 11:10:00,paccar inc pcar position held stewart patten co llc,0.0,0.0,1137.0,58.0,False,1
732525511428218880,pcar,2016-05-17 10:57:00,paccar inc pcar position held stewart patten co llc,0.0,0.0,494.0,6.0,False,0
732501935329157120,pcar,2016-05-17 09:24:00,pcar day high see greater pcar ti chro,0.0,0.0,50.0,60.0,False,1
732475034401308672,pcar,2016-05-17 07:37:00,envestnet asset management inc sells 374 shares paccar inc pcar,0.0,0.0,957.0,0.0,False,1
732460533715062786,pcar,2016-05-17 06:39:00,paccar inc pcar position reduced lpl financial llc,0.0,0.0,2160.0,11.0,False,1
732352329224048640,pcar,2016-05-16 23:29:00,pfsd ideas see greater pfsd pcar scie,0.0,0.0,39.0,20.0,False,0
732351560953405441,pcar,2016-05-16 23:26:00,ltnc previous close see greater ltnc pcar db,0.0,0.0,66.0,40.0,False,1
732340865876828161,pcar,2016-05-16 22:44:00,180 bullish,0.0,0.0,4683.0,2557.0,False,1
732314708494016516,pcar,2016-05-16 21:00:00,gpl stock message board see greater gpl alog pcar,0.0,0.0,36.0,40.0,False,0
732261094987698177,pcar,2016-05-16 17:27:00,tlrd short sales see greater tlrd sbac pcar,0.0,0.0,51.0,40.0,False,1
732259331895238661,pcar,2016-05-16 17:20:00,scty stock forum see greater scty pcar msgn,0.0,0.0,37.0,40.0,False,1
732220937291059200,pcar,2016-05-16 14:47:00,pcar updates,0.0,0.0,6.0,20.0,False,0
732213778037661696,pcar,2016-05-16 14:19:00,pcar bid size see greater pcar ohrp wbs,0.0,0.0,35.0,40.0,False,0
732212288141156355,pcar,2016-05-16 14:13:00,aixg volume see greater aixg pcar rcl,0.0,0.0,38.0,41.0,False,1
732210524130185217,pcar,2016-05-16 14:06:00,efii bid size see greater efii pcar lci,0.0,0.0,36.0,40.0,False,0
732194007741239296,pcar,2016-05-16 13:00:00,tomorrows ex dividend dates msft cvx hon tri pcar 15,0.0,0.0,454.0,0.0,False,1
732131108305797120,pcar,2016-05-16 08:50:00,dxyn filings see greater dxyn pcar achc,0.0,0.0,48.0,40.0,False,1
732103873008173060,pcar,2016-05-16 07:02:00,paccar inc pcar issue quarterly dividend dollars .24 june 6,0.0,0.0,6248.0,2293.0,False,1
732100467526930432,pcar,2016-05-16 06:48:00,paccar inc pcar issue quarterly dividend dollars .24 june 6,0.0,0.0,1024.0,11.0,False,0
732088832229658624,pcar,2016-05-16 06:02:00,wft change see greater wft nviv pcar,0.0,0.0,35.0,40.0,False,1
731849875873091584,pcar,2016-05-15 14:13:00,pcar news see greater pcar cm chmt,0.0,0.0,35.0,40.0,False,0
731741166329167872,pcar,2016-05-15 07:01:00,paa current price see greater paa bte pcar,0.0,0.0,35.0,20.0,False,0
731735900984467456,pcar,2016-05-15 06:40:00,chartguy89 2016 trending stocks pcar 56.02 stock charts pcar paccar inc,0.0,0.0,1117.0,1274.0,False,1
731388340491128832,pcar,2016-05-14 07:39:00,10 undervalued companies defensive investor emn fmc gps pfg rhi trv wfc pcar yhoo foxa,0.0,0.0,1581.0,525.0,False,1
731381303753379840,pcar,2016-05-14 07:11:00,pcar exchange see greater pcar fnhc amd,0.0,0.0,39.0,40.0,False,1
731297747769405441,pcar,2016-05-14 01:39:00,10 undervalued companies defensive investor emn fmc gps pfg rhi trv wfc pcar yhoo foxa,1.0,0.0,338.0,13.0,False,1
731275476744994817,pcar,2016-05-14 00:10:00,price rowe associates inc md sells 6600 shares paccar inc pcar,0.0,0.0,2151.0,11.0,False,0
731246651793362944,pcar,2016-05-13 22:16:00,pcar bullish analyst action bank america paccar,0.0,0.0,284.0,0.0,False,0
731240959107862529,pcar,2016-05-13 21:53:00,paccar inc pcar stake raised clearbridge llc,0.0,0.0,728.0,8.0,False,0
731196474000855040,pcar,2016-05-13 18:56:00,10 undervalued companies defensive investor emn fmc gps pfg rhi trv wfc pcar yhoo foxa,0.0,0.0,2078.0,769.0,False,1
731196471064821761,pcar,2016-05-13 18:56:00,10 undervalued companies defensive investor emn fmc gps pfg rhi trv wfc pcar yhoo foxa,0.0,0.0,1580.0,525.0,False,1
731190788722331649,pcar,2016-05-13 18:34:00,dis exchange see greater dis pcar pnr,1.0,0.0,33.0,40.0,False,1
731087155875876866,pcar,2016-05-13 11:42:00,paccar inc files sec form 4 statement changes beneficial ownership secur read,0.0,0.0,15.0,2.0,False,0
730946424716677120,pcar,2016-05-13 02:23:00,pcar investor opinions see greater pcar cacc csco,0.0,0.0,43.0,40.0,False,0
730907031712993282,pcar,2016-05-12 23:46:00,rt pcar,0.0,1.0,5514.0,4583.0,True,1
730906594263764992,pcar,2016-05-12 23:44:00,pcar,0.0,3.0,10292.0,0.0,False,1
730813315849424897,pcar,2016-05-12 17:34:00,sgnt stock message board see greater sgnt pcar tree,0.0,0.0,34.0,40.0,False,0
730792160837013504,pcar,2016-05-12 16:10:00,titxf pe ratio ratio see greater titxf pcar nvax,0.0,0.0,41.0,20.0,False,0
730790910380933120,pcar,2016-05-12 16:05:00,paccar inc pcar lifted buy bank america,0.0,0.0,405.0,10.0,False,1
730787758487130112,pcar,2016-05-12 15:52:00,mine news see greater mine pcar lyb,0.0,0.0,57.0,40.0,False,1
730767252354519040,pcar,2016-05-12 14:31:00,ngg volume see greater ngg ctsh pcar,0.0,0.0,32.0,39.0,False,1
730652146622943232,pcar,2016-05-12 06:53:00,paccar inc pcar go ex dividend may 17,0.0,0.0,940.0,0.0,False,1
730533470783602688,pcar,2016-05-11 23:02:00,nasdaq100 trend ea amzn tmus fisv trip ctsh chtr adbe cmcsa disca ntes mdlz pcar mnst,0.0,0.0,852.0,7.0,False,1
730514424017063936,pcar,2016-05-11 21:46:00,paccar inc pcar rating increased buy bank america,0.0,0.0,1028.0,11.0,False,1
730514018989965313,pcar,2016-05-11 21:44:00,paccar inc pcar rating increased buy bank america,0.0,0.0,6233.0,2293.0,False,0
730487589149478916,pcar,2016-05-11 19:59:00,nasdaq100 trend ea amzn tmus trip fisv ctsh adbe cmcsa esrx disca ntes mdlz chtr pcar,0.0,0.0,853.0,7.0,False,1
730334137165484032,pcar,2016-05-11 09:50:00,pcar bullish analyst action bank america paccar,0.0,0.0,290.0,0.0,False,1
730294644567908352,pcar,2016-05-11 07:13:00,paccar inc pcar shares bought two sigma advisers llc,0.0,0.0,403.0,10.0,False,1
730290229500776448,pcar,2016-05-11 06:55:00,gig e p see greater gig lfc pcar,0.0,0.0,48.0,60.0,False,0
730263429215227905,pcar,2016-05-11 05:09:00,htz bid see greater htz rxmd pcar,0.0,0.0,38.0,20.0,False,1
730247193819389952,pcar,2016-05-11 04:04:00,wso exchange see greater wso pcar dco,0.0,0.0,60.0,40.0,False,0
730242210189479944,pcar,2016-05-11 03:44:00,paccar inc pcar shares sold kbc group nv,0.0,0.0,935.0,0.0,False,1
730171084046270468,pcar,2016-05-10 23:02:00,nasdaq100 trend trip amzn tmus mdlz ctsh vrtx esrx adbe fb lvnta mar ntes pcar ctxs bmrn,0.0,0.0,854.0,7.0,False,1
730171014202675201,pcar,2016-05-10 23:01:00,nasdaq100 performance trip bmrn wdc akam amzn ntes pcar regn nflx ctxs aal tmus mu,0.0,0.0,854.0,7.0,False,1
730162542044131328,pcar,2016-05-10 22:28:00,180 bullish,0.0,0.0,4643.0,2563.0,False,1
730125193100832768,pcar,2016-05-10 19:59:00,nasdaq100 trend trip amzn tmus ctsh mdlz esrx adbe mar lvnta vrtx ntes fb ctxs alxn pcar,1.0,0.0,854.0,7.0,False,0
