Tweet Id,Ticker,Datetime,Text,Favs,RTs,Followers,Following,Is a RT,Sentiment
723470085348818945,pcar,2016-04-22 11:14:00,rt volvo negative commentary north american truck market nailed top last summer cmi pcar,0.0,4.0,15762.0,7381.0,True,1
723469713041428480,pcar,2016-04-22 11:13:00,rt volvo negative commentary north american truck market nailed top last summer cmi pcar,0.0,4.0,90.0,369.0,True,1
723467067131879426,pcar,2016-04-22 11:02:00,rt volvo negative commentary north american truck market nailed top last summer cmi pcar,0.0,4.0,2073.0,289.0,True,1
723466132942893056,pcar,2016-04-22 10:59:00,volvo negative commentary north american truck market nailed top last summer cmi pcar,4.0,4.0,41833.0,298.0,False,0
723424619340791809,pcar,2016-04-22 08:14:00,hska change see greater hska pcar imdz,0.0,0.0,39.0,41.0,False,0
723333766970642432,pcar,2016-04-22 02:13:00,pgx stock message board see greater pgx pcar cbi,0.0,0.0,46.0,40.0,False,1
723333052064256000,pcar,2016-04-22 02:10:00,pcar er open sp down 15 times last 25 qtrs 60 percent er,0.0,0.0,442.0,142.0,False,1
723290254548062208,pcar,2016-04-21 23:20:00,slingshot bullish,0.0,0.0,4566.0,2601.0,False,0
723217299499446272,pcar,2016-04-21 18:30:00,inc shares sold bridgewater associates lp read,0.0,0.0,13.0,2.0,False,1
723180972431253505,pcar,2016-04-21 16:05:00,paccar inc pcar shares sold bridgewater associates lp,0.0,0.0,698.0,8.0,False,1
723067387822657536,pcar,2016-04-21 08:34:00,paccar inc pcar position reduced caisse de depot et placement du quebec,0.0,0.0,980.0,11.0,False,0
723066172883763200,pcar,2016-04-21 08:29:00,paccar inc pcar position reduced caisse de depot et placement du quebec,0.0,0.0,6162.0,2295.0,False,0
722939120734093312,pcar,2016-04-21 00:04:00,paccar inc pcar stake increased mutual america capital management llc,0.0,0.0,980.0,11.0,False,1
722937837537136640,pcar,2016-04-20 23:59:00,paccar inc pcar stake increased mutual america capital management llc,0.0,0.0,6158.0,2295.0,False,1
722904000207532032,pcar,2016-04-20 21:45:00,pcar er open sp down 15 times last 25 qtrs 60 percent er,0.0,0.0,440.0,142.0,False,0
722763082112614400,pcar,2016-04-20 12:25:00,hartford investment management co dollars 075000 stake paccar inc pcar,0.0,0.0,325.0,10.0,False,0
722704384447131649,pcar,2016-04-20 08:32:00,graticule asia macro advisors llc takes position paccar inc pcar,0.0,0.0,696.0,8.0,False,1
722700099315507200,pcar,2016-04-20 08:15:00,pcar stock message board see greater pcar aixg hot,1.0,0.0,34.0,40.0,False,1
722691039090372609,pcar,2016-04-20 07:39:00,mga short sales see greater mga pcar cbb,0.0,0.0,49.0,40.0,False,1
722580232801251329,pcar,2016-04-20 00:18:00,paccar inc pcar shares sold morgan stanley,0.0,0.0,6146.0,2295.0,False,0
722563942892060672,pcar,2016-04-19 23:14:00,bearish doji,0.0,0.0,4557.0,2610.0,False,1
722563239687647233,pcar,2016-04-19 23:11:00,pcar paccar inc nasdaq pcar shares headed,0.0,0.0,727.0,5.0,False,1
722532097525751808,pcar,2016-04-19 21:07:00,pcar paccar inc nasdaq pcar check analyst ratings,0.0,0.0,625.0,0.0,False,1
722518034422874112,pcar,2016-04-19 20:11:00,pcar top stocks day paccar inc nasdaq pcar,0.0,0.0,755.0,6.0,False,0
722421058855440385,pcar,2016-04-19 13:46:00,long pcar 56.41,0.0,0.0,350.0,67.0,False,1
722369067521146880,pcar,2016-04-19 10:19:00,rt todays call put flow aapl trip jll pcar cmi ben ete tck bac db himx c apa pcrx kra,0.0,9.0,35.0,63.0,True,1
722348672332271616,pcar,2016-04-19 08:58:00,hsbc holdings plc increases position paccar inc pcar,0.0,0.0,979.0,11.0,False,0
722348195817394176,pcar,2016-04-19 08:56:00,hsbc holdings plc increases position paccar inc pcar,0.0,0.0,6144.0,2295.0,False,1
722217539363872768,pcar,2016-04-19 00:17:00,rt todays call put flow aapl trip jll pcar cmi ben ete tck bac db himx c apa pcrx kra,0.0,8.0,4228.0,474.0,True,0
722207095794352129,pcar,2016-04-18 23:36:00,slingshot bullish,0.0,0.0,4549.0,2613.0,False,1
722200407188094976,pcar,2016-04-18 23:09:00,rt cvx pcar tgt may calls,0.0,5.0,1365.0,1304.0,True,1
722200292595474433,pcar,2016-04-18 23:09:00,rt todays call put flow aapl trip jll pcar cmi ben ete tck bac db himx c apa pcrx kra,0.0,7.0,1365.0,1304.0,True,1
722196390168821760,pcar,2016-04-18 22:53:00,bullish cross,0.0,0.0,4549.0,2613.0,False,1
722179152820830208,pcar,2016-04-18 21:45:00,rt todays call put flow aapl trip jll pcar cmi ben ete tck bac db himx c apa pcrx kra,0.0,6.0,171.0,560.0,True,1
722175695351377921,pcar,2016-04-18 21:31:00,rt todays call put flow aapl trip jll pcar cmi ben ete tck bac db himx c apa pcrx kra,0.0,6.0,2482.0,9.0,True,1
722175273819631616,pcar,2016-04-18 21:29:00,rt todays call put flow aapl trip jll pcar cmi ben ete tck bac db himx c apa pcrx kra,0.0,6.0,561.0,4214.0,True,1
722174968293818368,pcar,2016-04-18 21:28:00,rt todays call put flow aapl trip jll pcar cmi ben ete tck bac db himx c apa pcrx kra,0.0,6.0,1763.0,695.0,True,0
722174489186930691,pcar,2016-04-18 21:26:00,rt todays call put flow aapl trip jll pcar cmi ben ete tck bac db himx c apa pcrx kra,0.0,6.0,479.0,426.0,True,1
722174397277188097,pcar,2016-04-18 21:26:00,rt todays call put flow aapl trip jll pcar cmi ben ete tck bac db himx c apa pcrx kra,0.0,6.0,70.0,32.0,True,0
722174165101473792,pcar,2016-04-18 21:25:00,todays call put flow aapl trip jll pcar cmi ben ete tck bac db himx c apa pcrx kra,9.0,9.0,38725.0,9630.0,False,0
722163523074306048,pcar,2016-04-18 20:42:00,rt cvx pcar tgt may calls,0.0,4.0,1096.0,1147.0,True,1
722154599717670912,pcar,2016-04-18 20:07:00,rt cvx pcar tgt may calls,0.0,4.0,890.0,5002.0,True,0
722154300084981760,pcar,2016-04-18 20:06:00,cvx pcar tgt may calls,0.0,5.0,726014.0,2436.0,False,0
722141905614548992,pcar,2016-04-18 19:17:00,unusual options activity pcar may dollars 6.10 calls tgt april 22 weekly dollars 3.50 calls,0.0,0.0,136.0,175.0,False,1
722099514350305285,pcar,2016-04-18 16:28:00,likely breaks pcar,0.0,0.0,3746.0,4.0,False,0
722099514274750464,pcar,2016-04-18 16:28:00,pcar chart likely breaks,0.0,0.0,240.0,78.0,False,1
722098145287675904,pcar,2016-04-18 16:23:00,rt pcar volume pop may 56.10 call activity 1700 dollars .70 offer expire may 20,0.0,1.0,19005.0,283.0,True,0
722097914961637376,pcar,2016-04-18 16:22:00,cmi pcar call sweepers,0.0,0.0,38711.0,9630.0,False,1
722097306447646721,pcar,2016-04-18 16:19:00,pcar volume pop may 56.10 call activity 1700 dollars .70 offer expire may 20,0.0,1.0,2528.0,241.0,False,0
722097016046653441,pcar,2016-04-18 16:18:00,1523 pcar may16 56.1 calls dollars .70,0.0,0.0,152.0,2.0,False,1
721780846064234496,pcar,2016-04-17 19:22:00,pcar macquarie downgrades paccar inc neutral,0.0,0.0,749.0,6.0,False,0
721448905305624576,pcar,2016-04-16 21:23:00,pcar paccar inc nasdaq pcar share rating review,0.0,0.0,721.0,1.0,False,1
721365005958918145,pcar,2016-04-16 15:49:00,bgg dividend see greater bgg rig pcar,0.0,0.0,23.0,40.0,False,0
721353340169232387,pcar,2016-04-16 15:03:00,pcar ask see greater pcar cpa zts,1.0,0.0,34.0,40.0,False,1
721161961723985920,pcar,2016-04-16 02:23:00,jnk bid see greater jnk pcar adc,0.0,0.0,40.0,40.0,False,0
721112961771794432,pcar,2016-04-15 23:08:00,commonwealth pennsylvania public school empls retrmt sys raises stake paccar inc pcar,0.0,0.0,971.0,11.0,False,1
721112431678894080,pcar,2016-04-15 23:06:00,commonwealth pennsylvania public school empls retrmt sys raises stake paccar inc pcar,1.0,0.0,6133.0,2295.0,False,1
721108491029647361,pcar,2016-04-15 22:50:00,nrd stocks,0.0,0.0,4531.0,2620.0,False,1
721100791143145472,pcar,2016-04-15 22:20:00,pcar buy signal 53.645 apr 12 16,0.0,0.0,293.0,5.0,False,1
721070367985414144,pcar,2016-04-15 20:19:00,advantus capital management inc buys 715 shares inc read,0.0,0.0,13.0,2.0,False,0
721070212750004224,pcar,2016-04-15 20:18:00,advantus capital management inc buys 715 shares inc read,0.0,0.0,13.0,2.0,False,1
721063617957900288,pcar,2016-04-15 19:52:00,aberdeen asset management plc uk purchases 4699 shares paccar inc pcar,0.0,0.0,316.0,10.0,False,1
721026116610322432,pcar,2016-04-15 17:23:00,pcar large cap key stocks day paccar inc nasdaq pcar,0.0,0.0,621.0,0.0,False,1
721022791818936320,pcar,2016-04-15 17:10:00,bxs change see greater bxs pcar fdml,0.0,0.0,33.0,59.0,False,1
721003075713003522,pcar,2016-04-15 15:51:00,nasdaq100 trend nvda chkp ebay ctxs nflx bidu foxa pcar qcom amat pcln adbe vod msft,0.0,0.0,845.0,7.0,False,1
720979806788153345,pcar,2016-04-15 14:19:00,ive watching pcar stumbled paws typing wrong symbol not ready yet,0.0,0.0,33.0,138.0,False,0
720953958756274176,pcar,2016-04-15 12:36:00,agio e p see greater agio cray pcar,0.0,0.0,27.0,41.0,False,1
720950322596741120,pcar,2016-04-15 12:22:00,inc cut neutral macquarie read,0.0,0.0,13.0,2.0,False,1
720915002903896065,pcar,2016-04-15 10:01:00,weekly nasdaq100 performance ctrp aal bidu pcar csx ulta nflx nxpi expe amzn pcln ebay,0.0,0.0,847.0,7.0,False,1
720895450652352512,pcar,2016-04-15 08:44:00,env pe ratio ratio see greater env hdng pcar,0.0,0.0,31.0,40.0,False,1
720839330705514497,pcar,2016-04-15 05:01:00,oclr bid see greater oclr pcar p,0.0,0.0,28.0,40.0,False,1
720824537479143424,pcar,2016-04-15 04:02:00,pcar weekly,0.0,0.0,2835.0,29.0,False,0
720806494451707904,pcar,2016-04-15 02:50:00,rt pcar buy signal 53.645 apr 12 16,0.0,1.0,1256.0,4091.0,True,0
720806349312036864,pcar,2016-04-15 02:50:00,pcar buy signal 53.645 apr 12 16,0.0,1.0,292.0,5.0,False,1
720764141292560388,pcar,2016-04-15 00:02:00,bearish doji,0.0,0.0,4526.0,2622.0,False,1
720721615097634816,pcar,2016-04-14 21:13:00,pcar paccar inc nasdaq pcar share rating check,0.0,0.0,714.0,1.0,False,1
720705457011236864,pcar,2016-04-14 20:09:00,paccar inc pcar position raised mitsubishi ufj kokusai asset management co ltd,0.0,0.0,869.0,0.0,False,0
720677769953185792,pcar,2016-04-14 18:19:00,ame filings see greater ame pran pcar,0.0,0.0,27.0,20.0,False,1
720673998930120704,pcar,2016-04-14 18:04:00,paccar inc pcar rating lowered sell zacks investment research,0.0,0.0,314.0,10.0,False,0
720673628501733376,pcar,2016-04-14 18:02:00,pcar paccar inc rating lowered sell zacks investment research,0.0,0.0,617.0,5.0,False,1
720673513665871872,pcar,2016-04-14 18:02:00,pcar paccar inc rating lowered sell zacks investment research,0.0,0.0,150.0,0.0,False,1
720671597107875840,pcar,2016-04-14 17:54:00,pcar company info see greater pcar rexx psxp,0.0,0.0,38.0,40.0,False,1
720645310523904004,pcar,2016-04-14 16:10:00,inc position cut affinity investment advisors llc read,0.0,0.0,13.0,2.0,False,1
720633354182197248,pcar,2016-04-14 15:22:00,mkl market cap see greater mkl pcar mog,1.0,0.0,22.0,40.0,False,0
720631071952474112,pcar,2016-04-14 15:13:00,paccar inc pcar cut “neutral” macquarie,0.0,0.0,968.0,11.0,False,1
720630574474530816,pcar,2016-04-14 15:11:00,paccar inc pcar cut “neutral” macquarie,0.0,0.0,6125.0,2295.0,False,1
720629319953854465,pcar,2016-04-14 15:06:00,inc cut neutral macquarie read,0.0,0.0,13.0,2.0,False,1
720628464076894208,pcar,2016-04-14 15:03:00,paccar inc pcar cut “neutral” macquarie,0.0,0.0,1126.0,40.0,False,0
720626685192900608,pcar,2016-04-14 14:56:00,pcar 55.56 paccar inc pcar added watch list right pcar watching last price 55.56 hig,0.0,0.0,884.0,441.0,False,1
720616277245431808,pcar,2016-04-14 14:14:00,first washington corp holds stake inc read,0.0,0.0,13.0,2.0,False,0
720582478952574977,pcar,2016-04-14 12:00:00,first washington corp holds stake paccar inc pcar,0.0,0.0,690.0,8.0,False,1
720577340351365120,pcar,2016-04-14 11:40:00,pcar buy signal 53.645 apr 12 16,0.0,0.0,288.0,5.0,False,1
720569355776475136,pcar,2016-04-14 11:08:00,weekly nasdaq100 performance ctrp ulta csx nflx pcar mu bidu vod atvi foxa esrx aal,0.0,0.0,844.0,7.0,False,0
720568854053785600,pcar,2016-04-14 11:06:00,mo pcar market analyst checklist stocks altria group nyse mo paccar …,0.0,0.0,713.0,1.0,False,1
720567525487079424,pcar,2016-04-14 11:01:00,looking buy pcar today awesome looking chart breakout downgraded tues gone straight up since,0.0,0.0,352.0,67.0,False,0
720565901200719872,pcar,2016-04-14 10:54:00,tk ask see greater tk pcar ecol,0.0,0.0,26.0,20.0,False,1
720552281192677376,pcar,2016-04-14 10:00:00,american international group inc raises position paccar inc pcar,0.0,0.0,691.0,8.0,False,0
720548412689502210,pcar,2016-04-14 09:45:00,wft percent change see greater wft pnm pcar,0.0,0.0,30.0,40.0,False,0
720526903409565696,pcar,2016-04-14 08:19:00,dft eod data see greater dft pcar idi,0.0,0.0,33.0,59.0,False,0
720463097660641282,pcar,2016-04-14 04:06:00,pcar paccar becomes shorted nasdaq 100 component replacing henry schein chart interesting ill research,0.0,0.0,24.0,128.0,False,0
720413500552712192,pcar,2016-04-14 00:48:00,oppenheimerfunds inc purchases new position paccar inc pcar,0.0,0.0,690.0,8.0,False,1
720390293372035073,pcar,2016-04-13 23:16:00,inc shares sold cornerstone capital management holdings llc read,0.0,0.0,13.0,2.0,False,1
720386559573434368,pcar,2016-04-13 23:01:00,nasdaq100 performance mu atvi csx bmrn ntes ctrp trip pcar bidu endp swks adsk viab,0.0,0.0,844.0,7.0,False,1
720383184450375680,pcar,2016-04-13 22:48:00,aroon positive,1.0,0.0,4518.0,2621.0,False,1
720365391428612097,pcar,2016-04-13 21:37:00,paccar inc pcar shares sold cornerstone capital management holdings llc,0.0,0.0,868.0,0.0,False,0
720340678681579521,pcar,2016-04-13 19:59:00,nasdaq100 performance mu atvi csx ntes bmrn ctrp bidu endp swks nxpi pcar adsk viab,0.0,0.0,844.0,7.0,False,1
720330576251596800,pcar,2016-04-13 19:19:00,rt pcar 1 million runaway 7 positive 3 percent .1 percent offhi news prvchi accel alltfs tlm 1.6 ilm 1.5 gopop positive 1.4 percent 1 week hi dyvol 1.3 million 0.6 times …,0.0,1.0,2068.0,289.0,True,1
720328983020220416,pcar,2016-04-13 19:13:00,pcar 1 million runaway 7 positive 3 percent .1 percent offhi news prvchi accel alltfs tlm 1.6 ilm 1.5 gopop positive 1.4 percent 1 week hi dyvol 1.3 million 0.6 times 0.4 times,0.0,1.0,6770.0,271.0,False,0
720316865285726208,pcar,2016-04-13 18:24:00,take profits machinery stocks j p morgan says,0.0,0.0,261.0,1.0,False,0
720316863725473792,pcar,2016-04-13 18:24:00,take profits machinery stocks j p morgan says,0.0,0.0,2038.0,31.0,False,0
720316861548613632,pcar,2016-04-13 18:24:00,take profits machinery stocks j p morgan says,0.0,0.0,21088.0,32.0,False,0
720314282747908097,pcar,2016-04-13 18:14:00,jpm cat de agco cnhi pcar joy jpmorgan says take profits machinery stocks market shrugs,0.0,0.0,698.0,602.0,False,1
720313360168955904,pcar,2016-04-13 18:11:00,pcar 1 million runaway 1 positive 3 percent .4 percent offhi news prvchi atpivr3 tf 1111101 tlm 0.8 ilm 1.3 gopop positive 1.4 percent 1 week hi dyvol 1.05 million 0.5 times 0.4 times,0.0,0.0,6770.0,271.0,False,1
720311182834450432,pcar,2016-04-13 18:02:00,pcar earnings reaction history paccar inc nasdaq pcar 60 …,0.0,0.0,617.0,0.0,False,1
720307706435936256,pcar,2016-04-13 17:48:00,rt bullish two hundred day moving average cross pcar sphd,0.0,1.0,1096.0,1147.0,True,1
720303033620369412,pcar,2016-04-13 17:30:00,pcar buy signal 53.645 apr 12 16,0.0,0.0,285.0,5.0,False,1
720300435836444672,pcar,2016-04-13 17:19:00,macquarie downgrades paccar inc pcar neutral,0.0,0.0,689.0,8.0,False,0
720297374308904960,pcar,2016-04-13 17:07:00,pcar 54.89 paccar inc pcar added watch list right pcar watching last price 54.89 hig,0.0,0.0,883.0,441.0,False,1
720295486079442944,pcar,2016-04-13 17:00:00,bullish two hundred day moving average cross pcar sphd,0.0,1.0,811.0,1189.0,False,1
720295253165674496,pcar,2016-04-13 16:59:00,pcar new sec filing pcar form px14 a6 g no 0001140361 16 060990,0.0,0.0,128.0,6.0,False,1
720270863082192900,pcar,2016-04-13 15:22:00,inc lowered sell zacks investment research read,0.0,0.0,13.0,2.0,False,1
720232476493357057,pcar,2016-04-13 12:49:00,paccar inc pcar lowered “sell” zacks investment research,0.0,0.0,686.0,8.0,False,1
720222251207897088,pcar,2016-04-13 12:09:00,employees retirement system texas dollars 043000 stake inc read,0.0,0.0,13.0,2.0,False,1
720139575553835008,pcar,2016-04-13 06:40:00,pcar us paccar inc pcar lowered sell zacks investment research inc,0.0,0.0,2743.0,274.0,False,1
720098700253597699,pcar,2016-04-13 03:58:00,pcar 52 week low see greater pcar nflx apc,1.0,0.0,41.0,60.0,False,0
720086608653979648,pcar,2016-04-13 03:10:00,pcar buy signal 53.645 apr 12 16,0.0,0.0,284.0,5.0,False,0
720075675470659584,pcar,2016-04-13 02:26:00,inc lowered sell zacks investment research read,0.0,0.0,13.0,2.0,False,1
720073336076824576,pcar,2016-04-13 02:17:00,pcar paccar inc lowered sell zacks investment research,0.0,0.0,6111.0,2296.0,False,1
720072338860032001,pcar,2016-04-13 02:13:00,pcar paccar inc pcar lowered sell zacks investment research,0.0,0.0,575.0,0.0,False,0
720066928333598720,pcar,2016-04-13 01:51:00,180 bullish,0.0,1.0,4514.0,2625.0,False,1
720024288443686913,pcar,2016-04-12 23:02:00,pcar paccar inc nasdaq pcar quick look earnings,0.0,0.0,575.0,0.0,False,0
720013406162411521,pcar,2016-04-12 22:19:00,180 bullish,0.0,0.0,4518.0,2625.0,False,0
719967427182862336,pcar,2016-04-12 19:16:00,yesterday’s consumer pops drops ua son pcar pkg pcar pkg son ua,0.0,0.0,1696.0,16.0,False,1
719949247039217664,pcar,2016-04-12 18:04:00,zacks investment research lowers inc sell read,0.0,0.0,13.0,2.0,False,1
719937580905689088,pcar,2016-04-12 17:17:00,paccar downgraded zacks investment research sell,0.0,0.0,4047.0,1.0,False,0
719934641847840769,pcar,2016-04-12 17:06:00,paccar downgraded zacks investment research sell,0.0,0.0,4534.0,2838.0,False,0
719932788871278592,pcar,2016-04-12 16:58:00,inc stake cut eaton vance management read,0.0,0.0,13.0,2.0,False,1
719853210421211136,pcar,2016-04-12 11:42:00,inc downgraded neutral macquarie read,0.0,0.0,13.0,2.0,False,1
719844827345645568,pcar,2016-04-12 11:09:00,pcar cce overview price moves paccar inc nasdaq pcar coca …,0.0,0.0,614.0,0.0,False,0
719746611426025472,pcar,2016-04-12 04:38:00,ranks 80 percent alert gains today click,0.0,0.0,7095.0,0.0,False,1
719655631670489088,pcar,2016-04-11 22:37:00,pcar us paccar inc pcar cut neutral macquarie inc,0.0,0.0,2738.0,274.0,False,1
719655490523779072,pcar,2016-04-11 22:36:00,stochastic oversold,0.0,0.0,4506.0,2625.0,False,1
719646289579757569,pcar,2016-04-11 22:00:00,rt pcar sell signal 52.65 apr 08 16,0.0,1.0,709.0,613.0,True,1
719646205320511488,pcar,2016-04-11 22:00:00,pcar sell signal 52.65 apr 08 16,1.0,1.0,282.0,5.0,False,1
719643500757835777,pcar,2016-04-11 21:49:00,mur pcar cmi oppenheimer’s technician buying growth value tech …,0.0,0.0,885.0,9.0,False,1
719539489157357570,pcar,2016-04-11 14:55:00,paccar inc pcar downgraded zacks investment research,0.0,0.0,300.0,10.0,False,0
719532975877156867,pcar,2016-04-11 14:30:00,pcar us paccar inc pcar cut neutral macquarie inc,0.0,0.0,2740.0,274.0,False,1
719528659250454529,pcar,2016-04-11 14:12:00,pcar us paccar inc pcar cut neutral macquarie inc,0.0,0.0,3354.0,247.0,False,1
719520125582503936,pcar,2016-04-11 13:39:00,downgrades son ari gg fltx wmc mfa ivr cmi pcar qlik afop unfi,0.0,0.0,183.0,126.0,False,0
719507005707169793,pcar,2016-04-11 12:46:00,rt top downgrades afop aldw ari avb clmt cmo gg mos nti pcar pot qlik unfi vlo wmc xyl,0.0,3.0,271.0,451.0,True,1
719506464554033153,pcar,2016-04-11 12:44:00,rt top downgrades afop aldw ari avb clmt cmo gg mos nti pcar pot qlik unfi vlo wmc xyl,0.0,3.0,470.0,410.0,True,1
719505933563535360,pcar,2016-04-11 12:42:00,rt top downgrades afop aldw ari avb clmt cmo gg mos nti pcar pot qlik unfi vlo wmc xyl,0.0,3.0,441.0,271.0,True,1
719505657112584192,pcar,2016-04-11 12:41:00,top downgrades afop aldw ari avb clmt cmo gg mos nti pcar pot qlik unfi vlo wmc xyl,0.0,3.0,18553.0,241.0,False,1
719504911923163136,pcar,2016-04-11 12:38:00,pcar investor opinions see greater pcar nj fb,0.0,0.0,29.0,20.0,False,0
719500022493028352,pcar,2016-04-11 12:19:00,inc cut neutral macquarie read,0.0,0.0,13.0,2.0,False,1
719499868096454656,pcar,2016-04-11 12:18:00,inc stock rating lowered macquarie read,0.0,0.0,13.0,2.0,False,0
719498893948379136,pcar,2016-04-11 12:14:00,becn goog googl fb twtr cmi pcar mos pot pkg blmn au analyst action,0.0,0.0,5963.0,193.0,False,0
719496988044042240,pcar,2016-04-11 12:07:00,btw estimated per share pcar dollars .01 1.92 percent current price,0.0,0.0,1281.0,1503.0,False,0
719496577245671424,pcar,2016-04-11 12:05:00,paccar downgraded macquarie neutral,0.0,0.0,4037.0,1.0,False,0
719496047018377216,pcar,2016-04-11 12:03:00,april analyst upgrades downgrades becn goog googl fb twtr cmi pcar mos pot pkg blmn au,0.0,0.0,1320.0,44.0,False,0
719495252038459392,pcar,2016-04-11 12:00:00,paccar inc downgrade macquarie ranked 20 neutral pcar,0.0,0.0,510.0,45.0,False,0
719494023082323968,pcar,2016-04-11 11:55:00,pcar take look price moves verifone systems inc nyse pay …,0.0,0.0,616.0,0.0,False,0
719493259576373248,pcar,2016-04-11 11:52:00,paccar inc pcar stock rating lowered macquarie,0.0,0.0,866.0,0.0,False,1
719489832234274816,pcar,2016-04-11 11:38:00,rt macquarie downgrades paccar pcar neutral,0.0,1.0,673.0,288.0,True,1
719489700323438592,pcar,2016-04-11 11:38:00,macquarie downgrades paccar pcar neutral,1.0,1.0,2985.0,1.0,False,1
719486145046781952,pcar,2016-04-11 11:23:00,avb xyl mfa ivr cmo ne pcar cmi wmc udr eqr,0.0,0.0,15369.0,329.0,False,1
719459977199534080,pcar,2016-04-11 09:40:00,pcar sell signal 52.65 apr 08 16,0.0,0.0,282.0,5.0,False,1
719459040615510016,pcar,2016-04-11 09:36:00,cibc world markets corp buys 4745 shares inc read,0.0,0.0,13.0,2.0,False,1
719444448791257088,pcar,2016-04-11 08:38:00,us bancorp de dollars 16180000 stake inc read,0.0,0.0,13.0,2.0,False,1
719437406567579648,pcar,2016-04-11 08:10:00,andra ap fonden raises stake paccar inc pcar,0.0,0.0,298.0,10.0,False,1
719432310349635584,pcar,2016-04-11 07:50:00,foe news see greater foe imdz pcar,1.0,0.0,27.0,40.0,False,0
719401411537215488,pcar,2016-04-11 05:47:00,pcar brighton jones llc sells 91 shares paccar inc pcar,0.0,0.0,742.0,6.0,False,0
719400912381468672,pcar,2016-04-11 05:45:00,pcar us bancorp de dollars 16180000 stake paccar inc pcar,0.0,0.0,885.0,9.0,False,1
719400656843448320,pcar,2016-04-11 05:44:00,brighton jones llc sells 91 shares paccar inc pcar,0.0,0.0,677.0,8.0,False,0
719305536160681986,pcar,2016-04-10 23:26:00,inc cut sell zacks investment research read,1.0,0.0,13.0,2.0,False,0
719208319546748928,pcar,2016-04-10 17:00:00,pcar sell signal 52.65 apr 08 16,0.0,0.0,280.0,5.0,False,1
719130075271077888,pcar,2016-04-10 11:49:00,pcar company info see greater pcar slv flks,0.0,0.0,26.0,40.0,False,0
719112145875636224,pcar,2016-04-10 10:37:00,pcar 52.65 stock charts pcar paccar inc nasdaq last updated 5 pcar stock chart 1 mont,0.0,0.0,1408.0,667.0,False,1
719106411897036801,pcar,2016-04-10 10:15:00,kex message board posts see greater kex mos pcar,1.0,0.0,35.0,40.0,False,0
718994928865390592,pcar,2016-04-10 02:52:00,jack dividend see greater jack pcar chma,0.0,0.0,26.0,40.0,False,0
718979311273963520,pcar,2016-04-10 01:50:00,pcar sell signal 52.65 apr 08 16,0.0,0.0,279.0,5.0,False,0
718910176481423361,pcar,2016-04-09 21:15:00,pcar paccar inc nasdaq pcar stock rating focus,0.0,0.0,620.0,0.0,False,1
718899349267333120,pcar,2016-04-09 20:32:00,pcar top stocks day paccar inc nasdaq pcar,0.0,0.0,745.0,6.0,False,1
718833348454543361,pcar,2016-04-09 16:10:00,pcar sell signal 52.65 apr 08 16,1.0,0.0,279.0,5.0,False,1
718798940490096642,pcar,2016-04-09 13:53:00,pcar paccar inc nasdaq pcar analyst rating update,0.0,0.0,886.0,9.0,False,1
718740683838857216,pcar,2016-04-09 10:01:00,weekly nasdaq100 performance esrx nflx fast ebay biib chrw pcar adp grmn mat wdc ctsh,0.0,0.0,845.0,7.0,False,1
718682622059130880,pcar,2016-04-09 06:11:00,sjt dividend see greater sjt l pcar,0.0,0.0,22.0,40.0,False,0
718643866832777216,pcar,2016-04-09 03:37:00,pcar volume see greater pcar cgnh afmd,1.0,0.0,34.0,20.0,False,0
718616924448493568,pcar,2016-04-09 01:50:00,pcar sell signal 52.65 apr 08 16,1.0,0.0,278.0,5.0,False,1
718613789109649408,pcar,2016-04-09 01:37:00,dlr exchange see greater dlr pcar ears,0.0,0.0,34.0,40.0,False,1
718611965560623104,pcar,2016-04-09 01:30:00,pcar paccar incorporated nasdaq pcar shorts decreased 1.43 …,0.0,0.0,573.0,0.0,False,1
718560867600723968,pcar,2016-04-08 22:07:00,pcar analysts rated paccar inc nasdaq pcar last week,0.0,0.0,703.0,1.0,False,0
718510235535577092,pcar,2016-04-08 18:46:00,ptla company info see greater point la ti pcar,1.0,0.0,23.0,40.0,False,1
718501679583207424,pcar,2016-04-08 18:12:00,infu tick see greater infu gva pcar,0.0,0.0,23.0,40.0,False,1
718471574618120193,pcar,2016-04-08 16:12:00,nisa investment advisors dollars 840000 position inc read,0.0,0.0,13.0,2.0,False,1
718466445672222720,pcar,2016-04-08 15:52:00,orbc financials see greater orbc pcar ncs,0.0,0.0,23.0,40.0,False,0
718466282115440641,pcar,2016-04-08 15:51:00,nasdaq100 performance vip mu lbtya ctxs vod nxpi pcar stx ntap fast adsk qcom disca,0.0,0.0,844.0,7.0,False,0
718441518114013187,pcar,2016-04-08 14:13:00,jbem pick cydy runng hard flks nxt,0.0,0.0,146.0,12.0,False,1
718433399321542656,pcar,2016-04-08 13:40:00,nisa investment advisors dollars 840000 position paccar inc pcar,0.0,0.0,861.0,0.0,False,1
718172761135316992,pcar,2016-04-07 20:25:00,pcar news see greater pcar shop lscc,0.0,0.0,34.0,40.0,False,0
718161814962372610,pcar,2016-04-07 19:41:00,exa change see greater exa cm pcar,0.0,0.0,30.0,40.0,False,1
718159647329370114,pcar,2016-04-07 19:32:00,gam holding ag raises stake paccar inc pcar,0.0,0.0,1123.0,40.0,False,1
718052748344733696,pcar,2016-04-07 12:28:00,ubs oconnor llc dollars 2936000 stake inc read,0.0,0.0,13.0,2.0,False,1
718043268240400384,pcar,2016-04-07 11:50:00,suntrust banks inc lowers position inc read,0.0,0.0,13.0,2.0,False,1
717957646901460992,pcar,2016-04-07 06:10:00,pcar key stocks day paccar inc nasdaq pcar,0.0,0.0,744.0,6.0,False,0
717920222221443072,pcar,2016-04-07 03:41:00,tup shares see greater tup blue pcar,0.0,0.0,28.0,40.0,False,0
