Tweet Id,Ticker,Datetime,Text,Favs,RTs,Followers,Following,Is a RT,Sentiment
719878279310807041,csx,2016-04-12 13:22:00,rt earnings far scorecard created spy fast csx,0.0,10.0,11.0,47.0,True,1
719877908945367040,csx,2016-04-12 13:20:00,rt earnings far scorecard created spy fast csx,0.0,4.0,381.0,616.0,True,1
719877908928544768,csx,2016-04-12 13:20:00,rt earnings far scorecard created spy fast csx,0.0,4.0,2666.0,1661.0,True,1
719877902448377856,csx,2016-04-12 13:20:00,rt earnings far scorecard created spy fast csx,0.0,4.0,29.0,55.0,True,1
719877874979876865,csx,2016-04-12 13:20:00,rt earnings far scorecard created spy fast csx,0.0,4.0,126.0,377.0,True,0
719877788979699712,csx,2016-04-12 13:20:00,earnings far scorecard created spy fast csx,19.0,23.0,502626.0,122047.0,False,0
719876511969517572,csx,2016-04-12 13:15:00,hoy reportan fast csx,0.0,0.0,5175.0,2342.0,False,1
719876460849315840,csx,2016-04-12 13:14:00,stocks play martes 12 de abril 2016 aapl fb nugt vrx jnpr csx lei aa hznp sbux egle gdx mro chk,0.0,0.0,4097.0,1812.0,False,0
719876382659080192,csx,2016-04-12 13:14:00,stocks play martes 12 de abril 2016 aapl fb nugt vrx jnpr csx lei aa hznp sbux egle gdx mro chk,0.0,0.0,4097.0,1812.0,False,0
719876267747753984,csx,2016-04-12 13:14:00,stocks play martes 12 de abril 2016 aapl fb nugt vrx jnpr csx lei aa hznp sbux egle gdx mro chk bhp fcx csco,0.0,0.0,4097.0,1812.0,False,1
719876206561091584,csx,2016-04-12 13:13:00,watching today earnings aa csx fast msg pery economic 2 pm treasury budget,0.0,0.0,59.0,40.0,False,1
719875539595567110,csx,2016-04-12 13:11:00,csx mgm top trending stocks view csx corporation nasdaq csx …,0.0,0.0,572.0,0.0,False,1
719873824968151040,csx,2016-04-12 13:04:00,top earnings tues adtn csx dtea layn top earnings wed pre cbsh jpm titn,1.0,0.0,18594.0,241.0,False,0
719872703059124224,csx,2016-04-12 13:00:00,csx fast adtn layn reporting today see last 4 qrtrs price movement history earnings announcement,0.0,0.0,119.0,5.0,False,1
719872331628326912,csx,2016-04-12 12:58:00,rt earnings scheduled today 🗓✍🏼😏👉🏼 adtn csx dtea fast pery layn leds staf,0.0,1.0,663.0,648.0,True,0
719870261915435008,csx,2016-04-12 12:50:00,csx dg analyst’s focused stocks csx corporation nasdaq csx dollar …,0.0,0.0,572.0,0.0,False,1
719866489197760512,csx,2016-04-12 12:35:00,csx stock estimates record csx corporation nasdaq csx,0.0,0.0,883.0,9.0,False,0
719864811044147200,csx,2016-04-12 12:28:00,rt notable 2016.04.12 fast pery csx,0.0,1.0,678.0,298.0,True,0
719862760163532800,csx,2016-04-12 12:20:00,notable 2016.04.12 fast pery csx,0.0,1.0,19299.0,13933.0,False,1
719862296047173632,csx,2016-04-12 12:18:00,railroad operator csx keeps chugging along,1.0,0.0,210.0,26.0,False,0
719862035396169728,csx,2016-04-12 12:17:00,earnings season underway aa slipping 3 percent report today close csx railroad stock others report,2.0,0.0,39385.0,619.0,False,1
719861527394795520,csx,2016-04-12 12:15:00,rails csx nsc unp jbht driving train high c1 4.12.16,1.0,0.0,210.0,26.0,False,1
719860689884418048,csx,2016-04-12 12:12:00,notable companies reporting today csx fast hcsg adtn tsi,0.0,0.0,215.0,92.0,False,1
719853381435662336,csx,2016-04-12 11:43:00,resultados para hoy antes del mercado fast perry después de cierre de mercado csx layn,0.0,0.0,11.0,1.0,False,0
719853247037632514,csx,2016-04-12 11:42:00,earnings today pre fast perry closing bell csx layn,0.0,0.0,2618.0,340.0,False,1
719846360728657925,csx,2016-04-12 11:15:00,us earnings release today fast ej agx pery asrv csx adtn amcn dtea vhc bbsi cnbka layn,0.0,0.0,335.0,581.0,False,1
719844993129521153,csx,2016-04-12 11:09:00,notable companies reporting today csx fast hcsg adtn tsi,0.0,0.0,2005.0,103.0,False,0
719839303812149249,csx,2016-04-12 10:47:00,csx dri analyst sales highlights csx corporation nasdaq csx darden …,0.0,0.0,717.0,5.0,False,1
719838463772725249,csx,2016-04-12 10:43:00,rt upcoming earnings mon aa ozrk tue csx fast dtea wed jpm thu wfc dal bac blk fri c full list …,0.0,32.0,106.0,207.0,True,1
719835141112074240,csx,2016-04-12 10:30:00,7 stocks watching today aa adtn csx fast pery jnpr layn,0.0,0.0,49067.0,1477.0,False,1
719834879580614657,csx,2016-04-12 10:29:00,7 stocks watching today aa adtn csx via,0.0,0.0,311.0,567.0,False,1
719831916149481472,csx,2016-04-12 10:17:00,earnings tues market adtn csx dtea hcsg layn leds,0.0,0.0,946.0,284.0,False,0
719831123283456000,csx,2016-04-12 10:14:00,close look tuesday’s key market events close look tuesday’s key market events csx unp nsc ther,0.0,0.0,1709.0,1748.0,False,1
719829899494715393,csx,2016-04-12 10:09:00,earnings scheduled today 🗓✍🏼😏👉🏼 adtn csx dtea fast pery layn leds staf,0.0,1.0,1260.0,1004.0,False,1
719819667678896128,csx,2016-04-12 09:29:00,aa csx dji spx ixic spy qqq dia ivv stocks set modest gains oil rallies,0.0,0.0,743.0,6.0,False,1
719815673887727616,csx,2016-04-12 09:13:00,csx up today report wall street expecting eps dollars .37 revenues dollars 732 billion,0.0,0.0,89.0,314.0,False,1
719811181049827328,csx,2016-04-12 08:55:00,csx 24.53 stock charts csx csx corp nasdaq last updated 2 csx stock chart 1 month htt,0.0,0.0,1410.0,667.0,False,1
719800044833140737,csx,2016-04-12 08:11:00,csx leds earnings scheduled april 12 2016,0.0,0.0,614.0,0.0,False,1
719795734976012288,csx,2016-04-12 07:54:00,rt upcoming earnings mon aa ozrk tue csx fast dtea wed jpm thu wfc dal bac blk fri c full list …,0.0,31.0,38.0,212.0,True,1
719794442106834945,csx,2016-04-12 07:49:00,calculated 63 day expected return csx 6.82 percent,0.0,0.0,1288.0,1502.0,False,0
719787708634263552,csx,2016-04-12 07:22:00,csx csx co nyse csx receives consensus rating “hold” …,0.0,0.0,743.0,6.0,False,1
719786138047787008,csx,2016-04-12 07:16:00,explore numbers pros cons csx,0.0,0.0,1287.0,1502.0,False,0
719780120311898112,csx,2016-04-12 06:52:00,know price csx dollars 7.3,0.0,0.0,1287.0,1502.0,False,0
719776872649912321,csx,2016-04-12 06:39:00,watch list april 2016 amp axp csx dfs gd jci pfg unp usb wfc qcom trow,0.0,0.0,1493.0,506.0,False,1
719773852654395393,csx,2016-04-12 06:27:00,close look tuesday’s key market events close look tuesday’s key market events csx unp nsc ther,0.0,0.0,7810.0,1613.0,False,0
719773850838302720,csx,2016-04-12 06:27:00,close look tuesday’s key market events close look tuesday’s key market events csx unp nsc ther,0.0,0.0,1492.0,1899.0,False,0
719773850565619712,csx,2016-04-12 06:27:00,close look tuesday’s key market events close look tuesday’s key market events csx unp nsc ther,0.0,0.0,1443.0,1897.0,False,0
719771141594812416,csx,2016-04-12 06:16:00,tape csx going full steam ahead wsj,0.0,0.0,7055.0,65.0,False,0
719766795289100288,csx,2016-04-12 05:59:00,close look tuesday’s key market events close look tuesday’s key market events csx unp nsc ther,0.0,0.0,180.0,1446.0,False,0
719766793871446017,csx,2016-04-12 05:59:00,close look tuesday’s key market events close look tuesday’s key market events csx unp nsc ther,0.0,0.0,206.0,257.0,False,1
719766791866556416,csx,2016-04-12 05:59:00,close look tuesday’s key market events close look tuesday’s key market events csx unp nsc ther,0.0,0.0,31.0,0.0,False,1
719766789790441474,csx,2016-04-12 05:59:00,close look tuesday’s key market events close look tuesday’s key market events csx unp nsc ther,0.0,0.0,979.0,1629.0,False,0
719765473018052608,csx,2016-04-12 05:53:00,close look tuesday’s key market events csx unp nsc,0.0,0.0,1778.0,1739.0,False,1
719762295631585285,csx,2016-04-12 05:41:00,rt aa csx fb fit calls joel meeting spy,0.0,7.0,1096.0,173.0,True,0
719761086631706624,csx,2016-04-12 05:36:00,fact would say solid chance csx actually increased profits yoy iron clad leadership,0.0,0.0,113.0,104.0,False,0
719760756086931457,csx,2016-04-12 05:35:00,forget thought csx revenues may down adjusted cutting expenses throughout company,0.0,0.0,113.0,104.0,False,1
719760217278251009,csx,2016-04-12 05:33:00,rt five watch week aa csx jpm bac dal aa bac csx dal jpm,0.0,2.0,113.0,104.0,True,0
719760108402511872,csx,2016-04-12 05:32:00,rt aa csx fb fit calls joel meeting spy,0.0,7.0,113.0,104.0,True,0
719759995647045632,csx,2016-04-12 05:32:00,solid write up csx,0.0,0.0,113.0,104.0,False,0
719754099630174208,csx,2016-04-12 05:08:00,csx release earnings wednesday csx,0.0,0.0,6112.0,2296.0,False,1
719753707798159361,csx,2016-04-12 05:07:00,earnings season continues tuesday csx closing bell find seasonal chart,0.0,0.0,2010.0,343.0,False,1
719740180488257540,csx,2016-04-12 04:13:00,earnings reaction keep eye tuesday fast csx aval leds pery adtn staf dtea layn,1.0,0.0,788.0,1905.0,False,1
719734540344889345,csx,2016-04-12 03:51:00,monday success buy michael james enterprises mjtv worry csx,0.0,0.0,1.0,2.0,False,1
719732256294567936,csx,2016-04-12 03:41:00,everyone buying week michael james ent mjtv picks csx,0.0,0.0,25.0,164.0,False,1
719729752139964416,csx,2016-04-12 03:31:00,otc selection otc mjtv old choices csx,0.0,0.0,11.0,9.0,False,0
719729613115514881,csx,2016-04-12 03:31:00,elder red,0.0,0.0,4508.0,2625.0,False,0
719729446647898112,csx,2016-04-12 03:30:00,true wall street wolf pick ticker michael james ent mjtv others odp csx znga,0.0,0.0,0.0,1.0,False,1
719727235981139969,csx,2016-04-12 03:21:00,pink sheet stock order michael james ent mjtv hold csx,0.0,0.0,80.0,219.0,False,1
719724396764483585,csx,2016-04-12 03:10:00,buy moon michael james enterprises mjtv picks csx,0.0,0.0,0.0,1.0,False,1
719724021206671360,csx,2016-04-12 03:09:00,five watch week aa csx jpm bac dal aa bac csx dal jpm,1.0,2.0,1492.0,506.0,False,1
719721667946225664,csx,2016-04-12 02:59:00,pick no buying csx,0.0,0.0,7.0,11.0,False,1
719719304921350145,csx,2016-04-12 02:50:00,monday bulls michael james ent old favorites csx,0.0,0.0,23.0,109.0,False,1
719718066263760896,csx,2016-04-12 02:45:00,rt notable earnings tuesday’s close,0.0,1.0,357.0,2067.0,True,0
719716824666021888,csx,2016-04-12 02:40:00,buy monday insider news pick otcbb mjtv old picks csx,0.0,0.0,6.0,7.0,False,0
719714501059186688,csx,2016-04-12 02:31:00,buy mjtv sell csx,0.0,0.0,15.0,52.0,False,0
719712077925867520,csx,2016-04-12 02:21:00,mjtv not worry csx,0.0,0.0,6.0,4.0,False,1
719709367642140672,csx,2016-04-12 02:10:00,b u l l h b u l e r mjtv michael james ent inc picks csx,0.0,0.0,4.0,6.0,False,1
719706822089650176,csx,2016-04-12 02:00:00,otcbb buy alert otcbb mjtv sold csx,0.0,0.0,46.0,117.0,False,1
719704765806944256,csx,2016-04-12 01:52:00,monday bulls mjtv others csx,0.0,0.0,2.0,6.0,False,1
719704158022926337,csx,2016-04-12 01:50:00,buy otc markets yahoo finance otcbb mjtv forget bac axn csx,0.0,0.0,2.0,7.0,False,1
719702186360311809,csx,2016-04-12 01:42:00,buy buy buy buy buy mjtv michael james ent inc old choices csx,0.0,0.0,0.0,0.0,False,1
719699859989741568,csx,2016-04-12 01:33:00,huge monday buy mjtv buys csx,0.0,0.0,0.0,1.0,False,0
719699468975648768,csx,2016-04-12 01:31:00,rt aa fast pery csx dtea c adtn layn jpm titn pir bac wfc blk dal pnc rf pgr tsm chke schw infy,0.0,67.0,5.0,20.0,True,1
719697611398189058,csx,2016-04-12 01:24:00,otc selection otcbb mjtv no buying csx,0.0,0.0,5.0,53.0,False,1
719695237950648320,csx,2016-04-12 01:14:00,opening bell buys ticker otcbb mjtv monday sells biib csx axvl,0.0,0.0,0.0,3.0,False,1
719695221328490496,csx,2016-04-12 01:14:00,otcbb buy alert mjtv no buys csx,0.0,0.0,0.0,20.0,False,1
719694311013527552,csx,2016-04-12 01:11:00,wolf worthy pick company otc mjtv no buys dla nete csx,0.0,0.0,4.0,7.0,False,1
719692208060952576,csx,2016-04-12 01:02:00,hot buy otc mjtv hold csx,0.0,0.0,5.0,53.0,False,1
719689801302151170,csx,2016-04-12 00:53:00,rt upcoming earnings mon aa ozrk tue csx fast dtea wed jpm thu wfc dal bac blk fri c full list …,0.0,30.0,406.0,146.0,True,1
719687082298310657,csx,2016-04-12 00:42:00,money monday alert michael james ent mjtv not worry csx,0.0,0.0,5.0,5.0,False,1
719686275612155904,csx,2016-04-12 00:39:00,watch list april 2016 amp axp csx dfs gd jci pfg unp usb wfc qcom trow,0.0,0.0,301.0,13.0,False,1
719684668585476096,csx,2016-04-12 00:32:00,monday pick insider alert otc mjtv others csx,0.0,0.0,4.0,15.0,False,1
719683293050904576,csx,2016-04-12 00:27:00,buy old choices phot csx,0.0,0.0,3.0,5.0,False,0
719683126906105856,csx,2016-04-12 00:26:00,not wait otc mjtv no buys cfge csx,0.0,0.0,7.0,34.0,False,1
719683065317040128,csx,2016-04-12 00:26:00,csx reports bell tomorrow could good chance pick up long term disappoint,0.0,0.0,242.0,1163.0,False,1
719682732712968192,csx,2016-04-12 00:25:00,stocks im watchingand buy targets csx 20 lvs 40 tgt 70,1.0,0.0,242.0,1163.0,False,1
719682088786468865,csx,2016-04-12 00:22:00,true otcmarkets selection otc mjtv monday sells csx,0.0,0.0,10.0,9.0,False,1
719681399066882048,csx,2016-04-12 00:19:00,order pink sheets otcbb mjtv sold gild csx,0.0,0.0,0.0,0.0,False,0
719679120733396992,csx,2016-04-12 00:10:00,pink sheet stock pick others csx,0.0,0.0,5.0,40.0,False,0
719679049329688577,csx,2016-04-12 00:10:00,not wait around co symbol otc mjtv picks bhi nvs csx,0.0,0.0,8.0,1.0,False,1
719678491839451136,csx,2016-04-12 00:08:00,buy alert bell otc mjtv old picks natr csx,0.0,0.0,1.0,3.0,False,0
719676135156555777,csx,2016-04-11 23:58:00,massive monday pump incoming mjtv michael james enterprises inc old picks csx,0.0,0.0,1.0,1.0,False,1
719676077489004544,csx,2016-04-11 23:58:00,super high float order yahoo finance otc mjtv old choices bhi acet csx,0.0,0.0,1.0,1.0,False,1
719674191524401152,csx,2016-04-11 23:51:00,rt season monday aa tues csx fast dtea wed jpm thu wfc dal bac blk fri c,0.0,1.0,884.0,98.0,True,1
719673657040089088,csx,2016-04-11 23:49:00,pick michael james enterprises inc buys csx,0.0,0.0,1.0,0.0,False,1
719673476920053761,csx,2016-04-11 23:48:00,pink sheet stock order yahoo finance otc mjtv picks hog csx mro,0.0,0.0,36.0,244.0,False,1
719672225373282304,csx,2016-04-11 23:43:00,money bulls coming ticker otc mjtv monday sells vktx csx zts,0.0,0.0,9.0,45.0,False,1
719670188858281984,csx,2016-04-11 23:35:00,dji spx gdx aa jpm fast csx funky trading might mean something,0.0,0.0,884.0,9.0,False,0
719667547025620992,csx,2016-04-11 23:24:00,monday bulls co tickr mjtv picks bbry csx nete,0.0,0.0,0.0,1.0,False,1
719666225534627841,csx,2016-04-11 23:19:00,monday money news mjtv otcbb old picks csx,0.0,0.0,1.0,1.0,False,1
719665264372133888,csx,2016-04-11 23:15:00,buy co tickr otcbb mjtv old choices rexx line csx,0.0,0.0,0.0,0.0,False,1
719664716159782912,csx,2016-04-11 23:13:00,people get rich buy company otc mjtv hold vktx amri csx,0.0,0.0,2.0,20.0,False,1
719663778841903104,csx,2016-04-11 23:09:00,early buy symbol otcbb mjtv sold pep teva csx,0.0,0.0,21.0,113.0,False,0
719663078996967424,csx,2016-04-11 23:07:00,b u l l h b u l e r mjtv michael james ent inc sold gild csx,0.0,0.0,7.0,11.0,False,1
719659051764867073,csx,2016-04-11 22:51:00,twitter buy alert symbol mjtv michael james enterprises inc hold hiho iwy csx,0.0,0.0,7.0,23.0,False,0
719658242377400320,csx,2016-04-11 22:47:00,incoming otc buy mjtv michael james ent inc bye csx,0.0,0.0,4.0,0.0,False,1
719657844769824768,csx,2016-04-11 22:46:00,buy news yahoo finance otcbb mjtv old favorites hyg csx ddd,0.0,0.0,4.0,3.0,False,1
719656877026463744,csx,2016-04-11 22:42:00,everyone buying week company otc mjtv sold vxx pcln csx,0.0,0.0,3.0,6.0,False,1
719656156411469828,csx,2016-04-11 22:39:00,elder red,0.0,0.0,4506.0,2625.0,False,1
719655610199900162,csx,2016-04-11 22:37:00,monday orders otc mjtv hold csx,0.0,0.0,1.0,0.0,False,1
719652965800214530,csx,2016-04-11 22:26:00,surge incoming buy mjtv michael james enterprises inc picks csx,0.0,0.0,21.0,113.0,False,1
719651808499486721,csx,2016-04-11 22:22:00,big buy alert mjtv michael james ent inc not worry watt csx,0.0,0.0,0.0,0.0,False,1
719650618227302400,csx,2016-04-11 22:17:00,buy mjtv sold csx,1.0,0.0,2.0,2.0,False,1
719650167343968258,csx,2016-04-11 22:15:00,buy bell symbol otc mjtv monday sold nflx csx amzn,0.0,0.0,2.0,2.0,False,1
719649769430224897,csx,2016-04-11 22:14:00,incoming otc buy symbol mjtv worry rexx emc csx,0.0,0.0,1.0,0.0,False,1
719648401474781184,csx,2016-04-11 22:08:00,rt aa fast pery csx dtea c adtn layn jpm titn pir bac wfc blk dal pnc rf pgr tsm chke schw infy,0.0,66.0,134.0,141.0,True,0
719647043367649280,csx,2016-04-11 22:03:00,csx csx corporation nyse csx – shares focus,0.0,0.0,717.0,5.0,False,1
719646697849286661,csx,2016-04-11 22:01:00,people become successful order company otc mjtv success nptn psun csx,0.0,0.0,3.0,21.0,False,1
719646537312301056,csx,2016-04-11 22:01:00,scan results fell below 50 dma today insy phh lulu eqr fb csx slab vrnt clmt aeo,0.0,0.0,615.0,45.0,False,1
719644560452882432,csx,2016-04-11 21:53:00,buy asap symbol sold qqqe gale csx,0.0,0.0,44.0,20.0,False,1
719643444147331074,csx,2016-04-11 21:49:00,place order otc mjtv no buying csx,0.0,0.0,1.0,5.0,False,1
719641881852964864,csx,2016-04-11 21:42:00,rt marketcurrents notable earnings tuesday’s close,1.0,0.0,4343.0,4976.0,False,0
719641041356374017,csx,2016-04-11 21:39:00,pump incoming otcbb mjtv old picks unp csx,0.0,0.0,4.0,1.0,False,0
719640862439960576,csx,2016-04-11 21:38:00,true otcmarkets selection no csx,0.0,0.0,2.0,9.0,False,1
719640184883515392,csx,2016-04-11 21:36:00,notable earnings tuesday’s close,0.0,0.0,258.0,1.0,False,1
719640183423913984,csx,2016-04-11 21:36:00,notable earnings tuesday’s close,1.0,1.0,21054.0,32.0,False,1
719639215294779392,csx,2016-04-11 21:32:00,rt expected tues csx fast 2 largest u companies market cap start research,0.0,1.0,665.0,647.0,True,1
719638655707557894,csx,2016-04-11 21:30:00,expected tues csx fast 2 largest u companies market cap start research,3.0,1.0,72429.0,5792.0,False,1
719635261194444801,csx,2016-04-11 21:16:00,huge buys incoming mjtv michael james enterprises inc hold csx,0.0,0.0,1.0,0.0,False,1
719635217674330112,csx,2016-04-11 21:16:00,hot buy stock tickr michael james ent mjtv worry auy btx csx,0.0,0.0,2.0,1.0,False,0
719633421597859840,csx,2016-04-11 21:09:00,five watch week aa csx jpm bac dal aa bac csx dal jpm,0.0,0.0,301.0,13.0,False,0
719633117519179776,csx,2016-04-11 21:08:00,buy mjtv michael james enterprises inc sold adxsw csx,0.0,0.0,1.0,1.0,False,1
719632447718055936,csx,2016-04-11 21:05:00,pick michael james ent mjtv sold csx,0.0,0.0,0.0,0.0,False,1
719632381691498500,csx,2016-04-11 21:05:00,corp miss earnings estimates quarter csx,0.0,0.0,10082.0,669.0,False,1
719631154765127680,csx,2016-04-11 21:00:00,earnings tomorrow close adtn csx,0.0,0.0,76.0,14.0,False,1
719631150344314880,csx,2016-04-11 21:00:00,csx corp csx cap dollars 3.7 billion first quarter tomorrow close consensus equals 0.374 week chg vs mkt 94 percent,0.0,0.0,76.0,14.0,False,0
719631111232626688,csx,2016-04-11 21:00:00,tomorrow p1 adtn cnbka csx dtea hcsg layn leds asrv fast pery cccl hyf mrtn points c,0.0,0.0,105.0,65.0,False,0
719630895905390594,csx,2016-04-11 20:59:00,something deadheads todays,1.0,0.0,10870.0,3918.0,False,0
719629891109523456,csx,2016-04-11 20:55:00,monday otc pick michael james ent success ups csx,0.0,0.0,8.0,15.0,False,1
719629843923644416,csx,2016-04-11 20:54:00,b u l l h b u worry csx,0.0,0.0,5.0,7.0,False,1
719628705258078208,csx,2016-04-11 20:50:00,buy today ticker otc mjtv hold qqqe goog csx,0.0,0.0,2.0,21.0,False,1
719627676034670596,csx,2016-04-11 20:46:00,not wait around old picks csx,1.0,0.0,11.0,21.0,False,1
719626750183890944,csx,2016-04-11 20:42:00,rt upcoming earnings mon aa ozrk tue csx fast dtea wed jpm thu wfc dal bac blk fri c full list …,0.0,29.0,120.0,365.0,True,1
719625252691533824,csx,2016-04-11 20:36:00,otcbb mjtv sold csx,0.0,0.0,0.0,0.0,False,0
719623616069931008,csx,2016-04-11 20:30:00,money monday alert stock tickr mjtv worry nvda csx mnov,0.0,0.0,0.0,20.0,False,1
719622760968925190,csx,2016-04-11 20:26:00,buy today otcbb mjtv worry csx,0.0,0.0,4.0,1.0,False,1
719622088844128256,csx,2016-04-11 20:24:00,monday success buy co tickr picks beat mbly csx,0.0,0.0,111.0,422.0,False,1
719620678136115200,csx,2016-04-11 20:18:00,high float order symbol michael james enterprises inc picks acrs csx acor,0.0,0.0,1.0,1.0,False,0
719620564973793281,csx,2016-04-11 20:18:00,low float week stock ticker michael james ent mjtv sold mrk csx gvp,0.0,0.0,1.0,1.0,False,0
719620499194556416,csx,2016-04-11 20:17:00,b u l l h b u symbol mjtv others sny auph csx,0.0,0.0,2.0,21.0,False,1
719620087439761408,csx,2016-04-11 20:16:00,b u l l h b u mjtv no csx,0.0,0.0,1.0,1.0,False,1
719617753636741120,csx,2016-04-11 20:06:00,hot pick otcbb mjtv not worry csx,0.0,0.0,10.0,88.0,False,1
719616643513462784,csx,2016-04-11 20:02:00,sold ew csx,0.0,0.0,0.0,1.0,False,0
719616231641194496,csx,2016-04-11 20:00:00,monday success buy mjtv sold free csx,0.0,0.0,4.0,7.0,False,1
719615226887299072,csx,2016-04-11 19:56:00,people become successful order michael james enterprises mjtv no buys csx,0.0,0.0,40.0,213.0,False,1
719615072478171136,csx,2016-04-11 19:56:00,unsure earnings date use zacks earnings calendar see whats coming up aa dal bac csx,0.0,0.0,2172.0,409.0,False,1
719613985058918400,csx,2016-04-11 19:51:00,order pink sheets stock symbol mjtv bye grpn csx zts,0.0,0.0,0.0,1.0,False,1
719612971819728896,csx,2016-04-11 19:47:00,breaking pick picks csx,0.0,0.0,9.0,178.0,False,0
719612333228756993,csx,2016-04-11 19:45:00,rt aa fast pery csx dtea c adtn layn jpm titn pir bac wfc blk dal pnc rf pgr tsm chke schw infy,0.0,64.0,503.0,1163.0,True,0
719611628854124549,csx,2016-04-11 19:42:00,tough 18 months railroad operator csx keeps chugging along csx looks poised clearer track ahead,0.0,0.0,10870.0,3918.0,False,1
719610765033017346,csx,2016-04-11 19:39:00,massive pump coming michael james enterprises mjtv no buys csx,0.0,0.0,3.0,22.0,False,0
719608147321618433,csx,2016-04-11 19:28:00,stock trade buy mjtv not worry csx,0.0,0.0,2.0,0.0,False,0
719608084285497344,csx,2016-04-11 19:28:00,buy asap yahoo finance otc mjtv hold auy aaap csx,0.0,0.0,1.0,2.0,False,0
719607014905790464,csx,2016-04-11 19:24:00,csx jim cramer watch csx tuesday,0.0,0.0,717.0,5.0,False,0
719606584620363776,csx,2016-04-11 19:22:00,jim cramer watch csx tuesday csx,0.0,0.0,18.0,0.0,False,1
719605378552590340,csx,2016-04-11 19:17:00,b u l l h b u l e r otc mjtv worry csx,0.0,0.0,23.0,252.0,False,1
719604316202528769,csx,2016-04-11 19:13:00,analysts alert buy mjtv favorites lnco csx,0.0,0.0,1.0,4.0,False,1
719603259929964544,csx,2016-04-11 19:09:00,buy buy buy buy buy co symbol equals otcbb mjtv hold nvs csx exas,0.0,0.0,2.0,7.0,False,1
719603257203666950,csx,2016-04-11 19:09:00,csx jbht nsc railroad operator csx keeps chugging along,0.0,0.0,742.0,6.0,False,0
719602872078307328,csx,2016-04-11 19:07:00,analysts alert buy otc mjtv forget csx,0.0,0.0,6.0,4.0,False,1
719601466063740928,csx,2016-04-11 19:02:00,buying market symbol no buying pset csx fslr,0.0,0.0,2.0,6.0,False,1
719600132103258113,csx,2016-04-11 18:56:00,sold csx,0.0,0.0,14.0,88.0,False,1
719600021679824896,csx,2016-04-11 18:56:00,rt buy bell stock ticker mjtv otcbb sell sny csx vivo,0.0,1.0,474.0,4431.0,True,1
719599514609254400,csx,2016-04-11 18:54:00,buy opening bell mjtv old picks axn csx,0.0,0.0,1.0,4.0,False,1
719599440131006464,csx,2016-04-11 18:54:00,co tickr mjtv buys auph csx acet,0.0,0.0,6.0,4.0,False,1
719598208314437636,csx,2016-04-11 18:49:00,buy buy buy buy buy mjtv michael james ent inc old picks knd csx,0.0,0.0,12.0,49.0,False,1
719598065691324417,csx,2016-04-11 18:48:00,buy shares asap stock tickr michael james enterprises mjtv no buys pep nvgn csx,0.0,0.0,1.0,0.0,False,1
719597919351910400,csx,2016-04-11 18:48:00,become wolf week buy otc mjtv sold csx,0.0,0.0,0.0,5.0,False,1
719597515562045440,csx,2016-04-11 18:46:00,high float get favorites sune csx,0.0,0.0,2.0,10.0,False,0
719595381814910976,csx,2016-04-11 18:38:00,buy shares asap otcbb mjtv sold csx,0.0,0.0,2.0,0.0,False,0
719592986791800832,csx,2016-04-11 18:28:00,b u l l h b u l e r mjtv monday sells csx,0.0,0.0,4.0,10.0,False,1
719589255606112256,csx,2016-04-11 18:13:00,ranks 80 percent alert gains today click,0.0,0.0,5092.0,0.0,False,1
719586716181520384,csx,2016-04-11 18:03:00,purchased otc company equals mjtv hold knsy gsk csx,0.0,0.0,1.0,115.0,False,1
719586571133911042,csx,2016-04-11 18:03:00,upcoming reports,1.0,0.0,17638.0,3312.0,False,0
719585323504812032,csx,2016-04-11 17:58:00,watch list april 2016 amp axp csx dfs gd jci pfg unp usb wfc qcom trow,1.0,0.0,1493.0,506.0,False,1
719584935338618880,csx,2016-04-11 17:56:00,super high float order michael james enterprises mjtv old picks csx,1.0,0.0,6.0,0.0,False,1
719584212291096576,csx,2016-04-11 17:53:00,pink sheet stock order tickr forget beat csx ccc,0.0,0.0,7.0,8.0,False,1
719582498934677504,csx,2016-04-11 17:46:00,stock trade buy michael james ent mjtv old choices csx,0.0,0.0,4.0,8.0,False,0
719579825640329216,csx,2016-04-11 17:36:00,pink sheet stock pick favorites csx,0.0,0.0,1.0,6.0,False,1
719577386757591040,csx,2016-04-11 17:26:00,buy michael james enterprises mjtv sell csx,0.0,0.0,33.0,42.0,False,1
719572967441571842,csx,2016-04-11 17:08:00,buy asap michael james enterprises mjtv others qcor csx,0.0,0.0,36.0,39.0,False,1
719572608652550148,csx,2016-04-11 17:07:00,buy bell stock ticker mjtv otcbb sell sny csx vivo,0.0,1.0,2.0,4.0,False,1
719572336362455041,csx,2016-04-11 17:06:00,massive monday pump incoming otc mjtv success csx,0.0,0.0,0.0,0.0,False,0
719572126093729792,csx,2016-04-11 17:05:00,co tickr michael james ent mjtv bye gg csx dia,0.0,0.0,4.0,2.0,False,1
719571741824172033,csx,2016-04-11 17:04:00,csx corporation valuation february 2016 update csx,0.0,0.0,2045.0,769.0,False,1
719569540401741825,csx,2016-04-11 16:55:00,hot buy michael james ent mjtv picks csx,0.0,0.0,10.0,41.0,False,1
719568850291810304,csx,2016-04-11 16:52:00,high float buy bye cbyl csx,0.0,0.0,2.0,19.0,False,1
719567337142226944,csx,2016-04-11 16:46:00,money monday alert mjtv michael james enterprises inc sold csx,0.0,0.0,4.0,6.0,False,1
