Tweet Id,Ticker,Datetime,Text,Favs,RTs,Followers,Following,Is a RT,Sentiment
729666071360245760,jd,2016-05-09 13:35:00,pre market losers lc negative 24 percent sphs negative 19 percent au negative 8 percent sbgl negative 6 percent jd negative 6 percent rio negative 6 percent kgc negative 6 percent bidu negative 5 percent vale negative 5 percent,0.0,0.0,2665.0,3001.0,False,1
729666010249187328,jd,2016-05-09 13:35:00,,0.0,1.0,13841.0,3246.0,False,0
729665283980439552,jd,2016-05-09 13:32:00,bidu negative 383 percent jd negative 762 percent acercandose sobreventa,0.0,0.0,539.0,1715.0,False,0
729664727102554114,jd,2016-05-09 13:30:00,jd pre gap fill back feb,0.0,0.0,119.0,65.0,False,0
729664315138039808,jd,2016-05-09 13:28:00,gap go stocks lc jd ssys hznp clls teva tsn trade direction gap,0.0,0.0,3298.0,3306.0,False,1
729664068865269760,jd,2016-05-09 13:27:00,fous4 times 2 day trading dvd review,0.0,0.0,590.0,8.0,False,1
729663781534457860,jd,2016-05-09 13:26:00,notable prem movers up kkd ssys hznp depo clls ebix teva down ihg nugt jnug cdk ta jd thrm,1.0,0.0,733.0,62.0,False,0
729663682133663744,jd,2016-05-09 13:25:00,rt percent movers pre bind negative 37 percent unis 31 lc sphs 24 fwm 16 jd 7 bidu 5,0.0,1.0,19177.0,243.0,True,1
729663472292777984,jd,2016-05-09 13:25:00,rt jd scty juno stmp ca dis ea fosl jazz jack sina ntes year prgo himx nvda shak jcp bita agn …,0.0,22.0,299.0,572.0,True,1
729663425056366592,jd,2016-05-09 13:24:00,percent movers pre bind negative 37 percent unis 31 lc sphs 24 fwm 16 jd 7 bidu 5,3.0,1.0,15711.0,383.0,False,1
729663388998053889,jd,2016-05-09 13:24:00,watching jd ssys teva fcx vrx endp admp gevo mgt gdx ag tsn dse,0.0,0.0,52.0,116.0,False,1
729663262556487681,jd,2016-05-09 13:24:00,― fly pre market movers ssys hznp teva tsn aria opk lc jd ta slw…,0.0,0.0,81109.0,80898.0,False,0
729662686179426304,jd,2016-05-09 13:21:00,jd cemp uslv significant pre market decliners speculatingstocks pre market,0.0,0.0,747.0,634.0,False,1
729662683092393984,jd,2016-05-09 13:21:00,jd cemp bidu significant pre market decliners speculatingstocks pre market,0.0,0.0,747.0,634.0,False,0
729662500434776065,jd,2016-05-09 13:21:00,gm twitter up mgt prgn kkd point x jdst down lc au jd fcx clf aa spy down premarket,5.0,0.0,2729.0,159.0,False,1
729662377478721538,jd,2016-05-09 13:20:00,rt fly pre market movers ssys hznp teva tsn aria opk lc jd ta slw bidu full story,0.0,2.0,6277.0,6151.0,True,1
729662314480291840,jd,2016-05-09 13:20:00,rt fly pre market movers ssys hznp teva tsn aria opk lc jd ta slw bidu full story,0.0,2.0,14853.0,7111.0,True,0
729662237002997761,jd,2016-05-09 13:20:00,fly pre market movers ssys hznp teva tsn aria opk lc jd ta slw bidu full story,1.0,2.0,12689.0,130.0,False,1
729662103649406976,jd,2016-05-09 13:19:00,stocks play lunes 09 de mayo 2016 aapl fb nugt vrx chk jcp hznp bidu jd teva lc kkd opk para,0.0,0.0,4115.0,1807.0,False,1
729662081402847232,jd,2016-05-09 13:19:00,stocks play lunes 09 de mayo 2016 aapl fb nugt vrx chk jcp hznp bidu jd teva lc kkd opk para,0.0,0.0,4115.0,1807.0,False,0
729661907448123392,jd,2016-05-09 13:18:00,trading watchlist 5.09.2016 akrx vrx bidu jd,0.0,0.0,78.0,234.0,False,1
729661847574581248,jd,2016-05-09 13:18:00,stocks play lunes 09 de mayo 2016 aapl fb nugt vrx chk jcp hznp bidu jd teva lc kkd opk,0.0,0.0,4115.0,1807.0,False,1
729661842226819072,jd,2016-05-09 13:18:00,watchlist today kkd tsn bid lc jd bidu,0.0,0.0,165.0,8.0,False,1
729661471685283841,jd,2016-05-09 13:17:00,jd,0.0,1.0,17882.0,3379.0,False,0
729661199369969664,jd,2016-05-09 13:16:00,stocks gapping down premarket,0.0,0.0,4643.0,2567.0,False,0
729661084991295488,jd,2016-05-09 13:15:00,pre market top losers sphs lc gsv nugt au jnug ta jd sbgl sn,0.0,0.0,21.0,19.0,False,1
729660487718182912,jd,2016-05-09 13:13:00,jd annual active accounts up 73 percent since time last year,0.0,0.0,262.0,70.0,False,1
729660379551432705,jd,2016-05-09 13:12:00,good morning whats among investors monday good ino lc teva hznp opk tsn kkd jd w bidu,0.0,0.0,944.0,1504.0,False,1
729659880299094016,jd,2016-05-09 13:10:00,hznp tsn bidu lc ssys teva clls agn ebix kkd jd,0.0,0.0,7829.0,5180.0,False,0
729658816367714312,jd,2016-05-09 13:06:00,rt downside pre mkt lc arlp jnug ta au sbgl sn cemp jd bidu ssri rio,0.0,3.0,155.0,377.0,True,1
729658723023638530,jd,2016-05-09 13:06:00,rt downside pre mkt lc arlp jnug ta au sbgl sn cemp jd bidu ssri rio,0.0,3.0,617.0,450.0,True,1
729658456735539200,jd,2016-05-09 13:05:00,long watches kkd tsn ssys vrx hznp watt dis nsam short watches bidu nugt wday jd lc x,1.0,0.0,13070.0,2666.0,False,0
729658390700494849,jd,2016-05-09 13:04:00,downside pre mkt lc arlp jnug ta au sbgl sn cemp jd bidu ssri rio,0.0,3.0,726051.0,2444.0,False,1
729658352607887360,jd,2016-05-09 13:04:00,premakret movers kkd positive 23.53 percent ssys positive 12.80 percent hznp positive 9.62 percent lc negative 24.12 percent jd negative 6.55 percent bidu negative 5.11 percent,0.0,0.0,5043.0,508.0,False,1
729658136362016768,jd,2016-05-09 13:03:00,jd get alerts momentum stocks run happens here’s how…yahoo search “topmarketgainers” thank later,0.0,0.0,151.0,6.0,False,1
729658125859446784,jd,2016-05-09 13:03:00,jd down premarket trading,0.0,0.0,4643.0,2567.0,False,1
729657838276993024,jd,2016-05-09 13:02:00,notable companies reporting today teva jd tsn lbtya slw juno xel,0.0,0.0,219.0,93.0,False,1
729657677467418624,jd,2016-05-09 13:02:00,watch list apol clne rlyp sina fisv byd glng aria bidu gold jd ha holx clvs jble mygn dis x,0.0,0.0,17.0,2.0,False,1
729657524819988480,jd,2016-05-09 13:01:00,c vrx jd,0.0,0.0,50.0,90.0,False,0
729657382540713988,jd,2016-05-09 13:00:00,watching jd kkd gld vxx uso 2 watch tsn bidu spy,0.0,0.0,239.0,262.0,False,1
729657183001051136,jd,2016-05-09 13:00:00,premarket declined stocks jd cemp bidu uslv cmrx gold tvix sync momo endp,0.0,0.0,320.0,231.0,False,0
729657179775619072,jd,2016-05-09 13:00:00,premarket active stocks jd tvix bidu aapl xiv fb siri hznp aria qqq,0.0,0.0,320.0,231.0,False,0
729656832113840130,jd,2016-05-09 12:58:00,jd covered pm short extreme weakness dollars 3.88 dollars 3.59 x 5 thousand,0.0,0.0,45.0,53.0,False,0
729655604386639874,jd,2016-05-09 12:53:00,get setup via imac,0.0,0.0,356.0,26.0,False,1
729655198654681089,jd,2016-05-09 12:52:00,,0.0,0.0,15.0,0.0,False,0
729655140563718145,jd,2016-05-09 12:51:00,📉🤔👎🏼 jd negative 5.67 percent cemp negative 5.55 percent uslv negative 4.90 percent bidu negative 4.56 percent gprn negative 3.95 percent gold negative 3.15 percent tvix negative 2.61 percent sync negative 1.74 percent momo negative 1.23 percent sqqq,0.0,0.0,1415.0,1077.0,False,1
729654955179577345,jd,2016-05-09 12:51:00,,0.0,0.0,2250.0,1222.0,False,0
729654772458889216,jd,2016-05-09 12:50:00,rt jd scty juno stmp ca dis ea fosl jazz jack sina ntes year prgo himx nvda shak jcp bita agn …,0.0,22.0,172.0,32.0,True,1
729654199210795008,jd,2016-05-09 12:48:00,watch idea gappers hznp vrx teva agn dis jd lc x bidu r,0.0,0.0,2049.0,68.0,False,1
729653412065841152,jd,2016-05-09 12:45:00,frayed shirtcuff chartists view jd interesting breaks below dollars 0,0.0,0.0,11001.0,258.0,False,0
729652176553811968,jd,2016-05-09 12:40:00,10 stocks moving mondays session bidu clls clne hznp glng tsn teva lc jd gold,1.0,0.0,49673.0,1499.0,False,0
729651674348855296,jd,2016-05-09 12:38:00,com announces first quarter 2016 results read,0.0,0.0,15.0,2.0,False,1
729651592291569665,jd,2016-05-09 12:37:00,rt jd scty juno stmp ca dis ea fosl jazz jack sina ntes year prgo himx nvda shak jcp bita agn …,0.0,22.0,2321.0,36.0,True,1
729651208537792513,jd,2016-05-09 12:36:00,com announces first quarter 2016 results read,0.0,0.0,15.0,2.0,False,1
729649920093868032,jd,2016-05-09 12:31:00,rt jd scty juno stmp ca dis ea fosl jazz jack sina ntes year prgo himx nvda shak jcp bita agn …,0.0,22.0,1169.0,2063.0,True,0
729648838135447552,jd,2016-05-09 12:26:00,jd gapdn 1.05 4.2 percent fill 40 percent prvcl 25.20 prvlo 24.48 1 newlo brkphi plo 5.1 percent accel tf 0100000 bigflt 475 million hipctsht6 percent 1 days,0.0,0.0,6783.0,271.0,False,1
729648413780758528,jd,2016-05-09 12:25:00,e commerce company coms revenue jumps 47 percent read,0.0,0.0,15.0,2.0,False,1
729647947852308480,jd,2016-05-09 12:23:00,update 1 e commerce company coms revenue jumps 47 pct read,0.0,0.0,15.0,2.0,False,1
729647792453394432,jd,2016-05-09 12:22:00,online e commerce company coms revenue jumps 47 per cent read,0.0,0.0,15.0,2.0,False,1
729647203002638337,jd,2016-05-09 12:20:00,notable 2016.05.09 aes bid hznp jd musa ssys stwd tsn w htz juno kite lc oas rax scty,0.0,0.0,19976.0,14575.0,False,0
729646271779110912,jd,2016-05-09 12:16:00,rt jd scty juno stmp ca dis ea fosl jazz jack sina ntes year prgo himx nvda shak jcp bita agn …,0.0,22.0,20414.0,935.0,True,0
729644912153493505,jd,2016-05-09 12:11:00,rt jd scty juno stmp ca dis ea fosl jazz jack sina ntes year prgo himx nvda shak jcp bita agn …,0.0,22.0,7829.0,5180.0,True,1
729644580564570113,jd,2016-05-09 12:09:00,jd says transitioning profitability focus 2016,0.0,0.0,80.0,561.0,False,1
729644381599313920,jd,2016-05-09 12:09:00,rt,0.0,1.0,539.0,1715.0,True,1
729643674183720962,jd,2016-05-09 12:06:00,know value jd dollars .15,0.0,0.0,1346.0,1497.0,False,1
729642129044054016,jd,2016-05-09 12:00:00,rt jd scty juno stmp ca dis ea fosl jazz jack sina ntes year prgo himx nvda shak jcp bita agn …,0.0,16.0,19180.0,243.0,True,1
729641847958740992,jd,2016-05-09 11:59:00,jd mall inflects positive operating margins first quarter 16 positive 0.5 percent versus negative 0.1 percent,0.0,0.0,80.0,561.0,False,1
729641430877147136,jd,2016-05-09 11:57:00,jd active customer accounts up 73 percent 169.1 mm,0.0,0.0,80.0,561.0,False,0
729641169974501376,jd,2016-05-09 11:56:00,rt jd scty juno stmp ca dis ea fosl jazz jack sina ntes year prgo himx nvda shak jcp bita agn …,0.0,16.0,17.0,21.0,True,1
729640593287200768,jd,2016-05-09 11:54:00,rt jd scty juno stmp ca dis ea fosl jazz jack sina ntes year prgo himx nvda shak jcp bita agn …,0.0,16.0,8.0,63.0,True,1
729640292861812736,jd,2016-05-09 11:52:00,rt jd scty juno stmp ca dis ea fosl jazz jack sina ntes year prgo himx nvda shak jcp bita agn …,0.0,16.0,2923.0,307.0,True,1
729639718854397952,jd,2016-05-09 11:50:00,online e commerce company coms revenue jumps 47 pct read,1.0,0.0,15.0,2.0,False,0
729639578999513088,jd,2016-05-09 11:50:00,whats ahead week disney deliver growth potential jd,0.0,0.0,15.0,0.0,False,0
729639563505717248,jd,2016-05-09 11:50:00,online e commerce company coms revenue jumps 47 pct read,0.0,0.0,15.0,2.0,False,1
729639229106622464,jd,2016-05-09 11:48:00,rt jd scty juno stmp ca dis ea fosl jazz jack sina ntes year prgo himx nvda shak jcp bita agn …,0.0,16.0,65.0,85.0,True,0
729639133686038529,jd,2016-05-09 11:48:00,large call buying,0.0,0.0,4643.0,2567.0,False,0
729638715870470144,jd,2016-05-09 11:46:00,rt jd scty juno stmp ca dis ea fosl jazz jack sina ntes year prgo himx nvda shak jcp bita agn …,0.0,16.0,725.0,290.0,True,1
729638539936210944,jd,2016-05-09 11:45:00,rt jd scty juno stmp ca dis ea fosl jazz jack sina ntes year prgo himx nvda shak jcp bita agn …,0.0,16.0,627.0,122.0,True,1
729638469308272643,jd,2016-05-09 11:45:00,rt jd scty juno stmp ca dis ea fosl jazz jack sina ntes year prgo himx nvda shak jcp bita agn …,0.0,16.0,74.0,430.0,True,0
729638399498452992,jd,2016-05-09 11:45:00,rt jd scty juno stmp ca dis ea fosl jazz jack sina ntes year prgo himx nvda shak jcp bita agn …,0.0,16.0,12516.0,130.0,True,0
729638329881403392,jd,2016-05-09 11:45:00,rt jd scty juno stmp ca dis ea fosl jazz jack sina ntes year prgo himx nvda shak jcp bita agn …,0.0,16.0,59.0,58.0,True,1
729638238110031872,jd,2016-05-09 11:44:00,rt jd first quarter net rev dollars .37 billion rmb54 billion vs est dollars .35 billion sees second quarter rev 64.2 billion yuan 66.2 billion yuan vs est 65.1 billion yuan,0.0,2.0,84.0,0.0,True,1
729638230698688512,jd,2016-05-09 11:44:00,rt jd scty juno stmp ca dis ea fosl jazz jack sina ntes year prgo himx nvda shak jcp bita agn …,0.0,16.0,707.0,86.0,True,0
729638219734757376,jd,2016-05-09 11:44:00,rt jd scty juno stmp ca dis ea fosl jazz jack sina ntes year prgo himx nvda shak jcp bita agn …,0.0,16.0,1304.0,30.0,True,0
729638188290088960,jd,2016-05-09 11:44:00,rt jd scty juno stmp ca dis ea fosl jazz jack sina ntes year prgo himx nvda shak jcp bita agn …,0.0,16.0,3404.0,293.0,True,1
729638028470325248,jd,2016-05-09 11:43:00,rt jd scty juno stmp ca dis ea fosl jazz jack sina ntes year prgo himx nvda shak jcp bita agn …,0.0,16.0,4963.0,585.0,True,1
729637887973658628,jd,2016-05-09 11:43:00,rt jd scty juno stmp ca dis ea fosl jazz jack sina ntes year prgo himx nvda shak jcp bita agn …,0.0,16.0,23510.0,102.0,True,0
729637775314587649,jd,2016-05-09 11:42:00,jd scty juno stmp ca dis ea fosl jazz jack sina ntes year prgo himx nvda shak jcp bita agn,49.0,35.0,15740.0,384.0,False,1
729634142506369026,jd,2016-05-09 11:28:00,rt jd first quarter net rev dollars .37 billion rmb54 billion vs est dollars .35 billion sees second quarter rev 64.2 billion yuan 66.2 billion yuan vs est 65.1 billion yuan,0.0,1.0,1476.0,850.0,True,1
729634004044025856,jd,2016-05-09 11:27:00,jd first quarter net rev dollars .37 billion rmb54 billion vs est dollars .35 billion sees second quarter rev 64.2 billion yuan 66.2 billion yuan vs est 65.1 billion yuan,2.0,2.0,4117.0,4159.0,False,1
729633583070089217,jd,2016-05-09 11:26:00,adap therapeutics vz tmus cybr feye panw akam yelp trip bbry hpq fit gpro nflx jd,0.0,0.0,16.0,36.0,False,1
729632448838045697,jd,2016-05-09 11:21:00,jd jd reports line first quarter eps gmv rose 55 percent,0.0,0.0,588.0,319.0,False,0
729630378974060545,jd,2016-05-09 11:13:00,,0.0,0.0,308.0,1.0,False,0
729630377682214912,jd,2016-05-09 11:13:00,,2.0,1.0,2226.0,29.0,False,1
729630376495194112,jd,2016-05-09 11:13:00,,0.0,0.0,3564.0,30.0,False,0
729630374259630081,jd,2016-05-09 11:13:00,,0.0,0.0,21407.0,30.0,False,1
729629734066335744,jd,2016-05-09 11:10:00,com announces first quarter 2016 results jd,0.0,0.0,452.0,260.0,False,1
729626962218491905,jd,2016-05-09 10:59:00,notable companies reporting today teva jd tsn lbtya slw juno xel,0.0,0.0,2027.0,107.0,False,1
729623022173310976,jd,2016-05-09 10:44:00,rt reading im curious people say jds richard liu 5 years hint jd beat baba baba …,0.0,1.0,81.0,559.0,True,0
729621006709448704,jd,2016-05-09 10:36:00,rt launch health products sales via com jd,0.0,1.0,113.0,66.0,True,1
729618928834482176,jd,2016-05-09 10:28:00,bkd stock forum see greater bkd eum jd,0.0,0.0,42.0,20.0,False,0
729606983377031168,jd,2016-05-09 09:40:00,jd chart see greater jd dnai sedg,0.0,0.0,34.0,20.0,False,1
729604821385383936,jd,2016-05-09 09:31:00,us earning release today teva jd tsn xel lvnta qvca hcp incy lbtya lbtyk iff opk mrvl pinc vvc dnb,0.0,0.0,364.0,595.0,False,1
729597966940409856,jd,2016-05-09 09:04:00,launch health products sales via com jd,1.0,1.0,107.0,148.0,False,1
729597533241094144,jd,2016-05-09 09:03:00,rt .6 iii imkta ino ipi jd kpti kos lilak lila lbtya lvnta lsxmk lmia lmia lpx wlh mgic mcc musa mdco…,0.0,2.0,15349.0,8254.0,True,0
729596764228079616,jd,2016-05-09 08:59:00,rt .6 iii imkta ino ipi jd kpti kos lilak lila lbtya lvnta lsxmk lmia lmia lpx wlh mgic mcc musa mdco…,0.0,2.0,7007.0,7031.0,True,1
729596660263866369,jd,2016-05-09 08:59:00,iii imkta ino ipi jd kpti kos lilak lila lbtya lvnta lsxmk lmia lmia lpx wlh mgic mcc musa mdco mcc nvro,0.0,2.0,5043.0,508.0,False,1
729592118851846145,jd,2016-05-09 08:41:00,zbi services l l c takes position,0.0,0.0,933.0,0.0,False,1
729566961353400321,jd,2016-05-09 07:01:00,fxc 52 week low see greater fxc kmph jd,1.0,0.0,39.0,40.0,False,0
729558829260677120,jd,2016-05-09 06:29:00,rt weekly dis scty agn nvda jcp hznp tsn jd opk csiq stmp nok plug w,0.0,47.0,221.0,315.0,True,0
729536838021595136,jd,2016-05-09 05:01:00,rt jd com becomes official platform selling ’s merchandise china,0.0,1.0,2470.0,1142.0,True,1
729528177320562688,jd,2016-05-09 04:27:00,rt goog amzn fb baba dollars 00 hour k pcln nflx bidu jd ebay ctrp expe lnkd,0.0,22.0,464.0,1003.0,True,0
729521200288825345,jd,2016-05-09 03:59:00,jd showing potential signs reversal volume strength high call option volume recently,0.0,0.0,82.0,46.0,False,0
729520463190183936,jd,2016-05-09 03:56:00,rt earnings week dis scty agn nvda jcp hznp tsn jd opk csiq stmp nok plug w jd rl kss,0.0,2.0,1854.0,721.0,True,1
729517157931995137,jd,2016-05-09 03:43:00,rt weekly dis scty agn nvda jcp hznp tsn jd opk csiq stmp nok plug w,0.0,46.0,10.0,312.0,True,1
729514376974176257,jd,2016-05-09 03:32:00,rt weekly dis scty agn nvda jcp hznp tsn jd opk csiq stmp nok plug w,0.0,46.0,11.0,515.0,True,1
729511713503105024,jd,2016-05-09 03:22:00,rt weekly dis scty agn nvda jcp hznp tsn jd opk csiq stmp nok plug w,0.0,46.0,12.0,566.0,True,1
729511153286664195,jd,2016-05-09 03:19:00,rt weekly dis scty agn nvda jcp hznp tsn jd opk csiq stmp nok plug w,0.0,46.0,9.0,527.0,True,0
729510589790294016,jd,2016-05-09 03:17:00,rt weekly dis scty agn nvda jcp hznp tsn jd opk csiq stmp nok plug w,0.0,46.0,14.0,843.0,True,0
729509836493193216,jd,2016-05-09 03:14:00,rt weekly dis scty agn nvda jcp hznp tsn jd opk csiq stmp nok plug w,0.0,46.0,233.0,215.0,True,1
729508094624071681,jd,2016-05-09 03:07:00,rt weekly dis scty agn nvda jcp hznp tsn jd opk csiq stmp nok plug w,0.0,46.0,15.0,520.0,True,1
729507174100111360,jd,2016-05-09 03:03:00,rt weekly dis scty agn nvda jcp hznp tsn jd opk csiq stmp nok plug w,0.0,46.0,3864.0,78.0,True,1
729505902563340288,jd,2016-05-09 02:58:00,rt weekly dis scty agn nvda jcp hznp tsn jd opk csiq stmp nok plug w,0.0,46.0,653.0,959.0,True,1
729497603352596481,jd,2016-05-09 02:25:00,rt weekly dis scty agn nvda jcp hznp tsn jd opk csiq stmp nok plug w,0.0,46.0,15.0,118.0,True,1
729493458625302528,jd,2016-05-09 02:09:00,rt earnings week dis scty agn nvda jcp hznp tsn jd opk csiq stmp nok plug w jd rl kss,0.0,2.0,2071.0,407.0,True,0
729493030705635328,jd,2016-05-09 02:07:00,earnings week dis scty agn nvda jcp hznp tsn jd opk csiq stmp nok plug w jd rl kss,4.0,4.0,631.0,122.0,False,1
729490852721119233,jd,2016-05-09 01:59:00,chart jd free app,0.0,0.0,52.0,18.0,False,0
729490207980986368,jd,2016-05-09 01:56:00,know price jd dollars 6.56,0.0,0.0,1345.0,1497.0,False,1
729489503245623296,jd,2016-05-09 01:53:00,jd com becomes official platform selling ’s merchandise china,0.0,1.0,301.0,165.0,False,0
729483550811131904,jd,2016-05-09 01:30:00,jd volume chart animation free app,0.0,0.0,46.0,5.0,False,1
729480641734189056,jd,2016-05-09 01:18:00,dis scty agn nvda jcp hznp tsn jd opk csiq stmp nok plug w,0.0,0.0,7.0,40.0,False,1
729479648304898049,jd,2016-05-09 01:14:00,rt earnings week via jd teva scty rax agn ea fosl vrx ctrp …,0.0,7.0,238.0,307.0,True,1
729478040695144448,jd,2016-05-09 01:08:00,,0.0,0.0,1416.0,979.0,False,1
729464215539326976,jd,2016-05-09 00:13:00,rt china earnings jd feng cxdc xin dq w csiq htht ntes sina wb yge year xnet th cyd bita caas f…,0.0,1.0,260.0,200.0,True,1
729461068519514112,jd,2016-05-09 00:00:00,reading im curious people say jds richard liu 5 years hint jd beat baba baba,3.0,1.0,5622.0,329.0,False,1
729451330528382976,jd,2016-05-08 23:22:00,rt goog amzn fb baba dollars 00 hour k pcln nflx bidu jd ebay ctrp expe lnkd,0.0,21.0,6.0,24.0,True,1
729449223599558656,jd,2016-05-08 23:13:00,rt goog amzn fb baba dollars 00 hour k pcln nflx bidu jd ebay ctrp expe lnkd,0.0,21.0,2.0,47.0,True,0
729445817854132224,jd,2016-05-08 23:00:00,rt ewhispers weekly dis scty agn nvda jcp hznp tsn jd,0.0,1.0,2775.0,159.0,True,1
729438748002418690,jd,2016-05-08 22:32:00,rt weekly dis scty agn nvda jcp hznp tsn jd opk csiq stmp nok plug w,0.0,37.0,690.0,110.0,True,1
729435436884500480,jd,2016-05-08 22:18:00,ewhispers weekly dis scty agn nvda jcp hznp tsn jd,0.0,0.0,98.0,10.0,False,1
729435430769164289,jd,2016-05-08 22:18:00,ewhispers weekly dis scty agn nvda jcp hznp tsn jd,1.0,1.0,919.0,52.0,False,1
729421917300609024,jd,2016-05-08 21:25:00,rt goog amzn fb baba dollars 00 hour k pcln nflx bidu jd ebay ctrp expe lnkd,0.0,19.0,299.0,391.0,True,0
729419391780147201,jd,2016-05-08 21:15:00,rt goog amzn fb baba dollars 00 hour k pcln nflx bidu jd ebay ctrp expe lnkd,0.0,16.0,512.0,220.0,True,1
729419081363783680,jd,2016-05-08 21:13:00,rt goog amzn fb baba dollars 00 hour k pcln nflx bidu jd ebay ctrp expe lnkd,0.0,16.0,3.0,37.0,True,1
729418982004908033,jd,2016-05-08 21:13:00,rt goog amzn fb baba dollars 00 hour k pcln nflx bidu jd ebay ctrp expe lnkd,0.0,15.0,133394.0,1064.0,True,1
729418463635189761,jd,2016-05-08 21:11:00,rt goog amzn fb baba dollars 00 hour k pcln nflx bidu jd ebay ctrp expe lnkd,0.0,15.0,578.0,402.0,True,0
729418401978957825,jd,2016-05-08 21:11:00,rt goog amzn fb baba dollars 00 hour k pcln nflx bidu jd ebay ctrp expe lnkd,0.0,15.0,173.0,327.0,True,1
729418147284062211,jd,2016-05-08 21:10:00,rt goog amzn fb baba dollars 00 hour k pcln nflx bidu jd ebay ctrp expe lnkd,0.0,15.0,1226.0,173.0,True,1
729418119442268161,jd,2016-05-08 21:10:00,rt goog amzn fb baba dollars 00 hour k pcln nflx bidu jd ebay ctrp expe lnkd,0.0,15.0,258.0,183.0,True,0
729417528519229440,jd,2016-05-08 21:07:00,rt goog amzn fb baba dollars 00 hour k pcln nflx bidu jd ebay ctrp expe lnkd,0.0,15.0,754.0,870.0,True,0
729417391558529029,jd,2016-05-08 21:07:00,rt goog amzn fb baba dollars 00 hour k pcln nflx bidu jd ebay ctrp expe lnkd,0.0,15.0,529.0,64.0,True,0
729416999500009472,jd,2016-05-08 21:05:00,rt goog amzn fb baba dollars 00 hour k pcln nflx bidu jd ebay ctrp expe lnkd,0.0,15.0,2146.0,601.0,True,1
729416637716168704,jd,2016-05-08 21:04:00,rt goog amzn fb baba dollars 00 hour k pcln nflx bidu jd ebay ctrp expe lnkd,0.0,15.0,75.0,66.0,True,1
729416626047700992,jd,2016-05-08 21:04:00,rt goog amzn fb baba dollars 00 hour k pcln nflx bidu jd ebay ctrp expe lnkd,0.0,15.0,153.0,107.0,True,1
729416533001277440,jd,2016-05-08 21:03:00,rt goog amzn fb baba dollars 00 hour k pcln nflx bidu jd ebay ctrp expe lnkd,0.0,15.0,349.0,711.0,True,0
729416195917684738,jd,2016-05-08 21:02:00,rt goog amzn fb baba dollars 00 hour k pcln nflx bidu jd ebay ctrp expe lnkd,0.0,15.0,3506.0,1448.0,True,1
729416176745373696,jd,2016-05-08 21:02:00,wondering risks jd 21 day volatility 12.83 percent,0.0,0.0,1347.0,1497.0,False,0
729416122148130816,jd,2016-05-08 21:02:00,rt goog amzn fb baba dollars 00 hour k pcln nflx bidu jd ebay ctrp expe lnkd,0.0,15.0,188.0,146.0,True,1
729416054745731074,jd,2016-05-08 21:01:00,goog amzn fb baba dollars 00 hour k pcln nflx bidu jd ebay ctrp expe lnkd,87.0,28.0,116966.0,485.0,False,1
729415740143570945,jd,2016-05-08 21:00:00,tomorrow p12 glp gtn hcp hznp iii imkta ino inod ipi jasn jd kos kpti lc lmca,0.0,0.0,158.0,64.0,False,0
729414722961977350,jd,2016-05-08 20:56:00,rt earnings week via jd teva scty rax agn ea fosl vrx ctrp …,0.0,6.0,2478.0,10.0,True,0
729398576825176064,jd,2016-05-08 19:52:00,one many big alerts aqxp,0.0,0.0,13254.0,12901.0,False,0
729389079637458944,jd,2016-05-08 19:14:00,rt weekly dis scty agn nvda jcp hznp tsn jd opk csiq stmp nok plug w,0.0,35.0,63.0,134.0,True,0
729380777255960577,jd,2016-05-08 18:41:00,rt earnings week via jd teva scty rax agn ea fosl vrx ctrp …,0.0,5.0,67.0,93.0,True,1
729375576541171713,jd,2016-05-08 18:21:00,rt earnings week via jd teva scty rax agn ea fosl vrx ctrp …,0.0,5.0,29.0,226.0,True,1
729374617643696129,jd,2016-05-08 18:17:00,rt earnings week via jd teva scty rax agn ea fosl vrx ctrp …,0.0,5.0,679.0,865.0,True,0
729374292593524736,jd,2016-05-08 18:15:00,rt mark down folks upcoming earnings include dis scty agn nvda jcp hznp tsn jd opk w,0.0,7.0,356.0,536.0,True,1
729373378633674752,jd,2016-05-08 18:12:00,rt earnings week via jd teva scty rax agn ea fosl vrx ctrp …,0.0,5.0,48.0,69.0,True,0
729370852349906944,jd,2016-05-08 18:02:00,rt earnings week via jd teva scty rax agn ea fosl vrx ctrp …,0.0,5.0,25.0,105.0,True,0
729370767650074624,jd,2016-05-08 18:01:00,earnings week via jd teva scty rax agn ea fosl vrx ctrp,18.0,7.0,38672.0,9614.0,False,0
729366769073328129,jd,2016-05-08 17:46:00,adap therapeutics vz tmus cybr feye panw akam yelp trip bbry hpq fit gpro nflx jd,1.0,0.0,16.0,35.0,False,0
729364143296385025,jd,2016-05-08 17:35:00,rt mark down folks upcoming earnings include dis scty agn nvda jcp hznp tsn jd opk w,0.0,5.0,852.0,206.0,True,1
729363781185216512,jd,2016-05-08 17:34:00,rt mark down folks upcoming earnings include dis scty agn nvda jcp hznp tsn jd opk w,0.0,5.0,63.0,118.0,True,0
729363430688231424,jd,2016-05-08 17:32:00,weekly dis scty agn nvda jcp hznp tsn jd opk csiq stmp nok plug w,0.0,0.0,4114.0,4095.0,False,1
729362872581513216,jd,2016-05-08 17:30:00,rt mark down folks upcoming earnings include dis scty agn nvda jcp hznp tsn jd opk w,0.0,5.0,329.0,567.0,True,0
729361663988781058,jd,2016-05-08 17:25:00,stocktwits mark down folks upcoming earnings include dis scty agn nvda jcp hznp tsn jd opk…,1.0,0.0,879.0,33.0,False,1
729360829104181248,jd,2016-05-08 17:22:00,rt dis scty agn nvda jcp hznp tsn jd opk w,0.0,1.0,27009.0,923.0,True,0
729360154135650304,jd,2016-05-08 17:19:00,rt mark down folks upcoming earnings include dis scty agn nvda jcp hznp tsn jd opk w,0.0,5.0,2055.0,39.0,True,1
729359024571834368,jd,2016-05-08 17:15:00,rt mark down folks upcoming earnings include dis scty agn nvda jcp hznp tsn jd opk w,0.0,5.0,800.0,1750.0,True,0
729358843235291136,jd,2016-05-08 17:14:00,dis scty agn nvda jcp hznp tsn jd opk w,0.0,1.0,751.0,10.0,False,1
729358145391222784,jd,2016-05-08 17:11:00,mark down folks upcoming earnings include dis scty agn nvda jcp hznp tsn jd opk w,12.0,7.0,505926.0,122551.0,False,1
729352438755540994,jd,2016-05-08 16:49:00,investing action plan facebook still buy need know disney nvidia earnings,0.0,0.0,1473.0,301.0,False,1
729342998392147968,jd,2016-05-08 16:11:00,large call buying,0.0,0.0,4642.0,2568.0,False,0
