Tweet Id,Ticker,Datetime,Text,Favs,RTs,Followers,Following,Is a RT,Sentiment
736271795318226944,jd,2016-05-27 19:04:00,call block buy jd 3969 fri 22.5 calls dollars .10,3.0,2.0,12822.0,3083.0,False,0
736271473589919744,jd,2016-05-27 19:02:00,jd call sweepers detected,0.0,0.0,39019.0,9585.0,False,1
736271286612037632,jd,2016-05-27 19:02:00,3969 jd fri 22.5 calls wkly dollars .10,0.0,0.0,266.0,4.0,False,1
736271277535682560,jd,2016-05-27 19:02:00,jd 22.5 calls buying activity expiring 24 jun volume 1292,0.0,0.0,1503.0,30.0,False,1
736271034085724160,jd,2016-05-27 19:01:00,jd 24 puts selling activity expiring 24 jun volume 1823,0.0,0.0,1503.0,30.0,False,0
736239150110638081,jd,2016-05-27 16:54:00,lets hope j yellens talk 0 pm affect twtr vips jd yy,0.0,0.0,30.0,87.0,False,1
736234403316305921,jd,2016-05-27 16:35:00,jd jd sports fashion plc gb positive score positive 2 signal positive 2,0.0,0.0,233.0,278.0,False,0
736210431891496960,jd,2016-05-27 15:00:00,jd flagging,0.0,0.0,108.0,494.0,False,1
736203100269121536,jd,2016-05-27 14:31:00,members banked nice profits jd vslr russell 2000 futures today,0.0,0.0,4766.0,2539.0,False,1
736200340660355074,jd,2016-05-27 14:20:00,jd 1 2 3 steps check fails breakout not jd,0.0,0.0,4363.0,4.0,False,1
736196903826776064,jd,2016-05-27 14:06:00,jd 354 percent llega 24,0.0,0.0,550.0,1744.0,False,1
736193357828001792,jd,2016-05-27 13:52:00,jd 25 percent twtr 371 percent,0.0,0.0,550.0,1744.0,False,1
736190950503030787,jd,2016-05-27 13:42:00,baba 208 percent bidu 207 percent jd 207 percent twtr 196 percent,0.0,0.0,550.0,1744.0,False,1
736188665760731136,jd,2016-05-27 13:33:00,bidu 157 percent jd 112 percent,0.0,0.0,550.0,1744.0,False,0
736182317396467712,jd,2016-05-27 13:08:00,watchlist wll nerv ttnp jd rlyp anf gooood luck,0.0,0.0,39.0,116.0,False,1
736163035560054784,jd,2016-05-27 11:51:00,nr7 stocks,0.0,1.0,4762.0,2540.0,False,1
736150668973617152,jd,2016-05-27 11:02:00,,0.0,0.0,2189.0,11.0,False,1
735979728985673729,jd,2016-05-26 23:43:00,esv news see greater esv wmih jd,0.0,0.0,47.0,40.0,False,0
735972223844913154,jd,2016-05-26 23:13:00,jd day high see greater jd sbcf jnj,0.0,0.0,47.0,40.0,False,1
735967259252793345,jd,2016-05-26 22:54:00,cx tick see greater cx jd mxwl,0.0,0.0,39.0,40.0,False,0
735966856838844416,jd,2016-05-26 22:52:00,nr7 stocks,0.0,1.0,4758.0,2539.0,False,1
735935651682476032,jd,2016-05-26 20:48:00,jd,1.0,0.0,5401.0,21.0,False,1
735901124327182336,jd,2016-05-26 18:31:00,,0.0,0.0,605.0,8.0,False,0
735833652513378304,jd,2016-05-26 14:03:00,jd jd sports fashion plc gb positive score positive 6 signal positive 6,0.0,0.0,234.0,278.0,False,1
735823265030111234,jd,2016-05-26 13:21:00,ill never touch china non transparent nothing headache baba jd,0.0,0.0,3512.0,1435.0,False,0
735754483603374080,jd,2016-05-26 08:48:00,ldrh investor opinions see greater ldrh wabc jd,0.0,0.0,39.0,40.0,False,1
735691417616420864,jd,2016-05-26 04:37:00,jd lets see breaks up range jd,0.0,0.0,4358.0,4.0,False,1
735668761592659968,jd,2016-05-26 03:07:00,tmall may turn worse jd case,0.0,0.0,855.0,1907.0,False,1
735655493872541696,jd,2016-05-26 02:15:00,fact us kick baba jd bidu etc exchanges bad us investors,0.0,0.0,3512.0,1434.0,False,1
735655140598919168,jd,2016-05-26 02:13:00,china stocks done us jd near total wipe simply flee stocks sec probe baba nothing probs,0.0,0.0,3512.0,1434.0,False,0
735654301217890304,jd,2016-05-26 02:10:00,haha funny long jd,0.0,0.0,5747.0,338.0,False,1
735645755432570880,jd,2016-05-26 01:36:00,baba accounting issue putting jd under pressure well,0.0,0.0,261.0,882.0,False,0
735642426690306049,jd,2016-05-26 01:23:00,jd sources warehouses everything,0.0,0.0,5744.0,337.0,False,1
735642033340055552,jd,2016-05-26 01:21:00,taobao losing reputation jd needed skus compete,0.0,0.0,5744.0,337.0,False,0
735641649653633024,jd,2016-05-26 01:20:00,every chinese adr considering theyre baba bidu jd vips ctrp yy etc,0.0,0.0,116.0,772.0,False,1
735641464672133120,jd,2016-05-26 01:19:00,virtuous cycle boosting suppliers reputation continue jd wracks taobao,0.0,0.0,5744.0,337.0,False,1
735640652055228416,jd,2016-05-26 01:16:00,biggest losers today large caps ete negative 8.77 percent baba negative 6.82 percent yhoo negative 5.17 percent wmb negative 3.98 percent jd negative 3.40 percent ctxs negative 3.20 percent hnp negative 3.16 percent cuk negative 3.00 percent,0.0,0.0,183.0,29.0,False,1
735628303936196608,jd,2016-05-26 00:27:00,chartseer jd,0.0,0.0,4473.0,1109.0,False,1
735627600261844992,jd,2016-05-26 00:24:00,jd,3.0,0.0,5397.0,21.0,False,1
735610910836981760,jd,2016-05-25 23:18:00,rt jim chanos long jd short baba jd down 3.5 percent without negative accounting issues baba,0.0,1.0,128.0,619.0,True,0
735610864091422721,jd,2016-05-25 23:17:00,rt jd shit baba coming years,0.0,2.0,128.0,619.0,True,0
735610849428185090,jd,2016-05-25 23:17:00,rt interesting say absolutely thesis jd one fundamental perspective …,0.0,1.0,128.0,619.0,True,1
735610834144133120,jd,2016-05-25 23:17:00,rt yes im building long term position jd sector gets beaten up add complete value play goin…,0.0,1.0,128.0,619.0,True,0
735610816569978880,jd,2016-05-25 23:17:00,rt jd chinese stock,0.0,1.0,128.0,619.0,True,1
735610749779902468,jd,2016-05-25 23:17:00,rt jds logistical infrastructure makes babas third party investments look like blackberry phones,0.0,2.0,128.0,619.0,True,1
735602863804698625,jd,2016-05-25 22:46:00,180 bearish,0.0,1.0,4748.0,2541.0,False,1
735592242128293889,jd,2016-05-25 22:03:00,scan results bearish engulfing today nyld ctxs quot ingr pay tss jd wmb smlp zen,0.0,0.0,694.0,45.0,False,1
735557781973913600,jd,2016-05-25 19:46:00,jd sinking sec probe baba pxd hrl tel fisv,0.0,0.0,13318.0,742.0,False,1
735557737267011585,jd,2016-05-25 19:46:00,jd sinking sec probe baba pxd hrl tel fisv,0.0,0.0,302.0,13.0,False,1
735557456596742144,jd,2016-05-25 19:45:00,jun 23 puts jd,1.0,0.0,514.0,1184.0,False,1
735555760248082433,jd,2016-05-25 19:38:00,rt jds logistical infrastructure makes babas third party investments look like blackberry phones,0.0,1.0,161.0,258.0,True,1
735555024324055040,jd,2016-05-25 19:35:00,rt jd shit baba coming years,0.0,1.0,1101.0,1423.0,True,0
735553186056933376,jd,2016-05-25 19:28:00,dollars 703 hk well jd tencent buy list little pricey atm,1.0,0.0,5737.0,336.0,False,0
735553000941457408,jd,2016-05-25 19:27:00,jd chinese stock,0.0,1.0,1103.0,1423.0,False,1
735552907165106177,jd,2016-05-25 19:27:00,jds logistical infrastructure makes babas third party investments look like blackberry phones,1.0,2.0,5739.0,337.0,False,1
735552823849586688,jd,2016-05-25 19:27:00,yes im building long term position jd sector gets beaten up add complete value play going 5 year,0.0,1.0,1103.0,1423.0,False,1
735552395929915392,jd,2016-05-25 19:25:00,interesting say absolutely thesis jd one fundamental perspective got gd mgmt,1.0,1.0,1103.0,1423.0,False,0
735552043830546432,jd,2016-05-25 19:24:00,jd shit baba coming years,10.0,2.0,5739.0,337.0,False,1
735551455298490369,jd,2016-05-25 19:21:00,alibaba extends losses sec probe threatens worst ever 1 day decline,0.0,0.0,1516.0,303.0,False,1
735546303103504384,jd,2016-05-25 19:01:00,rt live trading china tech stocks whats wrong alibaba,0.0,1.0,230.0,5.0,True,1
735546240885268480,jd,2016-05-25 19:01:00,live trading china tech stocks whats wrong alibaba,3.0,1.0,452.0,16.0,False,0
735524576822628352,jd,2016-05-25 17:34:00,jim chanos long jd short baba jd down 3.5 percent without negative accounting issues baba,1.0,1.0,46.0,95.0,False,1
735521415420608512,jd,2016-05-25 17:22:00,baba negative 535 percent jd negative 361 percent,0.0,0.0,549.0,1745.0,False,1
735521279072174080,jd,2016-05-25 17:21:00,rt,0.0,1.0,549.0,1745.0,True,0
735521219559231488,jd,2016-05-25 17:21:00,rt chinese consumers finally spending like americans,0.0,2.0,549.0,1745.0,True,0
735519253026066432,jd,2016-05-25 17:13:00,rt curious dichotomy people convinced baba jd compete tooth nail yet jd trades 250 billion p pure sympathy no t…,0.0,1.0,127.0,620.0,True,1
735519243723149312,jd,2016-05-25 17:13:00,rt chinese consumers finally spending like americans,0.0,2.0,127.0,620.0,True,0
735513963203547136,jd,2016-05-25 16:52:00,therapeutics adap vz tmus cybr feye panw akam yelp trip bbry hpq fit gpro nflx jd,1.0,0.0,0.0,0.0,False,1
735508219121041408,jd,2016-05-25 16:29:00,chinese consumers finally spending like americans,0.0,2.0,1183.0,489.0,False,0
735495165482139649,jd,2016-05-25 15:38:00,rt jd vp laura xiong gave keynote speech reception house lords hosted lord wei,0.0,2.0,4088.0,948.0,True,1
735495130736513024,jd,2016-05-25 15:37:00,rt 16 billion ecommerce parcels delivered 2.6 days average 2015 baba jd,0.0,1.0,126.0,619.0,True,0
735490546853023744,jd,2016-05-25 15:19:00,curious dichotomy people convinced baba jd compete tooth nail yet jd trades 250 billion p pure sympathy no thought comp edge,1.0,1.0,528.0,615.0,False,0
735484991430266888,jd,2016-05-25 14:57:00,,0.0,0.0,2767.0,32.0,False,1
735484591025184769,jd,2016-05-25 14:56:00,,0.0,1.0,2265.0,1221.0,False,1
735483857265250306,jd,2016-05-25 14:53:00,rt new post play safe baba booey,0.0,1.0,214.0,768.0,True,0
735482305767084033,jd,2016-05-25 14:47:00,new post play safe baba booey,0.0,1.0,25786.0,4298.0,False,1
735467422443053056,jd,2016-05-25 13:47:00,23 24 range jd,0.0,0.0,41.0,100.0,False,0
735464433653276673,jd,2016-05-25 13:35:00,jd negative 149 percent,0.0,0.0,549.0,1745.0,False,0
735464387473903616,jd,2016-05-25 13:35:00,rt thought good infographic primer chinas internet mobile landscape baba bidu ctrp jd wb …,0.0,2.0,268.0,2001.0,True,1
735456224167251968,jd,2016-05-25 13:03:00,rt alibaba faces sec accounting probe singles day baba falls,0.0,2.0,93835.0,233.0,True,0
735456186661769216,jd,2016-05-25 13:03:00,alibaba faces sec accounting probe singles day baba falls,2.0,3.0,1517.0,303.0,False,1
735429414981369856,jd,2016-05-25 11:16:00,jd jd sports fashion plc gb positive score positive 8 signal positive 8,0.0,0.0,234.0,278.0,False,1
735420017244790784,jd,2016-05-25 10:39:00,,1.0,0.0,980.0,0.0,False,0
735419832515080192,jd,2016-05-25 10:38:00,,0.0,0.0,752.0,8.0,False,1
735417328721006593,jd,2016-05-25 10:28:00,rt jd vp laura xiong gave keynote speech reception house lords hosted lord wei,0.0,1.0,124.0,619.0,True,1
735413850900561920,jd,2016-05-25 10:15:00,jd vp laura xiong gave keynote speech reception house lords hosted lord wei,1.0,2.0,308.0,165.0,False,1
735349947630014465,jd,2016-05-25 06:01:00,,0.0,0.0,558.0,45.0,False,1
735327942906105857,jd,2016-05-25 04:33:00,16 billion ecommerce parcels delivered 2.6 days average 2015 baba jd,3.0,1.0,1648.0,2852.0,False,0
735317029788454916,jd,2016-05-25 03:50:00,com signs mou hkwcc read,0.0,0.0,14.0,2.0,False,0
735304549112684544,jd,2016-05-25 03:00:00,rt skln reversal chart bottom clrb mgt bbep trtc fnma aapl goog msft nflx fb siri amat sfor jd htt…,0.0,1.0,1175.0,1136.0,True,1
735288831126036483,jd,2016-05-25 01:58:00,skln reversal chart bottom clrb mgt bbep trtc fnma aapl goog msft nflx fb siri amat sfor jd,1.0,1.0,2431.0,2347.0,False,1
735270280256458752,jd,2016-05-25 00:44:00,elder green,0.0,0.0,4749.0,2545.0,False,1
735261767857623044,jd,2016-05-25 00:10:00,jd looks like pursuing fifth wave jd,0.0,0.0,4343.0,4.0,False,1
735215057609625602,jd,2016-05-24 21:05:00,last minutes trading f jd ko low p sage sfun vale via,0.0,0.0,1124.0,18.0,False,0
735211789030285312,jd,2016-05-24 20:52:00,also understand obsession gmv ultimately jd gross net profit cash flow king,0.0,0.0,122.0,619.0,False,0
735211393645842432,jd,2016-05-24 20:50:00,meeting jd cfo sidney today year gross profit trend relevant gmv,0.0,0.0,122.0,619.0,False,1
735211159784034305,jd,2016-05-24 20:49:00,lbrda exchange see greater lbrda tna jd,0.0,0.0,57.0,40.0,False,0
735210861736796160,jd,2016-05-24 20:48:00,not garbage relevant points no smoking gun understand authors firm long baba short jd,0.0,0.0,122.0,619.0,False,0
735207892198907904,jd,2016-05-24 20:36:00,large call buying,0.0,0.0,4751.0,2546.0,False,1
735199387370983425,jd,2016-05-24 20:02:00,rt scan 4 u technically best looking 4 short term aa ge nok f jd gild dourdd,0.0,1.0,19.0,123.0,True,1
735189927713988609,jd,2016-05-24 19:25:00,jd sell short broken bastards ass cursed sons putttanaaaaaa,0.0,0.0,21.0,87.0,False,1
735171254685048834,jd,2016-05-24 18:11:00,jd 476 percent,0.0,0.0,547.0,1743.0,False,0
735160394243772416,jd,2016-05-24 17:27:00,else read garbage jd short pitch sumzero,1.0,0.0,652.0,66.0,False,1
735150371216183296,jd,2016-05-24 16:48:00,scan 4 u technically best looking 4 short term aa ge nok f jd gild dourdd,1.0,1.0,358.0,42.0,False,0
735102218991509504,jd,2016-05-24 13:36:00,bidu 243 percent jd 218 percent,0.0,0.0,547.0,1743.0,False,1
735101820607963136,jd,2016-05-24 13:35:00,espr e p see greater espr jd apd,0.0,0.0,51.0,40.0,False,1
735079943202340864,jd,2016-05-24 12:08:00,,0.0,0.0,750.0,8.0,False,1
735076489297793025,jd,2016-05-24 11:54:00,,0.0,0.0,2186.0,11.0,False,0
735069826876616704,jd,2016-05-24 11:27:00,jd jd sports fashion plc gb positive score positive 4 signal positive 4,0.0,0.0,232.0,278.0,False,1
735054497249144832,jd,2016-05-24 10:27:00,one many big alerts aqxp,0.0,0.0,13505.0,13280.0,False,0
734988053257674752,jd,2016-05-24 06:03:00,watchlist week uvxy xiv scty vrx rrc mur clr cf wdc nem stx jd hes myl kss bhi jwn ual,0.0,0.0,63.0,118.0,False,1
734958523830800385,jd,2016-05-24 04:05:00,rt li says tourism push help relieve poverty,0.0,1.0,118.0,619.0,True,0
734920983543468032,jd,2016-05-24 01:36:00,one many big alerts aqxp,0.0,0.0,13501.0,13275.0,False,0
734892488264196098,jd,2016-05-23 23:43:00,unusual call activity,0.0,0.0,4747.0,2548.0,False,1
734891104605069312,jd,2016-05-23 23:37:00,fous4 times 2 day trading dvd review,0.0,0.0,600.0,8.0,False,0
734837439391404032,jd,2016-05-23 20:04:00,unusual call activity,0.0,0.0,4744.0,2548.0,False,1
734834926348959744,jd,2016-05-23 19:54:00,one reason,0.0,0.0,2268.0,1221.0,False,1
734834925401055232,jd,2016-05-23 19:54:00,one reason,0.0,0.0,2763.0,32.0,False,1
734831872274882561,jd,2016-05-23 19:42:00,selloff weakness jd yy coming usa equity indices fine china share performed well overnight,0.0,0.0,34.0,86.0,False,1
734827783893876736,jd,2016-05-23 19:26:00,rt jd bullish jd long term pace r going either break expand merge another company ht…,0.0,1.0,116.0,619.0,True,1
734827719620321280,jd,2016-05-23 19:25:00,rt thought good infographic primer chinas internet mobile landscape baba bidu ctrp jd wb …,0.0,1.0,116.0,619.0,True,0
734812543638638592,jd,2016-05-23 18:25:00,unusual call activity,0.0,0.0,4743.0,2548.0,False,1
734800919724953601,jd,2016-05-23 17:39:00,unusual call activity,0.0,0.0,4744.0,2548.0,False,1
734793869208981504,jd,2016-05-23 17:11:00,thought good infographic primer chinas internet mobile landscape baba bidu ctrp jd wb,0.0,2.0,828.0,625.0,False,1
734793057804136448,jd,2016-05-23 17:08:00,,0.0,0.0,502.0,6.0,False,1
734792721127342081,jd,2016-05-23 17:06:00,,0.0,0.0,1148.0,58.0,False,0
734785782943076352,jd,2016-05-23 16:39:00,unusual call activity,0.0,0.0,4742.0,2548.0,False,0
734763667346968576,jd,2016-05-23 15:11:00,leahanne volume alert jd 23.00,0.0,0.0,3544.0,1995.0,False,1
734763635361206272,jd,2016-05-23 15:11:00,leahanne volume alert jd 23.00,0.0,0.0,13561.0,421.0,False,1
734745798433509376,jd,2016-05-23 14:00:00,jd bullish jd long term pace r going either break expand merge another company,0.0,1.0,25.0,57.0,False,1
734742253781012480,jd,2016-05-23 13:46:00,jd covered .67 gain,0.0,0.0,173.0,45.0,False,0
734740779696934913,jd,2016-05-23 13:40:00,anyone laid eyeballs sumzero jd report,0.0,0.0,522.0,612.0,False,1
734740571697340417,jd,2016-05-23 13:39:00,jd trying go under dollars 3 slipping fast,0.0,0.0,173.0,45.0,False,0
734731981506908161,jd,2016-05-23 13:05:00,watchlist clrb orig srpt jd scty tk swn gooood luck,0.0,0.0,43.0,115.0,False,1
734725850797641729,jd,2016-05-23 12:41:00,rt,0.0,2.0,38.0,84.0,True,1
734703458725560320,jd,2016-05-23 11:12:00,jd jd sports fashion plc gb positive score positive 4 signal positive 4,0.0,0.0,233.0,278.0,False,1
734672482859286528,jd,2016-05-23 09:09:00,jd 52 week high see greater jd ibb vmi,0.0,0.0,41.0,40.0,False,1
734669645983059968,jd,2016-05-23 08:57:00,oas short sales see greater oas spxu jd,0.0,0.0,38.0,40.0,False,1
734638270232023041,jd,2016-05-23 06:53:00,fb goog myec pfe nflx panw nwbo aezs kite juno cybr eltp jrjc noah jd ipci ibb,0.0,0.0,1312.0,249.0,False,0
734624973625643009,jd,2016-05-23 06:00:00,,0.0,2.0,199.0,347.0,False,1
734620520960921600,jd,2016-05-23 05:42:00,mon kite juno pbmd nwbo ipci eltp aezs adro nvax ibb fb nflx panw jrjc noah jd myec ddrante,1.0,0.0,1312.0,249.0,False,0
734616178543448064,jd,2016-05-23 05:25:00,rt holding shorts positions swing clrb keys jd gbsn up swings holding pbmd long down dollars .06,0.0,1.0,40.0,309.0,True,1
734614089964609541,jd,2016-05-23 05:17:00,alibaba king big value plus growth investing china,0.0,0.0,437.0,2015.0,False,1
734535381325107209,jd,2016-05-23 00:04:00,rt ⤵drops nyse nasdaq shorts ge fcx tck v mro baba mbly myl yhoo jd msft pypl fb nvda utx mcd hznp …,0.0,4.0,2480.0,8.0,True,0
734528434983043074,jd,2016-05-22 23:36:00,rt ⤵drops nyse nasdaq shorts ge fcx tck v mro baba mbly myl yhoo jd msft pypl fb nvda utx mcd hznp …,0.0,4.0,1167.0,1138.0,True,1
734517869350813696,jd,2016-05-22 22:54:00,rt ⤵drops nyse nasdaq shorts ge fcx tck v mro baba mbly myl yhoo jd msft pypl fb nvda utx mcd hznp …,0.0,2.0,828.0,437.0,True,0
734516392469221376,jd,2016-05-22 22:48:00,holding shorts positions swing clrb keys jd gbsn up swings holding pbmd long down dollars .06,1.0,1.0,171.0,45.0,False,1
734515595887050752,jd,2016-05-22 22:45:00,rt ⤵drops nyse nasdaq shorts ge fcx tck v mro baba mbly myl yhoo jd msft pypl fb nvda utx mcd hznp …,0.0,2.0,1895.0,721.0,True,0
734515490043924480,jd,2016-05-22 22:45:00,⤵drops nyse nasdaq shorts ge fcx tck v mro baba mbly myl yhoo jd msft pypl fb nvda utx mcd hznp,2.0,4.0,38926.0,9596.0,False,1
734495459750871041,jd,2016-05-22 21:25:00,rt rt seekingalpha alibaba king big value plus growth investing china,0.0,2.0,250.0,490.0,True,1
734494379960893441,jd,2016-05-22 21:21:00,rt rt seekingalpha alibaba king big value plus growth investing china,0.0,2.0,1167.0,1138.0,True,1
734489554082762752,jd,2016-05-22 21:02:00,investorslive4 u seekingalpha alibaba king big value plus growth investing china,0.0,0.0,1369.0,1193.0,False,1
734487837324791808,jd,2016-05-22 20:55:00,seekingalpha alibaba king big value plus growth investing china,1.0,0.0,1490.0,1006.0,False,0
734485034678288385,jd,2016-05-22 20:44:00,rt seekingalpha alibaba king big value plus growth investing china,1.0,2.0,8602.0,5.0,False,0
734353278486622208,jd,2016-05-22 12:00:00,jd sports fashion plc jd receives average recommendation “buy” analysts,0.0,0.0,971.0,0.0,False,1
734303667428302848,jd,2016-05-22 08:43:00,yeah theyre still figuring right jd focused f b offerings,0.0,0.0,117.0,614.0,False,1
734250852458725376,jd,2016-05-22 05:13:00,fous4 times 2 day trading dvd review,0.0,0.0,601.0,8.0,False,1
734240174780088321,jd,2016-05-22 04:31:00,rt bernstein retarded ill mean jd break support,0.0,1.0,25.0,56.0,True,0
734216944161722368,jd,2016-05-22 02:58:00,nmr eod data see greater nmr jd prim,0.0,0.0,57.0,40.0,False,1
734195908552855552,jd,2016-05-22 01:35:00,channel checks jd,4.0,0.0,17102.0,534.0,False,1
734174954892054530,jd,2016-05-22 00:12:00,paa 52 week high see greater paa tpub jd,0.0,0.0,75.0,40.0,False,1
734162621167865856,jd,2016-05-21 23:23:00,jd exchange see greater jd yge ahh,0.0,0.0,37.0,40.0,False,0
734120751863877633,jd,2016-05-21 20:36:00,1 part aapl bac brcd bx c endp ete f fl gps hpq intc jcp jd kmi mro,2.0,0.0,6044.0,5855.0,False,1
734068079223840769,jd,2016-05-21 17:07:00,one many big alerts aqxp,0.0,0.0,13477.0,13118.0,False,1
733995431047233536,jd,2016-05-21 12:18:00,“ many funds leaving crowed trade tiger funds sold amzn baba jd bought zillow,0.0,0.0,514.0,1914.0,False,1
733883626362941440,jd,2016-05-21 04:54:00,one many big alerts aqxp,0.0,0.0,13474.0,13108.0,False,0
733837006434893825,jd,2016-05-21 01:49:00,jd trading strategy,0.0,0.0,34.0,85.0,False,1
733835051549523968,jd,2016-05-21 01:41:00,jd atr .98 looking setup greater 23.95,0.0,0.0,206.0,55.0,False,1
733834560576704512,jd,2016-05-21 01:39:00,jd wkly,0.0,0.0,206.0,55.0,False,0
733833508192407552,jd,2016-05-21 01:35:00,compagnie odier sca buys shares 60330,0.0,0.0,499.0,6.0,False,0
733833008315305985,jd,2016-05-21 01:33:00,compagnie odier sca buys shares 60330,0.0,0.0,1148.0,58.0,False,1
733793446654271492,jd,2016-05-20 22:56:00,1234 bearish,0.0,0.0,4723.0,2552.0,False,0
733755541713981440,jd,2016-05-20 20:25:00,positive 27 slow day trade jd short scalp 23.60 23.55 ill take,0.0,0.0,98.0,903.0,False,0
733753909857144832,jd,2016-05-20 20:18:00,openoutcrier recap neg comments dish kerrisdale sbux clev rsrch cmg itg jd sumzero mrd klr,0.0,0.0,1330.0,1193.0,False,1
733749589619150848,jd,2016-05-20 20:01:00,fit 436 percent qcom 334 percent jd 147 percent,0.0,0.0,549.0,1738.0,False,0
733749266221432832,jd,2016-05-20 20:00:00,recap neg comments dish kerrisdale sbux clev rsrch cmg itg jd sumzero mrd klr,0.0,0.0,19429.0,244.0,False,1
733740142532395009,jd,2016-05-20 19:24:00,rt goog amzn fb baba dollars 00 hour k pcln nflx bidu jd ebay ctrp expe lnkd,0.0,28.0,86.0,20.0,True,1
733722807071301632,jd,2016-05-20 18:15:00,billionaire stephen mandel betting big internet tech stocks jd pcln amzn fb msft,1.0,0.0,13287.0,740.0,False,1
733722745884835842,jd,2016-05-20 18:15:00,billionaire stephen mandel betting big internet tech stocks jd pcln amzn fb msft,0.0,0.0,300.0,13.0,False,1
733707113906610180,jd,2016-05-20 17:13:00,simple range jd buy low 20 sell high 20,0.0,0.0,215.0,228.0,False,1
733696849371074560,jd,2016-05-20 16:32:00,especially since imo jd important shareholder 😂😂😂 👉💦,0.0,0.0,34.0,85.0,False,0
733696710355128320,jd,2016-05-20 16:31:00,anyone thoughts todays sz short piece jd good substance beyond valuation,0.0,0.0,122.0,611.0,False,1
733696477730639872,jd,2016-05-20 16:30:00,im not even going bother reading im confidant jd reach dollars 6 either fundamentals price manipulation,0.0,0.0,34.0,85.0,False,1
733692208361132033,jd,2016-05-20 16:13:00,jd jd sports fashion plc gb positive score positive 4 signal positive 4,2.0,0.0,236.0,278.0,False,1
733691257701191680,jd,2016-05-20 16:10:00,,0.0,0.0,745.0,8.0,False,1
733689459909124096,jd,2016-05-20 16:02:00,unicorn bay rating jd 1.73 5,0.0,0.0,1371.0,1495.0,False,1
733688503062663168,jd,2016-05-20 15:59:00,chart jd free app,0.0,0.0,61.0,18.0,False,1
733686271521001472,jd,2016-05-20 15:50:00,li says tourism push help relieve poverty,0.0,1.0,2156.0,691.0,False,1
733684963875409921,jd,2016-05-20 15:45:00,jd oi chart free app,0.0,0.0,47.0,16.0,False,0
733683709409288192,jd,2016-05-20 15:40:00,ibuy etsy ftd w pcln ostk baba jd,0.0,0.0,367.0,369.0,False,1
733677187614773250,jd,2016-05-20 15:14:00,leahanne volume alert jd 23.71,0.0,0.0,2904.0,4363.0,False,0
733674080445071360,jd,2016-05-20 15:01:00,jd bouncing back,0.0,0.0,233.0,93.0,False,1
733672155662188544,jd,2016-05-20 14:54:00,china’s lackluster april derails stabilization process ashr bidu jd ntes,0.0,0.0,1808.0,16.0,False,1
733670120325799936,jd,2016-05-20 14:46:00,50 pg short report jd,0.0,0.0,2312.0,230.0,False,1
733669826036666371,jd,2016-05-20 14:44:00,jd new point dollars 2,0.0,0.0,167.0,52.0,False,1
733669583761084417,jd,2016-05-20 14:43:00,wheres short report jd not seeing twitter,0.0,0.0,34.0,85.0,False,1
733669477653549056,jd,2016-05-20 14:43:00,rt jd hearing negative report making rounds,0.0,1.0,90.0,0.0,True,0
733669474260398081,jd,2016-05-20 14:43:00,jd starting sell bit,0.0,0.0,233.0,93.0,False,1
733669434238373889,jd,2016-05-20 14:43:00,jd watch green red action coming picked up shorts swing add needed avg dollars 3.625,0.0,0.0,167.0,52.0,False,1
733668836755525633,jd,2016-05-20 14:40:00,jd looks like min late never mind,0.0,0.0,8406.0,15.0,False,1
733668721605115904,jd,2016-05-20 14:40:00,jd neg report,0.0,0.0,8406.0,15.0,False,1
733668441836556288,jd,2016-05-20 14:39:00,jd negative report sumzero dollars 2 point,1.0,0.0,19419.0,244.0,False,1
733667362767962112,jd,2016-05-20 14:35:00,jd hearing negative report making rounds,2.0,1.0,19419.0,244.0,False,1
733667138980974592,jd,2016-05-20 14:34:00,jd short report,0.0,0.0,233.0,93.0,False,0
733666091319205889,jd,2016-05-20 14:30:00,,0.0,0.0,3596.0,30.0,False,0
733665642352640000,jd,2016-05-20 14:28:00,vips jd short fly,0.0,0.0,21.0,87.0,False,1
733661410882953216,jd,2016-05-20 14:11:00,jd 3.25 percent,0.0,0.0,549.0,1738.0,False,0
733654574301483008,jd,2016-05-20 13:44:00,oh could jd actually break above dollars 3.5 hold eod dollars 3.50 put open interest expires today,0.0,0.0,34.0,85.0,False,0
733628962962833408,jd,2016-05-20 12:02:00,baba jd bidu ntes sina wb etc,0.0,0.0,2142.0,690.0,False,1
733627246657687552,jd,2016-05-20 11:55:00,,0.0,0.0,601.0,8.0,False,1
733623332768210948,jd,2016-05-20 11:40:00,china approves sweeping plan clean up online finance industry sources,0.0,0.0,2142.0,690.0,False,0
733558579437785088,jd,2016-05-20 07:22:00,,0.0,0.0,2171.0,11.0,False,1
733398659555983361,jd,2016-05-19 20:47:00,rt jd breakdown watch bernstein note yday discussing companys long term inability compete baba,0.0,3.0,42.0,2145.0,True,1
733397348659822592,jd,2016-05-19 20:42:00,probably worst piece shit articles ive ever read life jd,1.0,0.0,5699.0,331.0,False,1
733387276055674881,jd,2016-05-19 20:02:00,recap unusual calls bp may 52.5 c kgc nov 5.5 c lbtyk jun 35 c gogo jun 11 c jd may 23 c,2.0,0.0,19412.0,244.0,False,1
733375660069167104,jd,2016-05-19 19:15:00,somebody buy last jd 2 may 27 21 strike puts dollars .10 ask like 4 hours bears jd,0.0,0.0,35.0,85.0,False,1
733355439451213824,jd,2016-05-19 17:55:00,one many big alerts aqxp,0.0,0.0,13467.0,13109.0,False,1
