Tweet Id,Ticker,Datetime,Text,Favs,RTs,Followers,Following,Is a RT,Sentiment
727878387633639426,mu,2016-05-04 15:11:00,setup mu one added yday below consolidation level,0.0,0.0,372.0,438.0,False,1
727875469769646085,mu,2016-05-04 15:00:00,rt spx roadmap 2016 tvix vxx vale aapl aks fcx msft aa mu vix spx spy pcln siri mcd,0.0,46.0,58.0,19.0,True,1
727874069102792705,mu,2016-05-04 14:54:00,volume alert mu 10.25 micron technology mu hit high today 10.49 closing day 9 10.25 0.11,0.0,0.0,741.0,448.0,False,1
727872905665757184,mu,2016-05-04 14:49:00,94.57 percent average gain 100 percent unbiased smallcaps qqq ibb gs nke tpac aapl mu,0.0,0.0,299.0,65.0,False,0
727869761418366977,mu,2016-05-04 14:37:00,micron technology mu nasdaq drops 2.45 percent dollars 0.36 tuesday among top 10 actives p500 mu,0.0,0.0,50.0,27.0,False,1
727868254476242944,mu,2016-05-04 14:31:00,rt spx roadmap 2016 tvix vxx vale aapl aks fcx msft aa mu vix spx spy pcln siri mcd,0.0,46.0,72.0,70.0,True,1
727867990100746240,mu,2016-05-04 14:30:00,micron technology mu nasdaq drops 2.45 percent dollars 0.36 tuesday among top 10 actives p500 mu,0.0,0.0,112.0,76.0,False,0
727865554732716032,mu,2016-05-04 14:20:00,rt tsx open higher oil rises canadas benchmark index likely open,0.0,1.0,785.0,2.0,True,1
727863405156048896,mu,2016-05-04 14:12:00,tsx open higher oil rises canadas benchmark index likely open,0.0,1.0,672.0,646.0,False,0
727854012146417664,mu,2016-05-04 13:34:00,ibm lifting mu dead cat bounce,0.0,0.0,946.0,2104.0,False,0
727846759297261568,mu,2016-05-04 13:06:00,nflx googl mu blmn play following price no reason trade right move missed another opp price fluctuates,0.0,0.0,77.0,18.0,False,1
727843418303500289,mu,2016-05-04 12:52:00,mu top news may 4 2016 mu,0.0,0.0,612.0,543.0,False,1
727836967312850944,mu,2016-05-04 12:27:00,spy names crossing below 50 day cf see fast pypl expd urbn tso mu chart greater,0.0,0.0,14606.0,94.0,False,1
727825877766012930,mu,2016-05-04 11:43:00,better buy hasbro inc vs mattel inc image hasbro huge brand nam,1.0,0.0,672.0,646.0,False,0
727824600352989184,mu,2016-05-04 11:38:00,mu chart,2.0,0.0,6757.0,1244.0,False,1
727811207877496832,mu,2016-05-04 10:44:00,rt 11 companies profits burnt crisp,0.0,1.0,305.0,129.0,True,1
727808206966263808,mu,2016-05-04 10:32:00,11 companies profits burnt crisp,0.0,1.0,45.0,67.0,False,1
727808078893207553,mu,2016-05-04 10:32:00,rt spx roadmap 2016 tvix vxx vale aapl aks fcx msft aa mu vix spx spy pcln siri mcd,0.0,44.0,133.0,404.0,True,0
727780228454617088,mu,2016-05-04 08:41:00,micron technology inc mu short interest down 6.2 percent april,0.0,0.0,1005.0,11.0,False,0
727779616845336576,mu,2016-05-04 08:39:00,micron technology inc mu short interest down 6.2 percent april,0.0,0.0,6229.0,2295.0,False,1
727773355470929920,mu,2016-05-04 08:14:00,micron technology inc mu shares bought manufacturers life insurance company,0.0,0.0,712.0,8.0,False,1
727759824365195267,mu,2016-05-04 07:20:00,even without growth apple worth image source apple,1.0,1.0,669.0,646.0,False,0
727755556023349248,mu,2016-05-04 07:03:00,rt dollars 0 floor cannot hold long,0.0,2.0,284.0,67.0,True,1
727725598735540224,mu,2016-05-04 05:04:00,view users posting speculatingstocks mu ulta,1.0,0.0,280.0,234.0,False,0
727686252607197185,mu,2016-05-04 02:28:00,rt spx roadmap 2016 tvix vxx vale aapl aks fcx msft aa mu vix spx spy pcln siri mcd,0.0,43.0,1065.0,1406.0,True,1
727677999873556480,mu,2016-05-04 01:55:00,view users posting speculatingstocks mu ulta,0.0,0.0,280.0,234.0,False,1
727672309536841728,mu,2016-05-04 01:32:00,fous4 times 2 dvd review,0.0,0.0,256.0,40.0,False,1
727670421076606976,mu,2016-05-04 01:25:00,commented despite dollars 0 price tag micron remains sell,0.0,0.0,1781.0,671.0,False,0
727664036138131459,mu,2016-05-04 01:00:00,mu sell signal 10.355 may 03 16,1.0,0.0,313.0,5.0,False,1
727653008280981504,mu,2016-05-04 00:16:00,encana deck capital fitbit slumped today image fitbit tues,0.0,0.0,668.0,645.0,False,0
727647970527600640,mu,2016-05-03 23:56:00,current longs rlyp twtr sdrl alqa watching vhc cemp halo hznp terp mu baba,0.0,0.0,156.0,208.0,False,1
727636387470565377,mu,2016-05-03 23:10:00,qqq mu brcd active hours seen speculatingstocks hours,0.0,0.0,741.0,623.0,False,1
727631485805703169,mu,2016-05-03 22:50:00,rt fiat chrysler may googles first self driving partner first goo,0.0,1.0,780.0,2.0,True,0
727629490822635520,mu,2016-05-03 22:42:00,fiat chrysler may googles first self driving partner first goo,0.0,1.0,668.0,645.0,False,0
727603776744476673,mu,2016-05-03 21:00:00,rt another big month fords high profit trucks suvs sales ford,0.0,1.0,779.0,2.0,True,1
727601704238088192,mu,2016-05-03 20:52:00,another big month fords high profit trucks suvs sales ford,0.0,1.0,668.0,645.0,False,0
727589169829044224,mu,2016-05-03 20:02:00,rt spx roadmap 2016 tvix vxx vale aapl aks fcx msft aa mu vix spx spy pcln siri mcd h…,0.0,0.0,1477.0,606.0,False,1
727586243689730048,mu,2016-05-03 19:50:00,rt guru stocks high yield profitability thanks gurufocus,0.0,1.0,779.0,2.0,True,1
727585379071594496,mu,2016-05-03 19:47:00,guru stocks high yield profitability thanks gurufocus,0.0,1.0,668.0,646.0,False,1
727571485791952896,mu,2016-05-03 18:52:00,stocks 3 must reads prudent investors image source jorge franganillo,0.0,0.0,668.0,646.0,False,1
727566139463700481,mu,2016-05-03 18:30:00,many shares mu cut bait faith add prob gonna keep adding cause dollars 0 stock,1.0,0.0,1187.0,889.0,False,1
727565836488167424,mu,2016-05-03 18:29:00,mu given up dollars since thats 3 trading days,0.0,0.0,1187.0,889.0,False,1
727558428671922176,mu,2016-05-03 18:00:00,rt cummins climbs despite ongoing weakness earnings sales image source c,0.0,1.0,778.0,2.0,True,1
727558328843259904,mu,2016-05-03 17:59:00,cummins climbs despite ongoing weakness earnings sales image source c,0.0,1.0,668.0,646.0,False,1
727545818358648834,mu,2016-05-03 17:10:00,rt mu showing relative strength morning,0.0,1.0,275.0,696.0,True,1
727543340812607491,mu,2016-05-03 17:00:00,rt looking back energys glory days trying predict future,0.0,1.0,778.0,2.0,True,1
727543171966619648,mu,2016-05-03 16:59:00,looking back energys glory days trying predict future,0.0,1.0,668.0,646.0,False,0
727535907700625408,mu,2016-05-03 16:30:00,rt ups fedex fuel surcharge means investors,0.0,1.0,778.0,2.0,True,1
727535482276446208,mu,2016-05-03 16:29:00,ups fedex fuel surcharge means investors,1.0,1.0,668.0,646.0,False,1
727523451305512961,mu,2016-05-03 15:41:00,rt tesla tsla earnings watch tesla motors tsla expected,0.0,1.0,775.0,2.0,True,0
727521574811656192,mu,2016-05-03 15:33:00,tesla tsla earnings watch tesla motors tsla expected,0.0,1.0,670.0,646.0,False,1
727517684049534976,mu,2016-05-03 15:18:00,mu top news may 3 2016 mu,0.0,0.0,608.0,543.0,False,1
727517663782572032,mu,2016-05-03 15:18:00,analysts disagree technology inc read,0.0,0.0,51.0,3.0,False,1
727517353475330048,mu,2016-05-03 15:17:00,analysts disagree technology inc read,0.0,0.0,51.0,3.0,False,1
727516127170027524,mu,2016-05-03 15:12:00,leahanne volume alert mu 10.38 micron technology mu hit,0.0,0.0,2822.0,4270.0,False,0
727512525739270144,mu,2016-05-03 14:57:00,volume alert mu 10.38 micron technology mu hit high today 10.62 closing day 0 10.38 0.24,0.0,0.0,742.0,448.0,False,0
727507608035274753,mu,2016-05-03 14:38:00,great job traders dtr rocked cmg agn starting like mu down vfc target hit,1.0,0.0,16804.0,246.0,False,1
727498992163131393,mu,2016-05-03 14:04:00,added .5 mu pos currently positive 10 percent,0.0,0.0,373.0,438.0,False,0
727498753091969024,mu,2016-05-03 14:03:00,rt spx roadmap 2016 tvix vxx vale aapl aks fcx msft aa mu vix spx spy pcln siri mcd,0.0,42.0,118.0,59.0,True,1
727493735005593600,mu,2016-05-03 13:43:00,mu showing relative strength morning,6.0,1.0,15776.0,329.0,False,1
727470333322776576,mu,2016-05-03 12:10:00,rt spx roadmap 2016 tvix vxx vale aapl aks fcx msft aa mu vix spx spy pcln siri mcd,0.0,41.0,265.0,357.0,True,0
727462341034414080,mu,2016-05-03 11:38:00,view users posting speculatingstocks mu ulta,0.0,0.0,276.0,230.0,False,1
727418184093962240,mu,2016-05-03 08:43:00,mu company info see greater mu team ag,0.0,0.0,33.0,39.0,False,1
727356164409675776,mu,2016-05-03 04:36:00,mu looking good holding above mid term sl 10.30,0.0,0.0,129.0,243.0,False,1
727331992380051458,mu,2016-05-03 03:00:00,rt reserving 20 tesla model 3 means nothing image source tesla last week,0.0,1.0,773.0,2.0,True,1
727331523901313025,mu,2016-05-03 02:58:00,reserving 20 tesla model 3 means nothing image source tesla last week,0.0,1.0,666.0,646.0,False,1
727325404051152896,mu,2016-05-03 02:34:00,rt spx roadmap 2016 tvix vxx vale aapl aks fcx msft aa mu vix spx spy pcln siri mcd,0.0,40.0,186.0,80.0,True,1
727314437787385856,mu,2016-05-03 01:50:00,fous4 times 2 dvd review,0.0,0.0,282.0,38.0,False,0
727314007393062912,mu,2016-05-03 01:49:00,hog eod data see greater hog mu cnc,0.0,0.0,39.0,20.0,False,1
727313347402571776,mu,2016-05-03 01:46:00,,0.0,0.0,101.0,40.0,False,0
727306271225995265,mu,2016-05-03 01:18:00,mu week key must hold 10.5 stand above 10.8 close week,0.0,0.0,29.0,33.0,False,1
727296902329409536,mu,2016-05-03 00:41:00,rt spx roadmap 2016 tvix vxx vale aapl aks fcx msft aa mu vix spx spy pcln siri mcd,0.0,39.0,661.0,4.0,True,1
727296016513421312,mu,2016-05-03 00:37:00,rt spx roadmap 2016 tvix vxx vale aapl aks fcx msft aa mu vix spx spy pcln siri mcd,0.0,39.0,109.0,24.0,True,1
727295489683542016,mu,2016-05-03 00:35:00,stock picking service review timothy sykes penny stocking silver alerts,0.0,0.0,194.0,14.0,False,1
727294236803129346,mu,2016-05-03 00:30:00,rt cf industries cf weak prices dent earnings cf industriescf,0.0,1.0,774.0,2.0,True,1
727293366732353536,mu,2016-05-03 00:27:00,cf industries cf weak prices dent earnings cf industriescf,0.0,1.0,669.0,646.0,False,0
727274003736477696,mu,2016-05-02 23:10:00,rt boeing planning new 737 jet boeing track start delivering,0.0,1.0,774.0,2.0,True,1
727273890792148992,mu,2016-05-02 23:09:00,boeing planning new 737 jet boeing track start delivering,0.0,1.0,669.0,646.0,False,1
727273102833385472,mu,2016-05-02 23:06:00,view users posting speculatingstocks mu ulta,0.0,0.0,273.0,229.0,False,0
727258359850741760,mu,2016-05-02 22:07:00,investment analysts’ weekly ratings changes micron technology mu,0.0,0.0,917.0,0.0,False,0
727230568660783104,mu,2016-05-02 20:17:00,pgnx quotes see greater pgnx apd mu,0.0,0.0,46.0,59.0,False,1
727226452060442624,mu,2016-05-02 20:01:00,recap positive comments mu ms wtw itg rba otr myv northcoast gsbc fig fcel hallum aldr janus,0.0,0.0,19109.0,242.0,False,1
727219923689312257,mu,2016-05-02 19:35:00,entered mu puts tight small may20 exp,0.0,0.0,374.0,438.0,False,1
727216662232059904,mu,2016-05-02 19:22:00,💯 ibio bullish dollars point 💯 nugt ebio gild tlog jnug mu mnst gg bidu ibb ibkr gasx hyh gasl brk dust grpn tck abio,0.0,0.0,10143.0,6660.0,False,1
727214312868163584,mu,2016-05-02 19:12:00,micron technology inc mu earns “buy” rating mizuho,0.0,0.0,1135.0,40.0,False,0
727205405978419200,mu,2016-05-02 18:37:00,mu going back dollars glad couple trades last week lasted 3 minutes dayam,0.0,0.0,3488.0,1406.0,False,1
727201839880372224,mu,2016-05-02 18:23:00,3 numbers watch inc reports first quarter tough one,0.0,0.0,672.0,646.0,False,1
727199926032162817,mu,2016-05-02 18:15:00,thats case u want long mu feye everything,0.0,0.0,155.0,208.0,False,1
727195976721559553,mu,2016-05-02 18:00:00,micron upside potential downside risk,0.0,0.0,3531.0,30.0,False,1
727193701236109312,mu,2016-05-02 17:51:00,gnw summary see greater gnw ceru mu,0.0,0.0,46.0,40.0,False,0
727189165129928704,mu,2016-05-02 17:33:00,mu time head back up,0.0,0.0,60.0,64.0,False,0
727186715639603200,mu,2016-05-02 17:23:00,mckesson mck fourth quarter earnings stock likely disappoint mckesson corporatio,0.0,0.0,672.0,646.0,False,1
727177431438622720,mu,2016-05-02 16:46:00,hell mu short coming fruition cc,0.0,0.0,199.0,61.0,False,0
727175138978893824,mu,2016-05-02 16:37:00,last time seen much activity mu chinese made bid try acquire dirt cheap ignore,0.0,0.0,94.0,39.0,False,1
727174976869027840,mu,2016-05-02 16:36:00,also wanted opinion mu terrible stock lately june option activity heavy,0.0,0.0,94.0,39.0,False,1
727169515960815616,mu,2016-05-02 16:14:00,💯 ibio bullish dollars point 💯 nugt ebio gild tlog jnug mu mnst gg bidu ibb ibkr gasx hyh gasl brk dust grpn tck abio,0.0,0.0,10137.0,6656.0,False,1
727160740654641152,mu,2016-05-02 15:40:00,mu change see greater mu cw tlt,0.0,0.0,39.0,20.0,False,0
727159056557826048,mu,2016-05-02 15:33:00,mu top news may 2 2016 mu,0.0,0.0,609.0,544.0,False,1
727157916843794432,mu,2016-05-02 15:28:00,wtf mu,0.0,0.0,3260.0,195.0,False,0
727149664034758658,mu,2016-05-02 14:56:00,volume alert mu 10.60 micron technology mu hit high today 10.86 closing day 0 10.60 0.15,0.0,0.0,742.0,448.0,False,0
727147045513908224,mu,2016-05-02 14:45:00,ignore linn energy llc 4 better stocks image source linn energ,0.0,0.0,671.0,646.0,False,1
727145984036343808,mu,2016-05-02 14:41:00,rt spy vxx yinn oil bac fcx fb mro aapl pfe ge wfc mu v,0.0,5.0,99.0,49.0,True,1
727139608396357632,mu,2016-05-02 14:16:00,winners,0.0,0.0,4614.0,2578.0,False,0
727137100206845952,mu,2016-05-02 14:06:00,rt spx roadmap 2016 tvix vxx vale aapl aks fcx msft aa mu vix spx spy pcln siri mcd,0.0,37.0,103.0,199.0,True,1
727136241414758400,mu,2016-05-02 14:02:00,💯 ibio bullish dollars point 💯 nugt ebio gild tlog jnug mu mnst gg bidu ibb ibkr gasx hyh gasl brk dust grpn tck abio,0.0,0.0,10133.0,6656.0,False,1
727135428176961536,mu,2016-05-02 13:59:00,rt spy vxx yinn oil bac fcx fb mro aapl pfe ge wfc mu v,0.0,4.0,924.0,1083.0,True,1
727134347967393792,mu,2016-05-02 13:55:00,stock futures buoyant bargain hunting higher oil prices stock futures,0.0,0.0,672.0,647.0,False,0
727132411713196034,mu,2016-05-02 13:47:00,rt spy vxx yinn oil bac fcx fb mro aapl pfe ge wfc mu v,0.0,4.0,13422.0,903.0,True,1
727130683278299136,mu,2016-05-02 13:40:00,rt spy vxx yinn oil bac fcx fb mro aapl pfe ge wfc mu v,0.0,4.0,656.0,4.0,True,1
727130582187167744,mu,2016-05-02 13:40:00,rt spy vxx yinn oil bac fcx fb mro aapl pfe ge wfc mu v,0.0,4.0,571.0,438.0,True,1
727130066333892608,mu,2016-05-02 13:38:00,spy vxx yinn oil bac fcx fb mro aapl pfe ge wfc mu v,0.0,5.0,6461.0,5096.0,False,1
727128510393913345,mu,2016-05-02 13:32:00,bull case mu 2 hour pretty compelling says gs,0.0,0.0,489.0,426.0,False,1
727128425488592896,mu,2016-05-02 13:31:00,mu hearing ms positive comments,2.0,0.0,19111.0,242.0,False,0
727127393144426496,mu,2016-05-02 13:27:00,94.57 percent avg gain 100 percent unbiased qqq ibb gs nke tpac aapl mu,0.0,0.0,34.0,6.0,False,0
727127045357056000,mu,2016-05-02 13:26:00,rt spx roadmap 2016 tvix vxx vale aapl aks fcx msft aa mu vix spx spy pcln siri mcd,0.0,37.0,260.0,375.0,True,1
727124426005876740,mu,2016-05-02 13:15:00,rt spx roadmap 2016 tvix vxx vale aapl aks fcx msft aa mu vix spx spy pcln siri mcd,0.0,37.0,83.0,270.0,True,0
727114546670931973,mu,2016-05-02 12:36:00,rt large call trades,0.0,1.0,379.0,771.0,True,0
727113365886095361,mu,2016-05-02 12:31:00,large call trades,0.0,1.0,4614.0,2578.0,False,1
727111667348299776,mu,2016-05-02 12:25:00,market catch up lam research,0.0,0.0,27.0,252.0,False,1
727111005625573377,mu,2016-05-02 12:22:00,want find trades like rprx positive 170 percent,0.0,0.0,13206.0,13349.0,False,1
727109901219045376,mu,2016-05-02 12:18:00,terp pe ratio ratio see greater terp cmi mu,0.0,0.0,45.0,40.0,False,0
727109004019781632,mu,2016-05-02 12:14:00,micron upside potential downside risk,0.0,0.0,2351.0,3076.0,False,0
727105874896916481,mu,2016-05-02 12:02:00,shlm exchange see greater shlm mu gbx,0.0,0.0,37.0,41.0,False,1
727104532531040256,mu,2016-05-02 11:56:00,interesting see news comes mu massive june 13 calls bought last week .30 .50,0.0,0.0,20.0,30.0,False,0
727097845333917696,mu,2016-05-02 11:30:00,p 500 tech sector ytd negative 3.4 percent best fb positive 12.3 percent gpn positive 11.9 percent wu positive 11.7 percent yhoo positive 10.0 percent worst stx negative 40.6 percent wdc negative 31.9 percent ads negative 26.5 percent mu negative 24.1 percent,2.0,1.0,824.0,618.0,False,0
727095446112456704,mu,2016-05-02 11:20:00,rt biggest open interest changes names include vrx jcp aapl bac bax mu pbr emc,0.0,1.0,722.0,321.0,True,0
727094396471132160,mu,2016-05-02 11:16:00,biggest open interest changes names include vrx jcp aapl bac bax mu pbr emc,2.0,1.0,16155.0,9327.0,False,1
727074078096429056,mu,2016-05-02 09:55:00,learn self sufficient svu mobl point n orig agen trxc wetf ngl mu,0.0,0.0,39.0,50.0,False,0
727066989613600768,mu,2016-05-02 09:27:00,bam change see greater bam mu dds,0.0,0.0,41.0,40.0,False,1
727065061798326273,mu,2016-05-02 09:19:00,micron technology mu nasdaq drops 7.49 percent dollars 0.75 friday among top 10 actives p500 mu,0.0,0.0,42.0,26.0,False,0
727061424384548864,mu,2016-05-02 09:05:00,rt micron technology mu nasdaq drops 7.49 percent dollars 0.75 friday among top 10 actives p500 mu …,0.0,1.0,586.0,64.0,True,1
727061330285367296,mu,2016-05-02 09:05:00,micron technology mu nasdaq drops 7.49 percent dollars 0.75 friday among top 10 actives p500 mu,0.0,1.0,109.0,76.0,False,1
727060325758046208,mu,2016-05-02 09:01:00,bilo selhi alerted vltc positive 73 percent,0.0,0.0,13202.0,13338.0,False,0
727058458697187328,mu,2016-05-02 08:53:00,micron technology inc fallen negative 7.49 percent today vetr users indicating target price dollars 2.79 mu,0.0,0.0,130.0,199.0,False,1
727053660216262656,mu,2016-05-02 08:34:00,micron technology mu nasdaq loses 07.49 percent dollars 0.75 friday among top 10 losers p500 mu,0.0,0.0,42.0,26.0,False,0
727052774681251840,mu,2016-05-02 08:31:00,connected home microns next growth frontier mu,0.0,0.0,324.0,102.0,False,1
727052573518139392,mu,2016-05-02 08:30:00,micron technology mu nasdaq loses 07.49 percent dollars 0.75 friday among top 10 losers p500 mu,0.0,0.0,109.0,76.0,False,1
727051257651687424,mu,2016-05-02 08:25:00,view users posting speculatingstocks mu ulta,0.0,0.0,272.0,229.0,False,1
727044058846121984,mu,2016-05-02 07:56:00,,0.0,0.0,101.0,40.0,False,0
726997308135641088,mu,2016-05-02 04:50:00,rt 4 things facebook inc management wants know facebook first qua,0.0,1.0,771.0,2.0,True,1
726995564789829632,mu,2016-05-02 04:43:00,4 things facebook inc management wants know facebook first qua,0.0,1.0,674.0,647.0,False,1
726991929263562752,mu,2016-05-02 04:29:00,commented harder alternative managing nand capacity 3 days age,0.0,0.0,0.0,6.0,False,0
726979635477643265,mu,2016-05-02 03:40:00,,0.0,0.0,13197.0,13339.0,False,1
726977116164767744,mu,2016-05-02 03:30:00,join,0.0,0.0,13197.0,13339.0,False,1
726974597711712256,mu,2016-05-02 03:20:00,join,0.0,0.0,13197.0,13339.0,False,0
726972611490680833,mu,2016-05-02 03:12:00,rt large call trades,0.0,1.0,379.0,771.0,True,1
726972227283898368,mu,2016-05-02 03:11:00,large call trades,0.0,1.0,4615.0,2579.0,False,1
726971818440048640,mu,2016-05-02 03:09:00,smart traders join,0.0,0.0,13197.0,13339.0,False,1
726971561090097153,mu,2016-05-02 03:08:00,smart traders join,0.0,0.0,13197.0,13339.0,False,1
726971030653259776,mu,2016-05-02 03:06:00,smart traders join,0.0,0.0,13197.0,13339.0,False,0
726968509926756352,mu,2016-05-02 02:56:00,bilo selhi alerted vltc positive 73 percent,0.0,0.0,13197.0,13339.0,False,1
726967017270468610,mu,2016-05-02 02:50:00,3 reasons need congress save social security photo afge via flickr,0.0,0.0,673.0,647.0,False,1
726965123361980417,mu,2016-05-02 02:42:00,bilo selhi alerted live positive 54 percent,0.0,0.0,13197.0,13339.0,False,1
726954289327910912,mu,2016-05-02 01:59:00,rt large call trades,0.0,1.0,379.0,771.0,True,0
726952924450947072,mu,2016-05-02 01:54:00,large call trades,0.0,1.0,4616.0,2579.0,False,1
726947384169734145,mu,2016-05-02 01:32:00,rt consistently find trades like nymx positive 124 percent,0.0,1.0,29.0,128.0,True,1
726947340381200384,mu,2016-05-02 01:32:00,consistently find trades like nymx positive 124 percent,0.0,1.0,13194.0,13339.0,False,1
726944495493877761,mu,2016-05-02 01:20:00,rt way solve facebook inc engagement problem image sourc,0.0,1.0,771.0,2.0,True,0
726943366047367168,mu,2016-05-02 01:16:00,way solve facebook inc engagement problem image sourc,0.0,1.0,673.0,647.0,False,0
726941619396685825,mu,2016-05-02 01:09:00,mu short swing watch feye balance direction tvix holding looking flow,0.0,0.0,199.0,62.0,False,1
726941199035207680,mu,2016-05-02 01:07:00,mu last week explosive pop drop back origin move definitely play,0.0,0.0,75.0,18.0,False,1
726940148345245696,mu,2016-05-02 01:03:00,rt spx roadmap 2016 tvix vxx vale aapl aks fcx msft aa mu vix spx spy pcln siri mcd,0.0,34.0,318.0,376.0,True,1
726934736405454848,mu,2016-05-02 00:42:00,,0.0,0.0,13195.0,13338.0,False,1
726922951413485568,mu,2016-05-01 23:55:00,rt panera amazing quarter get used image source panera,0.0,2.0,1018.0,2742.0,True,0
726922119511154689,mu,2016-05-01 23:51:00,interested momentum stocks subscribe,0.0,0.0,13195.0,13338.0,False,0
726921847913242624,mu,2016-05-01 23:50:00,rt large call trades,0.0,1.0,379.0,771.0,True,1
726921699996909571,mu,2016-05-01 23:50:00,rt nikes betting new app instead wearables nike swift exit fr,0.0,1.0,769.0,2.0,True,1
726921029939920896,mu,2016-05-01 23:47:00,large call trades,0.0,1.0,4616.0,2579.0,False,1
726920703828586496,mu,2016-05-01 23:46:00,nikes betting new app instead wearables nike swift exit fr,0.0,1.0,673.0,647.0,False,1
726914717730660353,mu,2016-05-01 23:22:00,rt,0.0,1.0,594.0,651.0,True,1
726914167505047553,mu,2016-05-01 23:20:00,rt panera amazing quarter get used image source panera,0.0,1.0,769.0,2.0,True,1
726912608243077120,mu,2016-05-01 23:14:00,panera amazing quarter get used image source panera,0.0,2.0,673.0,647.0,False,0
726912034202357764,mu,2016-05-01 23:11:00,,0.0,1.0,13195.0,13338.0,False,0
726905811679596545,mu,2016-05-01 22:47:00,mu tick see greater mu prty amag,0.0,0.0,31.0,40.0,False,0
726904214392307712,mu,2016-05-01 22:40:00,rt rt spx roadmap 2016 tvix vxx vale aapl aks fcx msft aa mu vix spx spy pcln siri …,0.0,1.0,652.0,4.0,True,0
726903355151249408,mu,2016-05-01 22:37:00,rt spx roadmap 2016 tvix vxx vale aapl aks fcx msft aa mu vix spx spy pcln siri mcd h…,0.0,1.0,1475.0,606.0,False,1
726901949845614592,mu,2016-05-01 22:31:00,see latest stock members making,1.0,0.0,13194.0,13336.0,False,0
726898287400259584,mu,2016-05-01 22:17:00,micron dollars 0 floor cannot hold long,0.0,0.0,168605.0,1438.0,False,1
726889321295286272,mu,2016-05-01 21:41:00,vggl positive 16 percent alerted,0.0,0.0,13191.0,13335.0,False,1
726889256220655616,mu,2016-05-01 21:41:00,elizabeth warren wants tax return take 5 minutes image sourc,0.0,0.0,674.0,647.0,False,0
726888512713330689,mu,2016-05-01 21:38:00,rt spx roadmap 2016 tvix vxx vale aapl aks fcx msft aa mu vix spx spy pcln siri mcd,0.0,33.0,82.0,54.0,True,1
726884108794777600,mu,2016-05-01 21:20:00,rt large call trades,0.0,1.0,379.0,771.0,True,0
726882533737013248,mu,2016-05-01 21:14:00,large call trades,0.0,1.0,4614.0,2579.0,False,1
726873919211356160,mu,2016-05-01 20:40:00,rt 3 key takeaways supervalu inc latest report even though save,0.0,1.0,766.0,2.0,True,1
726872010249244673,mu,2016-05-01 20:32:00,3 key takeaways supervalu inc latest report even though save,0.0,1.0,674.0,647.0,False,0
726859875058221057,mu,2016-05-01 19:44:00,view users posting speculatingstocks mu ulta,1.0,0.0,272.0,228.0,False,1
726859398560251904,mu,2016-05-01 19:42:00,rt spx roadmap 2016 tvix vxx vale aapl aks fcx msft aa mu vix spx spy pcln siri mcd,0.0,32.0,127.0,57.0,True,0
726857576059555840,mu,2016-05-01 19:35:00,large call trades,0.0,1.0,4614.0,2579.0,False,0
726851282951110656,mu,2016-05-01 19:10:00,rt u market indexes close lower week u market indexes lost,0.0,1.0,766.0,2.0,True,1
726850298107449345,mu,2016-05-01 19:06:00,u market indexes close lower week u market indexes lost,0.0,1.0,672.0,647.0,False,1
726844775228399617,mu,2016-05-01 18:44:00,,0.0,0.0,13191.0,13327.0,False,1
726826241681137665,mu,2016-05-01 17:30:00,rt better buy realty income corporation vs kimco realty corporation photo,0.0,1.0,765.0,2.0,True,1
726825998281396224,mu,2016-05-01 17:29:00,better buy realty income corporation vs kimco realty corporation photo,0.0,1.0,672.0,647.0,False,0
726825776054673408,mu,2016-05-01 17:29:00,rt large call trades,0.0,1.0,379.0,771.0,True,1
726825510471262208,mu,2016-05-01 17:28:00,large call trades,0.0,1.0,4612.0,2578.0,False,1
726820493920198657,mu,2016-05-01 17:08:00,put mu watch list buying next dip,0.0,0.0,440.0,1014.0,False,0
726812354932031488,mu,2016-05-01 16:35:00,rt spx roadmap 2016 tvix vxx vale aapl aks fcx msft aa mu vix spx spy pcln siri mcd,0.0,31.0,251.0,324.0,True,0
726780839711891457,mu,2016-05-01 14:30:00,rt intuit inc cant get everyone switch quickbooks online source intu,0.0,1.0,766.0,2.0,True,1
726780757268537344,mu,2016-05-01 14:30:00,intuit inc cant get everyone switch quickbooks online source intu,1.0,1.0,669.0,647.0,False,0
726771476804816896,mu,2016-05-01 13:53:00,rt spx roadmap 2016 tvix vxx vale aapl aks fcx msft aa mu vix spx spy pcln siri mcd,0.0,30.0,151.0,285.0,True,1
726757554055835649,mu,2016-05-01 12:57:00,large call trades,0.0,0.0,4608.0,2578.0,False,1
726753556867461120,mu,2016-05-01 12:42:00,micron upside potential downside risk,0.0,0.0,2.0,23.0,False,0
726750906587312129,mu,2016-05-01 12:31:00,importance trading strategy svu mobl point n orig agen trxc wetf ngl mu,0.0,0.0,39.0,50.0,False,1
726748094239506434,mu,2016-05-01 12:20:00,rt social security help image source fdr presidential lib,0.0,1.0,765.0,2.0,True,1
726747890215870464,mu,2016-05-01 12:19:00,social security help image source fdr presidential lib,0.0,1.0,667.0,647.0,False,1
726746843217022976,mu,2016-05-01 12:15:00,rt spx roadmap 2016 tvix vxx vale aapl aks fcx msft aa mu vix spx spy pcln siri mcd,0.0,29.0,5.0,33.0,True,1
