Tweet Id,Ticker,Datetime,Text,Favs,RTs,Followers,Following,Is a RT,Sentiment
736236030852927493,mu,2016-05-27 16:42:00,alphabet wins prolonged copyright case against oracle alphabet inc googl,0.0,0.0,693.0,644.0,False,1
736234786293972993,mu,2016-05-27 16:37:00,mu positive 13 percent week unless bot year u getting back losses one fugly bear channel maybe time,2.0,1.0,11581.0,233.0,False,1
736234221241393154,mu,2016-05-27 16:34:00,hot options report midday may 27 2016 ete aapl kgc swn mu bac baba,0.0,0.0,10754.0,121.0,False,0
736234019176779778,mu,2016-05-27 16:34:00,jul 11 calls mu positive 185 percent,1.0,0.0,511.0,1184.0,False,1
736233641223716864,mu,2016-05-27 16:32:00,unusual call activity,0.0,0.0,4764.0,2539.0,False,1
736232297792458753,mu,2016-05-27 16:27:00,investorslive4 u seekingalpha capital ready gold silver bottom july,0.0,0.0,1386.0,1192.0,False,1
736230947306102784,mu,2016-05-27 16:21:00,mu chatter acquired dollars 8 per share,0.0,0.0,161.0,931.0,False,1
736226869033459712,mu,2016-05-27 16:05:00,rt seekingalpha capital ready gold silver bottom july,0.0,0.0,8592.0,4.0,False,0
736226153334083585,mu,2016-05-27 16:02:00,capital ready gold silver bottom july,0.0,0.0,340.0,1.0,False,1
736226151866073088,mu,2016-05-27 16:02:00,capital ready gold silver bottom july,0.0,0.0,2037.0,29.0,False,0
736225972542791680,mu,2016-05-27 16:02:00,mu mu,0.0,0.0,4363.0,4.0,False,0
736225828439269376,mu,2016-05-27 16:01:00,one us dropped ball smh klac lrcx mu,0.0,0.0,287.0,88.0,False,0
736222480369651712,mu,2016-05-27 15:48:00,micron third quarter earnings interesting,0.0,0.0,8.0,38.0,False,1
736221620826607617,mu,2016-05-27 15:44:00,wdc rising investors digest company’s fourth quarter guidance call fnv ndaq frt mu,0.0,0.0,13327.0,742.0,False,0
736221603940290560,mu,2016-05-27 15:44:00,5 takeaways general electric companys latest investor presentation w,0.0,0.0,693.0,644.0,False,0
736221501154840578,mu,2016-05-27 15:44:00,wdc rising investors digest company’s fourth quarter guidance call fnv ndaq frt mu,0.0,0.0,303.0,13.0,False,1
736219241670660096,mu,2016-05-27 15:35:00,investorslive4 u seekingalpha micron third quarter earnings interesting,0.0,0.0,1381.0,1192.0,False,1
736215790181982208,mu,2016-05-27 15:21:00,longs mu bmy nbr bp esi mdlz bsx shorts ibn mtw,0.0,0.0,27829.0,77.0,False,1
736215697039097856,mu,2016-05-27 15:21:00,mu general question said buy level eager short,1.0,1.0,2392.0,35.0,False,0
736215211066183680,mu,2016-05-27 15:19:00,rt seekingalpha micron third quarter earnings interesting,0.0,0.0,8592.0,4.0,False,1
736214245461905408,mu,2016-05-27 15:15:00,micron third quarter earnings interesting,0.0,0.0,2390.0,3129.0,False,1
736214136200257536,mu,2016-05-27 15:15:00,notable gainers among liquid option names morning include viab positive 3.3 percent amat positive 2.9 percent nrg positive 2.9 percent mu positive 2.8 percent win positive 2.7 percent,0.0,0.0,31172.0,5431.0,False,1
736214021431562240,mu,2016-05-27 15:14:00,mu top news may 27 2016 mu,0.0,0.0,610.0,540.0,False,1
736213820192882688,mu,2016-05-27 15:13:00,micron third quarter earnings interesting,0.0,0.0,3625.0,30.0,False,1
736213723644334080,mu,2016-05-27 15:13:00,mu active relative volume 8.23 1 hour 0 ndx spy,0.0,0.0,152.0,1.0,False,1
736213041419673601,mu,2016-05-27 15:10:00,mu today type day harriet homemakers america stuff plastic,0.0,0.0,160.0,6.0,False,1
736212919042473984,mu,2016-05-27 15:10:00,mu insteresting level,0.0,0.0,75.0,5.0,False,1
736210694887071744,mu,2016-05-27 15:01:00,rt joined monday already up dollars k week get board twtr ddd mu,0.0,2.0,3986.0,77.0,True,0
736210498543190017,mu,2016-05-27 15:00:00,micron technology inc mu making gains dram nand sentiment improves,0.0,0.0,361.0,516.0,False,1
736210417576333312,mu,2016-05-27 15:00:00,popular mu dust wb rh cat googl efut mack hes petx nrz,0.0,0.0,1337.0,1.0,False,1
736210103955824644,mu,2016-05-27 14:59:00,chart mu free app,0.0,0.0,63.0,18.0,False,0
736209709104046081,mu,2016-05-27 14:57:00,rt early action ete kgc mrk mt mu tex via,0.0,1.0,191.0,234.0,True,0
736209517717819396,mu,2016-05-27 14:56:00,mu mother ucker move daily,0.0,0.0,244.0,264.0,False,0
736209508104425477,mu,2016-05-27 14:56:00,scan seny nhmd swhc hov ccxi gale hpe ttnp amat veev big feic ulta asx lrcx vnda cal atos neot mu atvi ttwo,0.0,0.0,1916.0,724.0,False,1
736208297057886208,mu,2016-05-27 14:51:00,rt personally would not chasing mu trimming lots bought not long ago sub 10 still love setup int term,0.0,1.0,1643.0,2020.0,True,1
736208124915245056,mu,2016-05-27 14:51:00,joined monday already up dollars k week get board twtr ddd mu,3.0,2.0,188.0,410.0,False,1
736207848649154560,mu,2016-05-27 14:50:00,early action ete kgc mrk mt mu tex via,0.0,1.0,1127.0,18.0,False,1
736207421782261760,mu,2016-05-27 14:48:00,volume alert mu 12.31 micron technology mu hit high today 12.43 closing day 0 12.31 positive 0.36,0.0,0.0,761.0,447.0,False,0
736207322846920705,mu,2016-05-27 14:47:00,personally would not chasing mu trimming lots bought not long ago sub 10 still love setup int term,0.0,1.0,1561.0,1359.0,False,1
736207301951008768,mu,2016-05-27 14:47:00,mu haznt seen red day 2 weeks short watch not high up,0.0,0.0,374.0,28.0,False,1
736206860907253763,mu,2016-05-27 14:46:00,,0.0,0.0,103.0,40.0,False,1
736206580350386177,mu,2016-05-27 14:45:00,mu oi chart free app,0.0,0.0,51.0,16.0,False,0
736204576844480514,mu,2016-05-27 14:37:00,.5 mu 12.27 positive 9 percent,0.0,0.0,18.0,1.0,False,0
736204131958808577,mu,2016-05-27 14:35:00,rt mu explosion addeed calls up 2 percent follow big boys,0.0,2.0,1643.0,2020.0,True,1
736204120499986432,mu,2016-05-27 14:35:00,rh nhod spy aapl mu pcln looking dollars 5,1.0,0.0,212.0,1410.0,False,1
736204112618889217,mu,2016-05-27 14:35:00,rt mu 12.40 trigger imo coudl go 13.50 not saying,0.0,1.0,1643.0,2020.0,True,0
736204088900100106,mu,2016-05-27 14:35:00,rt mu breach fo 12.40 hold 5 mins imo,0.0,1.0,1643.0,2020.0,True,1
736204071309213700,mu,2016-05-27 14:35:00,rt mu u want lock profits resistnace spy fb mu last video check today big,0.0,1.0,1643.0,2020.0,True,0
736204053378519040,mu,2016-05-27 14:34:00,rt massive call buying activity mu july dollars 0 calls volume 6300 july dollars 2 calls volume 9500,0.0,1.0,1643.0,2020.0,True,1
736203982285180928,mu,2016-05-27 14:34:00,mu highest print today since jan 14 16,0.0,0.0,3985.0,77.0,False,1
736203538410409984,mu,2016-05-27 14:32:00,mu crack week,0.0,0.0,1703.0,522.0,False,0
736203405258018816,mu,2016-05-27 14:32:00,massive call buying activity mu july dollars 0 calls volume 6300 july dollars 2 calls volume 9500,0.0,1.0,131.0,25.0,False,0
736202736450994178,mu,2016-05-27 14:29:00,big ol breakout mu calls bought like crazy long jun 10 13,0.0,0.0,1643.0,2020.0,False,1
736202535791300609,mu,2016-05-27 14:28:00,rt mu another 10000 jun24 12.5 calls trade 20000 day,0.0,2.0,1643.0,2020.0,True,0
736202263476084736,mu,2016-05-27 14:27:00,mu u want lock profits resistnace spy fb mu last video check today big,0.0,1.0,12821.0,3082.0,False,1
736202242479558656,mu,2016-05-27 14:27:00,mu not cutting mustard,2.0,0.0,3386.0,165.0,False,1
736201465149022208,mu,2016-05-27 14:24:00,spy mu aapl rh nice reversal today room dollars 5 possible retake 50 displaced moving average dollars 9,1.0,0.0,212.0,1410.0,False,1
736201338288230400,mu,2016-05-27 14:24:00,come mu break .40 resistance please,0.0,0.0,3386.0,165.0,False,0
736200940236083201,mu,2016-05-27 14:22:00,mu im positive 20 percent try next week,0.0,0.0,227.0,22.0,False,1
736200908992831488,mu,2016-05-27 14:22:00,rt mu another 10000 jun24 12.5 calls trade 20000 day,0.0,2.0,337.0,400.0,True,1
736200719296925696,mu,2016-05-27 14:21:00,rt mu trade paid years subscriptions,0.0,2.0,27829.0,79.0,True,1
736200305616920576,mu,2016-05-27 14:20:00,sold mu .68 .48 entry,0.0,0.0,1228.0,251.0,False,0
736200128739090432,mu,2016-05-27 14:19:00,openoutcrier nice trade mu earlier,1.0,0.0,1380.0,1192.0,False,0
736200108577030144,mu,2016-05-27 14:19:00,rt 20000 mu dollars 2.5 calls 95 percent ask,0.0,5.0,21.0,77.0,True,0
736200071025303553,mu,2016-05-27 14:19:00,rt means avoid fomo trades vslr rylp ttnp lc vrx amd amat brcd sdrl twtr mu,0.0,1.0,180.0,98.0,True,1
736200021981286401,mu,2016-05-27 14:18:00,rt mu trade paid years subscriptions,0.0,2.0,1643.0,2020.0,True,1
736200005287976960,mu,2016-05-27 14:18:00,rt long mu break attempt,0.0,1.0,1643.0,2020.0,True,1
736199801281318912,mu,2016-05-27 14:18:00,mu trade paid years subscriptions,1.0,2.0,223.0,222.0,False,1
736199735799844864,mu,2016-05-27 14:17:00,long mu break attempt,0.0,1.0,3386.0,165.0,False,1
736199619114328064,mu,2016-05-27 14:17:00,mu dollars 2.08 buy stock picks alert sent 8 et subscribers,0.0,0.0,134.0,6.0,False,1
736199609442148356,mu,2016-05-27 14:17:00,mu breach fo 12.40 hold 5 mins imo,0.0,1.0,227.0,22.0,False,1
736199578521874432,mu,2016-05-27 14:17:00,rt micron mu explodes higher buyout rumors,0.0,1.0,456.0,16.0,True,1
736199529263988736,mu,2016-05-27 14:17:00,micron mu explodes higher buyout rumors,1.0,1.0,232.0,5.0,False,1
736199321587056640,mu,2016-05-27 14:16:00,exit close filled sold 40 mu july 12 calls dollars .20 paid dollars 99 80 left dollars 920 profits 15 mins,0.0,0.0,27829.0,79.0,False,0
736199156574740482,mu,2016-05-27 14:15:00,mu 12.40 trigger imo coudl go 13.50 not saying,0.0,1.0,227.0,22.0,False,0
736198971140517888,mu,2016-05-27 14:14:00,mu,3.0,0.0,3985.0,77.0,False,1
736198961598365697,mu,2016-05-27 14:14:00,mu .68 ask .48 entry well fast,0.0,0.0,1228.0,251.0,False,1
736198792576303106,mu,2016-05-27 14:14:00,buying up thi mu non stop,0.0,0.0,1228.0,251.0,False,1
736198664796917761,mu,2016-05-27 14:13:00,mu 335 percent,0.0,0.0,550.0,1744.0,False,1
736198598291902464,mu,2016-05-27 14:13:00,exit close filled sold 40 160 mu july 12 calls dollars .12 next target dollars .20 dollars 240 profits less 15 mins,0.0,0.0,27829.0,79.0,False,1
736198560752926721,mu,2016-05-27 14:13:00,5978 mu jul16 10.0 calls dollars .55 lotta love name today,0.0,0.0,264.0,4.0,False,1
736198532219076609,mu,2016-05-27 14:13:00,nice trade mu earlier,0.0,0.0,19531.0,248.0,False,1
736198209177948160,mu,2016-05-27 14:11:00,looks like pump dump squads full force ahead long weekend x twtr mu,0.0,0.0,4390.0,1483.0,False,0
736197534519943169,mu,2016-05-27 14:09:00,means avoid fomo trades vslr rylp ttnp lc vrx amd amat brcd sdrl twtr mu,2.0,1.0,72.0,53.0,False,1
736197078120964100,mu,2016-05-27 14:07:00,rt mu explosion addeed calls up 2 percent follow big boys,0.0,2.0,774.0,330.0,True,1
736196793189294080,mu,2016-05-27 14:06:00,mu explosion addeed calls up 2 percent follow big boys,1.0,2.0,12820.0,3082.0,False,1
736196249586536448,mu,2016-05-27 14:03:00,rt mu up 5 day big boys added 20000 calls huge profits,0.0,2.0,1643.0,2020.0,True,0
736196237976842242,mu,2016-05-27 14:03:00,rt 20000 mu dollars 2.5 calls 95 percent ask,0.0,5.0,209.0,171.0,True,0
736196229416157185,mu,2016-05-27 14:03:00,rt todays top trade monster move tech stocks msft wdc intc mu aapl orcl,0.0,3.0,1643.0,2020.0,True,1
736196155692843009,mu,2016-05-27 14:03:00,rt mu jun24 13 call buyer positive 5000 .32,0.0,2.0,1643.0,2020.0,True,0
736196146134011904,mu,2016-05-27 14:03:00,mu jun 24 dollars 2.5 calls trading 20000 possible breakout trend channel btwn dollars,0.0,0.0,24.0,56.0,False,1
736196126156541953,mu,2016-05-27 14:03:00,rt mu piggy backed calls bought,0.0,1.0,1643.0,2020.0,True,1
736196119529656320,mu,2016-05-27 14:03:00,openoutcrier mu another 10000 jun24 12.5 calls trade 20000 day,0.0,0.0,1380.0,1192.0,False,0
736196090538627072,mu,2016-05-27 14:03:00,mu twtr call options bought yesterday paying nicely today post n charts later,0.0,0.0,449.0,1142.0,False,1
736196050180931584,mu,2016-05-27 14:03:00,trader bought 30000 mu calls,0.0,0.0,27829.0,79.0,False,1
736195667303895040,mu,2016-05-27 14:01:00,mu piggy backed calls bought,0.0,1.0,227.0,22.0,False,1
736195446461353984,mu,2016-05-27 14:00:00,mu looks good,0.0,0.0,1565.0,346.0,False,1
736195230244831234,mu,2016-05-27 13:59:00,mu chart,0.0,0.0,189.0,136.0,False,1
736195118458249217,mu,2016-05-27 13:59:00,took mu 12 calls .48,0.0,0.0,1228.0,251.0,False,1
736195106043252736,mu,2016-05-27 13:59:00,rt trader buys 20000 mu 6.24 12.5 calls long,0.0,1.0,24.0,56.0,True,1
736195030050734080,mu,2016-05-27 13:59:00,rt 20000 mu dollars 2.5 calls 95 percent ask,0.0,5.0,292.0,179.0,True,1
736194741373542405,mu,2016-05-27 13:57:00,trader buys 20000 mu 6.24 12.5 calls long,2.0,1.0,27829.0,79.0,False,1
736194368470650880,mu,2016-05-27 13:56:00,rt 20000 mu dollars 2.5 calls 95 percent ask,0.0,5.0,95.0,0.0,True,1
736194365186412544,mu,2016-05-27 13:56:00,mu jun weekly 12.5 call activity 7500 dollars 48 .49 offer expire jun 24 oi 556,2.0,0.0,2709.0,246.0,False,1
736194341312552960,mu,2016-05-27 13:56:00,mu dollars 2 break spy holds up runs could see one remain explosive,0.0,0.0,3985.0,77.0,False,1
736194332563120133,mu,2016-05-27 13:56:00,rt 20000 mu dollars 2.5 calls 95 percent ask,0.0,5.0,850.0,446.0,True,0
736194281191444480,mu,2016-05-27 13:56:00,20000 mu dollars 2.5 calls 95 percent ask,6.0,5.0,39016.0,9586.0,False,1
736193949065318400,mu,2016-05-27 13:54:00,mu another 10000 jun24 12.5 calls trade 20000 day,2.0,2.0,19531.0,248.0,False,1
736193859705675776,mu,2016-05-27 13:54:00,5000 mu fri 12.5 calls wkly dollars .49 above ask,1.0,0.0,264.0,4.0,False,0
736193838008696832,mu,2016-05-27 13:54:00,mu 12.5 calls buying activity expiring 24 jun volume 4873,1.0,0.0,1492.0,28.0,False,1
736192445629747200,mu,2016-05-27 13:48:00,openoutcrier mu jun24 12.5 call buyers positive 10 thousand dollars .49,0.0,0.0,1379.0,1192.0,False,0
736192075482419200,mu,2016-05-27 13:47:00,micron technology rises 3.02 percent dollars 1.95 thursday among top 10 actives p500,0.0,0.0,2.0,0.0,False,1
736191674548916225,mu,2016-05-27 13:45:00,micron technology rises 3.02 percent dollars 1.95 thursday among top 10 actives p500,0.0,0.0,52.0,33.0,False,0
736191541216219136,mu,2016-05-27 13:45:00,micron technology rises 3.02 percent dollars 1.95 thursday among top 10 actives p500,0.0,0.0,15.0,29.0,False,0
736191242254442496,mu,2016-05-27 13:44:00,micron technology rises 3.02 percent dollars 1.95 thursday among top 10 actives p500,0.0,0.0,113.0,76.0,False,0
736190531793870850,mu,2016-05-27 13:41:00,rt 9750 mu fri 12.5 calls wkly dollars .49,0.0,1.0,773.0,330.0,True,1
736190374763364354,mu,2016-05-27 13:40:00,mu jun24 12.5 call buyers positive 10 thousand dollars .49,0.0,0.0,19531.0,248.0,False,1
736189379849256960,mu,2016-05-27 13:36:00,9750 mu fri 12.5 calls wkly dollars .49,0.0,1.0,263.0,4.0,False,1
736154956391124993,mu,2016-05-27 11:19:00,epic friday long watchlist 2 mu 10.07 slb 75.62 wfc 47.35 wmt 63.15 xlf 23.21 spy,0.0,0.0,644.0,3489.0,False,1
736154352814034944,mu,2016-05-27 11:17:00,micron technology nasdaq mu gains 3.02 percent dollars 1.95 thursday among top 10 gainers p500,0.0,0.0,2.0,0.0,False,1
736154050966740992,mu,2016-05-27 11:16:00,micron technology nasdaq mu gains 3.02 percent dollars 1.95 thursday among top 10 gainers p500,0.0,0.0,52.0,33.0,False,1
736153596060897280,mu,2016-05-27 11:14:00,micron technology nasdaq mu gains 3.02 percent dollars 1.95 thursday among top 10 gainers p500,0.0,0.0,15.0,29.0,False,1
736153488560816128,mu,2016-05-27 11:14:00,micron technology nasdaq mu gains 3.02 percent dollars 1.95 thursday among top 10 gainers p500,0.0,0.0,112.0,76.0,False,0
736127529774424064,mu,2016-05-27 09:30:00,icm asset management inc wa invests dollars 124000 micron technology inc mu,0.0,0.0,756.0,8.0,False,1
736111456018534400,mu,2016-05-27 08:27:00,view users posting speculatingstocks mu ulta,0.0,0.0,313.0,269.0,False,1
736111133271064576,mu,2016-05-27 08:25:00,google discontinues nexus 9 tablets investorplaceinvestorplace stock marke,2.0,0.0,694.0,644.0,False,1
736076767266365440,mu,2016-05-27 06:09:00,buy momentum trade options short stocks years maybe,0.0,0.0,693.0,644.0,False,1
736043187303653380,mu,2016-05-27 03:55:00,stocks finish lower ahead yellen investorplaceinvestorplace stock mar,1.0,0.0,693.0,644.0,False,0
736029188566749185,mu,2016-05-27 03:00:00,sell signal detected 13 stocks dltr dg dri intu mu biib viab igt wdc hrb hpq payx glw,0.0,0.0,219.0,192.0,False,1
736026784001581056,mu,2016-05-27 02:50:00,view users posting speculatingstocks mu ulta,0.0,0.0,313.0,269.0,False,1
736020119382413313,mu,2016-05-27 02:24:00,thc last price see greater thc ge mu,0.0,0.0,42.0,40.0,False,0
736019518133141505,mu,2016-05-27 02:21:00,palo alto networks falls growth decelerates image source palo alto net,1.0,0.0,693.0,644.0,False,0
736016115269263361,mu,2016-05-27 02:08:00,rt trump warns says current market ‘very strange’,0.0,4.0,1739.0,0.0,True,1
736014661976526848,mu,2016-05-27 02:02:00,rt trump warns says current market ‘very strange’,0.0,4.0,1179.0,1136.0,True,0
736011378658578432,mu,2016-05-27 01:49:00,rt trump warns says current market ‘very strange’,0.0,4.0,2338.0,1904.0,True,1
736001285506244608,mu,2016-05-27 01:09:00,stock picking service review timothy sykes penny stocking silver alerts,0.0,0.0,206.0,14.0,False,0
735998899249393664,mu,2016-05-27 00:59:00,trump warns says current market ‘very strange’,6.0,4.0,21462.0,8274.0,False,1
735990294944972801,mu,2016-05-27 00:25:00,video ads blowing up instagram image source instagram instagram,1.0,0.0,693.0,644.0,False,0
735986993436450817,mu,2016-05-27 00:12:00,spy hpq baba pfe mu qqq efa csco trending stocks,0.0,0.0,107.0,1.0,False,1
735982853222080512,mu,2016-05-26 23:56:00,nike nke 2016 valuable apparel brand forbes recently announced,0.0,0.0,693.0,644.0,False,1
735956151087439872,mu,2016-05-26 22:09:00,everyone disagrees economy people skeptical politicia,0.0,0.0,693.0,644.0,False,1
735951771101728768,mu,2016-05-26 21:52:00,example chart structure similar ddd mu twtr shak gpro,0.0,0.0,3982.0,77.0,False,1
735952551468761089,mu,2016-05-26 21:55:00,micron mu making gains dram nand sentiment improves,0.0,0.0,2692.0,2133.0,False,1
735951499637952513,mu,2016-05-26 21:51:00,mdca axcm prgn tnxp sgyp clrb mu rare hlf aqxp opxa cbyl nerv alny csc recent green picks given free via tweets,3.0,0.0,1240.0,49.0,False,1
735940948979392512,mu,2016-05-26 21:09:00,williams sonoma inc starts year strong image source williams sonoma,2.0,0.0,690.0,644.0,False,1
735935180989300738,mu,2016-05-26 20:46:00,mu financials see greater mu swn foe,0.0,0.0,47.0,40.0,False,1
735931667425042432,mu,2016-05-26 20:32:00,asking right questions battleground no longer access,1.0,0.0,690.0,644.0,False,1
735930391329132545,mu,2016-05-26 20:27:00,missed entry paper trade gdx puts cat going well mu hit stop yet ok far,0.0,0.0,630.0,3444.0,False,1
735930200446402560,mu,2016-05-26 20:26:00,cara dest crmd chk fcx mu tsla,1.0,0.0,147.0,206.0,False,1
735923913071296512,mu,2016-05-26 20:01:00,recap unusual calls ngl jun 15 c mu jun24 13 c mdlz sep 50 c abbv jun10 62 c wetf sep 15 c,2.0,0.0,19515.0,248.0,False,1
735923556941475840,mu,2016-05-26 20:00:00,p500 trend dltr hpq pdco pvh dg mu nflx adm intu dri aap lvlt cnc viab wfm eqix,0.0,0.0,865.0,7.0,False,1
735923487475433473,mu,2016-05-26 20:00:00,p500 performance dltr hpq pdco pvh dg cost mu yhoo nflx eqt cxo akam kr ctxs agn,0.0,0.0,865.0,7.0,False,0
735923418009370626,mu,2016-05-26 19:59:00,nasdaq100 trend dltr mu nflx intu viab tmus wfm celg biib vod tsco ca aapl payx intc,0.0,0.0,865.0,7.0,False,1
735923349847736320,mu,2016-05-26 19:59:00,nasdaq100 performance dltr cost mu yhoo nflx tsla ntes akam ctxs intu viab nvda tmus,0.0,0.0,865.0,7.0,False,1
735920596412993536,mu,2016-05-26 19:48:00,mu recovering nicely last weeks im loaded long hope keeps up,0.0,0.0,1204.0,381.0,False,1
735919415087108097,mu,2016-05-26 19:43:00,mu making gains dram nand sentiment improves cve ntes cinf xl,0.0,0.0,13322.0,742.0,False,1
735919269893025792,mu,2016-05-26 19:43:00,mu making gains dram nand sentiment improves cve ntes cinf xl,0.0,0.0,302.0,13.0,False,1
735918435222183936,mu,2016-05-26 19:40:00,ti russian judge mu daily stochs would perfect 100 instead 97 still work sticking landing,0.0,0.0,88.0,93.0,False,1
735916799439425538,mu,2016-05-26 19:33:00,copart inc stock jumped today image source copart online auc,1.0,0.0,690.0,644.0,False,1
735915809088884736,mu,2016-05-26 19:29:00,rt mu looking first daily close dollars 2.00 since jan 14 2016,0.0,2.0,48745.0,1731.0,True,0
735915382943293440,mu,2016-05-26 19:27:00,rt mu looking first daily close dollars 2.00 since jan 14 2016,0.0,2.0,334.0,399.0,True,1
735914694742016001,mu,2016-05-26 19:25:00,mu looking first daily close dollars 2.00 since jan 14 2016,2.0,2.0,3981.0,77.0,False,0
735913953725796352,mu,2016-05-26 19:22:00,mu breaking 12 giddy up,0.0,0.0,64.0,635.0,False,0
735913243785334785,mu,2016-05-26 19:19:00,rt dollars 2.00 break mu much effort,0.0,1.0,334.0,399.0,True,1
735912918131343361,mu,2016-05-26 19:18:00,dollars 2.00 break mu much effort,0.0,1.0,3981.0,77.0,False,0
735912808496300032,mu,2016-05-26 19:17:00,mu stall around 12 level breaks 14 otw failed breakdown breakouts result powerful moves,0.0,0.0,152.0,285.0,False,1
735908733562261504,mu,2016-05-26 19:01:00,stock trading quiz,0.0,0.0,18285.0,13570.0,False,1
735908388584886272,mu,2016-05-26 19:00:00,micron technology inc mu ceo mark durcan j p morgan global technology media te,1.0,0.0,3622.0,30.0,False,1
735908057792663552,mu,2016-05-26 18:58:00,18 smart things dollars 000 right theres nothing like havi,0.0,0.0,690.0,644.0,False,1
735907783413927937,mu,2016-05-26 18:57:00,mu remember guys said 3 bot not see high 9 years,0.0,0.0,141.0,251.0,False,0
735902514424471552,mu,2016-05-26 18:36:00,mu go 14 breaks 12 level,0.0,0.0,12.0,30.0,False,1
735901507866886144,mu,2016-05-26 18:32:00,mu wow,0.0,0.0,2391.0,35.0,False,1
735899983472254976,mu,2016-05-26 18:26:00,mu micron technology inc hit dollars 2. today mu go higher time sell thoughts,0.0,0.0,64.0,635.0,False,1
735899814899093504,mu,2016-05-26 18:26:00,mu positive 26 percent last 10 trading days,0.0,0.0,1558.0,1359.0,False,0
735899010389659648,mu,2016-05-26 18:22:00,rt investor makes dollars 0 million dollars less one week sharing stock picks free,0.0,1.0,230.0,5.0,True,0
735898954475442178,mu,2016-05-26 18:22:00,investor makes dollars 0 million dollars less one week sharing stock picks free,1.0,1.0,453.0,16.0,False,1
735896430708031490,mu,2016-05-26 18:12:00,mu chipping away wall dollars 2.00,1.0,0.0,3981.0,77.0,False,1
735896423896469504,mu,2016-05-26 18:12:00,rt mu jun24 13 call buyer positive 5000 .32,0.0,2.0,1645.0,2019.0,True,0
735894852357869568,mu,2016-05-26 18:06:00,mu remember yesterdays doji indecision not confirmation market keep moving up,0.0,0.0,141.0,251.0,False,1
735894803376836608,mu,2016-05-26 18:06:00,view users posting speculatingstocks mu ulta,0.0,0.0,313.0,269.0,False,1
735892801888620545,mu,2016-05-26 17:58:00,rt mu jun24 13 call buyer positive 5000 .32,0.0,2.0,774.0,330.0,True,1
735891871453483009,mu,2016-05-26 17:54:00,mu jun24 13 call buyer positive 5000 .32,5.0,2.0,19531.0,248.0,False,1
735891810480971776,mu,2016-05-26 17:54:00,mu 13 calls buying activity expiring 24 jun volume 3921,0.0,0.0,1471.0,28.0,False,1
735891643967016960,mu,2016-05-26 17:53:00,mu nhod calls surge itm,2.0,0.0,3981.0,77.0,False,1
735887738965221377,mu,2016-05-26 17:38:00,ibm challenged intels memory technology ibm challenged intels memory technology,0.0,0.0,503.0,305.0,False,1
735886158102724609,mu,2016-05-26 17:31:00,mu sold half pos 11.72 open 10 great move looking buy back lower offering otm calls rest,0.0,0.0,217.0,1006.0,False,1
735877075731505153,mu,2016-05-26 16:55:00,rt mu intraday high 2.60 percent wekly 12 calls active 3000 contractsgetting extended,0.0,1.0,775.0,330.0,True,1
735876759107690497,mu,2016-05-26 16:54:00,mu intraday high 2.60 percent wekly 12 calls active 3000 contractsgetting extended,0.0,1.0,12819.0,3081.0,False,0
735871616794669056,mu,2016-05-26 16:33:00,mu going strong,1.0,0.0,38.0,14.0,False,1
735869945276444673,mu,2016-05-26 16:27:00,trump warns says current market ‘very strange’,1.0,0.0,21462.0,8274.0,False,1
735866965818908673,mu,2016-05-26 16:15:00,mu stop running,0.0,0.0,169.0,376.0,False,1
735863367383027713,mu,2016-05-26 16:01:00,bought mu twtr weeklys,2.0,0.0,447.0,1144.0,False,1
735863329185374208,mu,2016-05-26 16:01:00,mideast shares mixed finds limited support firmer oil prices mi,0.0,0.0,691.0,644.0,False,1
735861127901548546,mu,2016-05-26 15:52:00,p500 trend dltr pdco hpq pvh dg nflx intu dri mu wfm celg biib adm rok nlsn aap usd,0.0,0.0,864.0,7.0,False,1
735861059865706496,mu,2016-05-26 15:52:00,p500 performance dltr pdco hpq pvh cost dg nflx yhoo eqt intu ctxs cag aee dri mu,0.0,0.0,864.0,7.0,False,1
735860991846719488,mu,2016-05-26 15:51:00,nasdaq100 trend dltr nflx intu mu wfm celg biib vod ca mnst intc amgn dish txn lrcx,0.0,0.0,864.0,7.0,False,0
735860924171603969,mu,2016-05-26 15:51:00,nasdaq100 performance dltr cost nflx yhoo intu ctxs tsla mu wfm celg fb biib nvda,1.0,0.0,864.0,7.0,False,0
735859186064560129,mu,2016-05-26 15:44:00,mu top news may 26 2016 mu,0.0,0.0,608.0,539.0,False,1
735845760932122624,mu,2016-05-26 14:51:00,volume alert mu 11.79 micron technology mu hit high today 11.97 closing day 0 11.79 positive 0.19,0.0,0.0,759.0,447.0,False,1
735839513919000576,mu,2016-05-26 14:26:00,mu us micron technology inc mu sees significant growth short interest technology inc,0.0,0.0,2753.0,279.0,False,0
735834782437756929,mu,2016-05-26 14:07:00,stock followups mu anyone buy swap up breakout carved lower lo make bigger swing up,0.0,0.0,81.0,18.0,False,1
735830241046827008,mu,2016-05-26 13:49:00,rt mu non stop run since posted 10000 calls buy days ago up 300 percent,0.0,2.0,36.0,81.0,True,1
735829163253235713,mu,2016-05-26 13:45:00,mu raging higher guessed calls shoot 100 percent gain,1.0,0.0,3976.0,77.0,False,1
735828508803510272,mu,2016-05-26 13:42:00,rt mu non stop run since posted 10000 calls buy days ago up 300 percent,0.0,2.0,775.0,330.0,True,1
