Tweet Id,Ticker,Datetime,Text,Favs,RTs,Followers,Following,Is a RT,Sentiment
720980742830882816,mu,2016-04-15 14:22:00,fly top five analyst upgrades jblu luv ual apc mu stx dvn krc full story,0.0,1.0,12520.0,129.0,False,1
720980301988519936,mu,2016-04-15 14:21:00,rt reporting gpro mu soon wld love tune,0.0,1.0,1217.0,993.0,True,0
720980135755821056,mu,2016-04-15 14:20:00,reporting gpro mu soon wld love tune,3.0,1.0,13547.0,993.0,False,0
720979815269011458,mu,2016-04-15 14:19:00,mu active semiconductor lure active investment micron technology …,0.0,0.0,891.0,9.0,False,1
720979184294752259,mu,2016-04-15 14:16:00,rt top initiations axp baba bpmx drii dxcm ebs epam evtc fis fmc hpe hway mitk mrd mu nmrx pacb pay pf…,0.0,2.0,1097.0,1146.0,True,1
720978307282509824,mu,2016-04-15 14:13:00,mu micron technology up 3 percent brean starts coverage buy nasdaq …,0.0,0.0,621.0,0.0,False,1
720977985512321025,mu,2016-04-15 14:12:00,mu sentiment rise 0.57 change positive 0.47 sdr 1.03 1 hour 0 ndx spy,0.0,0.0,144.0,1.0,False,0
720976507540115457,mu,2016-04-15 14:06:00,short term bounces could put micron technology back map mu,0.0,0.0,20.0,0.0,False,1
720976284822675456,mu,2016-04-15 14:05:00,v mu benzinga’s top initiations,0.0,0.0,749.0,6.0,False,1
720976235057127425,mu,2016-04-15 14:05:00,diamond hill ups stake freight transportation company diamond hill capit,0.0,0.0,638.0,648.0,False,1
720975515918577664,mu,2016-04-15 14:02:00,rt gbsn sune ebio dwti dgaz plcm nugt mu bbry tsm vrx athm grek👌🏼😏👍🏼,0.0,3.0,1745.0,690.0,True,1
720975057523093504,mu,2016-04-15 14:00:00,rt 📈✍🏼😏 sune positive 19.25 percent orpn positive 8.33 percent aria positive 6.77 percent mu positive 2.40 percent expd positive 2.03 percent plcm positive 1.87 percent 📉🤔 plyp mitl ston ht…,0.0,3.0,1745.0,690.0,True,0
720974581666869248,mu,2016-04-15 13:58:00,benzinga top initiations pypl baba mu axp vrx,0.0,0.0,2299.0,2996.0,False,1
720973983299018754,mu,2016-04-15 13:56:00,mu jul 12 .50,0.0,0.0,982.0,1070.0,False,1
720973553672331264,mu,2016-04-15 13:54:00,rt fly pre market movers rf c line cbyl rgls aria mu smci plcm mitl rlyp esv ston ddd fu,0.0,1.0,208.0,200.0,True,1
720973524421226496,mu,2016-04-15 13:54:00,rt stocks desk watching ddd mu rlyp stx vrx fit,0.0,1.0,208.0,200.0,True,0
720972880188731392,mu,2016-04-15 13:51:00,long mu stop below double hammer pattern,0.0,0.0,25.0,54.0,False,0
720972007051890688,mu,2016-04-15 13:48:00,mu long pull,0.0,0.0,173.0,108.0,False,0
720971666046607361,mu,2016-04-15 13:46:00,rt long mu dollars 0.63 tags dollars 4 puts want,0.0,1.0,5664.0,45.0,True,0
720969591577579521,mu,2016-04-15 13:38:00,long mu dollars 0.63 tags dollars 4 puts want,1.0,1.0,93.0,66.0,False,1
720968716444438529,mu,2016-04-15 13:35:00,rt micron technology upgraded raymond james strong buy,0.0,2.0,282.0,337.0,True,0
720968082781446145,mu,2016-04-15 13:32:00,rt ― fly pre market movers rf c line cbyl rgls aria mu smci plcm mitl…,0.0,1.0,1734.0,1760.0,True,1
720967766660878337,mu,2016-04-15 13:31:00,rt mu positive 3.8 percent pre brean capital starts micron technology buy dollars 4 point raymond james upgrades strong buy dollars 7 point …,0.0,1.0,319.0,385.0,True,0
720967232742789124,mu,2016-04-15 13:29:00,stocks desk watching ddd mu rlyp stx vrx fit,1.0,1.0,21918.0,205.0,False,1
720967106242617346,mu,2016-04-15 13:28:00,early movers plcm mu fl cost seas viab vrx gs aapl nke mnw kkr dks yhoo rf,0.0,1.0,2534.0,2843.0,False,0
720966953725132802,mu,2016-04-15 13:28:00,― fly pre market movers rf c line cbyl rgls aria mu smci plcm mitl…,0.0,1.0,78639.0,78247.0,False,0
720966829120692224,mu,2016-04-15 13:27:00,fly pre market movers rf c line cbyl rgls aria mu smci plcm mitl rlyp esv ston ddd fu,0.0,2.0,12520.0,129.0,False,1
720966478011305985,mu,2016-04-15 13:26:00,enters system market micron accelerated solutions read,0.0,0.0,39.0,3.0,False,1
720966408230703104,mu,2016-04-15 13:26:00,mu two upgrades today watch trade,0.0,0.0,126.0,89.0,False,1
720966252584251393,mu,2016-04-15 13:25:00,early movers rf plcm bats fl mu seas,0.0,0.0,460.0,214.0,False,1
720966170535456770,mu,2016-04-15 13:25:00,early movers rf plcm bats fl mu seas vrx cost viab,0.0,0.0,508.0,995.0,False,1
720966106094022656,mu,2016-04-15 13:24:00,mu two upgrades one day,0.0,0.0,319.0,385.0,False,1
720966013991256064,mu,2016-04-15 13:24:00,rt brean initiates micron buy rating dollars 4 price target mu,0.0,1.0,319.0,385.0,True,1
720966013219577856,mu,2016-04-15 13:24:00,mu positive 3.8 percent pre brean capital starts micron technology buy dollars 4 point raymond james upgrades strong buy dollars 7 point,2.0,1.0,18751.0,242.0,False,1
720966002373054464,mu,2016-04-15 13:24:00,rt micron higher raymond james upgrade,0.0,1.0,319.0,385.0,True,1
720964939767107584,mu,2016-04-15 13:20:00,brean initiates micron buy rating dollars 4 price target mu,0.0,1.0,49171.0,1480.0,False,0
720964695121928192,mu,2016-04-15 13:19:00,stocks play viernes 15 de abril 2016 aapl fb nugt vrx baba mitl rlyp c mu aria esv rprx sune,0.0,0.0,4099.0,1811.0,False,1
720964597071626240,mu,2016-04-15 13:18:00,stocks play viernes 15 de abril 2016 aapl fb nugt vrx baba mitl rlyp c mu aria esv rprx sune,0.0,0.0,4099.0,1811.0,False,1
720964562485436416,mu,2016-04-15 13:18:00,gold tlt athm c ha luv axp bud infy mesg ebix sage mu,0.0,0.0,118.0,240.0,False,0
720964094400966656,mu,2016-04-15 13:16:00,rt top initiations axp baba bpmx drii dxcm ebs epam evtc fis fmc hpe hway mitk mrd mu nmrx pacb pay pf…,0.0,2.0,707.0,291.0,True,0
720963934698602496,mu,2016-04-15 13:16:00,top initiations axp baba bpmx drii dxcm ebs epam evtc fis fmc hpe hway mitk mrd mu nmrx pacb pay pfsw shop taho,1.0,2.0,18751.0,242.0,False,1
720963846706319360,mu,2016-04-15 13:15:00,top upgrades apc ar cat chrw coo ddr dvn expd infn jblu krc luv mu spn,0.0,0.0,18751.0,242.0,False,1
720963822622793728,mu,2016-04-15 13:15:00,stocks play viernes 15 de abril 2016 aapl fb nugt vrx baba mitl rlyp c mu aria esv rprx sune stx ddd gbsn,0.0,0.0,4099.0,1811.0,False,1
720962183555850240,mu,2016-04-15 13:09:00,stocks watch gbsn mu gene lnco line dgaz tvix,0.0,0.0,38.0,81.0,False,1
720960935939190784,mu,2016-04-15 13:04:00,rt micron technology dollars .25 billion bond offering bbb baa2 prices yield 7.5 percent,0.0,1.0,2013.0,1810.0,True,0
720960741704994816,mu,2016-04-15 13:03:00,watching ddd c vxx 2 watch mu gld uso spy,0.0,0.0,230.0,260.0,False,1
720960293636030465,mu,2016-04-15 13:01:00,rt gbsn sune ebio dwti dgaz plcm nugt mu bbry tsm vrx athm grek👌🏼😏👍🏼,0.0,3.0,322.0,175.0,True,1
720960243149238274,mu,2016-04-15 13:01:00,rt 📈✍🏼😏 sune positive 19.25 percent orpn positive 8.33 percent aria positive 6.77 percent mu positive 2.40 percent expd positive 2.03 percent plcm positive 1.87 percent 📉🤔 plyp mitl ston ht…,0.0,3.0,322.0,175.0,True,1
720960001813053440,mu,2016-04-15 13:00:00,mu upgrade hint stx upgraded days ago 👍,0.0,0.0,751.0,384.0,False,1
720959873136082944,mu,2016-04-15 13:00:00,premarket advanced stocks ebix aria rgls orpn arwr mu srpt jblu bbry plcm,0.0,0.0,310.0,182.0,False,1
720959871923916801,mu,2016-04-15 13:00:00,premarket active stocks plcm nxpi aria tvix mitl mu rlyp ntrsp orpn siri,0.0,0.0,310.0,182.0,False,0
720958256479399936,mu,2016-04-15 12:53:00,micron technology inc mu stock rating lowered vetr inc,0.0,0.0,970.0,11.0,False,1
720957716169158656,mu,2016-04-15 12:51:00,rt 📈✍🏼😏 sune positive 19.25 percent orpn positive 8.33 percent aria positive 6.77 percent mu positive 2.40 percent expd positive 2.03 percent plcm positive 1.87 percent 📉🤔 plyp mitl ston ht…,0.0,3.0,668.0,649.0,True,1
720957666722463744,mu,2016-04-15 12:51:00,micron technology inc mu stock rating lowered vetr inc,0.0,0.0,6134.0,2295.0,False,0
720957213242576900,mu,2016-04-15 12:49:00,apr 15 analyst upgrades downgrades mu dvn jblu mu chrw fl syna fl baba ssys ddd gddy shop blk joy,0.0,1.0,1327.0,44.0,False,1
720957206242463744,mu,2016-04-15 12:49:00,rt gbsn sune ebio dwti dgaz plcm nugt mu bbry tsm vrx athm grek👌🏼😏👍🏼,0.0,3.0,668.0,649.0,True,0
720956767887368193,mu,2016-04-15 12:47:00,rt stockguy22 up line rgls sune ebix aria dgaz ej stm mu c vrx down rlyp esv uwti m…,0.0,0.0,316.0,150.0,False,1
720956735855271936,mu,2016-04-15 12:47:00,friday top analyst upgrades downgrades point 1 ddd dvn intc mu mtn wr wcn bont stx,0.0,0.0,804.0,47.0,False,1
720956725700890624,mu,2016-04-15 12:47:00,early movers rf plcm bats fl mu seas vrx cost viab,0.0,0.0,342.0,593.0,False,1
720956158568173569,mu,2016-04-15 12:45:00,mu ddd best stocks view micron technology inc nasdaq mu 3 days …,1.0,0.0,714.0,1.0,False,0
720956063034449920,mu,2016-04-15 12:44:00,micron higher raymond james upgrade,0.0,0.0,147.0,220.0,False,1
720956028360245248,mu,2016-04-15 12:44:00,up line rgls sune ebix aria dgaz ej stm mu c vrx down rlyp esv uwti mitl uco mt etc,0.0,0.0,54570.0,781.0,False,1
720955925662556160,mu,2016-04-15 12:44:00,mu jblu significant pre market gainers speculatingstocks pre market,0.0,0.0,688.0,568.0,False,1
720955664655364096,mu,2016-04-15 12:43:00,gbsn sune ebio dwti dgaz plcm nugt mu bbry tsm vrx athm grek👌🏼😏👍🏼,4.0,3.0,1290.0,1022.0,False,1
720953859930255360,mu,2016-04-15 12:36:00,📈✍🏼😏 sune positive 19.25 percent orpn positive 8.33 percent aria positive 6.77 percent mu positive 2.40 percent expd positive 2.03 percent plcm positive 1.87 percent 📉🤔 plyp mitl ston,0.0,3.0,1290.0,1022.0,False,1
720953849922613249,mu,2016-04-15 12:36:00,raymond james upgrades micron technology mu strong buy dollars 7 price target,0.0,0.0,204.0,184.0,False,1
720952973317316610,mu,2016-04-15 12:32:00,micron higher raymond james upgrade mu,0.0,0.0,72.0,215.0,False,1
720952631309570048,mu,2016-04-15 12:31:00,rt 10 stocks moving fridays session aria c expd sune orpn mu plcm rlyp ston mitl,0.0,1.0,1743.0,356.0,True,1
720952483124654080,mu,2016-04-15 12:30:00,micron higher raymond james upgrade,0.0,0.0,266.0,1.0,False,0
720952481929256960,mu,2016-04-15 12:30:00,micron higher raymond james upgrade,0.0,0.0,2052.0,31.0,False,0
720952480650006528,mu,2016-04-15 12:30:00,micron higher raymond james upgrade,0.0,0.0,3449.0,32.0,False,1
720952478808682496,mu,2016-04-15 12:30:00,micron higher raymond james upgrade,1.0,1.0,21122.0,32.0,False,1
720952407761358848,mu,2016-04-15 12:30:00,10 stocks moving fridays session aria c expd sune orpn mu plcm rlyp ston mitl,1.0,1.0,49169.0,1480.0,False,1
720951891346243585,mu,2016-04-15 12:28:00,10 stocks moving fridays pre market session,0.0,0.0,2298.0,2993.0,False,1
720951883049934848,mu,2016-04-15 12:28:00,brean capital upgrades mu long term trends thesis dram pricing outlook poor look samsung latest results,0.0,0.0,489.0,359.0,False,1
720951778318163969,mu,2016-04-15 12:27:00,rt upgrades jblu luv cat dvn mu downgrades wfc va ddd stx seas fl 2016.04.15 est,0.0,1.0,693.0,301.0,True,0
720951379834073092,mu,2016-04-15 12:26:00,mu pile today breen intiating buy point 14 ray j upgrading buy strong buy point dollars 7,0.0,0.0,991.0,235.0,False,0
720951238821437440,mu,2016-04-15 12:25:00,upgrades jblu luv cat dvn mu downgrades wfc va ddd stx seas fl 2016.04.15 est,0.0,1.0,19352.0,13891.0,False,1
720950943542448128,mu,2016-04-15 12:24:00,technology inc covered analysts brean capital read,0.0,0.0,39.0,3.0,False,0
720949874355789824,mu,2016-04-15 12:20:00,micron technology dollars .25 billion bond offering bbb baa2 prices yield 7.5 percent,0.0,1.0,8061.0,999.0,False,1
720947990295261185,mu,2016-04-15 12:12:00,supermicro nexenta distract intel defaulters read,0.0,0.0,39.0,3.0,False,1
720947408394416129,mu,2016-04-15 12:10:00,rt microsoft finally solved windows app problem microsoft came late,0.0,1.0,708.0,2.0,True,1
720945867859988480,mu,2016-04-15 12:04:00,microsoft finally solved windows app problem microsoft came late,0.0,1.0,638.0,648.0,False,0
720945342339026944,mu,2016-04-15 12:02:00,early movers rf plcm bats fl mu seas vrx cost viab mor,0.0,0.0,585.0,319.0,False,0
720945000935264256,mu,2016-04-15 12:00:00,rt micron technology upgraded raymond james strong buy,0.0,1.0,154.0,244.0,True,1
720944807934357508,mu,2016-04-15 12:00:00,mu gapup 0.44 4.2 percent fill 19 percent prvcl 10.40 prvhi 10.79 news 0 onewhi prvchi accel tf 0111111 bigflt 1.0 billion hipctsht5 percent 2 days,0.0,0.0,6772.0,270.0,False,0
720941045828046852,mu,2016-04-15 11:45:00,micron technology loses 04.41 percent dollars 0.40 thursday among top 10 losers p500 mu,1.0,0.0,104.0,71.0,False,0
720939570234306560,mu,2016-04-15 11:39:00,micron technology upgraded raymond james strong buy,1.0,2.0,4055.0,1.0,False,1
720938208284975104,mu,2016-04-15 11:33:00,rt top percent gainers gbsn 74 percent sune 30 percent ebio 19 percent plcm 7 percent grek 5 percent dwti dgaz nugt stm athm tsm mu sdrl …,0.0,1.0,280.0,1071.0,True,0
720937235487428608,mu,2016-04-15 11:30:00,micron technology upgrade raymond james ranked 30 strong buy mu,0.0,0.0,524.0,45.0,False,1
720937092226904064,mu,2016-04-15 11:29:00,micron technology upgraded raymond james strong buy,0.0,0.0,4540.0,2838.0,False,1
720934478122594304,mu,2016-04-15 11:19:00,raises usd 1.25 billion notes issue read,0.0,0.0,38.0,3.0,False,1
720933459502436352,mu,2016-04-15 11:15:00,recent analysts ratings report micron technology mu…,0.0,0.0,172.0,288.0,False,1
720933457728299012,mu,2016-04-15 11:15:00,watched micron technology mu streamline…,0.0,0.0,172.0,288.0,False,1
720933456130228224,mu,2016-04-15 11:15:00,recent analysts ratings report micron technology mu…,0.0,0.0,172.0,288.0,False,1
720933455492681728,mu,2016-04-15 11:15:00,analyst recent rating update micron technology inc mu…,0.0,0.0,172.0,288.0,False,0
720933452317605888,mu,2016-04-15 11:15:00,traders observing tech stocks micron technology inc mu…,0.0,0.0,172.0,288.0,False,1
720932716422819840,mu,2016-04-15 11:12:00,mu micron technology inc earns buy rating analysts brean capital,0.0,0.0,6133.0,2295.0,False,1
720932001595920384,mu,2016-04-15 11:09:00,mu keep eye price trends micron technology inc nasdaq …,0.0,0.0,621.0,0.0,False,1
720932001419816960,mu,2016-04-15 11:09:00,pre market losers micron technology inc mu sirius…,0.0,0.0,172.0,288.0,False,1
720932000841003008,mu,2016-04-15 11:09:00,price target micron technology inc mu shares…,0.0,0.0,172.0,288.0,False,1
720932000098566144,mu,2016-04-15 11:09:00,analysts tips monitor micron technology inc mu…,0.0,0.0,172.0,288.0,False,1
720931999104561152,mu,2016-04-15 11:09:00,updated analysts rating report micron technology inc mu…,0.0,0.0,172.0,288.0,False,0
720931995086405633,mu,2016-04-15 11:09:00,pre market losers micron technology inc mu sirius…,0.0,0.0,172.0,288.0,False,1
720931990774620160,mu,2016-04-15 11:09:00,nasdaq top stocks micron technology inc mu terraform…,0.0,0.0,172.0,288.0,False,0
720929911104520192,mu,2016-04-15 11:00:00,mu upgraded raymond james,0.0,0.0,3016.0,10.0,False,1
720928460592574464,mu,2016-04-15 10:55:00,top percent gainers gbsn 74 percent sune 30 percent ebio 19 percent plcm 7 percent grek 5 percent dwti dgaz nugt stm athm tsm mu sdrl vrx russ bbry,1.0,1.0,543.0,413.0,False,0
720926779838345216,mu,2016-04-15 10:48:00,tmh company info see greater tmh scss mu,0.0,0.0,32.0,20.0,False,1
720924933140783104,mu,2016-04-15 10:41:00,investors focused stocks yhoo mu,0.0,0.0,262.0,862.0,False,1
720924819349499904,mu,2016-04-15 10:40:00,rt j b hunt transport jbht first quarter earnings surprise store j b hunt transp,0.0,1.0,708.0,2.0,True,1
720924032976039938,mu,2016-04-15 10:37:00,j b hunt transport jbht first quarter earnings surprise store j b hunt transp,1.0,1.0,638.0,648.0,False,0
720922156633161729,mu,2016-04-15 10:30:00,micron technology initiated coverage brean capital ranked 67 buy 14 point mu,0.0,0.0,524.0,45.0,False,1
720921930371567617,mu,2016-04-15 10:29:00,mu adt buzzer short call micron technology nasdaq mu adt …,0.0,0.0,749.0,6.0,False,0
720920664450932736,mu,2016-04-15 10:24:00,micron technology initiated brean capital buy dollars 4.00 point,0.0,0.0,4052.0,1.0,False,1
720918242823380993,mu,2016-04-15 10:14:00,micron technology initiated brean capital buy dollars 4.00 point,0.0,0.0,4540.0,2838.0,False,0
720910837146382336,mu,2016-04-15 09:45:00,rt mtg mu stocks buzz apple inc nasdaq aapl mgic investment corp …,0.0,1.0,174.0,15.0,True,1
720909289884401664,mu,2016-04-15 09:39:00,micron announces proposed dollars billion offering senior secured notes mu,0.0,0.0,1503.0,509.0,False,0
720908351442460672,mu,2016-04-15 09:35:00,mtg mu stocks buzz apple inc nasdaq aapl mgic investment corp …,1.0,1.0,890.0,9.0,False,0
720897837001793536,mu,2016-04-15 08:53:00,van eck associates corp dollars 681000 position micron technology inc mu,0.0,0.0,317.0,10.0,False,0
720896769870024704,mu,2016-04-15 08:49:00,mu micron upsizes prices dollars .25 bln 7.500 percent senior secured notes due 2023,0.0,0.0,17682.0,3311.0,False,1
720891239424393216,mu,2016-04-15 08:27:00,fous4 times 2 dvd review,0.0,0.0,249.0,40.0,False,1
720888149115867136,mu,2016-04-15 08:15:00,28 users vetr bullish micron technology inc indicating strong buy rating 4.5 stars mu,0.0,0.0,133.0,199.0,False,1
720876098041421825,mu,2016-04-15 07:27:00,commented micron growth stock deep value price,0.0,0.0,42.0,15.0,False,1
720865535131459584,mu,2016-04-15 06:45:00,intc financials updated friday april 15 2016 9 expe spxu oas mu,0.0,0.0,1127.0,447.0,False,0
720854738393112576,mu,2016-04-15 06:02:00,blackberry ltd bbry strong buy image via,0.0,0.0,638.0,648.0,False,1
720848098478596096,mu,2016-04-15 05:35:00,micron upsizes debt offering dollars .25 billion sets 7.5 percent interest rate 💤,0.0,0.0,146.0,220.0,False,1
720842310976548864,mu,2016-04-15 05:12:00,micron upsizes debt offering dollars .25 billion sets 7.5 percent interest rate,0.0,0.0,265.0,1.0,False,1
720842309613391872,mu,2016-04-15 05:12:00,micron upsizes debt offering dollars .25 billion sets 7.5 percent interest rate,0.0,0.0,3449.0,32.0,False,1
720842307675656193,mu,2016-04-15 05:12:00,micron upsizes debt offering dollars .25 billion sets 7.5 percent interest rate,0.0,0.0,21119.0,32.0,False,1
720841878501855232,mu,2016-04-15 05:11:00,rt seekingalpha blackstone looks smart cramers lightning round,0.0,0.0,8570.0,4.0,False,0
720838833269374977,mu,2016-04-15 04:59:00,mu day low see greater mu drq unp,1.0,0.0,42.0,40.0,False,1
720834251512373248,mu,2016-04-15 04:40:00,rt stocks finish mixed dow inches toward 18000 investorplaceinvestorpl,0.0,1.0,712.0,2.0,True,1
720831812151300097,mu,2016-04-15 04:31:00,stocks finish mixed dow inches toward 18000 investorplaceinvestorpl,0.0,1.0,639.0,648.0,False,0
720821541521346562,mu,2016-04-15 03:50:00,view users posting speculatingstocks mu ulta,1.0,0.0,251.0,209.0,False,1
720818695904313344,mu,2016-04-15 03:39:00,micron announces proposed dollars billion offering senior secured notes mu,0.0,0.0,307.0,13.0,False,1
720814088176144384,mu,2016-04-15 03:20:00,rt linkedin corporation earnings 4 key metrics watch two weeks l,0.0,1.0,712.0,2.0,True,0
720812653388517376,mu,2016-04-15 03:15:00,linkedin corporation earnings 4 key metrics watch two weeks l,0.0,1.0,639.0,648.0,False,0
720792518175010816,mu,2016-04-15 01:55:00,biggest losers today large caps vale negative 6.91 percent agu negative 5.59 percent mu negative 4.41 percent eric negative 4.23 percent gg negative 4.05 percent abx negative 3.93 percent armh negative 3.64 percent viab negative 3.44 percent,0.0,0.0,176.0,29.0,False,1
720786013140877312,mu,2016-04-15 01:29:00,rt demand micron upsizes cov lite leveraged loan dollars 50 million portion increased well,0.0,1.0,6.0,15.0,True,1
720784457544798208,mu,2016-04-15 01:23:00,jetblue goes upscale compete bigger rivals mid 2014 jetblue air,0.0,0.0,638.0,648.0,False,0
720783457673064448,mu,2016-04-15 01:19:00,mu shot down 4 percent since closing vetr inc upgrades micron technology inc strongbuy,0.0,0.0,18499.0,5787.0,False,0
720774455040032769,mu,2016-04-15 00:43:00,mu micron technology inc nasdaq mu closes negative 4.41 percent …,0.0,0.0,720.0,5.0,False,1
720763798316036096,mu,2016-04-15 00:00:00,rt winner vr wars needs dominate key vertical virtually,0.0,1.0,711.0,2.0,True,1
720763776665055232,mu,2016-04-15 00:00:00,rt twitter inc earnings expect ahead twitter first quarter ea,0.0,1.0,711.0,2.0,True,1
720762732383850496,mu,2016-04-14 23:56:00,twitter inc earnings expect ahead twitter first quarter ea,0.0,1.0,639.0,648.0,False,1
720762606953205760,mu,2016-04-14 23:56:00,winner vr wars needs dominate key vertical virtually,0.0,1.0,639.0,648.0,False,1
720756194734833665,mu,2016-04-14 23:30:00,prices dollars .25 billion offering 7.500 percent senior secured notes read,0.0,0.0,37.0,3.0,False,1
720750531770191876,mu,2016-04-14 23:08:00,mu us vetr inc downgrades micron technology inc mu buy technology inc,0.0,0.0,2744.0,274.0,False,0
720746025766535169,mu,2016-04-14 22:50:00,mu micron prices dollars .25 billion offering 7.500 percent senior secured notes,0.0,0.0,890.0,9.0,False,1
720745311124242433,mu,2016-04-14 22:47:00,micron prices dollars .25 billion offering 7.500 percent senior secured notes mu,0.0,0.0,439.0,260.0,False,1
720744961914712064,mu,2016-04-14 22:46:00,micron prices dollars .25 billion offering 7.500 percent senior secured notes,0.0,0.0,7060.0,67.0,False,1
720744903840546816,mu,2016-04-14 22:45:00,mu micron prices dollars .25 billion offering 7.500 percent senior secured notes stock news alerts app,0.0,0.0,1120.0,10.0,False,1
720726534642749440,mu,2016-04-14 21:32:00,view users posting speculatingstocks mu ulta,0.0,0.0,251.0,208.0,False,1
720726366665052160,mu,2016-04-14 21:32:00,assured guaranty ago subsidiary acquire cifg holding assured guaranty,0.0,0.0,639.0,648.0,False,0
720722642626592769,mu,2016-04-14 21:17:00,mu,0.0,0.0,873.0,967.0,False,1
720718640606265344,mu,2016-04-14 21:01:00,mu lexar announces microsd memory card – works gopro verification stock news alerts app,0.0,0.0,1119.0,10.0,False,0
720718573426122753,mu,2016-04-14 21:01:00,lexar announces microsd memory card – works gopro verification mu,0.0,0.0,439.0,260.0,False,0
720718536784658432,mu,2016-04-14 21:01:00,lexar announces microsd memory card ndash works gopro verification,0.0,0.0,7061.0,67.0,False,1
720715618954121219,mu,2016-04-14 20:49:00,micron announces proposed dollars billion offering senior secured notes mu,0.0,0.0,1502.0,509.0,False,0
720708653485989888,mu,2016-04-14 20:21:00,make tax amendment fix mistakes tax return although elect,0.0,0.0,639.0,648.0,False,1
720703168506695680,mu,2016-04-14 20:00:00,mu negative 441 percent fit negative 412 percent,0.0,0.0,532.0,1640.0,False,0
720689101620379648,mu,2016-04-14 19:04:00,fous4 times 2 dvd review,0.0,0.0,270.0,38.0,False,1
720686511931441153,mu,2016-04-14 18:53:00,demand micron upsizes cov lite leveraged loan dollars 50 million portion increased well,0.0,1.0,8056.0,998.0,False,1
720686308369285120,mu,2016-04-14 18:53:00,rt go bats ipo nasdaq marketsite tv studio times square image,0.0,2.0,708.0,2.0,True,0
720685872090320896,mu,2016-04-14 18:51:00,mu micron mu stock pressured preliminary seagate earnings,0.0,0.0,889.0,9.0,False,1
720685855770214405,mu,2016-04-14 18:51:00,micron mu stock pressured preliminary seagate earnings,0.0,0.0,2216.0,1223.0,False,1
720685527943356416,mu,2016-04-14 18:49:00,brief tech offer dollars billion senior secured notes read,0.0,0.0,36.0,3.0,False,0
720685372661899264,mu,2016-04-14 18:49:00,offer dollars billion senior secured notes due 2023 read,0.0,0.0,36.0,3.0,False,0
720685217371934720,mu,2016-04-14 18:48:00,technology inc micron offer dollars billion senior secured notes due 2023 read,0.0,0.0,36.0,3.0,False,1
720685089936375808,mu,2016-04-14 18:48:00,micron mu stock pressured preliminary seagate earnings,0.0,0.0,2728.0,32.0,False,1
720684655888973824,mu,2016-04-14 18:46:00,rt go bats ipo nasdaq marketsite tv studio times square image,0.0,2.0,1906.0,97.0,True,0
720684061769859072,mu,2016-04-14 18:44:00,go bats ipo nasdaq marketsite tv studio times square image,0.0,2.0,639.0,648.0,False,1
720677643767517184,mu,2016-04-14 18:18:00,european equity benchmarks edge higher bank england warns brexit impa,0.0,0.0,639.0,648.0,False,1
720672977801457665,mu,2016-04-14 18:00:00,micron awkward vision,0.0,0.0,3447.0,32.0,False,1
720665963088117760,mu,2016-04-14 17:32:00,makes moves toward storage read,0.0,0.0,36.0,3.0,False,1
720665788995100674,mu,2016-04-14 17:31:00,ubs aapl mu significant upside stocks buy rating,0.0,0.0,46.0,38.0,False,1
720664905871966208,mu,2016-04-14 17:27:00,mu upsized loan notes offering dollars 50 million no change pricing bberg,0.0,0.0,2856.0,138.0,False,1
720658740060557313,mu,2016-04-14 17:03:00,mu micron technology nasdaq mu unsuccessful convenes …,0.0,0.0,748.0,6.0,False,1
720655434873507840,mu,2016-04-14 16:50:00,rt peek first quarter bank earnings slated apr 15 c rf schw first quarter earning se,0.0,1.0,707.0,2.0,True,0
720655183412207616,mu,2016-04-14 16:49:00,peek first quarter bank earnings slated apr 15 c rf schw first quarter earning se,1.0,1.0,639.0,648.0,False,1
720648083202121728,mu,2016-04-14 16:21:00,aapl mu,2.0,0.0,46.0,38.0,False,1
720647412428083201,mu,2016-04-14 16:18:00,ubs analysts say aapl mu,0.0,0.0,803.0,1981.0,False,1
720643666457440256,mu,2016-04-14 16:03:00,pfg percent change see greater pfg mu abbv,0.0,0.0,22.0,40.0,False,1
720639388741464064,mu,2016-04-14 15:46:00,mu top news apr 14 2016 mu,0.0,0.0,593.0,543.0,False,1
720639197468446721,mu,2016-04-14 15:45:00,commented micron selling dollars b debt shares drop,0.0,0.0,42.0,15.0,False,1
720638689358049280,mu,2016-04-14 15:43:00,rt accelerates data center storage new nvme pcie ssd portfolio read,0.0,2.0,908.0,827.0,True,1
720634235355144192,mu,2016-04-14 15:26:00,mu bag dicks,1.0,0.0,2324.0,856.0,False,1
720633900439961604,mu,2016-04-14 15:24:00,mu sr secured deal secured intelsat jackson coupon spread per tranche leverage ranges make people long nervous,0.0,0.0,2324.0,856.0,False,1
