Tweet Id,Ticker,Datetime,Text,Favs,RTs,Followers,Following,Is a RT,Sentiment
721275265960316929,atvi,2016-04-16 09:53:00,atvi activision blizzard inc nasdaq atvi receives dollars 7.38 …,0.0,0.0,788.0,6.0,False,0
721194351192252420,atvi,2016-04-16 04:31:00,new trading need build trading account fast try new amazon ebook,2.0,0.0,272.0,40.0,False,1
721184981490401280,atvi,2016-04-16 03:54:00,atvi quotes see greater atvi bwld cald,1.0,0.0,80.0,41.0,False,1
721152641062084608,atvi,2016-04-16 01:46:00,atvi wall street analysts bullish atvis earnings growth,0.0,0.0,291.0,0.0,False,1
721151763944845312,atvi,2016-04-16 01:42:00,celg ex div date see greater celg vip atvi,1.0,0.0,34.0,59.0,False,0
721132331319357443,atvi,2016-04-16 00:25:00,elder blue,0.0,0.0,4531.0,2620.0,False,0
721039654670065664,atvi,2016-04-15 18:17:00,price target alert trading zacks price target change activision blizzard atvi,0.0,0.0,2296.0,2.0,False,1
721037142344867840,atvi,2016-04-15 18:07:00,rt afraid ghosts hope not new game incoming atvi,0.0,2.0,2886.0,994.0,True,0
721036932420018176,atvi,2016-04-15 18:06:00,afraid ghosts hope not new game incoming atvi,2.0,2.0,26363.0,500.0,False,1
721036925566488577,atvi,2016-04-15 18:06:00,afraid ghosts hope not new game incoming atvi,0.0,0.0,722.0,1.0,False,1
721034372049203200,atvi,2016-04-15 17:56:00,atvi rising revenues mobile games make activision blizzard inc atvi,0.0,0.0,59.0,43.0,False,1
721033783630147584,atvi,2016-04-15 17:53:00,currently sitting hun positive 6 percent mdxg negative 3 percent gld flat thc positive 10 percent nflx positive 11 percent atvi .5 position positive 6 percent,1.0,0.0,4976.0,478.0,False,1
721033274366124032,atvi,2016-04-15 17:51:00,took .5 atvi table 34.44 32 took balance stz table 155.73 142.86,0.0,0.0,5123.0,528.0,False,0
721020915518152704,atvi,2016-04-15 17:02:00,4 star analyst michael olson piper jaffray maintained buy atvi michael positive 5.1 percent avg rtrn,1.0,0.0,331.0,112.0,False,1
721015957477404674,atvi,2016-04-15 16:42:00,atvi ua adding position suggestions new hv gr8 weekend,1.0,0.0,228.0,291.0,False,0
721007131546267649,atvi,2016-04-15 16:07:00,atvi 3 open suited signals indicate continued price increase beyond average holding times,0.0,0.0,243.0,471.0,False,0
720999935848484864,atvi,2016-04-15 15:39:00,volume alert atvi 34.44 activision blizzard atvi hit high today 35.07 closing day 0 34.44,0.0,0.0,806.0,447.0,False,1
720998365404798977,atvi,2016-04-15 15:33:00,atvi twtr long calls expiring june august closed positions,0.0,0.0,385.0,548.0,False,1
720997362982895617,atvi,2016-04-15 15:29:00,gamr 10 percent weight atvi jesus,0.0,0.0,1670.0,471.0,False,1
720984614693679105,atvi,2016-04-15 14:38:00,activision blizzard inc atvi rating reiterated stifel nicolaus,0.0,0.0,421.0,10.0,False,1
720977240188706816,atvi,2016-04-15 14:09:00,edge everyone else figured already aa f gm kr tgt wmt aapl atvi cost goog intc msft,0.0,0.0,1506.0,509.0,False,1
720958332354326528,atvi,2016-04-15 12:53:00,vetr inc downgrades activision blizzard inc atvi buy,0.0,0.0,421.0,10.0,False,1
720928016667426816,atvi,2016-04-15 10:53:00,rt cool raised dollars .5 million l premium market greater,0.0,3.0,1657.0,1724.0,True,1
720902352127942656,atvi,2016-04-15 09:11:00,rt analyst actions breaking news fit atvi ctl gogo logi,0.0,2.0,54.0,66.0,True,0
720901586113925120,atvi,2016-04-15 09:08:00,delta lloyd nv dollars 384000 position activision blizzard inc atvi,0.0,0.0,1073.0,11.0,False,1
720901100568715264,atvi,2016-04-15 09:06:00,delta lloyd nv dollars 384000 position activision blizzard inc atvi,0.0,0.0,6364.0,2292.0,False,1
720898883983962112,atvi,2016-04-15 08:57:00,rt edge everyone else figured already aa f gm kr tgt wmt aapl atvi cost goog intc msft http…,0.0,1.0,1095.0,1146.0,True,1
720891209393156096,atvi,2016-04-15 08:27:00,activision candy crush jelly saga outperforming hearthstone,0.0,0.0,332.0,470.0,False,1
720887482452054016,atvi,2016-04-15 08:12:00,new trading need build trading account fast try new amazon ebook,0.0,0.0,117.0,40.0,False,1
720887439254945793,atvi,2016-04-15 08:12:00,,2.0,0.0,13730.0,13378.0,False,1
720886642072879104,atvi,2016-04-15 08:09:00,edge everyone else figured already aa f gm kr tgt wmt aapl atvi cost goog intc msft,0.0,1.0,307.0,13.0,False,1
720875266575192064,atvi,2016-04-15 07:23:00,недавно писал об интересе к акциям activision blizzard тогда цена была dollars 2.2 сегодня она dollars 491 рост 846 percent atvi,0.0,0.0,413.0,286.0,False,1
720831959153258498,atvi,2016-04-15 04:31:00,awesome stock trade alerts,0.0,0.0,13730.0,13378.0,False,0
720801755022434304,atvi,2016-04-15 02:31:00,rt edge everyone else figured already aa f gm kr tgt wmt aapl atvi cost goog intc msft …,0.0,1.0,1096.0,1147.0,True,0
720787685837795330,atvi,2016-04-15 01:35:00,edge everyone else figured already aa f gm kr tgt wmt aapl atvi cost goog intc msft,0.0,1.0,1504.0,509.0,False,0
720766405331849216,atvi,2016-04-15 00:11:00,atvi activision blizzard inc nasdaq atvi closes negative 0.71 percent session,0.0,0.0,591.0,0.0,False,0
720759721523851265,atvi,2016-04-14 23:44:00,,0.0,0.0,13730.0,13378.0,False,1
720746321007755264,atvi,2016-04-14 22:51:00,atvi us us bancorp de dollars 845000 stake activision blizzard inc atvi blizzard inc,0.0,0.0,2767.0,279.0,False,1
720738460055793664,atvi,2016-04-14 22:20:00,take two story begin big plans fiscal2017,2.0,0.0,378.0,217.0,False,1
720700960247394304,atvi,2016-04-14 19:51:00,rt new trading need build trading account fast try new amazon ebook,0.0,2.0,105.0,0.0,True,1
720692915173990400,atvi,2016-04-14 19:19:00,andra ap fonden increases position activision blizzard inc atvi,0.0,0.0,421.0,10.0,False,1
720691253973819392,atvi,2016-04-14 19:12:00,atvi best stocks day activision blizzard inc nasdaq atvi,0.0,0.0,767.0,1.0,False,1
720682085153771520,atvi,2016-04-14 18:36:00,candy crush jelly saga outperforming hearthstone mobile,0.0,0.0,287.0,737.0,False,0
720678971671588865,atvi,2016-04-14 18:23:00,advantus capital management inc dollars 897000 stake activision blizzard inc atvi,0.0,0.0,998.0,0.0,False,1
720671927266717696,atvi,2016-04-14 17:55:00,atvi us bancorp de dollars 845000 stake activision blizzard inc atvi,0.0,0.0,59.0,43.0,False,1
720668007891079168,atvi,2016-04-14 17:40:00,atvi 35.16 activision blizzard atvi added watch list right atvi watching last price,0.0,0.0,957.0,440.0,False,0
720656800312270848,atvi,2016-04-14 16:55:00,new trading need build trading account fast try new amazon ebook,3.0,2.0,272.0,40.0,False,1
720652680826191873,atvi,2016-04-14 16:39:00,commented stocktwits know see flashback march post atvi,0.0,0.0,125.0,9.0,False,0
720650336734568448,atvi,2016-04-14 16:30:00,activision candy crush jelly saga outperforming hearthstone mobile,0.0,0.0,3697.0,30.0,False,0
720639336203485191,atvi,2016-04-14 15:46:00,volume alert atvi 34.90 activision blizzard atvi hit high today 35.29 closing day 0 34.90,0.0,0.0,806.0,447.0,False,0
720631376949563393,atvi,2016-04-14 15:14:00,activisions stock reach dollars 0 medium term,0.0,0.0,154.0,256.0,False,1
720631231541587973,atvi,2016-04-14 15:14:00,rt cool raised dollars .5 million l premium market greater,0.0,2.0,1404.0,206.0,True,1
720627230704013312,atvi,2016-04-14 14:58:00,us bancorp de dollars 845000 stake activision blizzard inc atvi,0.0,0.0,1073.0,11.0,False,1
720626835156037633,atvi,2016-04-14 14:56:00,us bancorp de dollars 845000 stake activision blizzard inc atvi,0.0,0.0,6364.0,2292.0,False,0
720620144964186116,atvi,2016-04-14 14:30:00,micron amazon attack enterprise facebook gets busy f8,0.0,0.0,3447.0,32.0,False,0
720614130290442240,atvi,2016-04-14 14:06:00,rt cool raised dollars .5 million l premium market greater,0.0,1.0,2453.0,538.0,True,1
720611995544903684,atvi,2016-04-14 13:57:00,wbi investments inc invests dollars 488000 activision blizzard inc atvi,0.0,0.0,421.0,10.0,False,1
720601910122663936,atvi,2016-04-14 13:17:00,atvi go dollars 0,0.0,0.0,54.0,40.0,False,1
720601552877133824,atvi,2016-04-14 13:16:00,cool raised dollars .5 million l premium market greater,17.0,7.0,660.0,584.0,False,1
720601002945056768,atvi,2016-04-14 13:14:00,atvi stock reach dollars 0 medium term,0.0,0.0,925.0,2105.0,False,0
720597897583136769,atvi,2016-04-14 13:01:00,notice atvi optimism indicator seen investors news social media shows high expectations,0.0,0.0,340.0,103.0,False,1
720572540129640448,atvi,2016-04-14 11:20:00,atvi looks really nice,0.0,0.0,147.0,330.0,False,0
720569355776475136,atvi,2016-04-14 11:08:00,weekly nasdaq100 performance ctrp ulta csx nflx pcar mu bidu vod atvi foxa esrx aal,0.0,0.0,844.0,7.0,False,0
720565329722740736,atvi,2016-04-14 10:52:00,atvi data recent analysts ratings stocks activision blizzard inc nasdaq …,0.0,0.0,638.0,0.0,False,1
720556458895622144,atvi,2016-04-14 10:17:00,atvi wall street analysts bullish atvis earnings growth,0.0,0.0,291.0,0.0,False,1
720549428067577856,atvi,2016-04-14 09:49:00,activision blizzard atvi,0.0,0.0,4618.0,4.0,False,1
720549427941740544,atvi,2016-04-14 09:49:00,atvi chart activision blizzard,0.0,0.0,165.0,139.0,False,0
720542409713709056,atvi,2016-04-14 09:21:00,rt analyst actions breaking news fit atvi ctl gogo logi,0.0,2.0,53.0,63.0,True,1
720514218731180032,atvi,2016-04-14 07:29:00,activision blizzard inc atvi downgraded zacks investment research hold,0.0,0.0,998.0,0.0,False,1
720512641693782016,atvi,2016-04-14 07:22:00,bullish atvi target price dollars 8.68 6 mos vetr,0.0,0.0,23.0,118.0,False,1
720509981011943424,atvi,2016-04-14 07:12:00,atvi activision blizzard inc nasdaq atvi receives dollars 7.38 average …,1.0,0.0,788.0,6.0,False,1
720508909283385344,atvi,2016-04-14 07:08:00,activision blizzard inc atvi receives dollars 7.38 average price target analysts,0.0,0.0,771.0,8.0,False,0
720484980548374528,atvi,2016-04-14 05:32:00,calculated 63 day expected return atvi negative 2.37 percent,0.0,0.0,1399.0,1495.0,False,0
720482733315735558,atvi,2016-04-14 05:24:00,activision blizzard inc risen 5.02 percent today vetr users indicating target price dollars 7.72 atvi,0.0,0.0,149.0,198.0,False,0
720480603129397248,atvi,2016-04-14 05:15:00,atvi nice part post nearly everything along way play play sharing crystal ball fun,0.0,0.0,125.0,9.0,False,1
720480234273927168,atvi,2016-04-14 05:14:00,atvi took 2 day 9 percent lock profits along way smart,0.0,0.0,125.0,9.0,False,1
720467245529477120,atvi,2016-04-14 04:22:00,atvi skimmed top dollars 5 nice profits short period,0.0,0.0,125.0,9.0,False,1
720431504686362624,atvi,2016-04-14 02:00:00,atvi starting look good 35.50 next target,1.0,0.0,115.0,153.0,False,1
720416870126526465,atvi,2016-04-14 01:02:00,atvi activision blizzard inc nasdaq atvi closes positive 5.02 percent …,0.0,0.0,638.0,0.0,False,0
720386723021127681,atvi,2016-04-13 23:02:00,p500 performance thc mu lm dlph c cmi rf ms ads bwa cfg atvi nov har grmn r sti,0.0,0.0,845.0,7.0,False,1
720386559573434368,atvi,2016-04-13 23:01:00,nasdaq100 performance mu atvi csx bmrn ntes ctrp trip pcar bidu endp swks adsk viab,0.0,0.0,844.0,7.0,False,0
720386178831126528,atvi,2016-04-13 23:00:00,atvi,0.0,0.0,30.0,112.0,False,0
720382830316879872,atvi,2016-04-13 22:47:00,old school dev joins 2 works atvi,0.0,0.0,26363.0,500.0,False,1
720382829574553600,atvi,2016-04-13 22:47:00,old school dev joins 2 works atvi,0.0,0.0,722.0,1.0,False,0
720382535725764612,atvi,2016-04-13 22:45:00,expansion breakout,0.0,0.0,4864.0,2512.0,False,0
720381688841265152,atvi,2016-04-13 22:42:00,activision blizzard positive 3.9 percent stifel boosts target,0.0,0.0,6.0,28.0,False,0
720377614976819200,atvi,2016-04-13 22:26:00,atvi us sprint downgraded paypal activision point upped mgm buy blizzard inc,0.0,0.0,2767.0,279.0,False,1
720370060955688960,atvi,2016-04-13 21:56:00,activision blizzard downgraded zacks investment research hold,0.0,0.0,4587.0,2835.0,False,0
720360293906276353,atvi,2016-04-13 21:17:00,rt atvi activision candy crush jelly saga outperforming hearthstone mobile,0.0,32.0,220.0,225.0,True,0
720341608168824832,atvi,2016-04-13 20:03:00,atvi target performance rundown activision blizzard inc nasdaq …,1.0,0.0,945.0,9.0,False,1
720340678681579521,atvi,2016-04-13 19:59:00,nasdaq100 performance mu atvi csx ntes bmrn ctrp bidu endp swks nxpi pcar adsk viab,0.0,0.0,844.0,7.0,False,1
720330016978960384,atvi,2016-04-13 19:17:00,rt gaining strength last hour lots winners today atvi bx tasr tsla not market…,0.0,2.0,581.0,713.0,True,0
720328922869567490,atvi,2016-04-13 19:12:00,rt gaining strength last hour lots winners today atvi bx tasr tsla not market…,0.0,2.0,1228.0,2302.0,True,1
720328204641144832,atvi,2016-04-13 19:10:00,gaining strength last hour lots winners today atvi bx tasr tsla not market missing,4.0,2.0,22161.0,1730.0,False,1
720321372786786304,atvi,2016-04-13 18:42:00,atvi looking close above 35,0.0,0.0,115.0,153.0,False,0
720321220508577792,atvi,2016-04-13 18:42:00,atvi checking eps growth activision blizzard inc nasdaq atvi,0.0,0.0,788.0,6.0,False,1
720320957462654976,atvi,2016-04-13 18:41:00,jim50 atvi gapped up positive 0.19 atvi last price 34.66 day,0.0,0.0,13651.0,420.0,False,0
720311989348663297,atvi,2016-04-13 18:05:00,activision blizzard positive 3.9 percent stifel boosts target atvi,0.0,0.0,2823.0,3184.0,False,0
720309599174152194,atvi,2016-04-13 17:56:00,atvi options traders react activision blizzard inc atvi sets esports,0.0,0.0,59.0,43.0,False,1
720304287717265409,atvi,2016-04-13 17:34:00,activision blizzard positive 3.9 percent stifel boosts target,0.0,0.0,356.0,1.0,False,1
720304286295416833,atvi,2016-04-13 17:34:00,activision blizzard positive 3.9 percent stifel boosts target,0.0,0.0,2476.0,29.0,False,1
720304284303171588,atvi,2016-04-13 17:34:00,activision blizzard positive 3.9 percent stifel boosts target,0.0,0.0,3697.0,30.0,False,0
720304282839359489,atvi,2016-04-13 17:34:00,activision blizzard positive 3.9 percent stifel boosts target,0.0,0.0,21916.0,30.0,False,1
720303256606519297,atvi,2016-04-13 17:30:00,atvi activision candy crush jelly saga outperforming hearthstone mobile via r stockpicks,0.0,0.0,42.0,13.0,False,1
720295813428084737,atvi,2016-04-13 17:01:00,atvi activision blizzard inc nasdaq atvi held dollars 831 cash …,0.0,0.0,591.0,0.0,False,1
720290700282056705,atvi,2016-04-13 16:40:00,rt atvi activision candy crush jelly saga outperforming hearthstone mobile,0.0,1.0,877.0,128.0,True,1
720290656418140161,atvi,2016-04-13 16:40:00,rt atvi activision candy crush jelly saga outperforming hearthstone mobile,0.0,32.0,877.0,128.0,True,1
720290645034823680,atvi,2016-04-13 16:40:00,atvi activision candy crush jelly saga outperforming hearthstone mobile,0.0,0.0,773.0,1131.0,False,1
720290570111959040,atvi,2016-04-13 16:40:00,rt atvi activision candy crush jelly saga outperforming hearthstone mobile,0.0,1.0,877.0,128.0,True,0
720290437005754368,atvi,2016-04-13 16:39:00,atvi activision candy crush jelly saga outperforming hearthstone mobile,0.0,1.0,2108.0,1463.0,False,0
720290354294075392,atvi,2016-04-13 16:39:00,atvi activision candy crush jelly saga outperforming hearthstone mobile,0.0,32.0,5597.0,4092.0,False,0
720290280788742145,atvi,2016-04-13 16:39:00,atvi activision candy crush jelly saga outperforming hearthstone mobile,0.0,1.0,5056.0,3986.0,False,0
720290234429267968,atvi,2016-04-13 16:39:00,atvi activision candy crush jelly saga outperforming hearthstone mobile,0.0,0.0,8843.0,8922.0,False,1
720289066235871232,atvi,2016-04-13 16:34:00,atvi nasdaq 100 movers stx jd,0.0,0.0,1070.0,1611.0,False,1
720287646962966528,atvi,2016-04-13 16:28:00,activision candy crush jelly saga outperforming hearthstone mobile,0.0,0.0,3697.0,30.0,False,1
720284461502300160,atvi,2016-04-13 16:16:00,aav mt bp yhoo atvi todays 205 analyst reports usa uk markets,0.0,0.0,5421.0,5234.0,False,0
720280030991949824,atvi,2016-04-13 15:58:00,clayton atvi 34.67 activision blizzard atvi added,0.0,0.0,13651.0,420.0,False,1
720279075210731520,atvi,2016-04-13 15:54:00,atvi 34.67 activision blizzard atvi added watch list right atvi watching last price,0.0,0.0,957.0,440.0,False,1
720278203114332161,atvi,2016-04-13 15:51:00,volume alert atvi 34.66 activision blizzard atvi hit high today 35.27 closing day 9 34.66,0.0,0.0,806.0,447.0,False,0
720275388815925248,atvi,2016-04-13 15:40:00,mega call stifel updates activision game model sees high margin projects point history atvi,1.0,1.0,50443.0,1519.0,False,1
720270914823139329,atvi,2016-04-13 15:22:00,king bring revenue atvi blizzard presence mobile grow considerably,3.0,0.0,9459.0,470.0,False,1
720270109458243584,atvi,2016-04-13 15:19:00,5 star analyst drew crum stifel nicolaus reiterated buy atvi drew 82 percent success rate,0.0,0.0,331.0,112.0,False,1
720268269781778432,atvi,2016-04-13 15:11:00,analyst actions breaking news fit atvi ctl gogo logi,0.0,2.0,3514.0,11.0,False,1
720266362552131584,atvi,2016-04-13 15:04:00,snn atvi bubbly stocks focal point smith nephew nyse snn …,0.0,0.0,767.0,1.0,False,1
720262785297420288,atvi,2016-04-13 14:50:00,early action atvi bac chk hog pbr pm rig vips wmb via,0.0,0.0,1157.0,18.0,False,1
720259779420110848,atvi,2016-04-13 14:38:00,rt atvi fire early up near 4 percent,0.0,1.0,735.0,117.0,True,0
720257596431577088,atvi,2016-04-13 14:29:00,rt atvi us sprint downgraded paypal activision point upped mgm buy blizzard inc,0.0,1.0,883.0,1291.0,True,1
720257169602514944,atvi,2016-04-13 14:27:00,atvi us sprint downgraded paypal activision point upped mgm buy blizzard inc,0.0,1.0,2767.0,279.0,False,1
720254180032671745,atvi,2016-04-13 14:15:00,atvi may 36 calls hot trading 3600 day,1.0,0.0,2808.0,139.0,False,1
720251768106590208,atvi,2016-04-13 14:06:00,atvi activision blizzard atvi rising price target increase,0.0,0.0,1070.0,1611.0,False,1
720250536490962944,atvi,2016-04-13 14:01:00,atvi moved beautifully last weeks crack dollars 5,0.0,0.0,3553.0,1470.0,False,1
720247655138365440,atvi,2016-04-13 13:49:00,atvi abre en nivel coincidente disparándose parabolicamente,0.0,0.0,978.0,93.0,False,1
720247478079979521,atvi,2016-04-13 13:49:00,great company neighbors santa monica atvi,1.0,0.0,26049.0,1894.0,False,1
720245819635408898,atvi,2016-04-13 13:42:00,up 5 percent upgrade see good first quarter numbers merger king like lots come atvi,6.0,3.0,26049.0,1894.0,False,0
720244214693400576,atvi,2016-04-13 13:36:00,activision gets bullish note record viewership also pessimism dunkin unwind,0.0,1.0,5352.0,366.0,False,0
720244054148177920,atvi,2016-04-13 13:35:00,atvi fire early up near 4 percent,1.0,1.0,2808.0,139.0,False,1
720237144132857857,atvi,2016-04-13 13:08:00,piper survey shows teens spending real money electronic games gluu znga atvi,0.0,0.0,3059.0,1.0,False,0
720231166020874240,atvi,2016-04-13 12:44:00,systematic financial management lp dollars 7395000 stake activision blizzard inc atvi,0.0,0.0,1073.0,11.0,False,1
720230663429976064,atvi,2016-04-13 12:42:00,systematic financial management lp dollars 7395000 stake activision blizzard inc atvi,0.0,0.0,6364.0,2292.0,False,1
720220002268229632,atvi,2016-04-13 12:00:00,pie sky,0.0,0.0,3445.0,32.0,False,1
720218755284869120,atvi,2016-04-13 11:55:00,unusual call activity,0.0,0.0,4516.0,2626.0,False,1
720212471743512576,atvi,2016-04-13 11:30:00,activision blizzard inc boost price target stifel nicolaus ranked 43 buy 40 point atvi,0.0,0.0,594.0,45.0,False,0
720211919135711232,atvi,2016-04-13 11:27:00,activision blizzard inc atvi point raised dollars 0.00 stifel nicolaus,0.0,0.0,998.0,0.0,False,1
720208245202251776,atvi,2016-04-13 11:13:00,activision blizzards point raised stifel nicolaus dollars 0.00 buy rating,0.0,0.0,4587.0,2835.0,False,0
720204159903862784,atvi,2016-04-13 10:57:00,micron amazon attack enterprise facebook gets busy f8,0.0,0.0,3445.0,32.0,False,0
720200421558599680,atvi,2016-04-13 10:42:00,atvi tdc two stocks within analysts limelight activision blizzard inc …,1.0,0.0,767.0,1.0,False,1
720163290924597248,atvi,2016-04-13 08:14:00,,0.0,0.0,13730.0,13378.0,False,1
720139312600231936,atvi,2016-04-13 06:39:00,activision blizzardpbr540 sets new cs go major esports records 45 million hrs watched 1.6 million concurrent viewers,0.0,0.0,839.0,1858.0,False,0
720134948099895296,atvi,2016-04-13 06:22:00,activision blizzard crucial year yet dcf fundamental analysis atvi,0.0,0.0,299.0,541.0,False,1
720107842020249600,atvi,2016-04-13 04:34:00,awesome stock trade alerts,0.0,0.0,13730.0,13378.0,False,1
720080782597881856,atvi,2016-04-13 02:46:00,activision blizzard crucial year yet dcf fundamental analysis,0.0,0.0,3697.0,30.0,False,0
720042914131390464,atvi,2016-04-13 00:16:00,atvi activision blizzard inc nasdaq atvi closes positive 0.21 percent …,0.0,0.0,788.0,6.0,False,1
720023832958885889,atvi,2016-04-12 23:00:00,positions hun mdxg hurtin little monday drop gld short thc nflx atvi stz .5 position,0.0,0.0,4960.0,478.0,False,1
720014616068116480,atvi,2016-04-12 22:23:00,bullish doji,0.0,0.0,4518.0,2625.0,False,1
720004163220959234,atvi,2016-04-12 21:42:00,activision blizzard inc atvi position increased commonwealth pennsylvania public school empls retrmt sys,0.0,0.0,771.0,8.0,False,0
719990107256832001,atvi,2016-04-12 20:46:00,atvi new sec documents activision blizzard inc stock news alerts app,0.0,0.0,1221.0,10.0,False,1
719989542154018817,atvi,2016-04-12 20:44:00,atvi new sec filing atvi form 8 k no 0001104659 16 111037,0.0,0.0,122.0,0.0,False,1
719987334179991552,atvi,2016-04-12 20:35:00,,0.0,0.0,340.0,27.0,False,1
719975862548971520,atvi,2016-04-12 19:49:00,bank montreal raises position activision blizzard inc atvi,1.0,0.0,771.0,8.0,False,1
719972681832140801,atvi,2016-04-12 19:37:00,atvi activision blizzard inc nasdaq atvi check analyst ratings,0.0,0.0,788.0,6.0,False,1
719960345859723265,atvi,2016-04-12 18:48:00,atvi activision blizzard inc nasdaq atvi analyst recommendation …,0.0,0.0,945.0,9.0,False,1
719958227668996096,atvi,2016-04-12 18:39:00,billionaire jacob rothschild’s stock picking performance not disappoint despite atvi baba ebay dis cl,1.0,0.0,13051.0,733.0,False,1
719958176276332545,atvi,2016-04-12 18:39:00,billionaire jacob rothschild’s stock picking performance not disappoint despite atvi baba ebay dis cl,0.0,0.0,276.0,13.0,False,1
719948781756633088,atvi,2016-04-12 18:02:00,pie sky,0.0,0.0,169495.0,1025.0,False,1
719928389260419073,atvi,2016-04-12 16:41:00,atvi shares review activision blizzard inc nasdaq atvi,0.0,0.0,788.0,6.0,False,1
719912782330785792,atvi,2016-04-12 15:39:00,atvi msft competitive video gaming hits record viewers,0.0,0.0,615.0,0.0,False,0
719905644648632320,atvi,2016-04-12 15:10:00,activision blizzard media networks announces record viewership,0.0,0.0,26.0,41.0,False,1
719899618050322432,atvi,2016-04-12 14:46:00,big esports get activision announced record viewership,0.0,0.0,5267.0,352.0,False,1
719886775620145152,atvi,2016-04-12 13:55:00,atvi 34 calls buying activity expiring 29 apr volume 882 intermarketsweep,0.0,0.0,1868.0,32.0,False,1
719885742772584448,atvi,2016-04-12 13:51:00,rt bull flow really lite action tho myl may c buyer bull flow glw stld atvi rig nibbling fb,0.0,1.0,563.0,166.0,True,1
719885608517255168,atvi,2016-04-12 13:51:00,bull flow really lite action tho myl may c buyer bull flow glw stld atvi rig nibbling fb,3.0,1.0,38551.0,9635.0,False,1
719884345163427841,atvi,2016-04-12 13:46:00,atvi small apr 34 apr22 34 call buyers 1 thousand,2.0,0.0,19886.0,250.0,False,1
719879911197032449,atvi,2016-04-12 13:28:00,not best years 😟 eps improvements atvi,0.0,0.0,424.0,431.0,False,0
719860665108819968,atvi,2016-04-12 12:12:00,atvi activision blizzard media networks announces record esports viewership stock news alerts app,0.0,0.0,1221.0,10.0,False,1
719859121021915136,atvi,2016-04-12 12:06:00,blizzard media networks announces record esports viewership,0.0,0.0,7276.0,76.0,False,1
719858345797152772,atvi,2016-04-12 12:02:00,atvi activision blizzard media networks announces record esports viewership,0.0,0.0,286.0,0.0,False,1
719850290992832515,atvi,2016-04-12 11:30:00,rt pie sky,0.0,1.0,1098.0,173.0,True,1
719849703106551809,atvi,2016-04-12 11:28:00,pie sky,0.0,1.0,211.0,59.0,False,1
719845138336477186,atvi,2016-04-12 11:10:00,rt pie sky,0.0,1.0,1097.0,173.0,True,1
719844151349522433,atvi,2016-04-12 11:06:00,pie sky,0.0,0.0,258.0,1.0,False,1
719844149839536128,atvi,2016-04-12 11:06:00,pie sky,0.0,0.0,3441.0,32.0,False,1
719844148572921857,atvi,2016-04-12 11:06:00,pie sky,0.0,1.0,2225.0,31.0,False,1
719812115452805120,atvi,2016-04-12 08:59:00,atvi analysts bearish activision blizzard inc nasdaq atvi …,0.0,0.0,638.0,0.0,False,0
719803322350321665,atvi,2016-04-12 08:24:00,activision blizzard inc atvi stake increased schwab charles investment management inc,0.0,0.0,771.0,8.0,False,1
719766759784341504,atvi,2016-04-12 05:59:00,atvi thinking going shopping market wants show weakness heading march2016,0.0,0.0,125.0,9.0,False,0
719716239858405378,atvi,2016-04-12 02:38:00,atvi activision blizzard inc nasdaq atvi closes negative 1.65 percent session,0.0,0.0,945.0,9.0,False,1
719708454118625280,atvi,2016-04-12 02:07:00,atvi heroes dormtm arizona state university ‘real dream team 2016 heroes storm stock news alerts app,0.0,0.0,1221.0,10.0,False,1
719688308788477952,atvi,2016-04-12 00:47:00,atvi activision blizzard inc nasdaq atvi quick look earnings,0.0,0.0,591.0,0.0,False,1
719607245563117568,atvi,2016-04-11 19:25:00,atvi heroes dorm arizona state university real dream team 2016 heroes th,0.0,0.0,286.0,0.0,False,1
719605731138355201,atvi,2016-04-11 19:19:00,atvi heroes dormr arizona state university ‘real dream team 2016 heroes storm stock news alerts app,0.0,0.0,1221.0,10.0,False,0
719592416697806849,atvi,2016-04-11 18:26:00,atvi activision blizzard inc nasdaq atvi receives consensus …,0.0,0.0,591.0,0.0,False,0
719591983023550464,atvi,2016-04-11 18:24:00,activision blizzard inc atvi receives consensus recommendation “buy” brokerages,0.0,0.0,998.0,0.0,False,1
