Tweet Id,Ticker,Datetime,Text,Favs,RTs,Followers,Following,Is a RT,Sentiment
733518714918707200,atvi,2016-05-20 04:44:00,activision blizzard inc atvi upgraded vetr inc buy,0.0,0.0,6363.0,2292.0,False,1
733516636414611456,atvi,2016-05-20 04:36:00,activision blizzard inc atvi upgraded vetr inc buy,0.0,0.0,2224.0,11.0,False,0
733508039911710722,atvi,2016-05-20 04:01:00,rt broadcast live fb atvi,0.0,2.0,38.0,36.0,True,1
733506230199574530,atvi,2016-05-20 03:54:00,aapl amat amgn amtd amzn atvi trade long long short positions up 1500 percent since 2010,0.0,0.0,3728.0,3364.0,False,1
733482544742666240,atvi,2016-05-20 02:20:00,rt spy atvi ccxi gbsn orig mgt gps prgn crbp,0.0,1.0,877.0,128.0,True,1
733480858313707520,atvi,2016-05-20 02:13:00,spy atvi ccxi gbsn orig mgt gps prgn crbp,1.0,1.0,94.0,16.0,False,1
733462880771657728,atvi,2016-05-20 01:02:00,gaming expert hates vr loves activision likes nintendo,0.0,0.0,154.0,256.0,False,0
733454384340869122,atvi,2016-05-20 00:28:00,atvi motley fool money 3 stocks radar week,0.0,0.0,1070.0,1611.0,False,1
733440548799811586,atvi,2016-05-19 23:33:00,watch list video may 20 spy atvi ccxi gbsn orig mgt gps prgn crbp,4.0,0.0,9581.0,4529.0,False,1
733432828025671680,atvi,2016-05-19 23:03:00,scans cmi drip cern adbe atvi amgn vrx uwti nflx,0.0,0.0,18002.0,3402.0,False,1
733427579038769152,atvi,2016-05-19 22:42:00,rt 1234 bullish,0.0,1.0,392.0,775.0,True,0
733427083649552385,atvi,2016-05-19 22:40:00,1234 bullish,0.0,1.0,4864.0,2512.0,False,1
733407299482439680,atvi,2016-05-19 21:21:00,new trading need build trading account fast try new amazon ebook,0.0,0.0,272.0,40.0,False,1
733392342724530177,atvi,2016-05-19 20:22:00,rt first quarter digital revs atvi ea ttwo ubi one happy table,0.0,3.0,1211.0,1056.0,True,1
733388013661786113,atvi,2016-05-19 20:05:00,algo trading open signals buy atvi,0.0,0.0,400.0,149.0,False,1
733385499730141184,atvi,2016-05-19 19:55:00,rt first quarter digital revs atvi ea ttwo ubi one happy table,0.0,3.0,566.0,551.0,True,1
733379183871700993,atvi,2016-05-19 19:29:00,electronic arts could earn dollars sh 2020 says mkm partners,1.0,0.0,2961.0,2289.0,False,1
733378120372342789,atvi,2016-05-19 19:25:00,,0.0,1.0,13731.0,13378.0,False,0
733372318567833601,atvi,2016-05-19 19:02:00,rt first quarter digital revs atvi ea ttwo ubi one happy table,0.0,1.0,127.0,545.0,True,0
733351483207495680,atvi,2016-05-19 17:39:00,electronic arts could earn dollars sh 2020 says mkm partners tech trader daily,0.0,0.0,8091.0,263.0,False,0
733343276447727620,atvi,2016-05-19 17:07:00,atvi take two interactives ttwo fourth quarter earnings top estimates,0.0,0.0,1070.0,1611.0,False,0
733330040616783872,atvi,2016-05-19 16:14:00,trade worked well far fb atvi,0.0,0.0,109.0,392.0,False,0
733327370589900800,atvi,2016-05-19 16:04:00,,1.0,0.0,2306.0,29.0,False,1
733325853963124736,atvi,2016-05-19 15:58:00,q1 digital revs atvi ea ttwo ubi one happy table,1.0,3.0,791.0,403.0,False,1
733324228523614208,atvi,2016-05-19 15:51:00,nasdaq100 trend csco chtr nvda nxpi qcom incy vod ctsh symc ntes tsla tmus bmrn ea atvi,0.0,0.0,858.0,7.0,False,0
733322629671591936,atvi,2016-05-19 15:45:00,it’s fantastic atvi ttwo ea managed adapt digital distribution according first quarter earnings up 10 percent .6 revs,0.0,0.0,791.0,403.0,False,1
733320184283299840,atvi,2016-05-19 15:35:00,volume alert atvi 37.76 activision blizzard atvi hit high today 38.37 closing day 9 37.76,0.0,0.0,806.0,447.0,False,1
733302527861608448,atvi,2016-05-19 14:25:00,,0.0,0.0,13731.0,13378.0,False,1
733298313441599489,atvi,2016-05-19 14:08:00,pivotal moment industry espn yahoo jumping bandwagon dis atvi amzn,0.0,0.0,833.0,126.0,False,0
733288827511410688,atvi,2016-05-19 13:30:00,stock market logic atvi up 8.5 percent ea up 12.4 percent earnings beat ttwo earnings beat down negative 5.6 percent,0.0,0.0,9.0,3.0,False,1
733287580385443845,atvi,2016-05-19 13:25:00,pachter factor talks nintendo virtual reality gaming stocks ntdoy fb msft atvi sne,0.0,0.0,939.0,2104.0,False,1
733265966902075393,atvi,2016-05-19 12:00:00,activison blizzard stock brink crash,0.0,0.0,3592.0,30.0,False,1
733261732659912704,atvi,2016-05-19 11:43:00,utx atvi aap options largest change volume free options screener,0.0,0.0,1025.0,8.0,False,1
733257222818549761,atvi,2016-05-19 11:25:00,saquickideas best performing p 500 stocks earnings,0.0,0.0,1541.0,1422.0,False,1
733257034964082689,atvi,2016-05-19 11:24:00,biggest open interest changes today may 19 2016 names include bax cmcsa rkus atvi ete hpe,0.0,0.0,16205.0,9320.0,False,1
733248735661064192,atvi,2016-05-19 10:51:00,aap atvi cvx options largest change open interest free options screener,0.0,0.0,1025.0,8.0,False,1
733224414083309568,atvi,2016-05-19 09:14:00,rt activision price target raised dollars 2 dollars 9 piper jaffray atvi,0.0,2.0,47.0,50.0,True,1
733219655645429763,atvi,2016-05-19 08:56:00,ete volume see greater ete atvi chke,0.0,0.0,114.0,40.0,False,1
733162461239484416,atvi,2016-05-19 05:08:00,rt broadcast live fb atvi,0.0,1.0,62.0,77.0,True,0
733158175961157632,atvi,2016-05-19 04:51:00,rt billionaires paulson cohen soros others added major stocks bxlt atvi abx yhoo pypl,0.0,1.0,31.0,24.0,True,1
733124644954353664,atvi,2016-05-19 02:38:00,aapl amat amgn amtd amzn atvi trade long long short positions up 1500 percent since 2010,0.0,0.0,3727.0,3366.0,False,1
733109458189099009,atvi,2016-05-19 01:38:00,rt 🏆 todays top bets atvi eca db dyn xbi gdx,0.0,3.0,1374.0,1301.0,True,1
733100275263668225,atvi,2016-05-19 01:01:00,large call buying,0.0,0.0,4707.0,2553.0,False,0
733079538733862912,atvi,2016-05-18 23:39:00,activision blizzard inc atvi coo thomas tippl sells 300000 shares,0.0,0.0,998.0,0.0,False,1
733072136554844161,atvi,2016-05-18 23:09:00,reason suggest ea 2 pair trade atvi battlefront not year round games atvi hm,0.0,0.0,18.0,49.0,False,1
733070222429716480,atvi,2016-05-18 23:02:00,nasdaq100 trend chtr incy nvda vod qcom regn nxpi ctsh bmrn alxn lltc txn ntes ca atvi,0.0,0.0,857.0,7.0,False,1
733070178477592576,atvi,2016-05-18 23:02:00,nr7 stocks,0.0,0.0,4708.0,2554.0,False,1
733069005427249155,atvi,2016-05-18 22:57:00,coo activision blizzard nasdaq atvi selling shares atvi,0.0,0.0,466.0,214.0,False,1
733065862429724673,atvi,2016-05-18 22:44:00,need thoughts think playing gap down ea rode up long atvi think pair trade,0.0,0.0,9.0,31.0,False,1
733064929322905600,atvi,2016-05-18 22:41:00,atvi new insider transaction atvi chief operating officer,0.0,0.0,532.0,0.0,False,1
733064424685113344,atvi,2016-05-18 22:39:00,chief executive officer activision blizzard disposed 3308 shares,0.0,0.0,340.0,27.0,False,1
733062403466874880,atvi,2016-05-18 22:31:00,atvi new sec documents activision blizzard inc stock news alerts app,0.0,0.0,1221.0,10.0,False,1
733061112552259584,atvi,2016-05-18 22:26:00,activision blizzards chief operating officer disposed 300000 shares,0.0,0.0,340.0,27.0,False,1
733057635222757384,atvi,2016-05-18 22:12:00,atvi take twos digital sales salve tough quarter,0.0,0.0,1070.0,1611.0,False,1
733054568079200258,atvi,2016-05-18 22:00:00,today`s trades atvi bax cmcsa ete rkus via,0.0,0.0,1120.0,18.0,False,1
733054276751265794,atvi,2016-05-18 21:58:00,prediction atvi stock next quarter sit 50 per share 8.15.16,0.0,0.0,137.0,902.0,False,1
733042486168412161,atvi,2016-05-18 21:12:00,today`s selling action atvi au dal dg pfe trgp via,0.0,0.0,1157.0,18.0,False,1
733040062355677185,atvi,2016-05-18 21:02:00,rt atvi setting up breakout powerful growth story getting incremantally better,0.0,7.0,110.0,44.0,True,1
733039040992251906,atvi,2016-05-18 20:58:00,eqis capital management inc increases stake activision blizzard inc atvi,0.0,0.0,529.0,6.0,False,1
733038883093504000,atvi,2016-05-18 20:57:00,eqis capital management inc increases stake activision blizzard inc atvi,0.0,0.0,1171.0,58.0,False,0
733034057739718657,atvi,2016-05-18 20:38:00,🏆 todays top bets atvi eca db dyn xbi gdx,3.0,3.0,38135.0,9565.0,False,0
733024324718858241,atvi,2016-05-18 19:59:00,nasdaq100 trend chtr nvda incy qcom vod regn nxpi bmrn alxn lltc txn ctsh ntes atvi symc,0.0,0.0,857.0,7.0,False,1
733019786360168450,atvi,2016-05-18 19:41:00,rt atvi setting up breakout powerful growth story getting incremantally better,0.0,7.0,2579.0,316.0,True,1
733019022917283840,atvi,2016-05-18 19:38:00,rt atvi setting up breakout powerful growth story getting incremantally better,0.0,7.0,2808.0,139.0,True,0
733018571941531648,atvi,2016-05-18 19:37:00,rt atvi setting up breakout powerful growth story getting incremantally better,0.0,7.0,806.0,318.0,True,0
733017965549883392,atvi,2016-05-18 19:34:00,rt atvi setting up breakout powerful growth story getting incremantally better,0.0,7.0,393.0,270.0,True,1
733017863825416193,atvi,2016-05-18 19:34:00,atvi setting up breakout powerful growth story getting incremantally better,8.0,7.0,4418.0,86.0,False,1
733012798406529024,atvi,2016-05-18 19:14:00,aggressively trading short expiration atvi cmcsa dg dyn eca emr jwn tlrd via,1.0,0.0,1119.0,18.0,False,1
733010706744758272,atvi,2016-05-18 19:05:00,paper bought 15000 atvi may27 38.5 calls sold 30000 atvi may27 39.5 calls,0.0,0.0,10882.0,121.0,False,1
733010565875019776,atvi,2016-05-18 19:05:00,atvi 18.3 thousand volume vs 273 oi dollars 8.5 calls,0.0,0.0,225.0,784.0,False,1
732982151205949440,atvi,2016-05-18 17:12:00,scan cvo plpm ande saas mzor dgaz dust jdst cslt nxtd lnc ccxi rf mck nxpi sti bk atvi low nvda vod fnfg zayo fivn,0.0,0.0,1883.0,722.0,False,0
732980022001049600,atvi,2016-05-18 17:03:00,dis would help bought atvi even not close,0.0,0.0,543.0,84.0,False,1
732979074134577152,atvi,2016-05-18 17:00:00,alxn atvi exr f fl irwd pld tif trgp wfc via,0.0,0.0,1117.0,18.0,False,1
732972996911091712,atvi,2016-05-18 16:35:00,rt large transactions atvi bac bax pbr wft via,0.0,1.0,22.0,1005.0,True,1
732971525922557952,atvi,2016-05-18 16:30:00,large transactions atvi bac bax pbr wft via,0.0,1.0,1157.0,18.0,False,1
732969110619873280,atvi,2016-05-18 16:20:00,billionaires paulson cohen soros others added major stocks bxlt atvi abx yhoo pypl,0.0,1.0,13283.0,740.0,False,1
732968977165602816,atvi,2016-05-18 16:19:00,billionaires paulson cohen soros others added major stocks bxlt atvi abx yhoo pypl,0.0,0.0,297.0,13.0,False,1
732967756031746048,atvi,2016-05-18 16:15:00,traders trading premium atvi auy bax bby pbr wft via,1.0,0.0,1157.0,18.0,False,1
732965813372780545,atvi,2016-05-18 16:07:00,rt bullish action ypf atvi fl db ulta,0.0,1.0,261.0,814.0,True,0
732965715477692417,atvi,2016-05-18 16:06:00,bullish action ypf atvi fl db ulta,2.0,1.0,38849.0,9605.0,False,1
732964731959447552,atvi,2016-05-18 16:03:00,scans cmi drip cern adbe atvi amgn vrx uwti nflx,0.0,0.0,17981.0,3401.0,False,0
732961899176939522,atvi,2016-05-18 15:51:00,nasdaq100 trend chtr incy nvda qcom vod ctsh regn nxpi bmrn lltc ntes trip ca atvi txn,0.0,0.0,870.0,7.0,False,1
732957555958255616,atvi,2016-05-18 15:34:00,volume alert atvi 38.62 activision blizzard atvi hit high today 38.68 closing day 0 38.62,0.0,0.0,806.0,447.0,False,0
732945756479348738,atvi,2016-05-18 14:47:00,utx atvi aap options largest change volume free options screener,0.0,0.0,1025.0,8.0,False,1
732934682963267585,atvi,2016-05-18 14:03:00,activision blizzard inc atvi downgraded vetr inc “hold”,0.0,0.0,529.0,6.0,False,1
732934470681026565,atvi,2016-05-18 14:02:00,option day atvi,0.0,0.0,106.0,136.0,False,0
732934399721934848,atvi,2016-05-18 14:02:00,activision blizzard inc atvi downgraded vetr inc “hold”,0.0,0.0,1171.0,58.0,False,1
732934123942187009,atvi,2016-05-18 14:01:00,whats driving activision blizzards growth atvi ea igv king,0.0,0.0,1806.0,16.0,False,1
732933547938316288,atvi,2016-05-18 13:59:00,aap atvi cvx options largest change open interest free options screener,0.0,0.0,1025.0,8.0,False,1
732931031343456256,atvi,2016-05-18 13:49:00,atvi 41 calls selling activity expiring 17 jun volume 1800,0.0,0.0,1868.0,32.0,False,1
732926256363110400,atvi,2016-05-18 13:30:00,jump positive conclusions zynga yet,0.0,0.0,3587.0,30.0,False,0
732924274885853187,atvi,2016-05-18 13:22:00,aapl amat amgn amtd amzn atvi trade long long short positions up 1500 percent since 2010,0.0,1.0,3723.0,3368.0,False,1
732902011709067265,atvi,2016-05-18 11:53:00,saquickideas activison blizzard stock brink crash,0.0,0.0,1509.0,1422.0,False,1
732895992761094144,atvi,2016-05-18 11:29:00,activison blizzard stock brink crash,0.0,0.0,3588.0,30.0,False,1
732892785800536064,atvi,2016-05-18 11:17:00,rt biggest open interest changes today may 18 2016 names include bax gsat atvi nly pot yhoo …,0.0,1.0,539.0,478.0,True,1
732892626769350656,atvi,2016-05-18 11:16:00,biggest open interest changes today may 18 2016 names include bax gsat atvi nly pot yhoo,1.0,1.0,16194.0,9321.0,False,1
732880424599359489,atvi,2016-05-18 10:28:00,atvi の株買って儲けるしか…損した,0.0,0.0,220.0,400.0,False,0
732880109376548865,atvi,2016-05-18 10:26:00,rt facebook taps growing esports sector activision blizzard partnership fb atvi,0.0,36.0,185.0,200.0,True,0
732873906051289088,atvi,2016-05-18 10:02:00,weekly nasdaq100 trend nvda ntes vod incy trip ctsh qcom ca ea regn atvi tmus yhoo mnst,0.0,0.0,870.0,7.0,False,1
732873837096914944,atvi,2016-05-18 10:01:00,weekly nasdaq100 performance nvda ea ntes atvi ca vod bidu incy stx srcl symc pcln,0.0,0.0,870.0,7.0,False,1
732869436097593345,atvi,2016-05-18 09:44:00,activision bizzard loses 3.22 percent dollars 8.12 tuesday among top 10 losers p500 atvi,0.0,0.0,52.0,34.0,False,1
732866061125615616,atvi,2016-05-18 09:30:00,activision bizzard loses 3.22 percent dollars 8.12 tuesday among top 10 losers p500 atvi,0.0,0.0,113.0,76.0,False,1
732831884414226432,atvi,2016-05-18 07:15:00,battle looking new long term investment aapl already 15 percent portfolio ogling atvi,0.0,0.0,128.0,543.0,False,1
732809614018904067,atvi,2016-05-18 05:46:00,,0.0,0.0,13731.0,13378.0,False,0
732772368662175746,atvi,2016-05-18 03:18:00,rt 🏆 todays top bets atvi nly oih uso xlp gpc ual stx,0.0,3.0,1880.0,722.0,True,1
732757022421192708,atvi,2016-05-18 02:17:00,rt sharks stay long energies someone gutted atvi puts action review,0.0,7.0,760.0,498.0,True,0
732751129960927232,atvi,2016-05-18 01:54:00,,0.0,0.0,13731.0,13378.0,False,0
732749779378130944,atvi,2016-05-18 01:48:00,rt atvi opening put seller leads todays top orders nly oih uso xlp gpc ual stx,0.0,2.0,728.0,291.0,True,1
732746124268834816,atvi,2016-05-18 01:34:00,rt sharks stay long energies someone gutted atvi puts action review,0.0,7.0,38135.0,9565.0,True,0
732745925248966656,atvi,2016-05-18 01:33:00,rt atvi opening put seller leads todays top orders nly oih uso xlp gpc ual stx,0.0,2.0,573.0,708.0,True,1
732744296667983873,atvi,2016-05-18 01:27:00,gw capital inc lowers position activision blizzard inc atvi,0.0,0.0,998.0,0.0,False,0
732740816955932672,atvi,2016-05-18 01:13:00,rt sharks stay long energies someone gutted atvi puts action review,0.0,7.0,2077.0,289.0,True,1
732740783967764481,atvi,2016-05-18 01:13:00,rt sharks stay long energies someone gutted atvi puts action review,0.0,7.0,9044.0,5936.0,True,1
732740478588723200,atvi,2016-05-18 01:11:00,rt sharks stay long energies someone gutted atvi puts action review,0.0,7.0,14838.0,7970.0,True,1
732740413753171968,atvi,2016-05-18 01:11:00,rt sharks stay long energies someone gutted atvi puts action review,0.0,7.0,13427.0,7095.0,True,1
732740038279204864,atvi,2016-05-18 01:10:00,sharks stay long energies someone gutted atvi puts action review,10.0,7.0,17391.0,91.0,False,1
732736773399433216,atvi,2016-05-18 00:57:00,activision blizzard inc atvi shares bought ibm retirement fund,0.0,0.0,771.0,8.0,False,0
732736466640572416,atvi,2016-05-18 00:56:00,nasdaq100 trend vod trip ntes nvda incy regn qcom ctsh ca yhoo ea tmus atvi mnst ctrp,0.0,0.0,870.0,7.0,False,1
732731857318621188,atvi,2016-05-18 00:37:00,atvi opening put seller leads todays top orders nly oih uso xlp gpc ual stx,7.0,2.0,38840.0,9604.0,False,1
732720387331624960,atvi,2016-05-17 23:52:00,rt 🏆 todays top bets atvi nly oih uso xlp gpc ual stx,0.0,2.0,1372.0,1303.0,True,1
732717760304701441,atvi,2016-05-17 23:41:00,flxr hearing big news update coming mobileapp mini fridge spy momo sync crox atvi orig,0.0,0.0,6372.0,1401.0,False,0
732716642044633089,atvi,2016-05-17 23:37:00,slingshot bullish,0.0,1.0,4864.0,2512.0,False,0
732710925539639297,atvi,2016-05-17 23:14:00,atvi notable tuesday option activity fb khc atvi,0.0,0.0,1070.0,1611.0,False,1
732708765317758976,atvi,2016-05-17 23:05:00,rt scans cmi drip cern adbe atvi amgn vrx uwti nflx,0.0,1.0,987.0,185.0,True,1
732708039455694850,atvi,2016-05-17 23:03:00,scans cmi drip cern adbe atvi amgn vrx uwti nflx,0.0,1.0,17969.0,3377.0,False,1
732701268196478976,atvi,2016-05-17 22:36:00,atvi new insider transaction atvi director,0.0,0.0,532.0,0.0,False,1
732700223261147137,atvi,2016-05-17 22:32:00,unusual option activity alert bax 47 times average daily volume chtr 45 times fez 13 times vrx 10 times urbn 6 times abbv 5 times atvi 5 times,0.0,0.0,376.0,276.0,False,1
732699912287223809,atvi,2016-05-17 22:30:00,atvi new sec documents activision blizzard inc stock news alerts app,0.0,0.0,1221.0,10.0,False,0
732692180297453568,atvi,2016-05-17 22:00:00,today`s trades atvi bax dal gsat mbi nly via,2.0,0.0,1157.0,18.0,False,1
732689793214124032,atvi,2016-05-17 21:50:00,rt energy bull flow oih uso put seller calls bottom atvi iwm put sweepers wiseguy action review 》》,0.0,2.0,760.0,498.0,True,1
732688071922229248,atvi,2016-05-17 21:43:00,rt energy bull flow oih uso put seller calls bottom atvi iwm put sweepers wiseguy action review 》》,0.0,2.0,806.0,318.0,True,1
732687769542135808,atvi,2016-05-17 21:42:00,hot options report end day may 17 2016 bax dal gsat bac atvi nly pot,0.0,0.0,10882.0,121.0,False,0
732687138320486400,atvi,2016-05-17 21:40:00,energy bull flow oih uso put seller calls bottom atvi iwm put sweepers wiseguy action review 》》,5.0,2.0,38135.0,9565.0,False,0
732682018228719616,atvi,2016-05-17 21:19:00,rt 🏆 todays top bets atvi nly oih uso xlp gpc ual stx,0.0,1.0,36.0,2138.0,True,0
732681565692678144,atvi,2016-05-17 21:17:00,🏆 todays top bets atvi nly oih uso xlp gpc ual stx,3.0,3.0,38842.0,9604.0,False,1
732679850067165185,atvi,2016-05-17 21:11:00,today`s selling action atvi ggp mbi orcl pfe x via,1.0,0.0,1157.0,18.0,False,1
732671496234000384,atvi,2016-05-17 20:37:00,rt recap unusual puts dal may27 38.5 p bac sep 10 p gdx jun 24 p atvi may 37.5 p mbi aug 6 p bac jan 18 13…,0.0,1.0,1996.0,736.0,True,1
732667870925070336,atvi,2016-05-17 20:23:00,large call buying,0.0,0.0,4864.0,2512.0,False,1
732666378457505793,atvi,2016-05-17 20:17:00,btc ea dollars 5.07 looking entry spy atvi,0.0,0.0,14.0,126.0,False,1
732662903673757697,atvi,2016-05-17 20:03:00,recap unusual puts dal may27 38.5 p bac sep 10 p gdx jun 24 p atvi may 37.5 p mbi aug 6 p bac jan 18 13 p,4.0,1.0,19886.0,250.0,False,1
732661931971076097,atvi,2016-05-17 19:59:00,nasdaq100 trend vod trip ntes nvda regn incy qcom ctsh ca yhoo ea tmus atvi mnst ctrp,0.0,0.0,858.0,7.0,False,1
732654597358161920,atvi,2016-05-17 19:30:00,rt short atvi fb,0.0,1.0,1245.0,173.0,True,1
732654439790600192,atvi,2016-05-17 19:30:00,apple vs china new bidding war,0.0,0.0,1885.0,15.0,False,0
732653723151896577,atvi,2016-05-17 19:27:00,short atvi fb,1.0,1.0,99.0,383.0,False,1
732652437996199942,atvi,2016-05-17 19:22:00,im ersten anlauf knapp gescheitert örse atvi,0.0,0.0,4752.0,139.0,False,1
732645680754253824,atvi,2016-05-17 18:55:00,atvi option alert sweep sell atvi may dollars 7.5 put 23616 0.331 3 orders 25054 traded oi 444,1.0,0.0,302.0,94.0,False,0
732643289120247808,atvi,2016-05-17 18:45:00,rt atvi size may put seller calling st bottom,0.0,2.0,1296.0,2337.0,True,1
732643197545943040,atvi,2016-05-17 18:45:00,seller 24000 atvi may 37.5 puts dollars .32 trader willing buy 2.4 million shares 37.50,0.0,0.0,515.0,115.0,False,0
732642675019632640,atvi,2016-05-17 18:43:00,rt atvi size may put seller calling st bottom,0.0,2.0,186.0,402.0,True,0
732642488561848321,atvi,2016-05-17 18:42:00,atvi size may put seller calling st bottom,0.0,2.0,38135.0,9565.0,False,1
732642324728172544,atvi,2016-05-17 18:41:00,atvi may 37.5 put sellers negative 24 thousand dollars .32,0.0,0.0,19886.0,250.0,False,1
732642174601416708,atvi,2016-05-17 18:41:00,rt atvi 37.5 puts selling activity expiring 20 may volume 24657,0.0,1.0,186.0,402.0,True,0
732641867754549248,atvi,2016-05-17 18:40:00,atvi 37.5 puts selling activity expiring 20 may volume 24657,1.0,1.0,1868.0,32.0,False,1
732641574513844224,atvi,2016-05-17 18:38:00,rt savvy investing activision want bet ceos put money company atvi http…,0.0,1.0,604.0,2030.0,True,1
732631705580867584,atvi,2016-05-17 17:59:00,rt paulson takes profit gold miners gain 100 percent,0.0,3.0,1201.0,5000.0,True,0
732630909581725698,atvi,2016-05-17 17:56:00,rt paulson takes profit gold miners gain 100 percent,0.0,3.0,744.0,682.0,True,1
732630771622612993,atvi,2016-05-17 17:56:00,valuewalk paulson takes profit gold miners gain 100 percent,0.0,0.0,4588.0,1428.0,False,1
732630468911325185,atvi,2016-05-17 17:54:00,rt facebook taps growing esports sector activision blizzard partnership fb atvi,0.0,35.0,599.0,960.0,True,1
732629927346868224,atvi,2016-05-17 17:52:00,rt paulson takes profit gold miners gain 100 percent,0.0,3.0,1711.0,2951.0,True,1
732629801106706432,atvi,2016-05-17 17:52:00,paulson takes profit gold miners gain 100 percent,1.0,3.0,36701.0,2594.0,False,1
732598148875583488,atvi,2016-05-17 15:46:00,atvi rip call duty franchaise,0.0,0.0,394.0,1968.0,False,1
732596681993289728,atvi,2016-05-17 15:40:00,atvi rip call duty franchaise,0.0,0.0,394.0,1968.0,False,1
732596417118801920,atvi,2016-05-17 15:39:00,atvi see warcraft movie get world warcraft free,0.0,0.0,286.0,0.0,False,1
732594709940588544,atvi,2016-05-17 15:32:00,atvi see warcraft movie get world warcraftr free stock news alerts app,0.0,0.0,1221.0,10.0,False,1
732589852760346624,atvi,2016-05-17 15:13:00,volume alert atvi 38.15 activision blizzard atvi hit high today 39.35 closing day 0 38.15,0.0,0.0,806.0,447.0,False,0
732582003552313347,atvi,2016-05-17 14:42:00,atvi down much happened,0.0,0.0,42.0,147.0,False,1
732581038925434880,atvi,2016-05-17 14:38:00,think esports growth market like atvi management thinks tried understand old,0.0,0.0,759.0,521.0,False,1
732574585753866241,atvi,2016-05-17 14:12:00,rt beta played 9.7 million gamers 37 million matches atvi,0.0,4.0,78.0,198.0,True,1
732570244930252801,atvi,2016-05-17 13:55:00,activision blizzard inc atvi stake lowered proficio capital partners llc,0.0,0.0,6363.0,2292.0,False,1
732570037773438977,atvi,2016-05-17 13:54:00,fosl downgraded strong sell p increased liquidity fears,0.0,0.0,641.0,195.0,False,0
732568058875813888,atvi,2016-05-17 13:46:00,activision blizzard inc atvi stake lowered proficio capital partners llc,0.0,0.0,1073.0,11.0,False,1
732565618768158720,atvi,2016-05-17 13:37:00,update paulson co sheds abbvie picks up pfizer atvi pfe,0.0,0.0,105.0,286.0,False,0
732561429274853376,atvi,2016-05-17 13:20:00,jump positive conclusions zynga yet,0.0,0.0,3583.0,30.0,False,1
732554896348696576,atvi,2016-05-17 12:54:00,rt facebook taps growing esports sector activision blizzard partnership fb atvi,0.0,7.0,86.0,263.0,True,1
732551861270614020,atvi,2016-05-17 12:42:00,dnb asset management purchases 177300 shares activision blizzard inc atvi,0.0,0.0,2224.0,11.0,False,1
732545893958885376,atvi,2016-05-17 12:18:00,rt beta played 9.7 million gamers 37 million matches atvi,0.0,4.0,263.0,218.0,True,1
732539734166274048,atvi,2016-05-17 11:54:00,new list activities live tower,0.0,0.0,58.0,96.0,False,1
732539312999370752,atvi,2016-05-17 11:52:00,rt facebook taps growing esports sector activision blizzard partnership fb atvi,0.0,34.0,186.0,216.0,True,1
732537625064570880,atvi,2016-05-17 11:45:00,guess vivendis still facepalming today atvi executives turn dollars 00 million dollars .2 billion,1.0,0.0,159.0,578.0,False,1
732528565833633793,atvi,2016-05-17 11:09:00,rt facebook taps growing esports sector activision blizzard partnership fb atvi,0.0,33.0,1129.0,2957.0,True,1
732511654336987137,atvi,2016-05-17 10:02:00,weekly p500 trend nvda ea mon dnb tyc iff atvi ca ffiv pdco jci regn lly emc ni,0.0,0.0,859.0,7.0,False,1
732511649207177216,atvi,2016-05-17 10:02:00,rt facebook taps growing esports sector activision blizzard partnership fb atvi,0.0,32.0,4163.0,4692.0,True,1
732511512800186368,atvi,2016-05-17 10:02:00,weekly nasdaq100 trend nvda ea ntes atvi ca incy regn adbe intu hsic intc lbtya alxn ctsh,0.0,0.0,859.0,7.0,False,0
732511443573215232,atvi,2016-05-17 10:01:00,weekly nasdaq100 performance nvda ea ntes atvi ca incy amzn regn msft pcln bmrn trip,0.0,0.0,859.0,7.0,False,1
732508609137926145,atvi,2016-05-17 09:50:00,vivo investor opinions see greater vivo crus atvi,0.0,0.0,99.0,40.0,False,0
732504494924136448,atvi,2016-05-17 09:34:00,rt beta played 9.7 million gamers 37 million matches atvi,0.0,4.0,327.0,261.0,True,0
732491238230757377,atvi,2016-05-17 08:41:00,,1.0,0.0,13731.0,13378.0,False,1
732489311673704448,atvi,2016-05-17 08:33:00,rt beta played 9.7 million gamers 37 million matches atvi,0.0,4.0,171.0,163.0,True,1
732487978929426432,atvi,2016-05-17 08:28:00,beta played 9.7 million gamers 37 million matches atvi,7.0,4.0,26363.0,500.0,False,1
732487978396717056,atvi,2016-05-17 08:28:00,beta played 9.7 million gamers 37 million matches atvi,0.0,0.0,722.0,1.0,False,1
732483527166435329,atvi,2016-05-17 08:10:00,new trading need build trading account fast try new amazon ebook,0.0,0.0,272.0,40.0,False,1
732440299541159936,atvi,2016-05-17 05:19:00,rt facebook taps growing esports sector activision blizzard partnership fb atvi,0.0,6.0,485.0,2215.0,True,1
732440238602100738,atvi,2016-05-17 05:18:00,rt facebook taps growing esports sector activision blizzard partnership fb atvi,0.0,31.0,172.0,226.0,True,1
