Tweet Id,Ticker,Datetime,Text,Favs,RTs,Followers,Following,Is a RT,Sentiment
728595635004448768,atvi,2016-05-06 14:41:00,atvi positive 6 percent tops endp negative 39 percent tails nasdaq100 index 1 hour,0.0,0.0,3056.0,103.0,False,0
728594864682635265,atvi,2016-05-06 14:38:00,atvi gap fill go breakdown,0.0,0.0,2968.0,225.0,False,0
728592084471422976,atvi,2016-05-06 14:27:00,atvi 30 puts no action required collected full credit 1.8 thousand,4.0,0.0,2310.0,50.0,False,0
728591419422560256,atvi,2016-05-06 14:25:00,hate king digital acquisition,0.0,0.0,356.0,1.0,False,0
728591417937797120,atvi,2016-05-06 14:25:00,hate king digital acquisition,0.0,0.0,3697.0,30.0,False,1
728591416654336000,atvi,2016-05-06 14:25:00,hate king digital acquisition,0.0,0.0,3650.0,29.0,False,1
728590788528095233,atvi,2016-05-06 14:22:00,rt heres watchlist day atvi feye gpro pdce post ppc ubnt vrx yelp powered …,0.0,1.0,35.0,100.0,True,1
728589434837291009,atvi,2016-05-06 14:17:00,15 stocks moving fridays market session,1.0,0.0,137.0,255.0,False,1
728589245678559232,atvi,2016-05-06 14:16:00,atvi short 36.95,0.0,0.0,2186.0,34.0,False,0
728588849782263809,atvi,2016-05-06 14:14:00,atvi activision blizzard crushes estimates sees big future e sports,0.0,0.0,40.0,153.0,False,1
728587804712697856,atvi,2016-05-06 14:10:00,greg schnell activision atvi launches call duty,0.0,0.0,15653.0,3.0,False,1
728586262408400902,atvi,2016-05-06 14:04:00,ideas fuel boundless adventure rt atvi feye gpro pdce post ppc ubnt vrx yelp,0.0,0.0,11782.0,902.0,False,1
728585306312716289,atvi,2016-05-06 14:00:00,atvi comments call duty infinite warfares youtube dislikes,0.0,0.0,58.0,96.0,False,1
728585203518717952,atvi,2016-05-06 14:00:00,atvi u hot stocks hot stocks watch,0.0,0.0,1070.0,1611.0,False,0
728585201413181440,atvi,2016-05-06 14:00:00,atvi activision blizzard inc atvi sharply higher first quarter profit beat,0.0,0.0,1070.0,1611.0,False,1
728584281409343488,atvi,2016-05-06 13:56:00,rt full house esports panel w atvi,0.0,1.0,215.0,128.0,True,1
728582872001597440,atvi,2016-05-06 13:51:00,rt ― fly pre market movers pacd gv yelp post atvi hlf gpro wmc data…,0.0,3.0,5390.0,3613.0,True,0
728582805693693952,atvi,2016-05-06 13:50:00,post swir atvi gapped up 5 percent thoughts price,0.0,0.0,372.0,516.0,False,1
728582427623477249,atvi,2016-05-06 13:49:00,atvi gapped up positive 1.04 atvi last price 36.94 day high 0.00 day low 0.00 change positive 2.03 volume 302655 today 19 st,0.0,0.0,783.0,445.0,False,1
728581565824020481,atvi,2016-05-06 13:45:00,activision blizzard hits 1 quarter high,0.0,0.0,64.0,3.0,False,1
728580702820765696,atvi,2016-05-06 13:42:00,activision blizzard inc atvi given outperform rating wedbush,0.0,0.0,771.0,8.0,False,1
728580683782864896,atvi,2016-05-06 13:42:00,activision blizzard inc atvi given “buy” rating jefferies group,0.0,0.0,771.0,8.0,False,1
728580371193823232,atvi,2016-05-06 13:41:00,activision blizzard atvi stock gets price target hike pacific crest,0.0,0.0,2796.0,32.0,False,0
728580281339383808,atvi,2016-05-06 13:40:00,long til atvi makes new 52 week high tuesday,0.0,0.0,3553.0,1470.0,False,1
728579501286821888,atvi,2016-05-06 13:37:00,heres watchlist day atvi feye gpro pdce post ppc ubnt vrx yelp powered,2.0,1.0,335.0,78.0,False,0
728579474497806336,atvi,2016-05-06 13:37:00,fridays top analysts upgrades downgrades point 1 atvi brk brk b feye immu sq spwr wft wmb yelp,1.0,2.0,859.0,47.0,False,1
728579427550957570,atvi,2016-05-06 13:37:00,gappers yelp sppi atvi hlf argh ackman post anet,0.0,0.0,1745.0,298.0,False,1
728579351277494273,atvi,2016-05-06 13:37:00,activision blizzard atvi stock gets price target hike pacific crest,0.0,0.0,2290.0,1222.0,False,1
728579315944677381,atvi,2016-05-06 13:36:00,atvi touch dollars 0 chart,0.0,0.0,31.0,29.0,False,1
728579213243129856,atvi,2016-05-06 13:36:00,atvi lots analyst enthusiasm overwatch true franchise property guys keep right things,0.0,0.0,2808.0,139.0,False,1
728578956094373889,atvi,2016-05-06 13:35:00,atvi trade idea 1 buy may 6 expiry 34. .5 call spread dollars .00 stc added 1 times 2 ps expire,1.0,0.0,27499.0,254.0,False,1
728578936557342725,atvi,2016-05-06 13:35:00,atvi trade idea 2 buy may 6 expiry 34. .5 call spread sell may 6 expiry 32 put dollars .60 let put expire stc cs,1.0,0.0,27499.0,254.0,False,0
728578865380085760,atvi,2016-05-06 13:35:00,rt ― fly pre market movers pacd gv yelp post atvi hlf gpro wmc data…,0.0,3.0,950.0,575.0,True,0
728578637457326080,atvi,2016-05-06 13:34:00,gap go stocks gv hlf yelp ubnt post atvi data trade direction stock,0.0,0.0,3283.0,3295.0,False,0
728578431034646530,atvi,2016-05-06 13:33:00,price targets raised .5 aaww adc arcx atvi baba bcei bel clr cone crzo cwei dei doc door egn ens guid icfi inap,0.0,0.0,754.0,61.0,False,0
728578306493140992,atvi,2016-05-06 13:32:00,watchlist today atvi rate post ubnt yelp endp,0.0,0.0,11367.0,3236.0,False,1
728578192898809856,atvi,2016-05-06 13:32:00,play longs acad al anet atvi ci hlf mdr meli nbix post rate sppi swir ubnt yelp wynn,0.0,0.0,4911.0,43.0,False,0
728578170685784064,atvi,2016-05-06 13:32:00,long watches hlf post ubnt yelp acad atvi short watches amzn wba sq vrx qihu ctsh momo nflx jcp wfc,1.0,0.0,13100.0,644.0,False,1
728578169029070849,atvi,2016-05-06 13:32:00,watch sq aapl gpro feye fit acad wtw atvi trade well,1.0,0.0,43.0,109.0,False,0
728577594644307971,atvi,2016-05-06 13:30:00,activision blizzard inc reiterated rating jefferies co ranked 20 buy 45 point atvi,0.0,0.0,594.0,45.0,False,1
728577266154774530,atvi,2016-05-06 13:28:00,gapping up,0.0,0.0,4864.0,2512.0,False,1
728576745230749696,atvi,2016-05-06 13:26:00,not best years 😟 eps improvements atvi,0.0,0.0,424.0,431.0,False,0
728576083675615233,atvi,2016-05-06 13:24:00,― fly pre market movers pacd gv yelp post atvi hlf gpro wmc data…,1.0,3.0,85217.0,86853.0,False,1
728575961503911936,atvi,2016-05-06 13:23:00,atvi up away,0.0,0.0,31.0,29.0,False,1
728574708657049601,atvi,2016-05-06 13:18:00,rt fly pre market movers pacd gv yelp post atvi hlf gpro wmc data feye sq endp wba j,0.0,1.0,11088.0,7837.0,True,0
728574682861953027,atvi,2016-05-06 13:18:00,fly pre market movers pacd gv yelp post atvi hlf gpro wmc data feye sq endp wba j,1.0,3.0,12691.0,130.0,False,0
728574242107871232,atvi,2016-05-06 13:16:00,full house esports panel w atvi,3.0,1.0,821.0,411.0,False,1
728573938058539008,atvi,2016-05-06 13:15:00,activision blizzards buy rating reiterated jefferies group dollars 5.00 point,0.0,0.0,4587.0,2835.0,False,1
728573935101591552,atvi,2016-05-06 13:15:00,activision blizzards buy rating reiterated benchmark co,0.0,0.0,4587.0,2835.0,False,1
728573930919858176,atvi,2016-05-06 13:15:00,atvi stocks may come under pressure disappointing jobs data u commentary,0.0,0.0,1070.0,1611.0,False,0
728573866436640768,atvi,2016-05-06 13:15:00,rt sometimes cannot believe cdzi ubnt atvi acad gold dbvt apd fc…,0.0,1.0,208.0,0.0,True,1
728573800569180160,atvi,2016-05-06 13:15:00,activision blizzard inc reiterated rating benchmark co ranked 49 buy atvi,0.0,0.0,594.0,45.0,False,0
728573757942579201,atvi,2016-05-06 13:14:00,wall street breakfast traders eye u payrolls data,0.0,0.0,647.0,394.0,False,0
728573480287887360,atvi,2016-05-06 13:13:00,early movers wy ci goog san mdvn fb wba nwsa hlf gpro wynn hon yelp atvi sq ice,0.0,0.0,234.0,346.0,False,1
728573480115933186,atvi,2016-05-06 13:13:00,early movers wy ci goog san mdvn fb wba nwsa hlf gpro wynn hon yelp atvi sq ice,0.0,0.0,16189.0,1206.0,False,1
728572933732487169,atvi,2016-05-06 13:11:00,sometimes cannot believe cdzi ubnt atvi acad gold dbvt apd fcel vix yelp,0.0,1.0,129.0,255.0,False,1
728572764697837568,atvi,2016-05-06 13:10:00,gainers👌🏼😏📈 sdzi positive 22.95 percent sppi positive 10.63 percent ubnt positive 8.76 percent point ct positive 6.83 percent acad positive 6.28 percent ssri positive 4.12 percent immu positive 4.05 percent atvi positive 3.84 percent clne ugld,2.0,5.0,1569.0,1157.0,False,1
728572666282582016,atvi,2016-05-06 13:10:00,atvi acquired king acquired candy crush greats farm heroes saga pet rescue saga,0.0,0.0,67.0,199.0,False,0
728571684236701696,atvi,2016-05-06 13:06:00,watching today earnings atvi al meli wynn economic 3 pm consumer credit,1.0,0.0,1174.0,1009.0,False,1
728571274675556354,atvi,2016-05-06 13:05:00,atvi wall street analysts bullish atvis earnings growth,0.0,0.0,291.0,0.0,False,0
728571088007925760,atvi,2016-05-06 13:04:00,atvi buy,0.0,0.0,163.0,6.0,False,0
728570944973881345,atvi,2016-05-06 13:03:00,rt stockguy22 update up rate yelp hlf athx ubnt jnug nugt point ct acad atvi anet meli …,0.0,0.0,324.0,150.0,False,1
728570709803302912,atvi,2016-05-06 13:02:00,atvi underestimated,0.0,0.0,67.0,199.0,False,1
728570490978107392,atvi,2016-05-06 13:01:00,rt activision blizzard report biggest first quarter online player communities ever atvi up 10 percent blizzard up 23 percent,0.0,3.0,67.0,199.0,True,1
728570346958266369,atvi,2016-05-06 13:01:00,atvi awesome earnings report,1.0,0.0,67.0,199.0,False,0
728570320030961664,atvi,2016-05-06 13:01:00,watch open srpt aapl endp sq gpro tsla fit yelp tree atvi vrx,0.0,0.0,1707.0,104.0,False,1
728570171552608258,atvi,2016-05-06 13:00:00,watching telp higher atvi hlf higher pullbacks cern ctsh feye lower impv either way,0.0,0.0,135.0,149.0,False,0
728570016971554821,atvi,2016-05-06 13:00:00,premarket advanced stocks cdzi sppi ubnt acad ugld immu atvi clne fcel ssri,0.0,0.0,324.0,232.0,False,1
728569204601933824,atvi,2016-05-06 12:56:00,analysts bullish top technology picks atvi,1.0,0.0,466.0,214.0,False,1
728568878415020033,atvi,2016-05-06 12:55:00,3 stocks watch friday atvi gpro hlf,0.0,0.0,6132.0,631.0,False,1
728568689818210304,atvi,2016-05-06 12:54:00,early movers ci ice sq atvi yelp hon wynn gpro hlf,0.0,0.0,696.0,1152.0,False,1
728568239043698688,atvi,2016-05-06 12:52:00,rt hlf yelp endp atvi acad wba sq data post ubnt feye mnk jnug,0.0,1.0,9578.0,1274.0,True,1
728567986508972032,atvi,2016-05-06 12:51:00,15 stocks moving fridays pre market session yelp acad apd atvi,0.0,0.0,439.0,1072.0,False,1
728567553727942657,atvi,2016-05-06 12:50:00,watch idea gappers rate yelp post ubnt atvi gpro feye endp jcp impv sq cern r,0.0,0.0,2045.0,68.0,False,1
728567431682265088,atvi,2016-05-06 12:49:00,rt update up rate yelp hlf athx ubnt jnug nugt point ct acad atvi anet meli clne wynn etc,0.0,1.0,211.0,143.0,True,1
728567284659269632,atvi,2016-05-06 12:49:00,update up rate yelp hlf athx ubnt jnug nugt point ct acad atvi anet meli clne wynn etc,0.0,1.0,54564.0,788.0,False,1
728567221170122752,atvi,2016-05-06 12:48:00,catch atvi redefines franchise,0.0,0.0,569.0,430.0,False,1
728566690410156032,atvi,2016-05-06 12:46:00,activision blizzard nasdaq atvi first quarter 2016 earnings conference call transcript available,0.0,0.0,16.0,0.0,False,0
728566626497527808,atvi,2016-05-06 12:46:00,15 stocks moving fridays pre market session acad apd atvi,0.0,0.0,91.0,65.0,False,0
728566613079818240,atvi,2016-05-06 12:46:00,hlf yelp endp atvi acad wba sq data post ubnt feye mnk jnug,2.0,1.0,7775.0,5176.0,False,0
728566450743590912,atvi,2016-05-06 12:45:00,rt overwatch beta goes live platforms atvi nvda,0.0,1.0,155.0,887.0,True,1
728566182802915328,atvi,2016-05-06 12:44:00,atvi up premarket trading activision blizzard earnings results,0.0,0.0,4864.0,2512.0,False,0
728566172522778625,atvi,2016-05-06 12:44:00,light numbers 160000 new nfp jobs added april watch yelp hlf sorry bill ackman atvi ubnt,0.0,0.0,7295.0,997.0,False,0
728566003265765376,atvi,2016-05-06 12:44:00,acad atvi significant pre market gainers speculatingstocks pre market specu,0.0,0.0,868.0,778.0,False,1
728564548379140096,atvi,2016-05-06 12:38:00,feye ubnt atvi yelp chart,1.0,3.0,5074.0,170.0,False,1
728563701641523200,atvi,2016-05-06 12:34:00,rt ⬆️ pm syn dgaz yelp nugt acad post dwti atvi sync,0.0,2.0,1074.0,74.0,True,1
728562608404500481,atvi,2016-05-06 12:30:00,15 stocks moving fridays session acad atvi yelp cdzi sppi endp sq feye gpro jcp momo spwr,0.0,0.0,49693.0,1500.0,False,1
728561528383758340,atvi,2016-05-06 12:26:00,rt atvi positive 4.8 percent pre call duty maker activisions revenue profit beat estimates,0.0,1.0,179.0,620.0,True,1
728561200850558977,atvi,2016-05-06 12:25:00,atvi positive 4.8 percent pre call duty maker activisions revenue profit beat estimates,2.0,1.0,19886.0,250.0,False,1
728560519737573377,atvi,2016-05-06 12:22:00,atvi sum put oi equals 1200 sum call oi equals 12997 callputratio equals 0.09 expiration bullish,0.0,0.0,1026.0,8.0,False,1
728560154673733632,atvi,2016-05-06 12:20:00,atvi chart,0.0,2.0,5074.0,170.0,False,1
728560144259354624,atvi,2016-05-06 12:20:00,rt ⬆️ pm syn dgaz yelp nugt acad post dwti atvi sync,0.0,2.0,95.0,102.0,True,1
728559955700285441,atvi,2016-05-06 12:20:00,rt 5.6.16 fri watch ci ice sq atvi yelp hon wynn gpro hlf,0.0,1.0,52.0,12.0,True,1
728559408343560192,atvi,2016-05-06 12:17:00,⬆️ pm syn dgaz yelp nugt acad post dwti atvi sync,1.0,2.0,3218.0,105.0,False,0
728559341209567232,atvi,2016-05-06 12:17:00,atvi up 6.3 percent 37.10 prem posting first quarter adjusted eps 0.23 vs est 0.12,0.0,1.0,272.0,229.0,False,1
728558699413909504,atvi,2016-05-06 12:15:00,5.6.16 fri watch ci ice sq atvi yelp hon wynn gpro hlf,1.0,1.0,29.0,7.0,False,1
728555712016568320,atvi,2016-05-06 12:03:00,atvi up 6.3 percent 37.10 prem posting first quarter adjusted eps 0.23 vs est 0.12 raised guidance 2016 adjusted eps 1.78 vs est 1.75,0.0,0.0,754.0,61.0,False,0
728555100101349376,atvi,2016-05-06 12:00:00,rt wall street breakfast traders eye u payrolls data,0.0,1.0,877.0,128.0,True,0
728554946904236032,atvi,2016-05-06 12:00:00,wall street breakfast traders eye u payrolls data,0.0,1.0,12362.0,29.0,False,1
728554395491835907,atvi,2016-05-06 11:57:00,early movers ci ice sq atvi yelp hon wynn gpro hlf,0.0,0.0,607.0,329.0,False,1
728553414309728256,atvi,2016-05-06 11:54:00,large call buying,0.0,0.0,4627.0,2573.0,False,1
728553096159199232,atvi,2016-05-06 11:52:00,stocks trading up hours,0.0,0.0,4864.0,2512.0,False,1
728540224125476864,atvi,2016-05-06 11:01:00,rt digital drives activision blizzard atvi beat point dollars 2 baird,0.0,1.0,732.0,286.0,True,0
728539993283661826,atvi,2016-05-06 11:00:00,rt wall street breakfast traders eye u payrolls data,0.0,1.0,877.0,128.0,True,0
728539975877283840,atvi,2016-05-06 11:00:00,rt wall street breakfast traders eye u payrolls data,0.0,1.0,877.0,128.0,True,1
728539925444853760,atvi,2016-05-06 11:00:00,digital drives activision blizzard atvi beat point dollars 2 baird,1.0,1.0,3059.0,1.0,False,1
728539688345051136,atvi,2016-05-06 10:59:00,wall street breakfast traders eye u payrolls data,0.0,1.0,307.0,1.0,False,1
728539686298259460,atvi,2016-05-06 10:59:00,wall street breakfast traders eye u payrolls data,0.0,1.0,1111.0,29.0,False,0
728539684750557189,atvi,2016-05-06 10:59:00,wall street breakfast traders eye u payrolls data,0.0,0.0,3079.0,29.0,False,1
728536109072912385,atvi,2016-05-06 10:45:00,atvi electronic arts ea beat earnings estimates fourth quarter,0.0,0.0,1070.0,1611.0,False,0
728536106128556032,atvi,2016-05-06 10:45:00,atvi wall street edge jobs data come calling,0.0,0.0,1070.0,1611.0,False,1
728532705931972608,atvi,2016-05-06 10:31:00,activision blizzard atvi gets ready overwatch jefferies,0.0,0.0,3059.0,1.0,False,0
728532301869539329,atvi,2016-05-06 10:30:00,activision blizzard inc boost price target mizuho ranked 38 buy 42 point atvi,0.0,0.0,594.0,45.0,False,1
728527071769661440,atvi,2016-05-06 10:09:00,activision blizzard’s atvi overweight rating reaffirmed piper jaffray,0.0,0.0,1073.0,11.0,False,1
728526584718741504,atvi,2016-05-06 10:07:00,activision blizzard’s atvi overweight rating reaffirmed piper jaffray,0.0,0.0,6364.0,2292.0,False,0
728525230348615680,atvi,2016-05-06 10:02:00,weekly nasdaq100 trend ntes atvi yhoo mnst nxpi mdlz chtr vrtx fb mar lvnta fast esrx,0.0,0.0,854.0,7.0,False,1
728525160949624832,atvi,2016-05-06 10:01:00,weekly nasdaq100 performance isrg hsic ntap sbac ntes aal mnst amzn expe lmca atvi ilmn,0.0,0.0,853.0,7.0,False,1
728507261077868544,atvi,2016-05-06 08:50:00,activision blizzard gets hoped boost king digital atvi,0.0,0.0,68.0,63.0,False,0
728499921737879552,atvi,2016-05-06 08:21:00,awesome stock trade alerts,0.0,0.0,13731.0,13378.0,False,1
728478807364120576,atvi,2016-05-06 06:57:00,activision blizzard inc atvi issues quarterly earnings results,0.0,0.0,998.0,0.0,False,0
728478805313126402,atvi,2016-05-06 06:57:00,activision blizzard inc atvi issues quarterly earnings results,0.0,0.0,998.0,0.0,False,1
728476754310881280,atvi,2016-05-06 06:49:00,unicorn bay rating atvi 3.38 5,0.0,0.0,1399.0,1495.0,False,0
728470967333224448,atvi,2016-05-06 06:26:00,btw estimated per share atvi dollars .34 0.97 percent current price,0.0,0.0,1399.0,1495.0,False,1
728451338070155266,atvi,2016-05-06 05:08:00,not sure atvi explore pros cons,0.0,0.0,1399.0,1495.0,False,1
728450847189794817,atvi,2016-05-06 05:06:00,rt overall disliked video equals atvi stock go up no ones buying iw buying 100 dollar unit ab…,0.0,1.0,854.0,2700.0,True,0
728450777455296512,atvi,2016-05-06 05:06:00,overall disliked video equals atvi stock go up no ones buying iw buying 100 dollar unit above sucka,3.0,1.0,18425.0,761.0,False,1
728448636074397696,atvi,2016-05-06 04:57:00,stock analysts’ downgrades may 5 atvi bud gldd gmed gpp gte gwr hawk hbio hca,0.0,0.0,998.0,0.0,False,1
728437243761721345,atvi,2016-05-06 04:12:00,wondering risks atvi 21 day volatility 7.79 percent,0.0,0.0,1399.0,1495.0,False,0
728422814848585728,atvi,2016-05-06 03:15:00,rt atvi says 85 percent ps4 buyers usa quarter opted black ops iii bundle record sales engageme…,0.0,4.0,441.0,466.0,True,1
728414634512949248,atvi,2016-05-06 02:42:00,activision blizzard inc atvi issues fy16 earnings guidance,0.0,0.0,998.0,0.0,False,0
728413952506535936,atvi,2016-05-06 02:39:00,activision blizzard inc atvi issues fy16 earnings guidance,0.0,0.0,1073.0,11.0,False,0
728413948656136192,atvi,2016-05-06 02:39:00,activision blizzard inc atvi updates second quarter earnings guidance,0.0,0.0,1073.0,11.0,False,1
728413376104308736,atvi,2016-05-06 02:37:00,activision blizzard inc atvi issues fy16 earnings guidance,0.0,0.0,6364.0,2292.0,False,0
728413371532480514,atvi,2016-05-06 02:37:00,activision blizzard inc atvi updates second quarter earnings guidance,0.0,0.0,6364.0,2292.0,False,1
728411598281265152,atvi,2016-05-06 02:30:00,atvi high open interest range 32.00 37.50 option expiration,0.0,0.0,1026.0,8.0,False,0
728406488335691776,atvi,2016-05-06 02:10:00,rt watchlist acw yume etp atvi flr,0.0,1.0,23965.0,89.0,True,1
728405560807165952,atvi,2016-05-06 02:06:00,rt calculated 21 day expected return atvi 1.92 percent,0.0,1.0,1996.0,736.0,True,1
728402510520590336,atvi,2016-05-06 01:54:00,rt king delivered quarters next year must grow beyond candy crush ads help atvi,0.0,2.0,24521.0,330.0,True,1
728401434048344064,atvi,2016-05-06 01:50:00,rt king delivered quarters next year must grow beyond candy crush ads help atvi,0.0,2.0,17473.0,1050.0,True,1
728400252210810884,atvi,2016-05-06 01:45:00,calculated 21 day expected return atvi 1.92 percent,0.0,1.0,1399.0,1495.0,False,1
728397004615913472,atvi,2016-05-06 01:32:00,speaking activision earlier going absolutely huge position atvi considering,0.0,0.0,173.0,337.0,False,1
728396564704727040,atvi,2016-05-06 01:30:00,watchlist acw yume etp atvi flr,2.0,1.0,1021.0,98.0,False,0
728393982548557824,atvi,2016-05-06 01:20:00,rt posted reviews charts stocktwits spy iwm aapl ddd cat bby atvi bac jpm dis amzn uso,0.0,2.0,877.0,128.0,True,1
728393939166867457,atvi,2016-05-06 01:20:00,king delivered quarters next year must grow beyond candy crush ads help atvi,4.0,2.0,5419.0,1066.0,False,1
728393634895245312,atvi,2016-05-06 01:19:00,rt posted reviews charts stocktwits spy iwm aapl ddd cat bby atvi bac jpm dis amzn uso,0.0,2.0,729.0,322.0,True,0
728391574904803328,atvi,2016-05-06 01:10:00,posted reviews charts stocktwits spy iwm aapl ddd cat bby atvi bac jpm dis amzn uso,1.0,2.0,1081.0,40.0,False,0
728389697416908801,atvi,2016-05-06 01:03:00,sweetens results atvi,1.0,0.0,132.0,90.0,False,0
728389647827537920,atvi,2016-05-06 01:03:00,atvi hit dollars 0 tomorrow,0.0,0.0,31.0,29.0,False,1
728389482580455427,atvi,2016-05-06 01:02:00,aapl amat amgn amtd amzn atvi trade long long short positions up 1500 percent since 2010,0.0,0.0,3749.0,3344.0,False,1
728388993654599680,atvi,2016-05-06 01:00:00,atvi king no pun intended confidently held earnings,1.0,0.0,3553.0,1470.0,False,1
728386943453675520,atvi,2016-05-06 00:52:00,atvi comes big woot,1.0,0.0,3553.0,1470.0,False,1
728384700905988096,atvi,2016-05-06 00:43:00,rt activision blizzard atvi first quarter 2016 earnings nutshell,0.0,1.0,68.0,28.0,True,0
728384020585701376,atvi,2016-05-06 00:40:00,hlf gpro cara sq endp feye data atvi yelp ive learned decade trading,0.0,0.0,174.0,51.0,False,0
728383945751023616,atvi,2016-05-06 00:40:00,atvi activision blizzard inc releases quarterly earnings results beats…,0.0,0.0,629.0,5.0,False,0
728383833398251521,atvi,2016-05-06 00:40:00,atvi activision blizzard inc releases quarterly earnings results beats…,0.0,0.0,168.0,0.0,False,1
728383694038241281,atvi,2016-05-06 00:39:00,activision blizzard inc atvi releases quarterly earnings results beats expectations dollars .11 eps,0.0,0.0,1073.0,11.0,False,0
728383208736362496,atvi,2016-05-06 00:37:00,activision blizzard inc atvi releases quarterly earnings results beats expectations dollars .11 eps,0.0,0.0,6364.0,2292.0,False,0
728381049399468035,atvi,2016-05-06 00:29:00,ive said merits repeating tonight world class executive building killer business atvi,34.0,10.0,1645206.0,618.0,False,1
728380269875609600,atvi,2016-05-06 00:26:00,bears atvi,1.0,0.0,385.0,548.0,False,1
728380099851112448,atvi,2016-05-06 00:25:00,fuck say atvi moon,0.0,0.0,387.0,49.0,False,1
728379885459136512,atvi,2016-05-06 00:24:00,laugh looks like ill make little atvi stock goes up hours,0.0,0.0,67.0,87.0,False,1
728376655639502849,atvi,2016-05-06 00:11:00,rt activision blizzard report biggest first quarter online player communities ever atvi up 10 percent blizzard up 23 percent,0.0,3.0,147.0,574.0,True,1
728375897795989507,atvi,2016-05-06 00:08:00,rt 4 expontential moving average cross 8 expontential moving average stocks sync znga wox amlp clr p atvi ko epe etp xco two exel se jnj rice nice…,0.0,1.0,167.0,300.0,True,0
728373402184998912,atvi,2016-05-05 23:58:00,mid notables tomorrow yelp hlf ubnt atvi endp sq gpro,2.0,1.0,665.0,3.0,False,1
728373084688818178,atvi,2016-05-05 23:57:00,activision blizzard inc atvi issues fy16 earnings guidance,0.0,0.0,771.0,8.0,False,1
728370076072611844,atvi,2016-05-05 23:45:00,know value atvi dollars 1.01,0.0,0.0,1399.0,1495.0,False,1
728367893742682113,atvi,2016-05-05 23:36:00,yes glad held shares thru market ups downs atvi,2.0,0.0,1180.0,1919.0,False,1
728365462937985024,atvi,2016-05-05 23:27:00,spy flat dis pypl up atvi beats est tsla down musk ramp up production chart n video,0.0,0.0,623.0,684.0,False,1
728364366802882560,atvi,2016-05-05 23:22:00,atvi king tho,0.0,0.0,816.0,1450.0,False,0
728364047033192448,atvi,2016-05-05 23:21:00,live,0.0,0.0,623.0,684.0,False,0
728362560504922112,atvi,2016-05-05 23:15:00,atvi activision blizzard gets hoped boost king digital update,0.0,0.0,1070.0,1611.0,False,0
728359141626904577,atvi,2016-05-05 23:02:00,atvi up hours trading activision blizzard earnings results,0.0,0.0,4864.0,2512.0,False,1
728357999085903872,atvi,2016-05-05 22:57:00,great quarter atvi up 6 percent ah 910 million vs 820 million .23 vs .13 estimate stock nothing money making machine🤑🤑🤑,1.0,1.0,51.0,49.0,False,1
728356953039101952,atvi,2016-05-05 22:53:00,things got real atvi,0.0,0.0,4618.0,4.0,False,0
728356952976154626,atvi,2016-05-05 22:53:00,atvi chart things got real,0.0,0.0,302.0,94.0,False,1
728354999772680193,atvi,2016-05-05 22:45:00,activision blizzard atvi first quarter 2016 earnings nutshell,1.0,1.0,371.0,19.0,False,1
728354465242177536,atvi,2016-05-05 22:43:00,yelp atvi calls er plays today needed laugh,0.0,0.0,212.0,325.0,False,0
728352958707060738,atvi,2016-05-05 22:37:00,atvi activision blizzard reported strong earnings popping hours level support,2.0,0.0,6199.0,112.0,False,1
728352075785080833,atvi,2016-05-05 22:34:00,rt gainers ✍🏼😏📈✨ sppi positive 13.28 percent point ct positive 6.83 percent atvi positive 6.70 percent ubnt positive 6.55 percent acad positive 6.17 percent dbvt positive 5.17 percent inap positive 5 percent c…,0.0,2.0,347.0,187.0,True,0
728350170333761536,atvi,2016-05-05 22:26:00,rt atvi activision blizzard beats dollars .11 beats revs guides second quarter eps above consensus revs above consensus,0.0,1.0,102.0,235.0,True,1
728350002171383808,atvi,2016-05-05 22:25:00,rt atvi says 85 percent ps4 buyers usa quarter opted black ops iii bundle record sales engageme…,0.0,4.0,428.0,376.0,True,1
728349260857659392,atvi,2016-05-05 22:22:00,beautiful q team atvi still think folks realize packed pipeline nice expansion market,0.0,0.0,202.0,1008.0,False,1
728349102417661952,atvi,2016-05-05 22:22:00,wynn data loco meli hlf sq spwr mdvn atvi sage depo cybr feye gpro yelp endp,0.0,0.0,46.0,7.0,False,0
728348352602058756,atvi,2016-05-05 22:19:00,rt atvi says 85 percent ps4 buyers usa quarter opted black ops iii bundle record sales engageme…,0.0,4.0,232.0,150.0,True,1
728348141100109824,atvi,2016-05-05 22:18:00,parabolic sar buy,0.0,0.0,4864.0,2512.0,False,1
728347712299487232,atvi,2016-05-05 22:16:00,rt gainers ✍🏼😏📈✨ sppi positive 13.28 percent point ct positive 6.83 percent atvi positive 6.70 percent ubnt positive 6.55 percent acad positive 6.17 percent dbvt positive 5.17 percent inap positive 5 percent c…,0.0,2.0,682.0,664.0,True,1
728347554300055552,atvi,2016-05-05 22:16:00,sppi point ct atvi significant hours gainers seen speculatingstocks hours,0.0,0.0,868.0,778.0,False,1
