Tweet Id,Ticker,Datetime,Text,Favs,RTs,Followers,Following,Is a RT,Sentiment
735084222050914304,nxpi,2016-05-24 12:25:00,🗣keep following stocks radar swks nxpi qrvo avgo ibd top screen stocks former leading stocks sometimes lead mkt again✅,0.0,0.0,2983.0,2334.0,False,1
735070859950456832,nxpi,2016-05-24 11:32:00,rt apple chip suppliers up iphone 7 hopes,0.0,1.0,1170.0,1136.0,True,0
735060865054085120,nxpi,2016-05-24 10:52:00,chesley taft associates llc lowers stake nxp semiconductors nv nxpi,0.0,0.0,749.0,8.0,False,1
735054014446985216,nxpi,2016-05-24 10:25:00,apple chip suppliers up iphone 7 hopes,1.0,1.0,205.0,407.0,False,0
735048213678444545,nxpi,2016-05-24 10:02:00,weekly nasdaq100 trend amat mu incy csco trip tmus intu nvda nxpi qcom lltc txn mxim regn,0.0,0.0,855.0,7.0,False,1
735048146099789825,nxpi,2016-05-24 10:01:00,weekly nasdaq100 performance amat mu wdc chtr stx nflx endp ntap incy swks nvda nxpi,0.0,0.0,855.0,7.0,False,1
735031898154500097,nxpi,2016-05-24 08:57:00,trading rules discipline staying strong,0.0,0.0,600.0,8.0,False,1
735025054400970752,nxpi,2016-05-24 08:30:00,kst ex div date see greater kst nxpi skul,0.0,0.0,39.0,40.0,False,0
735010454465024000,nxpi,2016-05-24 07:32:00,nxpi analyst action clsa nxp semiconductors,0.0,0.0,285.0,0.0,False,1
734986901623562241,nxpi,2016-05-24 05:58:00,nxp semiconductors nv nxpi earns buy rating credit suisse,1.0,0.0,502.0,6.0,False,1
734956953588224000,nxpi,2016-05-24 03:59:00,stocks interest csco qcom anet panw cybr nvda nxpi avgo crm fmc aapl vmc,1.0,0.0,253.0,225.0,False,1
734931772513910784,nxpi,2016-05-24 02:19:00,nxp semiconductors nv nxpi shares gap up dollars 8.39,0.0,0.0,1046.0,11.0,False,1
734931457777537024,nxpi,2016-05-24 02:18:00,nxp semiconductors nv nxpi shares gap up dollars 8.39,0.0,0.0,6292.0,2292.0,False,1
734913072905740289,nxpi,2016-05-24 01:05:00,poll 50 percent moderately concerned partial automation lvl 3 4 pursued tsla fsl mbly nxpi,1.0,0.0,445.0,778.0,False,0
734882141939638272,nxpi,2016-05-23 23:02:00,nasdaq100 trend incy trip mu intu amat csco tmus nxpi mxim txn nvda lltc qcom regn nflx,0.0,0.0,857.0,7.0,False,1
734876253132460032,nxpi,2016-05-23 22:38:00,industry influencers address societal impacts adas iot technologies read blog,0.0,0.0,63.0,3.0,False,1
734875185325703168,nxpi,2016-05-23 22:34:00,parabolic sar buy,0.0,0.0,4747.0,2548.0,False,1
734871129085468672,nxpi,2016-05-23 22:18:00,looks like buy read,0.0,0.0,63.0,3.0,False,1
734844163858911232,nxpi,2016-05-23 20:31:00,rt apple chip suppliers broadcom nxp skyworks up iphone 7 hopes aapl swks nxpi avgo crus invn idti tsm,0.0,1.0,203.0,111.0,True,1
734843391385702400,nxpi,2016-05-23 20:28:00,apple chip suppliers broadcom nxp skyworks up iphone 7 hopes aapl swks nxpi avgo crus invn idti tsm,0.0,1.0,262.0,74.0,False,1
734836242723033088,nxpi,2016-05-23 19:59:00,nasdaq100 trend incy trip mu regn intu amat intc csco lltc tmus qcom nxpi txn mxim adi,0.0,0.0,857.0,7.0,False,1
734824486969675777,nxpi,2016-05-23 19:13:00,nxpi running dollars 9 low dollars 0 sentiment buy lock little,0.0,0.0,1259.0,300.0,False,1
734817251967143936,nxpi,2016-05-23 18:44:00,nxp aims target iot read,0.0,0.0,62.0,3.0,False,1
734816363496120320,nxpi,2016-05-23 18:40:00,far avgo nxpi candles not looking good possible reversal candles setting up see close smh bearish doji,0.0,0.0,16317.0,100.0,False,1
734816171669762049,nxpi,2016-05-23 18:40:00,nxpi analyst action clsa nxp semiconductors,0.0,0.0,284.0,0.0,False,1
734807391791927300,nxpi,2016-05-23 18:05:00,nxpi investors must comfortable 3 risks,0.0,0.0,1009.0,1216.0,False,1
734805356853886976,nxpi,2016-05-23 17:57:00,nxpi investors must comfortable 3 risks,0.0,0.0,1009.0,1216.0,False,1
734805356853874688,nxpi,2016-05-23 17:57:00,nxpi jun 88 84.5 put 1 times 2 trades 500 x 1000 2 lots,0.0,0.0,19460.0,244.0,False,1
734798379486728192,nxpi,2016-05-23 17:29:00,fisher asset management llc invests dollars 7892000 nxp semiconductors nv nxpi,0.0,0.0,405.0,10.0,False,0
734796587944267777,nxpi,2016-05-23 17:22:00,nxpi fisher asset management llc invests dollars 7892000 nxp semiconductors nv,1.0,0.0,627.0,5.0,False,0
734796472609300481,nxpi,2016-05-23 17:21:00,nxpi fisher asset management llc invests dollars 7892000 nxp semiconductors nv,0.0,0.0,159.0,0.0,False,1
734794584258052096,nxpi,2016-05-23 17:14:00,nv investors must know 3 risks read,0.0,0.0,62.0,3.0,False,1
734794097542696960,nxpi,2016-05-23 17:12:00,bayer mon possibility dollars 2 billion qcom nxpi dollars 0 billion sound crazy,0.0,0.0,2908.0,140.0,False,1
734793891283619844,nxpi,2016-05-23 17:11:00,given size deal skeptical qcom wud go nxpi though itd b perfect fit nomura thinks possible,0.0,0.0,2908.0,140.0,False,1
734776935759384576,nxpi,2016-05-23 16:04:00,nvda also nxpi driverless autos,1.0,0.0,44.0,278.0,False,1
734775123178184705,nxpi,2016-05-23 15:56:00,well nflx today nxpi swks got great job aapl today,0.0,0.0,14529.0,3235.0,False,0
734773815549431808,nxpi,2016-05-23 15:51:00,nasdaq100 trend incy trip mu aapl nxpi avgo intu amat adi csco intc txn chkp lltc qcom,0.0,0.0,858.0,7.0,False,1
734773747756990464,nxpi,2016-05-23 15:51:00,nasdaq100 performance incy trip viab stx swks wdc nflx regn mu aapl disca nxpi avgo,0.0,0.0,858.0,7.0,False,1
734756685089103873,nxpi,2016-05-23 14:43:00,rt nxp nxpi ultimately gets acquired nomura brcm qcom txn,0.0,1.0,731.0,290.0,True,0
734756388291764224,nxpi,2016-05-23 14:42:00,nv investors must know 3 risks read,0.0,0.0,62.0,3.0,False,0
734754932402708480,nxpi,2016-05-23 14:36:00,nxp nxpi ultimately gets acquired nomura brcm qcom txn,1.0,1.0,3031.0,1.0,False,1
734752477099229185,nxpi,2016-05-23 14:26:00,nxpi chart verge breakout,0.0,0.0,277.0,85.0,False,1
734752477086507008,nxpi,2016-05-23 14:26:00,verge breakout nxpi,0.0,0.0,4321.0,4.0,False,0
734741595073990657,nxpi,2016-05-23 13:43:00,rt early bull flow greater greater crm fmc kss nxpi,0.0,1.0,554.0,500.0,True,1
734741367918841857,nxpi,2016-05-23 13:42:00,early bull flow greater greater crm fmc kss nxpi,4.0,1.0,38938.0,9596.0,False,1
734723924232179713,nxpi,2016-05-23 12:33:00,5 stocks get driverless car investments up speed,3.0,0.0,418.0,238.0,False,0
734723505388802048,nxpi,2016-05-23 12:31:00,macd bull crossover fitb htz intc jpm key met mu nxpi,0.0,0.0,88.0,60.0,False,1
734720291444776961,nxpi,2016-05-23 12:19:00,nxpi analyst action clsa nxp semiconductors,0.0,0.0,285.0,0.0,False,1
734694898977234945,nxpi,2016-05-23 10:38:00,rf cooking faster healthier smarter cooking read blog,0.0,0.0,61.0,3.0,False,1
734685828329406466,nxpi,2016-05-23 10:02:00,weekly nasdaq100 trend ctsh lltc tmus amat chtr nxpi qcom incy csco wfm ntes nvda txn,0.0,0.0,858.0,7.0,False,1
734646094278365184,nxpi,2016-05-23 07:24:00,rt cobi day low see greater cobi chuy nxpi,0.0,1.0,149.0,199.0,True,0
734643034898505728,nxpi,2016-05-23 07:12:00,cobi day low see greater cobi chuy nxpi,0.0,1.0,48.0,40.0,False,1
734629360821538816,nxpi,2016-05-23 06:17:00,nxp semiconductors nv’s nxpi buy rating reiterated credit suisse,0.0,0.0,2178.0,11.0,False,1
734617428932624386,nxpi,2016-05-23 05:30:00,nxp semiconductors nv reiterated rating jefferies co ranked 20 buy nxpi,0.0,0.0,558.0,45.0,False,1
734314745717612544,nxpi,2016-05-22 09:27:00,nxpi change see greater nxpi tna sdrl,0.0,0.0,37.0,40.0,False,1
734278760082460672,nxpi,2016-05-22 07:04:00,boh news see greater boh nxpi nsr,0.0,0.0,46.0,40.0,False,1
734176456415186946,nxpi,2016-05-22 00:18:00,ahgp stock forum see greater ahgp nxpi ipgp,0.0,0.0,37.0,40.0,False,1
734168959050743809,nxpi,2016-05-21 23:48:00,rt nuan last price see greater nuan bns nxpi,0.0,1.0,49.0,4.0,True,1
734167409012002816,nxpi,2016-05-21 23:42:00,nuan last price see greater nuan bns nxpi,0.0,1.0,36.0,39.0,False,1
734134838173655042,nxpi,2016-05-21 21:32:00,nxpi sum put oi equals 1503 sum call oi equals 1748 callputratio equals 0.86 expiration bullish,0.0,0.0,958.0,8.0,False,1
734091575442083841,nxpi,2016-05-21 18:40:00,cgnh ask see greater cgnh cvco nxpi,0.0,0.0,45.0,20.0,False,1
734079198529130496,nxpi,2016-05-21 17:51:00,nxpi oi maturity 55.00 highest put 78.00 highest call bearish,0.0,0.0,959.0,8.0,False,1
734025467531919360,nxpi,2016-05-21 14:18:00,nxpi max pain equals 83.50 maturity equals previous close equals 88.39 bearish,0.0,0.0,957.0,8.0,False,1
734021722010161152,nxpi,2016-05-21 14:03:00,daily updated synthesis nxpi,0.0,0.0,1046.0,54.0,False,1
734002842906697728,nxpi,2016-05-21 12:48:00,large call selling,1.0,0.0,4724.0,2551.0,False,0
733961027642138624,nxpi,2016-05-21 10:01:00,weekly nasdaq100 trend ctsh lltc tmus amat chtr nxpi qcom incy csco wfm ntes nvda txn,0.0,0.0,859.0,7.0,False,1
733822877137567745,nxpi,2016-05-21 00:53:00,nxpi analyst action clsa nxp semiconductors,0.0,0.0,286.0,0.0,False,1
733814751826968576,nxpi,2016-05-21 00:20:00,nxpi chart beauty happy action alerts subscriber feel better jim,0.0,0.0,11.0,48.0,False,0
733800167418265600,nxpi,2016-05-20 23:22:00,well heres example nxpi nice move higher looks good higher prices bb opening up,2.0,0.0,3675.0,243.0,False,1
733798780315795459,nxpi,2016-05-20 23:17:00,stochastic ob,0.0,0.0,4724.0,2552.0,False,1
733794957631336448,nxpi,2016-05-20 23:02:00,nasdaq100 trend amat qcom chtr nxpi lltc tmus wfm incy ctsh csco ntes txn nvda adbe alxn,0.0,0.0,858.0,7.0,False,0
733755414836318209,nxpi,2016-05-20 20:24:00,rt “the price crude got ahead aapl tbt tlt nxpi oil ung uso,0.0,3.0,1698.0,0.0,True,1
733755188863979521,nxpi,2016-05-20 20:24:00,rt “the price crude got ahead aapl tbt tlt nxpi oil ung uso,0.0,3.0,930.0,1083.0,True,1
733754839604330497,nxpi,2016-05-20 20:22:00,rt “the price crude got ahead aapl tbt tlt nxpi oil ung uso,0.0,3.0,13557.0,902.0,True,1
733752226674577408,nxpi,2016-05-20 20:12:00,twtr swir dip buyers going higher small cap mtsl insider buying kerx buyers nxpi still long,0.0,0.0,1257.0,301.0,False,0
733749137972154368,nxpi,2016-05-20 20:00:00,“the price crude got ahead aapl tbt tlt nxpi oil ung uso,0.0,3.0,6475.0,5113.0,False,1
733749050873413632,nxpi,2016-05-20 19:59:00,nasdaq100 trend amat qcom nxpi wfm lltc chtr tmus incy csco ctsh ntes txn nvda bmrn vod,0.0,0.0,858.0,7.0,False,0
733743035671031809,nxpi,2016-05-20 19:35:00,nxp semiconductors nv nxpi receives consensus recommendation “buy” brokerages,0.0,0.0,1038.0,11.0,False,0
733743032714006530,nxpi,2016-05-20 19:35:00,nxp semiconductors nv nxpi receives consensus recommendation “buy” brokerages,0.0,0.0,1038.0,11.0,False,1
733742882595741696,nxpi,2016-05-20 19:35:00,nxp semiconductors nv nxpi receives consensus recommendation “buy” brokerages,0.0,0.0,6285.0,2292.0,False,1
733742876966981632,nxpi,2016-05-20 19:35:00,nxp semiconductors nv nxpi receives consensus recommendation “buy” brokerages,0.0,0.0,6285.0,2292.0,False,1
733738572893851648,nxpi,2016-05-20 19:18:00,nxpi analyst action clsa nxp semiconductors,0.0,0.0,287.0,0.0,False,1
733736260611772420,nxpi,2016-05-20 19:08:00,nxp semiconductors nv nxpi shares bought independent portfolio consultants inc,0.0,0.0,499.0,6.0,False,1
733736189392527360,nxpi,2016-05-20 19:08:00,nxp semiconductors nv nxpi shares bought independent portfolio consultants inc,0.0,0.0,1148.0,58.0,False,0
733730193462939649,nxpi,2016-05-20 18:44:00,investorslive4 u cmlviz rt ophirgottlieb nxpi ripping since market bottom feb 9,0.0,0.0,1321.0,1193.0,False,1
733725912408195073,nxpi,2016-05-20 18:27:00,cmlviz rt ophirgottlieb nxpi ripping since market bottom feb 9,0.0,0.0,1462.0,1006.0,False,0
733724449778753536,nxpi,2016-05-20 18:21:00,rt nxpi ripping since market bottom feb 9,0.0,1.0,2087.0,40.0,True,0
733723867533873152,nxpi,2016-05-20 18:19:00,nxpi ripping since market bottom feb 9,0.0,1.0,10248.0,98.0,False,1
733686328039211009,nxpi,2016-05-20 15:50:00,volume alert nxpi 88.04 nxp semiconductors nxpi hit high today 88.80 closing day 9 88.04 positive 1,0.0,0.0,757.0,448.0,False,0
733676314603835393,nxpi,2016-05-20 15:10:00,scan clrb gale amat hban ioc keys wmt spgi bsft eght cb lpl mkto kerx tasr ntes etfc mon nxpi aig nvda tmus low,1.0,0.0,1885.0,722.0,False,1
733670247237050368,nxpi,2016-05-20 14:46:00,rt another strong day semis nxpi slowly climbing higher,0.0,1.0,11388.0,247.0,True,0
733665328958410753,nxpi,2016-05-20 14:26:00,call put highest percent volume changes calls dow rsx mgm oil nxpi puts xlf jblu vlo mdlz tna,0.0,0.0,15119.0,2921.0,False,1
733656336076955649,nxpi,2016-05-20 13:51:00,another strong day semis nxpi slowly climbing higher,7.0,1.0,16937.0,164.0,False,1
733641501218066433,nxpi,2016-05-20 12:52:00,92795 shares nxp semiconductors nv nxpi acquired howard capital management,0.0,0.0,400.0,10.0,False,1
733640973285265408,nxpi,2016-05-20 12:50:00,rt credit suisse reiterates “buy” rating nxp semiconductors nv nxpi,0.0,1.0,289.0,701.0,True,1
733640946462625792,nxpi,2016-05-20 12:50:00,rt nxpi pennystocksweekly sees nxpi hitting 195.7438 9 months yahoo finance message boards,0.0,1.0,289.0,701.0,True,1
733635901251706880,nxpi,2016-05-20 12:30:00,nxpi pennystocksweekly sees nxpi hitting 195.7438 9 months yahoo finance message boards,0.0,1.0,5717.0,4578.0,False,1
733634232644423680,nxpi,2016-05-20 12:23:00,credit suisse reiterates “buy” rating nxp semiconductors nv nxpi,0.0,1.0,745.0,8.0,False,1
733633080003547136,nxpi,2016-05-20 12:18:00,credit suisse reiterates “buy” rating nxp semiconductors nv nxpi,0.0,0.0,400.0,10.0,False,1
733605444372049920,nxpi,2016-05-20 10:29:00,nxpi analyst action clsa nxp semiconductors,0.0,0.0,284.0,0.0,False,1
733598635057762304,nxpi,2016-05-20 10:01:00,weekly nasdaq100 trend nvda chtr qcom nxpi vod csco incy ctsh ntes tmus tsla lltc wfm,0.0,0.0,857.0,7.0,False,1
733497767503351808,nxpi,2016-05-20 03:21:00,wedge maybe nxpi,0.0,0.0,4281.0,4.0,False,1
733451997282598912,nxpi,2016-05-20 00:19:00,prefer nvda nxpi,0.0,0.0,43.0,278.0,False,1
733441374280929280,nxpi,2016-05-19 23:37:00,bearish harami,0.0,0.0,4722.0,2553.0,False,1
733432562207588353,nxpi,2016-05-19 23:02:00,nasdaq100 trend nvda chtr qcom nxpi vod csco ctsh incy tmus ntes tsla lltc wfm bmrn symc,1.0,0.0,857.0,7.0,False,0
733431667663069184,nxpi,2016-05-19 22:58:00,announces best supplier awards read,0.0,0.0,61.0,3.0,False,1
733427017962643456,nxpi,2016-05-19 22:40:00,rt usdot adds nxp contactless technology smart city challenge read blog,0.0,1.0,947.0,0.0,True,1
733426688437026816,nxpi,2016-05-19 22:38:00,usdot adds nxp contactless technology smart city challenge read blog,0.0,1.0,61.0,3.0,False,1
733420292064714753,nxpi,2016-05-19 22:13:00,nxpi nxp semiconductors announces best supplier awards,0.0,0.0,20.0,39.0,False,1
733399270351601664,nxpi,2016-05-19 20:49:00,research analysts’ recent ratings changes nxp semiconductors nv nxpi,0.0,0.0,970.0,0.0,False,1
733398193862520832,nxpi,2016-05-19 20:45:00,research analysts’ recent ratings changes nxp semiconductors nv nxpi,0.0,0.0,1037.0,11.0,False,0
733397999892619264,nxpi,2016-05-19 20:44:00,research analysts’ recent ratings changes nxp semiconductors nv nxpi,0.0,0.0,6278.0,2292.0,False,1
733394313934077952,nxpi,2016-05-19 20:30:00,feel secure fortinet growth portfolio,0.0,0.0,3593.0,30.0,False,0
733386817425297408,nxpi,2016-05-19 20:00:00,rt nasdaq100 trend chtr nvda qcom nxpi vod csco ctsh incy tsla tmus symc ulta csx ca ea,0.0,1.0,881.0,2.0,True,1
733386652723388418,nxpi,2016-05-19 19:59:00,nasdaq100 trend chtr nvda qcom nxpi vod csco ctsh incy tsla tmus symc ulta csx ca ea,0.0,1.0,857.0,7.0,False,0
733382606058717184,nxpi,2016-05-19 19:43:00,nxpi yield see greater nxpi gkos fun,0.0,0.0,36.0,40.0,False,1
733370374243639297,nxpi,2016-05-19 18:54:00,call put highest percent volume changes calls cst ftr mgm adbe sco puts shld nxpi afl ypf,0.0,0.0,15120.0,2921.0,False,1
733346043962793985,nxpi,2016-05-19 17:18:00,nxp focuses smart cities security keynote read,0.0,0.0,61.0,3.0,False,1
733341464168681472,nxpi,2016-05-19 17:00:00,rt nxpi keynote,0.0,1.0,10932.0,1767.0,True,1
733333926349918208,nxpi,2016-05-19 16:30:00,nxp increases notes issue usd 1.75 billion read,0.0,0.0,61.0,3.0,False,1
733333151418875904,nxpi,2016-05-19 16:27:00,nxpi analyst action clsa nxp semiconductors,0.0,0.0,285.0,0.0,False,0
733329424989310976,nxpi,2016-05-19 16:12:00,nxpi keynote,1.0,1.0,205.0,87.0,False,0
733324228523614208,nxpi,2016-05-19 15:51:00,nasdaq100 trend csco chtr nvda nxpi qcom incy vod ctsh symc ntes tsla tmus bmrn ea atvi,0.0,0.0,858.0,7.0,False,1
733322679982391296,nxpi,2016-05-19 15:45:00,credit agricole begins coverage nxp semiconductors nv nxpi,0.0,0.0,745.0,8.0,False,1
733281569645858816,nxpi,2016-05-19 13:02:00,new platform pushes autonomous cars closer production read,0.0,0.0,60.0,3.0,False,1
733281071463174145,nxpi,2016-05-19 13:00:00,google takes amazon hp makes big 3 days printing claims,0.0,0.0,3593.0,30.0,False,1
733261036472569856,nxpi,2016-05-19 11:40:00,nxpi nxp semiconductors nv kurtosis 1.44 skew 0.24 correlation histogram,0.0,0.0,3216.0,3339.0,False,1
733257025874845697,nxpi,2016-05-19 11:24:00,blcm current price see greater blcm grnh nxpi,0.0,0.0,38.0,20.0,False,1
733256916730712064,nxpi,2016-05-19 11:24:00,sa volume see greater sa fult nxpi,0.0,0.0,42.0,40.0,False,1
733250232050388998,nxpi,2016-05-19 10:57:00,nxp semiconductors nv nxpi stake boosted first financial corp,0.0,0.0,2171.0,11.0,False,1
733249694789455872,nxpi,2016-05-19 10:55:00,rt seekingalpha buy chipotle under dollars 40 cramers lightning round,0.0,0.0,8607.0,4.0,False,1
733248380919549953,nxpi,2016-05-19 10:50:00,seekingalpha buy chipotle under dollars 40 cramers lightning round,0.0,0.0,1467.0,1006.0,False,1
733240803460452352,nxpi,2016-05-19 10:20:00,trading rules discipline staying strong,0.0,0.0,599.0,8.0,False,1
733240670169628672,nxpi,2016-05-19 10:19:00,report foreign issuer rules 13 16 15 days 16,0.0,0.0,310.0,27.0,False,1
733240047281930240,nxpi,2016-05-19 10:17:00,paa bid see greater paa nxpi ceo,0.0,0.0,38.0,20.0,False,1
733236236706549762,nxpi,2016-05-19 10:01:00,weekly nasdaq100 trend nvda incy regn vod chtr qcom nxpi ctsh bmrn alxn lltc txn ntes ca,0.0,0.0,858.0,7.0,False,1
733233557838123008,nxpi,2016-05-19 09:51:00,nxp semiconductors nv’s nxpi buy rating reaffirmed credit suisse,0.0,0.0,1034.0,11.0,False,0
733233389709492225,nxpi,2016-05-19 09:50:00,nxp semiconductors nv’s nxpi buy rating reaffirmed credit suisse,0.0,0.0,6277.0,2292.0,False,1
733220821661949952,nxpi,2016-05-19 09:00:00,nxp launches autonomous vehicle platform amid chinese market boom read,0.0,0.0,60.0,3.0,False,0
733198047862239232,nxpi,2016-05-19 07:30:00,nxp semiconductors nv nxpi earns “buy” rating jefferies group,0.0,0.0,495.0,6.0,False,1
733197798833848320,nxpi,2016-05-19 07:29:00,nxp semiconductors nv nxpi earns “buy” rating jefferies group,0.0,0.0,1140.0,58.0,False,1
733184579763326976,nxpi,2016-05-19 06:36:00,nxp semiconductors nv nxpi shares up 2.9 percent,0.0,0.0,1034.0,11.0,False,0
733184315971018753,nxpi,2016-05-19 06:35:00,nxp semiconductors nv nxpi shares up 2.9 percent,0.0,0.0,6278.0,2292.0,False,1
733153214699298816,nxpi,2016-05-19 04:32:00,nxpi analyst action clsa nxp semiconductors,0.0,0.0,284.0,0.0,False,1
733124917340708865,nxpi,2016-05-19 02:39:00,nxpi last trade see greater nxpi rvlt nath,0.0,0.0,62.0,40.0,False,1
733094703608922112,nxpi,2016-05-19 00:39:00,flt quotes see greater flt nvee nxpi,0.0,0.0,49.0,40.0,False,1
733082987483398144,nxpi,2016-05-18 23:52:00,nxpi nxp semi sub prices offering senior notes,1.0,0.0,17987.0,3402.0,False,0
733069991226966016,nxpi,2016-05-18 23:01:00,nxp announces pricing senior unsecured notes offering read,0.0,0.0,60.0,3.0,False,1
733055224005300224,nxpi,2016-05-18 22:02:00,brief prices senior unsecured notes read,0.0,0.0,60.0,3.0,False,1
733052388639039488,nxpi,2016-05-18 21:51:00,nxpi nxp announces pricing senior unsecured notes offering,0.0,0.0,15.0,39.0,False,1
733049992533827584,nxpi,2016-05-18 21:41:00,5.18.16 watchlist long bpop nxpi ccl jazz short hcp,0.0,0.0,11.0,24.0,False,0
733042913542852609,nxpi,2016-05-18 21:13:00,rt nxp prices bond offering increasing deal dollars 50 million dollars .75 billion,0.0,1.0,1298.0,4818.0,True,1
733042882941177858,nxpi,2016-05-18 21:13:00,nxp prices bond offering increasing deal dollars 50 million dollars .75 billion,0.0,1.0,8278.0,990.0,False,1
733032808357220352,nxpi,2016-05-18 20:33:00,seekingalpha feel secure fortinet growth portfolio,0.0,0.0,1457.0,1006.0,False,1
733030195226136576,nxpi,2016-05-18 20:23:00,rt seekingalpha feel secure fortinet growth portfolio,0.0,0.0,8606.0,4.0,False,0
733030138888257536,nxpi,2016-05-18 20:22:00,saquickideas feel secure fortinet growth portfolio,0.0,0.0,1519.0,1422.0,False,0
733029597185368064,nxpi,2016-05-18 20:20:00,feel secure fortinet growth portfolio,0.0,0.0,3588.0,30.0,False,1
733018925366120448,nxpi,2016-05-18 19:38:00,franklin street advisors inc nc sells 2509 shares nxp semiconductors nv nxpi,0.0,0.0,963.0,0.0,False,1
733015923703959552,nxpi,2016-05-18 19:26:00,nxp ceo layoffs continue reduce redundancies mega tech merger read,0.0,0.0,59.0,3.0,False,1
733013903722971136,nxpi,2016-05-18 19:18:00,nxp siemens demonstrate smart mobility austin read,0.0,0.0,59.0,3.0,False,0
733012565303922688,nxpi,2016-05-18 19:13:00,nxpi start paying dividends 2017 good idea maybe not,0.0,0.0,1007.0,1216.0,False,1
733011884400467968,nxpi,2016-05-18 19:10:00,brief nxp announces launch senior unsecured notes offering read,0.0,0.0,59.0,3.0,False,0
733011418442686464,nxpi,2016-05-18 19:08:00,riddle nv pay dividends read,0.0,0.0,59.0,3.0,False,1
733009329192853505,nxpi,2016-05-18 19:00:00,rt nxp semi smart diversify nxpi,0.0,1.0,861.0,6.0,True,1
733009013965611008,nxpi,2016-05-18 18:59:00,nxpi start paying dividends 2017 good idea maybe not,0.0,0.0,1007.0,1216.0,False,1
733008282978115584,nxpi,2016-05-18 18:56:00,nxp semi smart diversify nxpi,0.0,1.0,13518.0,188.0,False,0
733005825581572096,nxpi,2016-05-18 18:46:00,instant analysis n v took big step driverless cars read,0.0,0.0,59.0,3.0,False,0
732999276637360129,nxpi,2016-05-18 18:20:00,nxp semiconductors nv’s nxpi “buy” rating reiterated credit suisse,0.0,0.0,1033.0,11.0,False,1
732998902710931456,nxpi,2016-05-18 18:18:00,nxp semiconductors nv’s nxpi “buy” rating reiterated credit suisse,0.0,0.0,6278.0,2292.0,False,1
732989339442024448,nxpi,2016-05-18 17:40:00,nxpi rising,0.0,0.0,10218.0,98.0,False,1
732987653923033089,nxpi,2016-05-18 17:34:00,riddle nv pay dividends read,0.0,0.0,59.0,3.0,False,1
732986875842056195,nxpi,2016-05-18 17:31:00,nxpi 1 million runaway 7 positive 3 percent .1 percent offhi news alltfs tlm 0.9 ilm 1.0 1 week hi dyvol 2.08 million 0.9 times 0.5 times dyrng 3.4 percent 1.8 times 1.4 times potlong,0.0,0.0,6750.0,271.0,False,1
732982856754987008,nxpi,2016-05-18 17:15:00,nxp semiconductors nv reiterated rating credit suisse ranked 27 buy nxpi,0.0,0.0,558.0,45.0,False,1
732982151205949440,nxpi,2016-05-18 17:12:00,scan cvo plpm ande saas mzor dgaz dust jdst cslt nxtd lnc ccxi rf mck nxpi sti bk atvi low nvda vod fnfg zayo fivn,0.0,0.0,1883.0,722.0,False,0
732981947010519040,nxpi,2016-05-18 17:11:00,nxp semiconductors nvs buy rating reiterated credit suisse,0.0,0.0,4563.0,2838.0,False,0
732980619278450688,nxpi,2016-05-18 17:06:00,nxp semiconductors nvs buy rating reiterated credit suisse,0.0,0.0,4183.0,0.0,False,1
732969014859702272,nxpi,2016-05-18 16:20:00,nxp builds computer engine self driving cars read,0.0,0.0,59.0,3.0,False,0
732965273725243394,nxpi,2016-05-18 16:05:00,analog devices soft third quarter guidance prove apples iphone 7 cut adi aapl nxpi swks qrvo avgo,0.0,0.0,252.0,74.0,False,1
732961956450185217,nxpi,2016-05-18 15:52:00,nxpi 1 million runaway 4 positive 3 percent .1 percent offhi news alltfs tlm 2.3 ilm 1.2 1 week hi dyvol 1.32 million 0.6 times 0.3 times dyrng 3.4 percent 1.8 times 1.4 times potlong,0.0,0.0,6750.0,271.0,False,1
732954793241645056,nxpi,2016-05-18 15:23:00,analysts bullish top technology picks nxpi,0.0,0.0,457.0,213.0,False,1
732952830064136193,nxpi,2016-05-18 15:15:00,nxp semiconductors nv nxpi earns buy rating jefferies group,0.0,0.0,741.0,8.0,False,1
732952828776435712,nxpi,2016-05-18 15:15:00,nxp semiconductors nv nxpi covered credit agricole,0.0,0.0,741.0,8.0,False,0
732941369904271360,nxpi,2016-05-18 14:30:00,nxp announces launch senior unsecured notes offering read,0.0,0.0,59.0,3.0,False,1
732941301667221504,nxpi,2016-05-18 14:29:00,call put highest percent volume changes calls nxpi eog xbi panw amd puts mfrm cog vale pep ko,0.0,0.0,15116.0,2921.0,False,1
732940903929647106,nxpi,2016-05-18 14:28:00,nxp announces launch senior unsecured notes offering read,0.0,0.0,59.0,3.0,False,0
732939921770471424,nxpi,2016-05-18 14:24:00,free tip today nxpi up greater 3 percent,0.0,0.0,13172.0,14455.0,False,0
732939058662539264,nxpi,2016-05-18 14:21:00,nxpi 3 million runaway 1 positive 3 percent .2 percent offhi news accel alltfs tlm 1.7 ilm 1.6 1 week hi dyvol 488 0.2 times 0.1 times dyrng 3.1 percent 1.6 times 1.3 times,0.0,0.0,6750.0,271.0,False,1
732938878378741760,nxpi,2016-05-18 14:20:00,rt nxpi coming range one stronger semis late,0.0,2.0,49.0,104.0,True,1
732938581996527616,nxpi,2016-05-18 14:19:00,rt nxpi coming range one stronger semis late,0.0,2.0,13616.0,7601.0,True,1
732938511431704576,nxpi,2016-05-18 14:18:00,nxpi coming range one stronger semis late,2.0,2.0,42295.0,309.0,False,1
732937907149938689,nxpi,2016-05-18 14:16:00,nxp semiconductors launches dollars b bond offering repay term debt refi freescale 5 percent notes,0.0,0.0,8278.0,990.0,False,1
732936917201735680,nxpi,2016-05-18 14:12:00,semiconductors perking up today look nxpi example,0.0,0.0,16923.0,164.0,False,1
732933584638611456,nxpi,2016-05-18 13:59:00,rt nxpi stifel financial corp raises stake nxp semiconductors nv,0.0,1.0,291.0,701.0,True,1
732931316052725762,nxpi,2016-05-18 13:50:00,rt rainy days long trade ideas watchlist nxpi pot rrc wynn yelp yhoo,0.0,2.0,7041.0,464.0,True,0
732925990683299840,nxpi,2016-05-18 13:29:00,raise usd 1 bln debt refinancing read,0.0,0.0,59.0,3.0,False,0
