Tweet Id,Ticker,Datetime,Text,Favs,RTs,Followers,Following,Is a RT,Sentiment
727512668874010625,nxpi,2016-05-03 14:58:00,amba nxpi swks tech getting slammed recently money going,0.0,0.0,3.0,31.0,False,0
727503024059502592,nxpi,2016-05-03 14:20:00,nxpi stock sale today dollars 4.98 1.36 im going shopping pfe nice results added today,0.0,0.0,109.0,556.0,False,0
727494065068105729,nxpi,2016-05-03 13:44:00,nxp semiconductors nv’s nxpi strong buy rating reaffirmed needham company llc,0.0,0.0,360.0,10.0,False,1
727490744768974849,nxpi,2016-05-03 13:31:00,nxp demonstrates security enhancement icode high frequency smart label products rfid journal 2016 nxpi,0.0,0.0,454.0,260.0,False,1
727350733545197569,nxpi,2016-05-03 04:15:00,nxpi volume see greater nxpi ssri vlo,0.0,0.0,38.0,41.0,False,1
727325069089734658,nxpi,2016-05-03 02:33:00,nati current price see greater nati nxpi htz,0.0,0.0,34.0,40.0,False,0
727269094802628610,nxpi,2016-05-02 22:50:00,yy ex div date see greater yy rgen nxpi,0.0,0.0,43.0,40.0,False,1
727268781135900673,nxpi,2016-05-02 22:49:00,nr7 stocks,0.0,0.0,4620.0,2578.0,False,1
727266293158531072,nxpi,2016-05-02 22:39:00,iot evolution taking processing analytics edge read blog,1.0,0.0,52.0,3.0,False,0
727243660144705537,nxpi,2016-05-02 21:09:00,jefferies adds 2 high profile stocks franchise picks list hain nxpi,0.0,0.0,2630.0,2958.0,False,1
727222060993372160,nxpi,2016-05-02 19:43:00,morgan stanley reaffirms buy rating nxp semiconductors nv nxpi,0.0,0.0,355.0,10.0,False,1
727218570770440192,nxpi,2016-05-02 19:29:00,canaccord genuity reaffirms buy rating nxp semiconductors nv nxpi,0.0,0.0,710.0,8.0,False,0
727214304970330112,nxpi,2016-05-02 19:12:00,nxp semiconductors nv nxpi earns “strong buy” rating needham company llc,0.0,0.0,1135.0,40.0,False,1
727206409276788736,nxpi,2016-05-02 18:41:00,epd filings see greater epd apdn nxpi,0.0,0.0,46.0,59.0,False,0
727190166528512000,nxpi,2016-05-02 17:37:00,someone explain divergence aapl suppliers crus nxpi swks apple largest customer sucks,0.0,0.0,304.0,532.0,False,1
727187658733047808,nxpi,2016-05-02 17:27:00,uthr message board posts see greater uthr nxpi efx,0.0,0.0,39.0,20.0,False,1
727183928491020288,nxpi,2016-05-02 17:12:00,nxpi mentioned earlier gap fill took place friday looks good far,0.0,0.0,442.0,67.0,False,0
727180238136872961,nxpi,2016-05-02 16:57:00,nxpi semiconductors nv strong perspectives merger processed,0.0,0.0,3799.0,3628.0,False,0
727177700868239360,nxpi,2016-05-02 16:47:00,rt nxp semiconductors nv nxpi rating reiterated oppenheimer,0.0,1.0,107.0,556.0,True,1
727173592107065344,nxpi,2016-05-02 16:31:00,rt one hit dollars 00 first svxy nxpi,0.0,1.0,29897.0,33112.0,True,1
727172532235726849,nxpi,2016-05-02 16:26:00,one hit dollars 00 first svxy nxpi,0.0,1.0,228.0,768.0,False,1
727154454361952256,nxpi,2016-05-02 15:15:00,nxp semiconductors nv nxpi rating reiterated oppenheimer,1.0,1.0,355.0,10.0,False,1
727150732697325573,nxpi,2016-05-02 15:00:00,strategic financial services inc acquires 449 shares nxp semiconductors nv nxpi,0.0,0.0,917.0,0.0,False,0
727134927863582720,nxpi,2016-05-02 13:57:00,8 years old pic ii c behind spy vxx aapl gild f baba nxpi,0.0,0.0,6461.0,5096.0,False,1
727132643029057537,nxpi,2016-05-02 13:48:00,south state corp purchases 1225 shares nxp semiconductors nv nxpi,0.0,0.0,6219.0,2295.0,False,1
727095308753084416,nxpi,2016-05-02 11:20:00,nxpi financials see greater nxpi slb pbf,1.0,0.0,46.0,40.0,False,1
727052393389522945,nxpi,2016-05-02 08:29:00,skul ex div date see greater skul nxpi rrgb,0.0,0.0,52.0,40.0,False,1
727031643278561280,nxpi,2016-05-02 07:07:00,nxpi 3 reasons nxp semiconductors nv great value play motley fool,2.0,0.0,105.0,556.0,False,1
727027820820594688,nxpi,2016-05-02 06:51:00,nxpi merkels dollars .4 billion german e car push boosts infineon stmicro strong buy,1.0,0.0,105.0,556.0,False,1
727018124038541312,nxpi,2016-05-02 06:13:00,nxp semiconductors nv’s nxpi “buy” rating reaffirmed jefferies group,0.0,0.0,357.0,10.0,False,1
726973241164713986,nxpi,2016-05-02 03:15:00,rt xlf filings see greater xlf nxpi ctb,0.0,1.0,146.0,206.0,True,1
726898756319219712,nxpi,2016-05-01 22:19:00,xlf filings see greater xlf nxpi ctb,0.0,1.0,32.0,40.0,False,1
726725202588123139,nxpi,2016-05-01 10:49:00,nxp semiconductors nv nxpi receives average rating “buy” brokerages,0.0,0.0,1002.0,11.0,False,0
726724744222007296,nxpi,2016-05-01 10:47:00,nxp semiconductors nv nxpi receives average rating “buy” brokerages,0.0,0.0,6208.0,2295.0,False,0
726701580674691074,nxpi,2016-05-01 09:15:00,rt nxp semiconductors oppenheimer makes third buy rating nxpi,0.0,1.0,28.0,23.0,True,1
726688240942612481,nxpi,2016-05-01 08:22:00,jefferies group comments nxp semiconductors nv’s second quarter 2016 earnings nxpi,0.0,0.0,715.0,8.0,False,1
726599192152408064,nxpi,2016-05-01 02:28:00,analyst upgrades price target increases,0.0,0.0,4603.0,2582.0,False,1
726581900203057152,nxpi,2016-05-01 01:19:00,turn 💲500 💲5000💥 join ⤵ 📧 pennystockhotline com nxpi jblu fcx,0.0,0.0,2287.0,4999.0,False,1
726476283106881537,nxpi,2016-04-30 18:20:00,commented nxp semiconductors minor disappointment hidden upside,0.0,0.0,614.0,915.0,False,0
726445149849526273,nxpi,2016-04-30 16:16:00,rt seekingalpha nxp semiconductors minor disappointment hidden upside,0.0,0.0,8604.0,4.0,False,1
726443531301208064,nxpi,2016-04-30 16:10:00,nxp semiconductors minor disappointment hidden upside nxpi,0.0,0.0,374.0,588.0,False,0
726442684043259908,nxpi,2016-04-30 16:06:00,nxp semiconductors minor disappointment hidden upside,0.0,0.0,3521.0,32.0,False,0
726339723015426048,nxpi,2016-04-30 09:17:00,q2 2016 eps estimates nxp semiconductors nv lowered jefferies group nxpi,0.0,0.0,1001.0,11.0,False,1
726339193165758464,nxpi,2016-04-30 09:15:00,q2 2016 eps estimates nxp semiconductors nv lowered jefferies group nxpi,0.0,0.0,6209.0,2295.0,False,1
726306717210927104,nxpi,2016-04-30 07:06:00,nxp semiconductors nv nxpi sees large volume increase analyst upgrade,0.0,0.0,918.0,0.0,False,1
726306575573508096,nxpi,2016-04-30 07:05:00,nxp semiconductors nv nxpi sees large volume increase analyst upgrade,0.0,0.0,714.0,8.0,False,1
726206044884574208,nxpi,2016-04-30 00:26:00,dal idea tapped manufacture rfid chips motorola nxpi 50 million may industry standard,0.0,0.0,730.0,614.0,False,1
726199986619305984,nxpi,2016-04-30 00:02:00,nxpi laugh,0.0,0.0,441.0,67.0,False,0
726191667993272320,nxpi,2016-04-29 23:29:00,1234 bullish,0.0,0.0,4604.0,2583.0,False,0
726178786581090304,nxpi,2016-04-29 22:38:00,rt friday top analyst upgrades downgrades point 2 gain gnc gw krc moh mplx nxpi oii srcl tpx ugi int,0.0,1.0,1345.0,476.0,True,1
726177774558449665,nxpi,2016-04-29 22:34:00,nxp semiconductors nv nxpi sees strong trading volume analyst upgrade,0.0,0.0,1000.0,11.0,False,1
726165314447261697,nxpi,2016-04-29 21:44:00,nxpi,0.0,0.0,50.0,145.0,False,1
726134653078241280,nxpi,2016-04-29 19:42:00,analyst upgrades price target increases,0.0,0.0,4602.0,2583.0,False,1
726131182551851008,nxpi,2016-04-29 19:28:00,jefferies group equities analysts decrease earnings estimates nxp semiconductors nv nxpi,0.0,0.0,1134.0,40.0,False,0
726121273282027520,nxpi,2016-04-29 18:49:00,nxpi fills post earnings gap up,0.0,0.0,976.0,195.0,False,0
726114410314354688,nxpi,2016-04-29 18:22:00,3 reasons nxp semiconductors nxpi great value play,2.0,0.0,1076.0,535.0,False,1
726113190417936384,nxpi,2016-04-29 18:17:00,nxp semiconductors nv nxpi stock rating reaffirmed canaccord genuity,0.0,0.0,1134.0,40.0,False,0
726113187666513920,nxpi,2016-04-29 18:17:00,drexel hamilton raises nxp semiconductors nv nxpi price target dollars 15.00,0.0,0.0,1134.0,40.0,False,0
726112615081082880,nxpi,2016-04-29 18:15:00,nxp semiconductors nv nxpi stock rating reaffirmed morgan stanley,0.0,0.0,719.0,8.0,False,1
726112613206204417,nxpi,2016-04-29 18:15:00,nxp semiconductors nv nxpi stock rating reaffirmed needham company llc,0.0,0.0,719.0,8.0,False,1
726112611255869443,nxpi,2016-04-29 18:15:00,nxp semiconductors nv nxpi stock rating reaffirmed needham company llc,0.0,0.0,719.0,8.0,False,1
726112605996208128,nxpi,2016-04-29 18:15:00,nxp semiconductors nv nxpi earns “outperform” rating oppenheimer,0.0,0.0,719.0,8.0,False,1
726112604163346433,nxpi,2016-04-29 18:15:00,nxp semiconductors nv nxpi earns “outperform” rating oppenheimer,0.0,0.0,719.0,8.0,False,1
726112270078476288,nxpi,2016-04-29 18:13:00,amazing day another 10 trading idea laid pre market nailed amzn lnkd prgn sdrl p vrx syna shpg true nxpi,0.0,0.0,5709.0,45.0,False,1
726111687108136961,nxpi,2016-04-29 18:11:00,topeka capital markets lowers nxp semiconductors nv nxpi price target dollars 0.00,0.0,0.0,1001.0,11.0,False,0
726111066737020928,nxpi,2016-04-29 18:09:00,topeka capital markets lowers nxp semiconductors nv nxpi price target dollars 0.00,0.0,0.0,6209.0,2295.0,False,1
726109905002729472,nxpi,2016-04-29 18:04:00,nxpi gets franchise tag jeffries tp dollars 30,0.0,0.0,976.0,195.0,False,1
726107418741067776,nxpi,2016-04-29 17:54:00,nxpi strong negative traded positive 42 early quickly turned mess negative 2.64,0.0,0.0,16.0,0.0,False,1
726106327185936384,nxpi,2016-04-29 17:50:00,nxpi filled gap remember beat er,0.0,0.0,441.0,67.0,False,1
726097774450626560,nxpi,2016-04-29 17:16:00,analyst upgrades price target increases,0.0,0.0,4605.0,2583.0,False,1
726092676794298368,nxpi,2016-04-29 16:55:00,baird financial group inc dollars 922000 position nxp semiconductors nv nxpi,0.0,0.0,349.0,10.0,False,1
726085591419465728,nxpi,2016-04-29 16:27:00,skyworks third quarter guidance lags dollars 0 million petering apple iphone demand swks aapl qrvo avgo nxpi invn qcom,0.0,0.0,244.0,76.0,False,0
726081149055864832,nxpi,2016-04-29 16:10:00,rt 5 6 gained srcl p long short mdca long nxpi long small loss bxlt cut early amazing team in…,0.0,1.0,5709.0,45.0,True,1
726079393131585536,nxpi,2016-04-29 16:03:00,5 6 gained srcl p long short mdca long nxpi long small loss bxlt cut early amazing team room,1.0,1.0,574.0,1999.0,False,1
726078935327342592,nxpi,2016-04-29 16:01:00,analyst upgrades price target increases,0.0,0.0,4607.0,2583.0,False,1
726067898968608768,nxpi,2016-04-29 15:17:00,volume alert nxpi 84.19 nxp semiconductors nxpi hit high today 86.42 closing day 0 84.19 1,0.0,0.0,744.0,448.0,False,1
726066651137896448,nxpi,2016-04-29 15:12:00,rt dollars 900 net p l srsly best trade room big board stocks bar none glbs mdca nxpi srcl uvxy …,0.0,1.0,5709.0,45.0,True,1
726064394602303488,nxpi,2016-04-29 15:03:00,dollars 900 net p l srsly best trade room big board stocks bar none glbs mdca nxpi srcl uvxy,1.0,1.0,149.0,111.0,False,1
726059853915934721,nxpi,2016-04-29 14:45:00,short puts uvxy nxpi fb bidu no bid collected full credit 100 percent total 9.9 thousand sick week enjoy weekend everyone bam🎉💰,1.0,0.0,2287.0,63.0,False,1
726055607292321792,nxpi,2016-04-29 14:28:00,nxp semiconductors nv nxpi point raised dollars 30.00 jefferies group,0.0,0.0,919.0,0.0,False,1
726051923846111232,nxpi,2016-04-29 14:14:00,nxp semiconductors nvs point raised jefferies group dollars 30.00 buy rating,0.0,0.0,4547.0,2838.0,False,1
726050472654692352,nxpi,2016-04-29 14:08:00,nxp semiconductors nvs point raised jefferies group dollars 30.00 buy rating,0.0,0.0,4127.0,0.0,False,1
726050032919564288,nxpi,2016-04-29 14:06:00,analyst upgrades price target increases,0.0,0.0,4605.0,2583.0,False,1
726049780426768384,nxpi,2016-04-29 14:05:00,friday top analyst upgrades downgrades point 2 gain gnc gw krc moh mplx nxpi oii srcl tpx ugi int,0.0,1.0,196835.0,271.0,False,1
726037854170705924,nxpi,2016-04-29 13:18:00,price targets raised md n nov nus nxpi odfl qlik rgc siri skyw snr spb tbnk ups wcn wll wm,0.0,0.0,738.0,62.0,False,1
726036543555559425,nxpi,2016-04-29 13:12:00,friday top analyst upgrades downgrades point 2 gain gnc gw krc moh mplx nxpi oii srcl tpx ugi int,0.0,0.0,825.0,46.0,False,1
726033301807464448,nxpi,2016-04-29 13:00:00,premarket active stocks tivo tvix aapl xiv qqq amzn fb nxpi glng shpg,0.0,0.0,315.0,231.0,False,1
726032393736314881,nxpi,2016-04-29 12:56:00,semiconductors 4.4 million share block trade priced dollars 6.00 nxpi citi acted sole book running manager c,0.0,0.0,162.0,437.0,False,1
726010714712866817,nxpi,2016-04-29 11:30:00,nxpi tgt raised jefferies,0.0,0.0,3093.0,10.0,False,0
726008566260314115,nxpi,2016-04-29 11:21:00,long term gr8 stock rt jefferies “we put nxpi jefferies franchise pick list raise point dollars 30” street high,1.0,0.0,1069.0,1417.0,False,1
726008305680846848,nxpi,2016-04-29 11:20:00,jefferies “we put nxpi jefferies franchise pick list raise point dollars 30” street high,0.0,0.0,1016.0,238.0,False,1
726006634820964352,nxpi,2016-04-29 11:14:00,rt nxp semiconductors nxpi added jefferies franchise pick point dollars 30,0.0,1.0,717.0,290.0,True,1
726006159396610048,nxpi,2016-04-29 11:12:00,nxp semiconductors nxpi added jefferies franchise pick point dollars 30,0.0,1.0,3002.0,1.0,False,1
726004914531536896,nxpi,2016-04-29 11:07:00,nxp semiconductors nv nxpi shares sold notis mcconarty edward,0.0,0.0,718.0,8.0,False,1
726001929168523264,nxpi,2016-04-29 10:55:00,nxpi 5.6 million citi,0.0,0.0,15.0,0.0,False,1
725982063401295872,nxpi,2016-04-29 09:36:00,fifth third bancorp sells 6760 shares nxp semiconductors nv nxpi,0.0,0.0,718.0,8.0,False,1
725947771316895744,nxpi,2016-04-29 07:20:00,nxp semiconductors nv nxpi receives dollars 05.53 consensus price target brokerages,0.0,0.0,916.0,0.0,False,1
725942231866085377,nxpi,2016-04-29 06:58:00,confused nxpi taking drastic turn 2015 charts help,2.0,0.0,1013.0,1213.0,False,1
725902570745528320,nxpi,2016-04-29 04:20:00,commented stocktwits ever get fb let know like oas dollars luv nxpi,0.0,0.0,823.0,2206.0,False,0
725857897918304256,nxpi,2016-04-29 01:23:00,og well fb crushed still lacks respect 2 year oculus reached many users happen nxpi thx,0.0,0.0,824.0,2206.0,False,1
725856014981984256,nxpi,2016-04-29 01:15:00,nxpi f¥^ percent missed something today help anyone sector news thx bought dollars 7. avg dollars 2,0.0,0.0,824.0,2206.0,False,0
725825246855614465,nxpi,2016-04-28 23:13:00,wide range bar,0.0,0.0,4596.0,2585.0,False,1
725822447933599744,nxpi,2016-04-28 23:02:00,nasdaq100 trend chtr mar mu fb pcar adsk fast esrx dish mdlz csx ebay vrsk tsco nxpi,0.0,0.0,846.0,7.0,False,1
725821287017381888,nxpi,2016-04-28 22:57:00,nxpi giving nice trade hours ceo cramer alerted,0.0,0.0,19451.0,277.0,False,1
725819911080054784,nxpi,2016-04-28 22:52:00,hey son called nxpi last year laughed nice work today,0.0,0.0,81.0,918.0,False,0
725816620459810817,nxpi,2016-04-28 22:39:00,true sold glad syna awful np also sold nxpi er wait til mid summer,0.0,0.0,515.0,908.0,False,1
725809840375758849,nxpi,2016-04-28 22:12:00,confused nxpi taking drastic turn 2015 charts help,0.0,0.0,1013.0,1213.0,False,1
725805857682808832,nxpi,2016-04-28 21:56:00,rt looking forward nxp ceo rick clemmers appearance tonight nxpi,0.0,4.0,89049.0,2211.0,True,0
725774043383627776,nxpi,2016-04-28 19:49:00,rt top fb aapl amzn twtr cmg f gild lnkd fcx celg swks jblu nxpi ba,0.0,85.0,2134.0,3902.0,True,1
725772363267084289,nxpi,2016-04-28 19:43:00,water logged getting wetter stock day nxp semiconductors nxpi nxpi,0.0,0.0,2233.0,1223.0,False,0
725769861347995650,nxpi,2016-04-28 19:33:00,seems like reversal well irrational nxpi dumps aapl nxpi not sales impact s7 2,0.0,0.0,229.0,769.0,False,0
725769450146828288,nxpi,2016-04-28 19:31:00,ago sell cmg twtr ebay bwld crus fb fslr ups celg amzn lnkd bidu swks fcx v gild hele nxpi cvx,0.0,0.0,47.0,7.0,False,1
725769128150196225,nxpi,2016-04-28 19:30:00,rt splk seems undervalued earnings jim interview doug merritt looking…,0.0,1.0,11714.0,240.0,True,1
725766570652229632,nxpi,2016-04-28 19:20:00,splk seems undervalued earnings jim interview doug merritt looking forward nxpi,0.0,1.0,229.0,769.0,False,1
725765555983011841,nxpi,2016-04-28 19:16:00,aapl iphone sales down samsung s7 benefits neutral nxpi since designed pypl move higher,0.0,0.0,229.0,769.0,False,0
725765358418677760,nxpi,2016-04-28 19:15:00,lots ugly reversals today nxpi one example,2.0,0.0,5534.0,452.0,False,1
725761668869963776,nxpi,2016-04-28 19:00:00,rt looking forward nxp ceo rick clemmers appearance tonight nxpi,0.0,3.0,7083.0,2423.0,True,1
725760178230947840,nxpi,2016-04-28 18:54:00,nxpi 50 moving average rejection weekly weeks not yet tho,0.0,0.0,442.0,67.0,False,1
725757058033668096,nxpi,2016-04-28 18:42:00,rt looking forward nxp ceo rick clemmers appearance tonight nxpi,0.0,3.0,474.0,77.0,True,1
725756931923648515,nxpi,2016-04-28 18:41:00,rt looking forward nxp ceo rick clemmers appearance tonight nxpi,0.0,3.0,942159.0,411.0,True,1
725756715187073025,nxpi,2016-04-28 18:40:00,looking forward nxp ceo rick clemmers appearance tonight nxpi,5.0,4.0,29400.0,2033.0,False,0
725755232697851904,nxpi,2016-04-28 18:35:00,42 percent earnings 🌱growth🌱 3 years what’s opinion nxp semiconductors nv nxpi,0.0,0.0,375.0,431.0,False,0
725754993643495424,nxpi,2016-04-28 18:34:00,nxpi new sec filing nxpi form 6 k no 0001193125 16 562939,0.0,0.0,130.0,6.0,False,1
725750231158165505,nxpi,2016-04-28 18:15:00,texas instruments beats first quarter despite apple iphone shortfall txn aapl nxpi swks qrvo crus,0.0,0.0,242.0,76.0,False,1
725747300325163014,nxpi,2016-04-28 18:03:00,nxpi easily could fill gap 50 moving average pushing cross above 200 moving average bullish setup,0.0,0.0,977.0,194.0,False,1
725744169163984896,nxpi,2016-04-28 17:51:00,qqq nxpi good session chip growth story needs come,2.0,0.0,229.0,769.0,False,0
725735518584066049,nxpi,2016-04-28 17:16:00,looking forward ceo rick clemmers appearance tonight nxpi,0.0,0.0,284.0,399.0,False,1
725725314387566592,nxpi,2016-04-28 16:36:00,check nxpi chart fb could big gap up gaps usually fill right,0.0,0.0,977.0,194.0,False,1
725716222759686144,nxpi,2016-04-28 16:00:00,mixed bag nxp semiconductor stock,0.0,0.0,3506.0,32.0,False,1
725714788333002753,nxpi,2016-04-28 15:54:00,nasdaq100 trend fb mu chtr mar siri nxpi txn pcar mdlz akam esrx bbby adsk ebay fast,0.0,0.0,846.0,7.0,False,1
725708544931061761,nxpi,2016-04-28 15:29:00,nxpi sold 2 may 20 16 calls strike price dollars 5 bot dollars .60 total cost dollars 729.50 sold dollars 4.20 profit equals dollars 101,0.0,0.0,133.0,51.0,False,1
725708174464970752,nxpi,2016-04-28 15:28:00,volume alert nxpi 89.89 nxp semiconductors nxpi hit high today 91.18 closing day 0 89.89 positive 0,0.0,0.0,743.0,448.0,False,0
725704267240247296,nxpi,2016-04-28 15:12:00,nxp semiconductors nv nxpi given new dollars 0.00 price target topeka capital markets,1.0,0.0,709.0,8.0,False,1
725685330997874688,nxpi,2016-04-28 13:57:00,nxp semiconductors nv’s nxpi buy rating reaffirmed canaccord genuity,0.0,0.0,709.0,8.0,False,1
725683903860711424,nxpi,2016-04-28 13:51:00,nxp semiconductors nv hits 1 quarter high,0.0,0.0,26.0,1.0,False,0
725680950684860416,nxpi,2016-04-28 13:39:00,recent research analysts’ ratings changes nxp semiconductors nv nxpi,0.0,0.0,996.0,11.0,False,1
725680820317503488,nxpi,2016-04-28 13:39:00,nxpi 90 calls buying activity expiring 29 apr volume 584,1.0,0.0,1212.0,27.0,False,1
725680369010356224,nxpi,2016-04-28 13:37:00,recent research analysts’ ratings changes nxp semiconductors nv nxpi,0.0,0.0,6203.0,2295.0,False,0
725678639312982016,nxpi,2016-04-28 13:30:00,nxpi 83 calls buying activity expiring 29 apr volume 223,0.0,0.0,1212.0,27.0,False,1
725626132654088193,nxpi,2016-04-28 10:02:00,weekly nasdaq100 trend mu akam pcar tsco csx nxpi ctxs ulta esrx adsk bbby ebay mdlz rost,0.0,0.0,846.0,7.0,False,0
725626062592462848,nxpi,2016-04-28 10:01:00,weekly nasdaq100 performance viab mu akam pcar tsco stx wdc dish biib csx nxpi fast,0.0,0.0,846.0,7.0,False,0
725612600877142016,nxpi,2016-04-28 09:08:00,watching mar mdlz akam nxpi sonc still long wll jblu,0.0,0.0,9.0,42.0,False,0
725553946647916544,nxpi,2016-04-28 05:15:00,chartguy89 nxpi 88.94 stock charts nxpi nxp semiconductors,0.0,0.0,3518.0,1996.0,False,1
725518512228278272,nxpi,2016-04-28 02:54:00,investors sell nxp semiconductors nv nxpi strength nxpi,0.0,0.0,994.0,11.0,False,0
725518084270858240,nxpi,2016-04-28 02:52:00,investors sell nxp semiconductors nv nxpi strength nxpi,0.0,0.0,6197.0,2295.0,False,0
725497488933801985,nxpi,2016-04-28 01:30:00,watch tomorrow fb nxpi swks,3.0,0.0,3461.0,127.0,False,1
725487744047149057,nxpi,2016-04-28 00:52:00,nxpi biib please thanks scott,0.0,0.0,123.0,402.0,False,1
725485148603478016,nxpi,2016-04-28 00:41:00,macd bull crossover akam ebay fast mar mdlz nxpi,0.0,0.0,89.0,60.0,False,1
725484605512519680,nxpi,2016-04-28 00:39:00,say nxpi loving bouncing back apples e opinion way undervalued per future looks even better,0.0,0.0,98.0,547.0,False,1
725462405736730625,nxpi,2016-04-27 23:11:00,rt 180 bullish,0.0,1.0,593.0,652.0,True,1
725460099708387329,nxpi,2016-04-27 23:02:00,180 bullish,0.0,1.0,4578.0,2583.0,False,1
725460052988026880,nxpi,2016-04-27 23:02:00,nasdaq100 trend akam mdlz ebay nxpi esrx pcar ulta bbby rost tsco ctxs csx adsk sbac mu,0.0,0.0,847.0,7.0,False,1
725459983064793088,nxpi,2016-04-27 23:01:00,nasdaq100 performance akam wdc mdlz ebay nxpi mar esrx nvda pcar ulta fast trip bbby,0.0,0.0,847.0,7.0,False,1
725454202890121216,nxpi,2016-04-27 22:38:00,trading rules discipline staying strong,0.0,0.0,584.0,8.0,False,1
725446720772038656,nxpi,2016-04-27 22:09:00,scan results jack box bullish today ten nxpi sanm cpgx tri ir blmn big cnc thrm,0.0,0.0,645.0,45.0,False,1
725445997804003328,nxpi,2016-04-27 22:06:00,scan results 180 bullish setup today iart fe nxpi ns src bcr dps idcc kn mdt,0.0,0.0,645.0,45.0,False,1
725436548615806978,nxpi,2016-04-27 21:28:00,nxpi sold 3 may 20 16 calls strike price dollars 7.50 bot dollars .60 total cost dollars 990 sold dollars 1.50 profit equals dollars 449,0.0,0.0,134.0,51.0,False,1
725423688464650240,nxpi,2016-04-27 20:37:00,rt huge pay week huge far nxpi fb 🎉💰👌🏻🦁🍹☑️🚀,0.0,1.0,44.0,46.0,True,1
725423517450149888,nxpi,2016-04-27 20:36:00,huge pay week huge far nxpi fb 🎉💰👌🏻🦁🍹☑️🚀,0.0,1.0,2281.0,58.0,False,1
725414173576929284,nxpi,2016-04-27 19:59:00,nasdaq100 trend akam ebay mdlz esrx bbby pcar ulta nxpi tsco adsk mu sbac siri csx txn,0.0,0.0,847.0,7.0,False,1
725414103188119552,nxpi,2016-04-27 19:59:00,nasdaq100 performance akam ebay mar mdlz esrx bbby wdc fast pcar ulta nvda nxpi tmus,0.0,0.0,847.0,7.0,False,1
725399135667396609,nxpi,2016-04-27 19:00:00,nxp semiconductors nv nxpi richard lynn clemmer first quarter 2016 results earnings call transc,0.0,0.0,3505.0,32.0,False,1
725395445862649856,nxpi,2016-04-27 18:45:00,nxp semiconductors nv reiterated rating morgan stanley ranked 37 buy nxpi,0.0,0.0,525.0,45.0,False,1
725394858282606592,nxpi,2016-04-27 18:43:00,nxp semiconductors n v nxpi volume up 11 percent,1.0,0.0,5615.0,1926.0,False,1
725390793867931648,nxpi,2016-04-27 18:26:00,rt impressive intra day reversal aapl names avgo swks nxpi crus strong gate overall solid session dow co…,0.0,3.0,736.0,475.0,True,1
725390722136956928,nxpi,2016-04-27 18:26:00,rt impressive intra day reversal aapl names avgo swks nxpi crus strong gate overall solid session dow co…,0.0,3.0,1663.0,3859.0,True,1
725390640599572482,nxpi,2016-04-27 18:26:00,impressive intra day reversal aapl names avgo swks nxpi crus strong gate overall solid session dow could 200,2.0,3.0,80543.0,689.0,False,1
725386830640631809,nxpi,2016-04-27 18:11:00,nxpi back,0.0,0.0,974.0,194.0,False,1
725386263180627969,nxpi,2016-04-27 18:08:00,nxpi dips 84 86 got bought goin higher,0.0,0.0,440.0,67.0,False,1
725382051088605184,nxpi,2016-04-27 17:52:00,clayton nxpi 85.60 nxp semiconductors nxpi added,0.0,0.0,3517.0,1996.0,False,1
725382041378811904,nxpi,2016-04-27 17:52:00,clayton nxpi 85.60 nxp semiconductors nxpi added,0.0,0.0,13485.0,421.0,False,1
725380907515928576,nxpi,2016-04-27 17:47:00,nxpi 85.60 nxp semiconductors nxpi added watch list right nxpi watching last price 8,0.0,0.0,906.0,441.0,False,1
725377033203814400,nxpi,2016-04-27 17:32:00,nxp semiconductors nvs buy rating reiterated canaccord genuity,0.0,0.0,4544.0,2838.0,False,1
725376495921717249,nxpi,2016-04-27 17:30:00,nxp semiconductors nv reiterated rating canaccord genuity ranked 62 buy nxpi,0.0,0.0,528.0,45.0,False,1
725375811482718208,nxpi,2016-04-27 17:27:00,nxp semiconductors nvs buy rating reiterated canaccord genuity,0.0,0.0,4117.0,0.0,False,0
725370685795782660,nxpi,2016-04-27 17:07:00,mixed bag nxp semiconductor stock nxpi,0.0,0.0,375.0,586.0,False,1
725358669223858176,nxpi,2016-04-27 16:19:00,cirrus logic beats apple iphone slump dings skyworks qorvo broadcom crus aapl swks qrvo avgo nxpi txn,0.0,0.0,241.0,76.0,False,1
725358423362002944,nxpi,2016-04-27 16:18:00,like action nxpi since better expected eps report remain long ultra growth portfolio overall best stocks,1.0,0.0,6329.0,1082.0,False,0
725356862430953472,nxpi,2016-04-27 16:12:00,mixed bag nxp semiconductor stock,0.0,0.0,70.0,955.0,False,0
725356618536341504,nxpi,2016-04-27 16:11:00,mixed bag nxp semiconductor stock,0.0,0.0,87.0,923.0,False,1
725356290516619264,nxpi,2016-04-27 16:09:00,mixed bag nxp semiconductor stock,0.0,0.0,108.0,518.0,False,1
725356261609332736,nxpi,2016-04-27 16:09:00,impressive recovery far aapl suppliers nxpi already announced earnings up 1 percent bullish,0.0,0.0,204.0,82.0,False,1
725353532656754688,nxpi,2016-04-27 15:58:00,rt seekingalpha mixed bag nxp semiconductor stock,0.0,0.0,8586.0,4.0,False,1
725352206870835200,nxpi,2016-04-27 15:53:00,mixed bag nxp semiconductor stock,0.0,0.0,3506.0,32.0,False,1
725350927767478272,nxpi,2016-04-27 15:48:00,brief nxp says dollars 00 mln partial redemption 2016 senior notes read,0.0,0.0,50.0,3.0,False,0
725349137248583680,nxpi,2016-04-27 15:41:00,volume alert nxpi 86.28 nxp semiconductors nxpi hit high today 87.99 closing day 0 86.28 0,0.0,0.0,739.0,448.0,False,1
