Tweet Id,Ticker,Datetime,Text,Favs,RTs,Followers,Following,Is a RT,Sentiment
735172017503277056,fisv,2016-05-24 18:14:00,rt fisv fiserv helps clients fight financial crime streamlining predictive analytics integration zementis …,0.0,1.0,207.0,16.0,True,1
735162365763833857,fisv,2016-05-24 17:35:00,peddock capital advisors llc dollars 278000 position fiserv inc fisv,0.0,1.0,982.0,0.0,False,0
735154703986724865,fisv,2016-05-24 17:05:00,wendell david associates inc dollars 0659000 position fiserv inc fisv,0.0,1.0,2192.0,11.0,False,1
735148289360842752,fisv,2016-05-24 16:39:00,boston advisors llc acquires 12315 shares fiserv inc fisv,0.0,0.0,501.0,6.0,False,1
735148146855190529,fisv,2016-05-24 16:39:00,boston advisors llc acquires 12315 shares fiserv inc fisv,0.0,0.0,1150.0,58.0,False,1
735094151671341056,fisv,2016-05-24 13:04:00,fisv fiserv helps clients fight financial crime streamlining predictive analytics integration zementis,1.0,1.0,281.0,0.0,False,1
735093260947951616,fisv,2016-05-24 13:01:00,fisv fiserv helps clients fight financial crime streamlining predictive analytics integration zement stock news alerts app,0.0,0.0,1170.0,10.0,False,0
735024749185802241,fisv,2016-05-24 08:28:00,insider selling fiserv inc fisv ceo sells dollars 229520.00 stock,0.0,0.0,502.0,6.0,False,1
735024494587285504,fisv,2016-05-24 08:27:00,insider selling fiserv inc fisv ceo sells dollars 229520.00 stock,0.0,0.0,1151.0,58.0,False,1
735023639242899456,fisv,2016-05-24 08:24:00,insider selling fiserv inc fisv ceo sells dollars 229520.00 stock,0.0,0.0,2185.0,11.0,False,1
734945368551641088,fisv,2016-05-24 03:13:00,invested mitek mitk consider reading free report partner cachet financial solutions,1.0,0.0,1288.0,541.0,False,1
734900776603164678,fisv,2016-05-24 00:16:00,ascending ttb,0.0,0.0,4749.0,2548.0,False,1
734827292204093441,fisv,2016-05-23 19:24:00,campbell newman asset management inc dollars 378000 position fiserv inc fisv,0.0,0.0,979.0,0.0,False,1
734806900278231040,fisv,2016-05-23 18:03:00,nicolet bankshares inc sells 15 shares fiserv inc fisv,0.0,0.0,748.0,8.0,False,0
734799516944203780,fisv,2016-05-23 17:33:00,fiserv inc fisv woodley farra manion portfolio management inc ’s largest position,0.0,0.0,978.0,0.0,False,0
734701769767452673,fisv,2016-05-23 11:05:00,fiserv inc fisv downgraded “hold” zacks investment research,0.0,0.0,502.0,6.0,False,1
734694234989694976,fisv,2016-05-23 10:35:00,j donald sherman acquires 2000 shares fiserv inc fisv stock,0.0,0.0,1149.0,58.0,False,1
734694133990842368,fisv,2016-05-23 10:35:00,j donald sherman acquires 2000 shares fiserv inc fisv stock,0.0,0.0,502.0,6.0,False,1
734693153245155328,fisv,2016-05-23 10:31:00,j donald sherman acquires 2000 shares fiserv inc fisv stock,0.0,1.0,982.0,0.0,False,1
734670511301656576,fisv,2016-05-23 09:01:00,jeffery w yabuki sells 12000 shares fiserv inc fisv stock,0.0,0.0,974.0,0.0,False,1
734662877273952256,fisv,2016-05-23 08:30:00,,0.0,0.0,258.0,40.0,False,1
734375663294111744,fisv,2016-05-22 13:29:00,chevy chase trust holdings inc sells 276 shares fiserv inc fisv,0.0,0.0,749.0,8.0,False,1
734323266060451840,fisv,2016-05-22 10:01:00,fiserv inc fisv position maintained osborne partners capital management llc,0.0,0.0,2178.0,11.0,False,1
734124064877350912,fisv,2016-05-21 20:49:00,,0.0,0.0,260.0,40.0,False,1
733815402921222144,fisv,2016-05-21 00:23:00,ascending ttb,0.0,0.0,4724.0,2552.0,False,1
733756673563709442,fisv,2016-05-20 20:29:00,exxonmobil investment management inc tx buys 3055 shares fiserv inc fisv,0.0,0.0,1038.0,11.0,False,0
733756322647298048,fisv,2016-05-20 20:28:00,exxonmobil investment management inc tx buys 3055 shares fiserv inc fisv,0.0,0.0,6286.0,2292.0,False,1
733745637288759296,fisv,2016-05-20 19:46:00,fiserv inc fisv stake increased atalanta sosnoff capital llc,0.0,0.0,498.0,6.0,False,1
733745361588789248,fisv,2016-05-20 19:45:00,fiserv inc fisv stake increased atalanta sosnoff capital llc,0.0,0.0,1148.0,58.0,False,0
733743050011385856,fisv,2016-05-20 19:35:00,bath savings trust co dollars 169000 stake fiserv inc fisv,0.0,0.0,402.0,10.0,False,1
733741035407413249,fisv,2016-05-20 19:27:00,churchill management corp reduces position fiserv inc fisv,0.0,0.0,1148.0,58.0,False,0
733741021029380096,fisv,2016-05-20 19:27:00,churchill management corp reduces position fiserv inc fisv,0.0,0.0,498.0,6.0,False,1
733718690408083460,fisv,2016-05-20 17:59:00,fisv sec form 4 year abuki jeffery wpres ceos sale dollars 02.46 12000430708 3 percent dollars 229570,0.0,0.0,13.0,12.0,False,0
733704298715074560,fisv,2016-05-20 17:01:00,fiserv inc fisv director j donald sherman purchases 2000 shares stock,0.0,0.0,402.0,10.0,False,1
733695186526736384,fisv,2016-05-20 16:25:00,fiserv inc fisv ceo jeffery w yabuki sells 12000 shares,0.0,0.0,402.0,10.0,False,0
733695070726160384,fisv,2016-05-20 16:25:00,recent research analysts’ ratings updates fiserv fisv,0.0,0.0,1036.0,11.0,False,1
733695069677596672,fisv,2016-05-20 16:25:00,recent research analysts’ ratings updates fiserv fisv,0.0,0.0,1036.0,11.0,False,1
733694373993578496,fisv,2016-05-20 16:22:00,recent research analysts’ ratings updates fiserv fisv,0.0,0.0,6285.0,2292.0,False,0
733694372617834498,fisv,2016-05-20 16:22:00,recent research analysts’ ratings updates fiserv fisv,0.0,0.0,6285.0,2292.0,False,1
733677584630841345,fisv,2016-05-20 15:15:00,zacks investment research lowers fiserv inc fisv hold,0.0,0.0,744.0,8.0,False,1
733674463682781188,fisv,2016-05-20 15:03:00,fiserv inc forecasted post fy2016 earnings dollars .34 per share fisv,0.0,0.0,1147.0,58.0,False,1
733672281629691906,fisv,2016-05-20 14:54:00,fiserv inc forecasted post fy2016 earnings dollars .34 per share fisv,0.0,0.0,402.0,10.0,False,0
733670328635908097,fisv,2016-05-20 14:46:00,fiserv inc forecasted post fy2016 earnings dollars .34 per share fisv,0.0,0.0,498.0,6.0,False,1
733503081476960256,fisv,2016-05-20 03:42:00,rt seekingalpha,0.0,0.0,8613.0,4.0,False,1
733502095488229379,fisv,2016-05-20 03:38:00,,0.0,0.0,2098.0,29.0,False,1
733443482904334336,fisv,2016-05-19 23:45:00,fiserv inc fisv ceo sells dollars 229520.00 stock,0.0,0.0,6277.0,2292.0,False,0
733440825535934464,fisv,2016-05-19 23:34:00,fiserv inc fisv ceo sells dollars 229520.00 stock,0.0,0.0,744.0,8.0,False,1
733424555050434560,fisv,2016-05-19 22:30:00,parabolic sar sell,0.0,0.0,4720.0,2553.0,False,1
733413453159747585,fisv,2016-05-19 21:46:00,fisv new insider transaction fisv director,0.0,0.0,498.0,0.0,False,1
733410526806609925,fisv,2016-05-19 21:34:00,fiserv inc fisv shares sold foundry partners llc,0.0,0.0,744.0,8.0,False,1
733391569261318146,fisv,2016-05-19 20:19:00,fisv new sec filing fisv form 8 k no 0001193125 16 596035,0.0,0.0,104.0,6.0,False,1
733390741607583744,fisv,2016-05-19 20:15:00,fisv new sec documents fiserv inc stock news alerts app,0.0,0.0,1166.0,10.0,False,1
733390612548849664,fisv,2016-05-19 20:15:00,submission matters vote security,0.0,0.0,311.0,27.0,False,1
733386857690607616,fisv,2016-05-19 20:00:00,fjarde ap fonden fourth swedish national pension fund dollars 293000 stake fiserv inc fisv,0.0,0.0,396.0,10.0,False,1
733380900696788993,fisv,2016-05-19 19:36:00,integrated investment consultants llc maintains position fiserv inc fisv,0.0,0.0,970.0,0.0,False,0
733379752032108545,fisv,2016-05-19 19:32:00,daiwa sb investments ltd dollars 018000 position fiserv inc fisv,0.0,0.0,396.0,10.0,False,1
733375813672960000,fisv,2016-05-19 19:16:00,fiserv inc fisv position increased webster bank n,0.0,0.0,1035.0,11.0,False,1
733375509552332800,fisv,2016-05-19 19:15:00,fiserv inc fisv position increased webster bank n,0.0,0.0,6278.0,2292.0,False,0
733315413686292480,fisv,2016-05-19 15:16:00,fiserv inc fisv stock rating lowered zacks investment research,0.0,0.0,2171.0,11.0,False,0
733314985741410304,fisv,2016-05-19 15:14:00,fiserv inc fisv stock rating lowered zacks investment research,0.0,0.0,969.0,0.0,False,1
733292950055059459,fisv,2016-05-19 13:47:00,,0.0,0.0,109.0,40.0,False,0
733289036580691968,fisv,2016-05-19 13:31:00,fiserv inc fisv earns “hold” rating robert w baird,0.0,0.0,495.0,6.0,False,1
733288485755494400,fisv,2016-05-19 13:29:00,fiserv inc fisv earns “hold” rating robert w baird,0.0,0.0,1141.0,58.0,False,1
733288225574359044,fisv,2016-05-19 13:28:00,fiserv inc fisv earns “hold” rating robert w baird,0.0,0.0,2171.0,11.0,False,1
733282567726714880,fisv,2016-05-19 13:06:00,fisv fiserv extends loan processing private label credit relationship john deere financial stock news alerts app,0.0,0.0,1164.0,10.0,False,1
733282499997147136,fisv,2016-05-19 13:05:00,fisv fiserv extends loan processing private label credit relationship john deere financial,0.0,0.0,276.0,0.0,False,1
733282177094287360,fisv,2016-05-19 13:04:00,fisv fiserv extends loan processing private label credit relationship john deere financial,0.0,0.0,18.0,39.0,False,1
733269071551160321,fisv,2016-05-19 12:12:00,fiserv inc forecasted earn fy2016 earnings dollars .34 per share fisv,0.0,0.0,2171.0,11.0,False,1
733268726326407169,fisv,2016-05-19 12:11:00,fiserv inc forecasted earn fy2016 earnings dollars .34 per share fisv,0.0,0.0,744.0,8.0,False,0
733238392138432512,fisv,2016-05-19 10:10:00,fiserv’s fisv “buy” rating reiterated sterne agee crt,0.0,0.0,742.0,8.0,False,1
733130082722553856,fisv,2016-05-19 03:00:00,,0.0,0.0,261.0,40.0,False,1
733091054715604992,fisv,2016-05-19 00:25:00,ascending ttb,0.0,0.0,4707.0,2553.0,False,0
733056010148024321,fisv,2016-05-18 22:05:00,fisv us ccm investment advisers llc dollars 3575000 position fiserv inc fisv inc,0.0,0.0,3346.0,249.0,False,1
733052184795971584,fisv,2016-05-18 21:50:00,community trust investment co dollars 328000 position fiserv inc fisv,0.0,0.0,394.0,10.0,False,1
733006589947465728,fisv,2016-05-18 18:49:00,fiserv inc post fy2016 earnings dollars .34 per share sterne agee crt forecasts fisv,0.0,0.0,1033.0,11.0,False,1
733006587586039808,fisv,2016-05-18 18:49:00,fiserv inc post fy2016 earnings dollars .34 per share sterne agee crt forecasts fisv,0.0,0.0,1033.0,11.0,False,1
733006463644356608,fisv,2016-05-18 18:48:00,fiserv inc post fy2016 earnings dollars .34 per share sterne agee crt forecasts fisv,0.0,0.0,6278.0,2292.0,False,1
733006460502855682,fisv,2016-05-18 18:48:00,fiserv inc post fy2016 earnings dollars .34 per share sterne agee crt forecasts fisv,0.0,0.0,6278.0,2292.0,False,1
733003946499903488,fisv,2016-05-18 18:38:00,fiserv inc fisv rating reiterated sterne agee crt,0.0,0.0,963.0,0.0,False,1
732981884314132481,fisv,2016-05-18 17:11:00,fiserv’s fisv “buy” rating reaffirmed sterne agee crt,0.0,0.0,2170.0,11.0,False,1
732980607509274624,fisv,2016-05-18 17:06:00,fiserv’s fisv “buy” rating reaffirmed sterne agee crt,0.0,0.0,394.0,10.0,False,1
732977076211453952,fisv,2016-05-18 16:52:00,fiserv inc fisv rating reiterated sterne agee crt,0.0,0.0,742.0,8.0,False,0
732971583627649025,fisv,2016-05-18 16:30:00,fiserv inc reiterated rating sterne agee ranked 35 buy fisv,0.0,0.0,559.0,45.0,False,1
732968259876737026,fisv,2016-05-18 16:17:00,fiservs buy rating reiterated sterne agee crt,0.0,0.0,4183.0,0.0,False,0
732962195638759426,fisv,2016-05-18 15:52:00,fisv nibble lil bit,0.0,0.0,373.0,114.0,False,1
732941019654848512,fisv,2016-05-18 14:28:00,fisv us ccm investment advisers llc dollars 3575000 position fiserv inc fisv inc,0.0,0.0,2756.0,277.0,False,1
732883857104642048,fisv,2016-05-18 10:41:00,fiserv inc fisv downgraded zacks investment research “hold”,0.0,0.0,740.0,8.0,False,1
732857446205689856,fisv,2016-05-18 08:56:00,robert w baird reiterates “hold” rating fiserv inc fisv,0.0,0.0,960.0,0.0,False,1
732857445031235585,fisv,2016-05-18 08:56:00,robert w baird reiterates “hold” rating fiserv inc fisv,0.0,0.0,960.0,0.0,False,0
732819343520718850,fisv,2016-05-18 06:25:00,fisv us ccm investment advisers llc dollars 3575000 position fiserv inc fisv inc,0.0,0.0,2756.0,277.0,False,1
732814310787977216,fisv,2016-05-18 06:05:00,fisv us ccm investment advisers llc dollars 3575000 position fiserv inc fisv inc,0.0,0.0,3347.0,249.0,False,1
732749423374172162,fisv,2016-05-18 01:47:00,ccm investment advisers llc dollars 3575000 position fiserv inc fisv,0.0,0.0,495.0,6.0,False,0
732749265311793154,fisv,2016-05-18 01:46:00,fisv bangkok bank fiserv make life easier mobile p2 puts payments alerts banking services wear stock news alerts app,0.0,0.0,1162.0,10.0,False,1
732748797038764032,fisv,2016-05-18 01:45:00,ccm investment advisers llc dollars 3575000 position fiserv inc fisv,0.0,0.0,1138.0,58.0,False,1
732747002392514560,fisv,2016-05-18 01:37:00,fiserv inc fisv stake boosted ibm retirement fund,0.0,0.0,394.0,10.0,False,0
732729085173059584,fisv,2016-05-18 00:26:00,albion financial group ut dollars 493000 position fiserv inc fisv,0.0,0.0,738.0,8.0,False,1
732664598176862208,fisv,2016-05-17 20:10:00,fiserv inc fisv given “hold” rating robert w baird,0.0,0.0,392.0,10.0,False,1
732657529168224257,fisv,2016-05-17 19:42:00,fiserv’s fisv “hold” rating reiterated robert w baird,0.0,0.0,734.0,8.0,False,1
732650720848007168,fisv,2016-05-17 19:15:00,fiserv inc reiterated rating robert w baird ranked 19 hold fisv,0.0,0.0,558.0,45.0,False,1
732622405454209024,fisv,2016-05-17 17:22:00,fisv fiserv inc downgraded hold zacks investment research,0.0,0.0,6262.0,2293.0,False,0
732617332347011073,fisv,2016-05-17 17:02:00,fiserv inc fisv downgraded zacks investment research hold,0.0,0.0,1029.0,11.0,False,0
732616520635953154,fisv,2016-05-17 16:59:00,fiserv inc fisv downgraded zacks investment research hold,0.0,0.0,6259.0,2293.0,False,0
732613240237260800,fisv,2016-05-17 16:46:00,fiserv downgraded zacks investment research hold,0.0,0.0,4558.0,2838.0,False,0
732611082561433600,fisv,2016-05-17 16:37:00,fiserv downgraded zacks investment research hold,0.0,0.0,4178.0,0.0,False,0
732572258615611392,fisv,2016-05-17 14:03:00,fiservs first quarter 16 earnings mean investors fis fisv jkhy vfh,0.0,0.0,1804.0,16.0,False,0
732538825474465792,fisv,2016-05-17 11:50:00,rt latest triggered trades review,0.0,1.0,719.0,4.0,True,1
732538517268496385,fisv,2016-05-17 11:49:00,latest triggered trades review,2.0,1.0,6791.0,1251.0,False,1
732366053649592321,fisv,2016-05-17 00:24:00,ascending ttb,0.0,0.0,4684.0,2557.0,False,0
732293395989811200,fisv,2016-05-16 19:35:00,ativo capital management llc maintains stake fiserv inc fisv,0.0,0.0,2156.0,11.0,False,1
732269431691206656,fisv,2016-05-16 18:00:00,bullish big mac bullish occurred 0 pm may 16 dollars 04.50 fiserv inc fisv fisv,0.0,0.0,135.0,3.0,False,1
732258286532169728,fisv,2016-05-16 17:15:00,fiss solid first quarter 16 performance boost stock price fis fisv xlf jkhy,0.0,0.0,1803.0,16.0,False,1
732236916628672512,fisv,2016-05-16 15:50:00,fisv,0.0,0.0,271.0,84.0,False,1
732230378468048896,fisv,2016-05-16 15:25:00,wescap management group inc acquires shares 24048 fiserv inc fisv,0.0,0.0,951.0,0.0,False,0
732219754467999745,fisv,2016-05-16 14:42:00,colony group llc acquires 535 shares fiserv inc fisv,0.0,0.0,492.0,6.0,False,1
732219499705999362,fisv,2016-05-16 14:41:00,colony group llc acquires 535 shares fiserv inc fisv,0.0,0.0,1134.0,58.0,False,0
732149121252003840,fisv,2016-05-16 10:02:00,weekly nasdaq100 trend nvda ntes adbe amzn intu fb hsic trip fisv mdlz mnst isrg chtr vod,0.0,0.0,857.0,7.0,False,1
732149052033355776,fisv,2016-05-16 10:01:00,weekly nasdaq100 performance nvda ntes amzn trip incy adbe isrg msft wfm ctxs fisv hsic,0.0,0.0,857.0,7.0,False,1
732056487913230337,fisv,2016-05-16 03:54:00,fisv bullish analyst action argus research fiserv,0.0,0.0,284.0,0.0,False,1
731976924621340675,fisv,2016-05-15 22:37:00,fisv us handelsbanken fonder ab acquires new position fiserv inc fisv inc,0.0,0.0,2754.0,277.0,False,1
731971342774489088,fisv,2016-05-15 22:15:00,fisv us handelsbanken fonder ab acquires new position fiserv inc fisv inc,0.0,0.0,3348.0,249.0,False,0
731966457597157377,fisv,2016-05-15 21:56:00,,0.0,0.0,261.0,40.0,False,0
731935764171370497,fisv,2016-05-15 19:54:00,stop calling online lending cos fintech term bberg fds fisv jkhy v etc lc lender like dfs,2.0,0.0,312.0,539.0,False,1
731902809440964608,fisv,2016-05-15 17:43:00,handelsbanken fonder ab acquires new position fiserv inc fisv,0.0,0.0,491.0,6.0,False,0
731902669049221120,fisv,2016-05-15 17:42:00,handelsbanken fonder ab acquires new position fiserv inc fisv,0.0,0.0,1133.0,58.0,False,1
731894030540374017,fisv,2016-05-15 17:08:00,fiserv inc fisv stake raised bridgeway capital management inc,0.0,0.0,730.0,8.0,False,1
731772617108164608,fisv,2016-05-15 09:06:00,fisv wall street analysts bullish fisvs earnings growth,0.0,0.0,268.0,0.0,False,0
731627194376699904,fisv,2016-05-14 23:28:00,,0.0,0.0,107.0,40.0,False,0
731612678993510405,fisv,2016-05-14 22:30:00,,0.0,0.0,260.0,40.0,False,1
731612589852000256,fisv,2016-05-14 22:30:00,fisv waiting div 4 hour hap\u2026 fisv,0.0,0.0,4227.0,4.0,False,1
731609861281185794,fisv,2016-05-14 22:19:00,rt fisv chart rolling 200 day sma support,0.0,1.0,24140.0,307.0,True,0
731609556590059520,fisv,2016-05-14 22:18:00,rolling 200 day sma support fisv,0.0,0.0,4227.0,4.0,False,1
731609556510343168,fisv,2016-05-14 22:18:00,fisv chart rolling 200 day sma support,0.0,1.0,27220.0,253.0,False,0
731532282922696704,fisv,2016-05-14 17:11:00,fisv bullish analyst action argus research fiserv,0.0,0.0,284.0,0.0,False,1
731522161563865088,fisv,2016-05-14 16:30:00,ws consensus fisv second quarter 2016 shifted significantly upwards,0.0,0.0,251.0,0.0,False,1
731456130048765952,fisv,2016-05-14 12:08:00,manufacturers life insurance company sells 16107 shares fiserv inc fisv,0.0,0.0,951.0,0.0,False,1
731433958597111808,fisv,2016-05-14 10:40:00,insider selling fiserv inc fisv director sells dollars 181578.20 stock,0.0,0.0,2152.0,11.0,False,1
731429769506660354,fisv,2016-05-14 10:23:00,daniel p kearney sells 11220 shares fiserv inc fisv stock,0.0,0.0,731.0,8.0,False,0
731428714467217408,fisv,2016-05-14 10:19:00,daniel p kearney sells 11220 shares fiserv inc fisv stock,0.0,0.0,395.0,10.0,False,1
731428481578328064,fisv,2016-05-14 10:18:00,fisv daniel p kearney sells 11220 shares fiserv inc stock,0.0,0.0,621.0,5.0,False,1
731428381288325120,fisv,2016-05-14 10:18:00,fisv daniel p kearney sells 11220 shares fiserv inc stock,0.0,0.0,162.0,0.0,False,1
731424327866974208,fisv,2016-05-14 10:02:00,weekly nasdaq100 trend nvda ntes adbe amzn intu fb hsic trip fisv mdlz mnst isrg chtr vod,0.0,0.0,854.0,7.0,False,0
731424258908426240,fisv,2016-05-14 10:01:00,weekly nasdaq100 performance nvda ntes amzn trip incy adbe isrg msft wfm ctxs fisv hsic,0.0,0.0,854.0,7.0,False,1
731422216861192192,fisv,2016-05-14 09:53:00,fiserv inc fisv director daniel p kearney sells 11220 shares,0.0,0.0,952.0,0.0,False,1
731422215128879104,fisv,2016-05-14 09:53:00,fiserv inc fisv director daniel p kearney sells 11220 shares,0.0,0.0,952.0,0.0,False,1
731280958809382912,fisv,2016-05-14 00:32:00,ascending ttb,0.0,0.0,4664.0,2556.0,False,1
731258256400715778,fisv,2016-05-13 23:02:00,nasdaq100 trend nvda ntes adbe amzn intu fb hsic trip mnst mdlz fisv isrg chtr vod cmcsa,0.0,0.0,855.0,7.0,False,0
731256524262100992,fisv,2016-05-13 22:55:00,fisv us 4108547 shares fiserv inc fisv acquired bain capital investors llc inc,0.0,0.0,2751.0,276.0,False,0
731251316341809157,fisv,2016-05-13 22:34:00,fisv us 4108547 shares fiserv inc fisv acquired bain capital investors llc inc,0.0,0.0,3348.0,249.0,False,1
731235344109191168,fisv,2016-05-13 21:31:00,fisv new sec documents fiserv inc stock news alerts app,0.0,0.0,1165.0,10.0,False,1
731233977189695488,fisv,2016-05-13 21:25:00,nitorum capital l p invests dollars 205000 fiserv inc fisv,0.0,0.0,2151.0,11.0,False,1
731213613457870849,fisv,2016-05-13 20:04:00,fiserv inc fisv shares bought fayerweather charles,0.0,0.0,393.0,10.0,False,1
731212355963588609,fisv,2016-05-13 19:59:00,nasdaq100 trend nvda ntes adbe amzn msft cmcsa fb intu mdlz hsic trip fisv mnst isrg,0.0,0.0,855.0,7.0,False,0
731156302911705088,fisv,2016-05-13 16:17:00,jarislowsky fraser ltd dollars 28921000 stake fiserv inc fisv,0.0,0.0,1027.0,11.0,False,1
731149930425913345,fisv,2016-05-13 15:51:00,nasdaq100 trend nvda hsic ntes amzn adbe isrg msft mdlz fb trip cmcsa fisv mnst chtr,0.0,0.0,857.0,7.0,False,0
731085376622874624,fisv,2016-05-13 11:35:00,rt seekingalpha stay away mobileye cramers lightning round,0.0,0.0,8601.0,5.0,False,1
731062012562804736,fisv,2016-05-13 10:02:00,weekly p500 performance ea mon amzn atvi dnb pki ca jec mlm iff ctsh fisv luk nfx,0.0,0.0,855.0,7.0,False,0
731061940638908416,fisv,2016-05-13 10:02:00,weekly nasdaq100 trend ea amzn ca mdlz atvi tmus hsic fisv adbe cmcsa ctsh ntes mnst fb,0.0,0.0,855.0,7.0,False,1
731061871172849664,fisv,2016-05-13 10:01:00,weekly nasdaq100 performance ea amzn atvi ca ctsh fisv ntes tmus pcln ctxs akam msft,0.0,0.0,855.0,7.0,False,1
731047464950738944,fisv,2016-05-13 09:04:00,analysts set fiserv inc fisv price target dollars 5.86,0.0,0.0,722.0,8.0,False,1
731046749775769600,fisv,2016-05-13 09:01:00,analysts set fiserv inc fisv price target dollars 5.86,0.0,0.0,1020.0,11.0,False,1
731046193774628864,fisv,2016-05-13 08:59:00,analysts set fiserv inc fisv price target dollars 5.86,0.0,0.0,6229.0,2293.0,False,0
731009718513192961,fisv,2016-05-13 06:34:00,fisv us 4108547 shares fiserv inc fisv acquired bain capital investors llc inc,0.0,0.0,2752.0,276.0,False,0
731008322208464896,fisv,2016-05-13 06:29:00,rt fisv us 4108547 shares fiserv inc fisv acquired bain capital investors llc inc,0.0,1.0,1718.0,0.0,True,1
731005225239236609,fisv,2016-05-13 06:16:00,fisv us 4108547 shares fiserv inc fisv acquired bain capital investors llc inc,1.0,1.0,3344.0,249.0,False,0
730953514873020416,fisv,2016-05-13 02:51:00,catchet financial cafn subject new research vista partners,0.0,0.0,1280.0,536.0,False,0
730927297612644352,fisv,2016-05-13 01:07:00,fisv wall street analysts bullish fisvs earnings growth,0.0,0.0,267.0,0.0,False,1
730906755312521217,fisv,2016-05-12 23:45:00,martin investment management llc dollars 4489000 position fiserv inc fisv,0.0,0.0,396.0,10.0,False,1
730895868430299136,fisv,2016-05-12 23:02:00,nasdaq100 trend ca ea amzn mdlz atvi tmus hsic cmcsa fisv adbe ctsh fb ntes mnst ctxs,0.0,0.0,856.0,7.0,False,1
730895311812612096,fisv,2016-05-12 22:59:00,stochastic sell,0.0,0.0,4657.0,2558.0,False,1
730884394932568064,fisv,2016-05-12 22:16:00,fisv,0.0,0.0,272.0,84.0,False,1
730849965610811393,fisv,2016-05-12 19:59:00,nasdaq100 trend ca ea mdlz amzn atvi tmus hsic cmcsa adbe fisv ctsh ntes fb mnst trip,0.0,0.0,856.0,7.0,False,0
730790923290972164,fisv,2016-05-12 16:05:00,fiserv inc fisv raised buy argus,0.0,0.0,403.0,10.0,False,1
730789481565970432,fisv,2016-05-12 15:59:00,fisv next 10 days,1.0,0.0,240.0,58.0,False,1
730787534020718592,fisv,2016-05-12 15:51:00,nasdaq100 trend ca ea amzn fisv adbe tmus cmcsa chtr atvi mdlz fb trip ctxs ctsh mnst,0.0,0.0,854.0,7.0,False,0
730765089318428672,fisv,2016-05-12 14:22:00,rt seekingalpha deeper dive jack henry investor day 2016,0.0,0.0,8606.0,4.0,False,1
730761437782495232,fisv,2016-05-12 14:07:00,deeper dive jack henry investor day 2016,0.0,0.0,3572.0,30.0,False,1
730747865690181632,fisv,2016-05-12 13:14:00,fisv bullish analyst action argus research fiserv,0.0,0.0,288.0,0.0,False,1
730737103366193152,fisv,2016-05-12 12:31:00,info fisv sentiment indicator seen investors news social media shows positive perception,0.0,0.0,340.0,103.0,False,1
730720569054892033,fisv,2016-05-12 11:25:00,go 3 times fisv cws,0.0,0.0,27.0,92.0,False,1
730699686550601728,fisv,2016-05-12 10:02:00,weekly p500 trend ea mlm luk dnb fisv amzn ctsh cpb iff trip gis emc tss sna mdt,1.0,0.0,853.0,7.0,False,1
730699542497234944,fisv,2016-05-12 10:02:00,weekly nasdaq100 trend ea fisv amzn ctsh tmus trip adbe chtr cmcsa disca ntes mdlz mnst,0.0,0.0,853.0,7.0,False,0
730699473018572800,fisv,2016-05-12 10:01:00,weekly nasdaq100 performance ea disca atvi wfm fisv amzn ctsh tmus ntes trip yhoo nvda,0.0,0.0,853.0,7.0,False,1
730660917323665408,fisv,2016-05-12 07:28:00,fisv setzt aufwärtsdynamik fort der richtige optionsschein hätte positive 78 percent gemacht,0.0,0.0,4795.0,1220.0,False,1
730599465225084929,fisv,2016-05-12 03:24:00,,1.0,0.0,260.0,40.0,False,1
730550874095931392,fisv,2016-05-12 00:11:00,ascending ttb,0.0,0.0,4650.0,2560.0,False,1
730533613993906177,fisv,2016-05-11 23:02:00,p500 trend ea bax amzn ni gis emc twc sna tss cpb xel lh mdt luk fisv stz cci,0.0,0.0,852.0,7.0,False,1
730533470783602688,fisv,2016-05-11 23:02:00,nasdaq100 trend ea amzn tmus fisv trip ctsh chtr adbe cmcsa disca ntes mdlz pcar mnst,0.0,0.0,852.0,7.0,False,1
730526931410628608,fisv,2016-05-11 22:36:00,fisv us fiserv unveils prologue financials accounting suite inc,0.0,0.0,2750.0,276.0,False,1
730521887118340097,fisv,2016-05-11 22:16:00,fiserv’s fisv “hold” rating reiterated robert w baird,0.0,0.0,1028.0,11.0,False,1
730521884928937989,fisv,2016-05-11 22:16:00,fiserv’s fisv “hold” rating reiterated robert w baird,0.0,0.0,1028.0,11.0,False,1
730521311378853893,fisv,2016-05-11 22:13:00,fiserv’s fisv “hold” rating reiterated robert w baird,0.0,0.0,6233.0,2293.0,False,0
730521309885693952,fisv,2016-05-11 22:13:00,fiserv’s fisv “hold” rating reiterated robert w baird,0.0,0.0,6233.0,2293.0,False,0
730515589341560832,fisv,2016-05-11 21:51:00,fiserv inc fisv shares bought caisse de depot et placement du quebec,0.0,0.0,940.0,0.0,False,1
730515103754391552,fisv,2016-05-11 21:49:00,jefferies group llc takes position fiserv inc fisv,0.0,0.0,718.0,8.0,False,1
730514415578157056,fisv,2016-05-11 21:46:00,argus upgrades fiserv inc fisv buy,0.0,0.0,1028.0,11.0,False,1
730513996630085632,fisv,2016-05-11 21:44:00,argus upgrades fiserv inc fisv buy,0.0,0.0,6233.0,2293.0,False,1
730487589149478916,fisv,2016-05-11 19:59:00,nasdaq100 trend ea amzn tmus trip fisv ctsh adbe cmcsa esrx disca ntes mdlz chtr pcar,0.0,0.0,853.0,7.0,False,0
