Tweet Id,Ticker,Datetime,Text,Favs,RTs,Followers,Following,Is a RT,Sentiment
720597534570192896,fisv,2016-04-14 13:00:00,,0.0,0.0,248.0,40.0,False,1
720536443987357697,fisv,2016-04-14 08:57:00,13500 shares fiserv inc fisv acquired grantham mayo van otterloo co llc,0.0,0.0,967.0,11.0,False,0
720535925349052416,fisv,2016-04-14 08:55:00,13500 shares fiserv inc fisv acquired grantham mayo van otterloo co llc,0.0,0.0,6124.0,2295.0,False,1
720431535439114241,fisv,2016-04-14 02:00:00,fiserv inc top pick stockchase,0.0,0.0,1344.0,31.0,False,1
720431513217712128,fisv,2016-04-14 02:00:00,electronic transactions benefits many trends masterc fiserv inc,0.0,0.0,1344.0,31.0,False,0
720386240772583424,fisv,2016-04-13 23:00:00,fiserv inc top pick stockchase,0.0,0.0,1344.0,31.0,False,1
720386218106626048,fisv,2016-04-13 23:00:00,electronic transactions benefits many trends masterc fiserv inc,0.0,0.0,1344.0,31.0,False,0
720382241130602497,fisv,2016-04-13 22:44:00,fisv us eaton vance management sells 7971 shares fiserv inc fisv inc,0.0,0.0,2742.0,274.0,False,0
720377493702713344,fisv,2016-04-13 22:25:00,fisv us eaton vance management sells 7971 shares fiserv inc fisv inc,0.0,0.0,3354.0,247.0,False,1
720328657865191425,fisv,2016-04-13 19:11:00,mitsubishi ufj kokusai asset management co ltd boosts stake fiserv inc fisv,0.0,0.0,868.0,0.0,False,1
720327563843735552,fisv,2016-04-13 19:07:00,fiserv inc fisv stake decreased schroder investment management group,0.0,0.0,964.0,11.0,False,0
720322092193845248,fisv,2016-04-13 18:45:00,fiserv inc fisv stake decreased schroder investment management group,0.0,0.0,6118.0,2295.0,False,1
720317482850848768,fisv,2016-04-13 18:27:00,jbem pick flks data release read,0.0,0.0,151.0,12.0,False,0
720310992899444736,fisv,2016-04-13 18:01:00,cameron hurst top picks mastercard coca cola fiserv ko fisv,0.0,0.0,15448.0,144.0,False,1
720276158919622656,fisv,2016-04-13 15:43:00,eaton vance management sells 7971 shares fiserv inc fisv,0.0,0.0,965.0,11.0,False,0
720275570806890496,fisv,2016-04-13 15:40:00,eaton vance management sells 7971 shares fiserv inc fisv,0.0,0.0,6113.0,2296.0,False,0
720236865224368128,fisv,2016-04-13 13:07:00,fisv fiserv research reveals factors billing bill payments speed security satisfaction,0.0,0.0,269.0,0.0,False,1
720235776848605184,fisv,2016-04-13 13:02:00,fisv fiserv research reveals factors billing bill payments speed security satisfaction stock news alerts app,0.0,0.0,1111.0,10.0,False,1
720225098494578688,fisv,2016-04-13 12:20:00,fisv fiserv inc nasdaq fisv scripps networks interactive …,0.0,0.0,887.0,9.0,False,1
720211887162593280,fisv,2016-04-13 11:27:00,wbi investments inc dollars 208000 stake fiserv inc fisv,0.0,0.0,869.0,0.0,False,1
720069279610191872,fisv,2016-04-13 02:01:00,rt 1234 bullish,0.0,2.0,703.0,2.0,True,1
720067316206055424,fisv,2016-04-13 01:53:00,1234 bullish,0.0,2.0,4514.0,2625.0,False,1
720013593220001792,fisv,2016-04-12 22:19:00,1234 bullish,0.0,0.0,4518.0,2625.0,False,1
720005891165155328,fisv,2016-04-12 21:49:00,fisv fiserv inc nasdaq fisv check analyst ratings,0.0,0.0,711.0,1.0,False,1
719993510523314177,fisv,2016-04-12 21:00:00,bullish big mac bullish occurred 5 pm apr 12 dollars 00.05 fiserv inc fisv fisv,0.0,0.0,125.0,3.0,False,1
719874561655836672,fisv,2016-04-12 13:07:00,fisv intracoastal bank supports growing small business client base addition mobiliti business mobile stock news alerts app,0.0,0.0,1109.0,10.0,False,1
719873540456116225,fisv,2016-04-12 13:03:00,fisv intracoastal bank supports growing small business client base addition mobiliti business mobile,0.0,0.0,268.0,0.0,False,1
719823006797836288,fisv,2016-04-12 09:42:00,possible swing plays based uoa aig dhr endp fisv fit jwn kr nke syna tif xrt,0.0,0.0,73.0,41.0,False,0
719803630556180480,fisv,2016-04-12 08:25:00,schwab charles investment management inc purchases 9614 shares fiserv inc fisv,0.0,0.0,868.0,0.0,False,1
719775079547203585,fisv,2016-04-12 06:32:00,fisv us american international group inc decreases position fiserv inc fisv inc,0.0,0.0,2738.0,274.0,False,1
719738549516505088,fisv,2016-04-12 04:06:00,ranks 80 percent alert gains today click,0.0,0.0,7096.0,0.0,False,1
719626203359944704,fisv,2016-04-11 20:40:00,3 ways get fiserv,1.0,0.0,26902.0,252.0,False,1
719592774253813760,fisv,2016-04-11 18:27:00,rt added fisv jun 100 95 1 times 2 put spreads 8 10 calls credit per equals equals equals greater,0.0,1.0,449.0,210.0,True,0
719584794720403457,fisv,2016-04-11 17:55:00,added fisv jun 100 95 1 times 2 put spreads 8 10 calls credit per equals equals equals greater,4.0,1.0,26898.0,252.0,False,1
719575436133404672,fisv,2016-04-11 17:18:00,fisv,1.0,0.0,3237.0,241.0,False,0
719574971165466625,fisv,2016-04-11 17:16:00,3 ways get fiserv dragonfly capital,2.0,0.0,26898.0,252.0,False,0
719574431572602880,fisv,2016-04-11 17:14:00,3 ways get fiserv dragonfly capital fisv,2.0,0.0,26898.0,252.0,False,1
719572337222381568,fisv,2016-04-11 17:06:00,fisv cheryl nash fiserv lead industry initiative attract women careers wealth management,0.0,0.0,268.0,0.0,False,1
719571464660365313,fisv,2016-04-11 17:03:00,fisv cheryl nash fiserv lead industry initiative attract women careers wealth management stock news alerts app,0.0,0.0,1114.0,10.0,False,1
719496982490980353,fisv,2016-04-11 12:07:00,commonwealth pennsylvania public school empls retrmt sys sells 140 shares fiserv inc fisv,0.0,0.0,679.0,8.0,False,0
719490749591457792,fisv,2016-04-11 11:42:00,ahp fisv hot alert sunedison inc nyse sune ashford hospitality prime …,0.0,0.0,742.0,6.0,False,0
719442955820359680,fisv,2016-04-11 08:32:00,,1.0,0.0,247.0,40.0,False,0
719423370161496064,fisv,2016-04-11 07:14:00,suntrust banks inc increases position fiserv inc fisv,0.0,0.0,867.0,0.0,False,1
719420284994985984,fisv,2016-04-11 07:02:00,fisv fiserv inc fisv given bbb credit rating,0.0,0.0,618.0,0.0,False,1
719417886578774016,fisv,2016-04-11 06:52:00,fiserv inc fisv given bbb credit rating,0.0,0.0,6098.0,2296.0,False,1
719278308009975808,fisv,2016-04-10 21:38:00,rt top 5 stock picks monday 1 fisv 2 lfus 3 sho 4 eig 5 nice …,0.0,4.0,260.0,3050.0,True,0
719277743234527236,fisv,2016-04-10 21:35:00,rt top 5 stock picks monday 1 fisv 2 lfus 3 sho 4 eig 5 nice …,0.0,4.0,182.0,989.0,True,1
719273300040396800,fisv,2016-04-10 21:18:00,rt top 5 stock picks monday 1 fisv 2 lfus 3 sho 4 eig 5 nice …,0.0,1.0,6.0,125.0,True,1
718934525175296000,fisv,2016-04-09 22:52:00,fisv wall street analysts bullish fisvs earnings growth,0.0,0.0,244.0,0.0,False,1
718924428923559936,fisv,2016-04-09 22:11:00,top 5 stock picks monday 1 fisv 2 lfus 3 sho 4 eig 5 nice,5.0,4.0,2764.0,4725.0,False,1
718915708319571968,fisv,2016-04-09 21:37:00,fisv fiserv inc nasdaq fisv stock rating focus,0.0,0.0,745.0,6.0,False,1
718726241415667712,fisv,2016-04-09 09:04:00,,2.0,0.0,94.0,40.0,False,1
718578837152399360,fisv,2016-04-08 23:18:00,1234 bullish,0.0,0.0,4504.0,2630.0,False,1
718556882021920769,fisv,2016-04-08 21:51:00,,0.0,0.0,245.0,40.0,False,0
718533713987006464,fisv,2016-04-08 20:19:00,pyds strong operating performance b cf read gpn xoom pypl vntv fisv,0.0,0.0,3376.0,2401.0,False,0
718513763607969792,fisv,2016-04-08 19:00:00,bullish big mac bullish occurred 5 pm apr 08 dollars 00.75 fiserv inc fisv fisv,0.0,0.0,124.0,3.0,False,0
718460237502685184,fisv,2016-04-08 15:27:00,fiserv inc fisv toth financial’s 4 largest position,0.0,0.0,861.0,0.0,False,0
718432613321588736,fisv,2016-04-08 13:37:00,exxonmobil investment management dollars 685000 position fiserv inc fisv,0.0,0.0,962.0,11.0,False,1
718242962258452480,fisv,2016-04-08 01:04:00,,1.0,0.0,245.0,40.0,False,1
718225305966653442,fisv,2016-04-07 23:53:00,rt top 5 stock picks friday 1 swhc 2 efii 3 fisv 4 ggg 5 nee …,0.0,5.0,32541.0,33109.0,True,1
718225195018924037,fisv,2016-04-07 23:53:00,rt top 5 stock picks friday 1 swhc 2 efii 3 fisv 4 ggg 5 nee …,0.0,5.0,33.0,243.0,True,1
718224750443700224,fisv,2016-04-07 23:51:00,rt top 5 stock picks friday 1 swhc 2 efii 3 fisv 4 ggg 5 nee …,0.0,5.0,616.0,920.0,True,0
718224681711624192,fisv,2016-04-07 23:51:00,rt top 5 stock picks friday 1 swhc 2 efii 3 fisv 4 ggg 5 nee …,0.0,5.0,183.0,433.0,True,1
718218240527372288,fisv,2016-04-07 23:25:00,top 5 stock picks friday 1 swhc 2 efii 3 fisv 4 ggg 5 nee,5.0,5.0,2568.0,4800.0,False,1
718203806706577409,fisv,2016-04-07 22:28:00,bullish pullback,0.0,0.0,4496.0,2630.0,False,1
718198090386247680,fisv,2016-04-07 22:05:00,fisv us fiserv inc fisv stake increased cibc world markets corp inc,0.0,0.0,3353.0,246.0,False,1
718152197083676672,fisv,2016-04-07 19:03:00,fisv fiserv incorporated nasdaq fisv shorted shares increased …,0.0,0.0,712.0,5.0,False,0
718077439512080384,fisv,2016-04-07 14:06:00,fisv valuation fiserv inc nasdaq fisv,0.0,0.0,702.0,1.0,False,1
718077186780110848,fisv,2016-04-07 14:05:00,fisv us fiserv inc fisv stake increased cibc world markets corp inc,0.0,0.0,3351.0,246.0,False,1
718021761711915008,fisv,2016-04-07 10:25:00,fisv wall street analysts bullish fisvs earnings growth,0.0,0.0,242.0,0.0,False,0
718017653504393216,fisv,2016-04-07 10:08:00,fiserv inc fisv stake increased cibc world markets corp,0.0,0.0,966.0,11.0,False,1
718016892888358912,fisv,2016-04-07 10:05:00,fiserv inc fisv stake increased cibc world markets corp,0.0,0.0,6083.0,2296.0,False,1
718002303077388288,fisv,2016-04-07 09:07:00,fiserv inc fisv sees unusually high trading volume,0.0,0.0,966.0,11.0,False,1
717879668058120192,fisv,2016-04-07 01:00:00,fisv new long 101.8 broken targets 103.53 105.26 114.52 bears must retake 91.76 qqq nqf ndx,0.0,0.0,3890.0,3030.0,False,1
717839328181821441,fisv,2016-04-06 22:20:00,180 bullish,0.0,0.0,4486.0,2633.0,False,1
717836582477307905,fisv,2016-04-06 22:09:00,4 great long term momentum charts markets bmy fisv msft googl,0.0,0.0,1480.0,504.0,False,1
717836170424659968,fisv,2016-04-06 22:07:00,scan results 123 pullback bullish today viv jah kep fisv simo iart urbn cnl ugi ctre,0.0,0.0,612.0,45.0,False,1
717835296688193537,fisv,2016-04-06 22:04:00,scan results bullish engulfing today bhi gddy wat evhc pfsw stj fisv simo spls lvnta,0.0,0.0,612.0,45.0,False,0
717819446245658626,fisv,2016-04-06 21:01:00,fisv new sec documents fiserv inc stock news alerts app,0.0,0.0,1103.0,10.0,False,1
717745972890243073,fisv,2016-04-06 16:09:00,4 great long term momentum charts markets bmy fisv msft googl,0.0,0.0,301.0,13.0,False,1
717714557519667200,fisv,2016-04-06 14:04:00,acn fisv accenture plc nyse acn takeovers acquisition majority …,0.0,0.0,743.0,6.0,False,1
717708355897155584,fisv,2016-04-06 13:39:00,,0.0,0.0,94.0,40.0,False,0
717687642742210561,fisv,2016-04-06 12:17:00,nok fisv hotspot stocks hit list nokia nyse nok,1.0,0.0,743.0,6.0,False,0
717643296840003587,fisv,2016-04-06 09:21:00,4 great long term momentum charts markets bmy fisv msft googl,0.0,0.0,1478.0,504.0,False,1
717638193789665280,fisv,2016-04-06 09:00:00,nelson van denburg campbell wealth management group llc increases stake fiserv inc fisv,0.0,0.0,1124.0,40.0,False,1
717638147262267392,fisv,2016-04-06 09:00:00,nelson van denburg campbell wealth management group llc increases stake fiserv inc fisv,0.0,0.0,853.0,0.0,False,0
717584223511703552,fisv,2016-04-06 05:26:00,fiserv inc fisv receives bbb credit rating morningstar,0.0,0.0,967.0,11.0,False,1
717583743842652160,fisv,2016-04-06 05:24:00,fiserv inc fisv receives bbb credit rating morningstar,0.0,0.0,6082.0,2296.0,False,0
717504867305000960,fisv,2016-04-06 00:11:00,,0.0,0.0,245.0,40.0,False,1
717450267185299460,fisv,2016-04-05 20:34:00,fisv new sec filing fisv form def 14 no 0001193125 16 530795,0.0,0.0,98.0,0.0,False,1
717449516769783808,fisv,2016-04-05 20:31:00,fisv new sec documents fiserv inc stock news alerts app,0.0,0.0,1101.0,10.0,False,0
717310598632120320,fisv,2016-04-05 11:19:00,bailard inc invests dollars 427000 fiserv inc fisv,0.0,0.0,1128.0,40.0,False,0
717287572997672960,fisv,2016-04-05 09:47:00,fisv received new alert find,0.0,0.0,8024.0,7918.0,False,0
717284216225062913,fisv,2016-04-05 09:34:00,fiserv inc fisv stake raised atlantic trust group llc,0.0,0.0,1128.0,40.0,False,1
717210687408316416,fisv,2016-04-05 04:42:00,cydy running flks starting,0.0,0.0,131.0,12.0,False,1
717156215709638656,fisv,2016-04-05 01:05:00,fisv cuscal limited selects fiserv enable delivery automated cash atm network management financ,0.0,0.0,264.0,0.0,False,1
717155419798511616,fisv,2016-04-05 01:02:00,fisv cuscal limited selects fiserv enable delivery automated cash atm network management finan stock news alerts app,0.0,0.0,1100.0,10.0,False,1
717117106291081218,fisv,2016-04-04 22:30:00,fisv fiserv inc nasdaq fisv target price 93.111 expected,0.0,0.0,867.0,9.0,False,1
717064217119969280,fisv,2016-04-04 19:00:00,bullish big mac bullish occurred 5 pm apr 04 dollars 02.99 fiserv inc fisv fisv,0.0,0.0,124.0,3.0,False,1
716975843722063872,fisv,2016-04-04 13:08:00,fisv fiserv release first quarter earnings results may 5 2016,0.0,0.0,263.0,0.0,False,1
716974321042853888,fisv,2016-04-04 13:02:00,fisv fiserv release first quarter earnings results may 5 2016 stock news alerts app,0.0,0.0,1095.0,10.0,False,0
716928832553558016,fisv,2016-04-04 10:02:00,weekly nasdaq100 trend ilmn dltr amat lbtya tsla sbac aapl ctxs fisv tsco vrsk amgn disca,0.0,0.0,841.0,7.0,False,0
716924568062005248,fisv,2016-04-04 09:45:00,fiserv inc fisv stake decreased mufg americas holdings corp,0.0,0.0,2141.0,11.0,False,1
716923887552970752,fisv,2016-04-04 09:42:00,fiserv inc fisv stake decreased mufg americas holdings corp,0.0,0.0,672.0,8.0,False,1
716906659499675648,fisv,2016-04-04 08:34:00,hugh johnson advisors llc dollars 141000 stake fiserv inc fisv,0.0,0.0,961.0,11.0,False,0
716906189079121920,fisv,2016-04-04 08:32:00,hugh johnson advisors llc dollars 141000 stake fiserv inc fisv,0.0,0.0,6076.0,2296.0,False,1
716905092721455106,fisv,2016-04-04 08:27:00,viral video biggest bubble entire u economy fb fast frt fdx fis fitb fslr fe fisv flir,0.0,0.0,4.0,35.0,False,1
716620630733369344,fisv,2016-04-03 13:37:00,viral video biggest bubble entire u economy fb fast frt fdx fis fitb fslr fe fisv flir,0.0,0.0,4.0,35.0,False,0
716268535140507648,fisv,2016-04-02 14:18:00,fisv first call projects eps 1.09 fiserv inc nasdaq fisv,0.0,0.0,737.0,6.0,False,1
716267002415996929,fisv,2016-04-02 14:12:00,weekly nasdaq100 trend ilmn dltr amat lbtya tsla sbac aapl ctxs fisv tsco vrsk amgn disca,0.0,0.0,841.0,7.0,False,1
716133518829551616,fisv,2016-04-02 05:21:00,fiserv inc fisv assigned bbb credit rating,0.0,0.0,1126.0,40.0,False,1
716132460862504960,fisv,2016-04-02 05:17:00,fisv fiserv inc fisv assigned bbb credit rating,0.0,0.0,562.0,0.0,False,1
716082676072071174,fisv,2016-04-02 01:59:00,three penny stock picks quadrupled value big things way,0.0,0.0,13805.0,8.0,False,1
716077502356172802,fisv,2016-04-02 01:39:00,1466 percent gains top stock picks lately see big new pick early,0.0,0.0,15089.0,0.0,False,1
716056673903718402,fisv,2016-04-02 00:16:00,rt watch makes convenient fisv,0.0,3.0,25.0,26.0,True,1
716039499768139776,fisv,2016-04-01 23:08:00,,0.0,0.0,246.0,40.0,False,1
716023659916189696,fisv,2016-04-01 22:05:00,wondering indicator fisv short ratio 3.74 percent,0.0,0.0,1274.0,1502.0,False,1
716022907588087808,fisv,2016-04-01 22:02:00,calculated 63 day expected return fisv 9.85 percent,0.0,0.0,1274.0,1502.0,False,1
716020641187540992,fisv,2016-04-01 21:53:00,know value fisv dollars 1.81,0.0,0.0,1274.0,1502.0,False,1
716007005232697345,fisv,2016-04-01 20:59:00,fisv new sec filing fisv form 8 k no 0001193125 16 528021,0.0,0.0,98.0,6.0,False,1
715992368923721728,fisv,2016-04-01 20:00:00,fisv new sec documents fiserv inc stock news alerts app,0.0,0.0,1095.0,10.0,False,1
715992065704869888,fisv,2016-04-01 19:59:00,nasdaq100 trend tsla ilmn amgn sbac gild avgo dltr tsco cmcsa ctxs lltc disca fisv amat,0.0,0.0,841.0,7.0,False,0
715991912738631680,fisv,2016-04-01 19:59:00,oppenheimerfunds inc increases stake fiserv inc fisv,0.0,0.0,6076.0,2296.0,False,1
715977146917736449,fisv,2016-04-01 19:00:00,popular f watt wmt dyn nvro fisv drwi nok safm amgn sbux hpe aep,0.0,0.0,1297.0,1.0,False,1
715965990006308864,fisv,2016-04-01 18:16:00,fisv new insider transaction fisv director,0.0,0.0,435.0,0.0,False,1
715952076996653056,fisv,2016-04-01 17:20:00,rt care rt bwsportswire watch care makes convenient fiserv fisv,0.0,0.0,8195.0,570.0,False,1
715949686834724864,fisv,2016-04-01 17:11:00,rt watch makes convenient fisv,0.0,3.0,655598.0,1183.0,True,1
715929638518841344,fisv,2016-04-01 15:51:00,nasdaq100 trend ilmn tsla dltr amat klac ctxs intu disca vrsk adbe fisv tsco incy gild,0.0,0.0,841.0,7.0,False,0
715907605294657536,fisv,2016-04-01 14:24:00,fis fisv goldman sachs upgrades fidelity national information services …,0.0,0.0,562.0,0.0,False,1
715906126580068353,fisv,2016-04-01 14:18:00,fisv stock 102.01 fiserv inc fisv hit 52 week high 102.40 closing day 5 102.01 0.57 0.56 percent w,0.0,0.0,942.0,842.0,False,0
715904872764321793,fisv,2016-04-01 14:13:00,fisv stock highlights fiserv inc nasdaq fisv sandstorm gold ltd …,0.0,0.0,866.0,9.0,False,1
715902708612370433,fisv,2016-04-01 14:04:00,,0.0,0.0,88.0,40.0,False,1
715887121446383616,fisv,2016-04-01 13:02:00,watch makes convenient fisv,0.0,0.0,642.0,2042.0,False,0
715885242733633536,fisv,2016-04-01 12:55:00,strongest strongest relative strength stocks spy acc wtr mbs fb fslr fisv hrl jcp kmb mcd pm twc,0.0,0.0,14108.0,336.0,False,0
715884072099299328,fisv,2016-04-01 12:50:00,watch makes convenient fisv,2.0,3.0,554.0,414.0,False,1
715883379217010688,fisv,2016-04-01 12:47:00,three penny stock picks quadrupled value big things way,0.0,0.0,13805.0,8.0,False,1
715879315225911297,fisv,2016-04-01 12:31:00,info fisv sentiment indicator seen investors news social media shows positive perception,0.0,0.0,304.0,103.0,False,0
715877798905266176,fisv,2016-04-01 12:25:00,1466 percent gains top stock picks lately see big new pick early,0.0,0.0,15089.0,0.0,False,0
715857797351604224,fisv,2016-04-01 11:06:00,fiserv inc fisv shares sold bank montreal,0.0,0.0,2141.0,11.0,False,0
715856965461782528,fisv,2016-04-01 11:02:00,want automatic email alerts expr pnr sho fisv mnta subscribe marketbeat daily,0.0,0.0,4001.0,1.0,False,1
715841651047063552,fisv,2016-04-01 10:02:00,weekly nasdaq100 trend vip chkp yhoo amat dltr viab ctsh ntap bidu isrg vrsk fisv intu,1.0,0.0,841.0,7.0,False,1
715700202120675329,fisv,2016-04-01 00:39:00,,0.0,0.0,246.0,40.0,False,0
715695391426142209,fisv,2016-04-01 00:20:00,three penny stock picks quadrupled value big things way,0.0,0.0,13805.0,8.0,False,1
715690433691656192,fisv,2016-04-01 00:01:00,1466 percent gains top stock picks lately see big new pick early,0.0,0.0,15089.0,0.0,False,1
715675574681923584,fisv,2016-03-31 23:02:00,nasdaq100 trend vip viab ntap vrsk chkp intu yhoo amat adp bidu fisv isrg cmcsa ctsh,0.0,0.0,841.0,7.0,False,0
715666980397846528,fisv,2016-03-31 22:27:00,fisv us bank ceylon upgrades core systems fiserv inc,0.0,0.0,2746.0,274.0,False,1
715662230856007680,fisv,2016-03-31 22:09:00,fisv us bank ceylon upgrades core systems fiserv inc,0.0,0.0,3350.0,247.0,False,1
715657884588113920,fisv,2016-03-31 21:51:00,time highs via aep algn alrm avgo bro cinf cone cprt cube ed efx elli exr fisv g,0.0,0.0,825.0,602.0,False,0
715657762097631232,fisv,2016-03-31 21:51:00,large increases 03.31.16 bac vale mo ftr jcp vrx fisv,20.0,0.0,171341.0,9463.0,False,1
715641669140369409,fisv,2016-03-31 20:47:00,monthly recap 27 long positions acgl azo bcr bdx bf b brk casy chd cni dhr ecl enb fisv gww hrl,0.0,0.0,11218.0,26.0,False,0
715629681232445442,fisv,2016-03-31 19:59:00,nasdaq100 trend viab vrsk chkp amat bidu intu adp isrg cmcsa ctsh yhoo fisv csco aapl,0.0,0.0,841.0,7.0,False,0
715618595582009344,fisv,2016-03-31 19:15:00,two companies eliminate bank tellers jack henry associates jkhy fisv invest unfortunately bc started,0.0,0.0,1251.0,410.0,False,1
715618584207224832,fisv,2016-03-31 19:15:00,teacher retirement system texas cuts stake fiserv inc fisv,0.0,0.0,961.0,11.0,False,1
715618194791276545,fisv,2016-03-31 19:14:00,teacher retirement system texas cuts stake fiserv inc fisv,0.0,0.0,6076.0,2296.0,False,1
715569355124133888,fisv,2016-03-31 16:00:00,bullish big mac bullish occurred 0 mar 31 dollars 02.42 fiserv inc fisv fisv,0.0,0.0,125.0,3.0,False,1
715567255015276546,fisv,2016-03-31 15:51:00,nasdaq100 trend bidu vrsk intu isrg chkp amat cmcsa fisv csco yhoo hsic aapl dltr ctsh,0.0,0.0,841.0,7.0,False,1
715560440118509568,fisv,2016-03-31 15:24:00,yesterday made dollars 4000 one trade info,0.0,0.0,7101.0,0.0,False,0
715546758194073600,fisv,2016-03-31 14:30:00,fisv us bank ceylon upgrades core systems fiserv inc,0.0,0.0,2746.0,274.0,False,1
715541596742230016,fisv,2016-03-31 14:09:00,fisv us bank ceylon upgrades core systems fiserv inc,0.0,0.0,3350.0,247.0,False,1
715511949983817728,fisv,2016-03-31 12:11:00,financial services technology provider fisv said bank ceylon expanded relationship,0.0,0.0,10.0,2.0,False,0
715482049537179652,fisv,2016-03-31 10:13:00,1466 percent gains top stock picks lately see big new pick early,0.0,0.0,15089.0,0.0,False,1
715452658727960576,fisv,2016-03-31 08:16:00,fiserv inc fisv stake increased golub group llc,0.0,0.0,961.0,11.0,False,0
715452061962395648,fisv,2016-03-31 08:13:00,fiserv inc fisv stake increased golub group llc,0.0,0.0,6076.0,2296.0,False,1
715450019487285248,fisv,2016-03-31 08:05:00,fiserv inc fisv stake increased golub group llc,0.0,0.0,2141.0,11.0,False,1
715430147000770560,fisv,2016-03-31 06:46:00,premium alerts ranked gains 2834 percent last week,0.0,0.0,7101.0,0.0,False,1
715343536019869696,fisv,2016-03-31 01:02:00,fisv bank ceylon upgraded core banking front end teller systems signature teller fi stock news alerts app,1.0,0.0,1095.0,10.0,False,1
715343174881951744,fisv,2016-03-31 01:01:00,fisv bank ceylon upgraded core banking front end teller …,0.0,0.0,699.0,1.0,False,1
715330218106355713,fisv,2016-03-31 00:09:00,three penny stock picks quadrupled value big things way,0.0,0.0,13805.0,8.0,False,1
715327564336771073,fisv,2016-03-30 23:59:00,1466 percent gains top stock picks lately see big new pick early,0.0,0.0,15089.0,0.0,False,1
715313228012761094,fisv,2016-03-30 23:02:00,nasdaq100 trend chkp dltr amat avgo aapl txn ctsh csco nvda yhoo hsic intu lltc fisv,0.0,0.0,841.0,7.0,False,1
715278966806810624,fisv,2016-03-30 20:46:00,jbem bak 2 sendng comprehensive dd goin bak 2 roots,0.0,0.0,127.0,12.0,False,0
715267365420707840,fisv,2016-03-30 20:00:00,bullish big mac bullish occurred 0 pm mar 30 dollars 02.16 fiserv inc fisv fisv,0.0,0.0,125.0,3.0,False,1
715267329769254917,fisv,2016-03-30 19:59:00,nasdaq100 trend chkp amat dltr aapl ctsh avgo txn csco nvda yhoo hsic intu fisv lltc,0.0,0.0,841.0,7.0,False,0
715258816800096257,fisv,2016-03-30 19:26:00,fiserv inc fisv position boosted choate investment advisors,0.0,0.0,1126.0,40.0,False,0
715257487419514880,fisv,2016-03-30 19:20:00,cafn cachet financial up positive 12.77 percent cornerstone credit union league annual expo,0.0,0.0,1260.0,532.0,False,1
715256241618980864,fisv,2016-03-30 19:15:00,choate investment advisors acquires 2315 shares fiserv inc fisv,0.0,0.0,6076.0,2296.0,False,1
715252462572048384,fisv,2016-03-30 19:00:00,,0.0,0.0,88.0,40.0,False,1
715251540664139776,fisv,2016-03-30 18:57:00,fisv new insider transaction fisv group president,0.0,0.0,606.0,0.0,False,1
715241131970326528,fisv,2016-03-30 18:15:00,fisv new sec documents fiserv inc stock news alerts app,0.0,0.0,1095.0,10.0,False,1
715191877155180548,fisv,2016-03-30 15:00:00,bullish big mac bullish occurred 5 mar 30 dollars 02.00 fiserv inc fisv fisv,0.0,0.0,125.0,3.0,False,1
715184887637098496,fisv,2016-03-30 14:32:00,fisv us gulf international bank uk ltd purchases 400 shares fiserv inc fisv inc,0.0,0.0,2746.0,274.0,False,0
715179407929843713,fisv,2016-03-30 14:10:00,provider cachet financial solutions inc cafn trading up early positive 4.04 percent,0.0,0.0,1260.0,532.0,False,0
715179402380853248,fisv,2016-03-30 14:10:00,fisv us gulf international bank uk ltd purchases 400 shares fiserv inc fisv inc,0.0,0.0,3350.0,247.0,False,0
715162868853915648,fisv,2016-03-30 13:04:00,fisv three credit unions implement dna core account processing platform integrated solutions fiserv stock news alerts app,0.0,0.0,1095.0,10.0,False,1
715162686347198466,fisv,2016-03-30 13:04:00,three credit unions implement dna core account processing platform,0.0,0.0,7008.0,65.0,False,1
715162364719534080,fisv,2016-03-30 13:02:00,fisv three credit unions implement dna core account processing platform integrated solutions fiserv,0.0,0.0,261.0,0.0,False,0
715140379260137472,fisv,2016-03-30 11:35:00,fisv technical alerts 180 bullish setup non adx 1234 bullish expansion breakout reversal n,0.0,0.0,608.0,45.0,False,1
715116905036644352,fisv,2016-03-30 10:02:00,weekly nasdaq100 trend spls nvda fb dltr yhoo lrcx isrg fisv cmcsa klac vrsk aapl txn adp,0.0,0.0,841.0,7.0,False,0
715041862504091649,fisv,2016-03-30 05:03:00,three penny stock picks quadrupled value big things way,0.0,0.0,13805.0,8.0,False,1
715039693268770816,fisv,2016-03-30 04:55:00,1466 percent gains top stock picks lately see big new pick early,0.0,0.0,15089.0,0.0,False,0
714950976906661888,fisv,2016-03-29 23:02:00,p500 trend uhs lrcx csc isrg yhoo ntap kim nwl hcn aapl mkc vtr fisv fb mhfi klac,0.0,0.0,841.0,7.0,False,1
714950832102449152,fisv,2016-03-29 23:02:00,nasdaq100 trend lrcx isrg yhoo ntap aapl fisv fb klac spls ctxs nvda txn adp vrsk cmcsa,0.0,0.0,841.0,7.0,False,0
714944369837654018,fisv,2016-03-29 22:36:00,fisv us care accept donations via fiserv popmoney inc,0.0,0.0,2746.0,274.0,False,1
714940310682382337,fisv,2016-03-29 22:20:00,new uptrend,0.0,0.0,4490.0,2641.0,False,1
714937953957650433,fisv,2016-03-29 22:11:00,fisv us care accept donations via fiserv popmoney inc,0.0,0.0,3350.0,247.0,False,0
714930461202624513,fisv,2016-03-29 21:41:00,picks seeing incredible gains get exclusive early access new alerts,0.0,0.0,4233.0,0.0,False,1
