Tweet Id,Ticker,Datetime,Text,Favs,RTs,Followers,Following,Is a RT,Sentiment
742889916351287296,fisv,2016-06-15 01:22:00,ichimoku green,0.0,0.0,4864.0,2512.0,False,1
742870436858322945,fisv,2016-06-15 00:04:00,check fisv fi amzn skill,0.0,0.0,96.0,48.0,False,0
742851024696840192,fisv,2016-06-14 22:47:00,fisv us traders buy shares fiserv inc fisv weakness inc,0.0,0.0,2767.0,279.0,False,1
742835513493737472,fisv,2016-06-14 21:46:00,fisv wall street analysts bullish fisvs earnings growth,0.0,0.0,291.0,0.0,False,1
742793599084007424,fisv,2016-06-14 18:59:00,fiserv inc fisv position boosted glenmede trust co na,0.0,0.0,771.0,8.0,False,1
742618562456616960,fisv,2016-06-14 07:23:00,traders buy shares fiserv inc fisv weakness,0.0,0.0,1074.0,11.0,False,0
742617754902122496,fisv,2016-06-14 07:20:00,traders buy shares fiserv inc fisv weakness,0.0,0.0,6365.0,2292.0,False,1
742517745430990848,fisv,2016-06-14 00:43:00,nasdaq100 trend hsic isrg cern sbac esrx ctxs csx fisv ebay lltc txn ca ulta dltr dish,0.0,0.0,869.0,7.0,False,1
742516984722665472,fisv,2016-06-14 00:40:00,weekly nasdaq100 trend hsic isrg cern csx esrx ctxs fisv sbac ebay lltc ulta txn ca dltr,0.0,0.0,869.0,7.0,False,0
742485675094609920,fisv,2016-06-13 22:35:00,bullish moving oversold occurred 5 pm jun 13 dollars 05.56 fiserv inc fisv fisv get report,0.0,0.0,143.0,10.0,False,1
742386285671747584,fisv,2016-06-13 16:00:00,fisv 3 open suited signals indicate continued price increase 2 days,0.0,0.0,243.0,471.0,False,1
742245357128585217,fisv,2016-06-13 06:40:00,,0.0,0.0,272.0,40.0,False,0
742093960982630400,fisv,2016-06-12 20:39:00,,0.0,0.0,117.0,40.0,False,0
742058152867168256,fisv,2016-06-12 18:17:00,fxy currencyshares japanese yen trust financials fxy fisv ewh xiu,0.0,0.0,60.0,40.0,False,1
742057147098226690,fisv,2016-06-12 18:13:00,fisv fiserv inc day high fisv pacb oniax jnug,0.0,0.0,60.0,40.0,False,1
742053635169751040,fisv,2016-06-12 17:59:00,dba powershares db agriculture fund short sales dba ag ge fisv,0.0,0.0,80.0,41.0,False,1
741917009529737216,fisv,2016-06-12 08:56:00,fisv ngam advisors l p dollars 299000 position fiserv inc,0.0,0.0,630.0,5.0,False,1
741916885470564353,fisv,2016-06-12 08:55:00,fisv ngam advisors l p dollars 299000 position fiserv inc,0.0,0.0,168.0,0.0,False,0
741916759066836992,fisv,2016-06-12 08:55:00,ngam advisors l p dollars 299000 position fiserv inc fisv,0.0,0.0,422.0,10.0,False,0
741864935982911488,fisv,2016-06-12 05:29:00,,0.0,0.0,117.0,40.0,False,0
741676756814336000,fisv,2016-06-11 17:01:00,urre proshares ultrapro russell2000 volume urre clf pcln fisv,0.0,0.0,80.0,41.0,False,1
741659770898120707,fisv,2016-06-11 15:54:00,drys direxion daily gold miners index bear 3 times shares bid size drys dipsx fisv sbux,0.0,0.0,58.0,40.0,False,1
741606461638205440,fisv,2016-06-11 12:22:00,fiserv inc fisv 106.38 fisv vanguard realty group hires robert kravitz senior vice president commercia,0.0,0.0,1852.0,446.0,False,1
741524875374952448,fisv,2016-06-11 06:58:00,fisv wall street analysts bullish fisvs earnings growth,0.0,0.0,291.0,0.0,False,1
741523066925244416,fisv,2016-06-11 06:50:00,rt get say fisv speculatingstocks discovery engine,0.0,1.0,966.0,6.0,True,1
741522513235042306,fisv,2016-06-11 06:48:00,get say fisv speculatingstocks discovery engine,0.0,1.0,868.0,778.0,False,0
741260392404549633,fisv,2016-06-10 13:27:00,blackrock group ltd reduces position fiserv inc fisv,0.0,0.0,1074.0,11.0,False,1
741259960185655296,fisv,2016-06-10 13:25:00,blackrock group ltd reduces position fiserv inc fisv,0.0,0.0,6365.0,2292.0,False,0
741042869796929537,fisv,2016-06-09 23:02:00,nasdaq100 trend hsic isrg csx esrx ctxs ebay yhoo dltr lrcx txn ca cern fisv sbac mnst,0.0,0.0,869.0,7.0,False,0
741031160248143873,fisv,2016-06-09 22:16:00,fisv us fiserv inc fisv reaches new 52 week high dollars 07.54 inc,0.0,0.0,3342.0,253.0,False,1
740997033666830337,fisv,2016-06-09 20:00:00,nasdaq100 trend hsic isrg esrx csx ctxs ebay yhoo dltr txn ca fisv cern sbac tsla nvda,0.0,0.0,869.0,7.0,False,1
740952645561647104,fisv,2016-06-09 17:04:00,fisv 3 open suited signals indicate continued price increase 4 days,0.0,0.0,243.0,471.0,False,0
740916719489683456,fisv,2016-06-09 14:41:00,,0.0,0.0,272.0,40.0,False,1
740887791723241472,fisv,2016-06-09 12:46:00,blackrock institutional trust company n sells 141326 shares fiserv inc fisv,0.0,0.0,2226.0,11.0,False,1
740876167738208256,fisv,2016-06-09 12:00:00,sentry investment management llc dollars 776000 position fiserv inc fisv,0.0,0.0,422.0,10.0,False,1
740844290885222404,fisv,2016-06-09 09:53:00,canandaigua national bank trust co dollars 44000 stake fiserv inc fisv,0.0,0.0,422.0,10.0,False,1
740749233968586753,fisv,2016-06-09 03:35:00,fiserv inc fisv reaches new 52 week high dollars 07.54,0.0,0.0,1074.0,11.0,False,0
740748439210844164,fisv,2016-06-09 03:32:00,fiserv inc fisv reaches new 52 week high dollars 07.54,0.0,0.0,6365.0,2292.0,False,0
740689734893178882,fisv,2016-06-08 23:39:00,keltner,0.0,0.0,4864.0,2512.0,False,1
740624978370912256,fisv,2016-06-08 19:22:00,,0.0,0.0,272.0,40.0,False,1
740618503967887360,fisv,2016-06-08 18:56:00,fiserv inc stock testing highs fisv,0.0,0.0,196.0,6.0,False,0
740608915205820416,fisv,2016-06-08 18:18:00,8 new 52 week highs fisv,0.0,0.0,1373.0,1.0,False,1
740608811896066048,fisv,2016-06-08 18:17:00,fiserv hits 1 year high,0.0,0.0,64.0,3.0,False,1
740560523146764290,fisv,2016-06-08 15:06:00,tiaa cref investment management llc dollars 10754000 stake fiserv inc fisv,0.0,0.0,998.0,0.0,False,1
740478920642940928,fisv,2016-06-08 09:41:00,marietta investment partners llc sells 5800 shares fiserv inc fisv,0.0,0.0,771.0,8.0,False,1
740424558835052544,fisv,2016-06-08 06:05:00,fisv fiserv inc robert w baird global consumer technology services conference transcript,0.0,0.0,69.0,90.0,False,1
740322290982912000,fisv,2016-06-07 23:19:00,lizard bearish,0.0,1.0,4864.0,2512.0,False,1
740265042805940224,fisv,2016-06-07 19:31:00,fisv baird 2016 global consumer technology services conference audio available,0.0,0.0,69.0,90.0,False,1
740239150604029952,fisv,2016-06-07 17:49:00,fisv annual meeting shareholders presentation available,0.0,0.0,69.0,90.0,False,1
740221384706531328,fisv,2016-06-07 16:38:00,52 week high alert trading today’s movement fiserv fisv,0.0,0.0,2296.0,2.0,False,1
740185943274102784,fisv,2016-06-07 14:17:00,fiserv inc stock testing highs fisv,0.0,0.0,196.0,6.0,False,1
740185448497205248,fisv,2016-06-07 14:15:00,fisv lope dw ueic presentations starting,0.0,0.0,337.0,754.0,False,1
740167712182312960,fisv,2016-06-07 13:05:00,fisv cu moves fiserv drive service efficiency member engagement integrated core account,0.0,0.0,286.0,0.0,False,1
740167644087738368,fisv,2016-06-07 13:04:00,fisv cu moves fiserv drive service efficiency member engagement integrated core account stock news alerts app,0.0,0.0,1221.0,10.0,False,0
740140132343255040,fisv,2016-06-07 11:15:00,yri yamana gold inc tick year fisv celg gdx,0.0,0.0,73.0,40.0,False,0
740136998652936192,fisv,2016-06-07 11:03:00,vnr vanguard natural resources llc news vnr fisv xeg nugt,0.0,0.0,58.0,40.0,False,1
740131826614689792,fisv,2016-06-07 10:42:00,psct powershares p smallcap information technology portfolio dividend psct fisv ung enoc,0.0,0.0,60.0,40.0,False,1
740121988371472385,fisv,2016-06-07 10:03:00,howard hughes medical institute dollars 81000 stake fiserv inc fisv,0.0,0.0,2226.0,11.0,False,1
740121388283920384,fisv,2016-06-07 10:01:00,fisv fiserv inc message board posts fisv smh dia gush,1.0,0.0,70.0,40.0,False,1
740119997721153536,fisv,2016-06-07 09:55:00,dwa dreamworks animation skg inc investor opinions dwa shy fisv tna,0.0,0.0,80.0,41.0,False,1
740077960141635588,fisv,2016-06-07 07:08:00,fiserv inc fisv given average rating “hold” brokerages,0.0,0.0,1084.0,11.0,False,1
740077501695852544,fisv,2016-06-07 07:06:00,fiserv inc fisv given average rating “hold” brokerages,0.0,0.0,6334.0,2292.0,False,1
740076030833135616,fisv,2016-06-07 07:00:00,rt,0.0,1.0,927.0,6.0,True,0
740075024883671042,fisv,2016-06-07 06:56:00,,0.0,1.0,118.0,40.0,False,1
739978515488083969,fisv,2016-06-07 00:33:00,52 week high,0.0,0.0,4814.0,2525.0,False,1
739888705209536512,fisv,2016-06-06 18:36:00,fiserv hits 1 year high,0.0,0.0,52.0,3.0,False,1
739886225281126404,fisv,2016-06-06 18:26:00,fiserv inc stock testing highs fisv,0.0,0.0,195.0,6.0,False,1
739876167826690052,fisv,2016-06-06 17:46:00,fisv 3 open suited signals indicate continued price increase 7 days,0.0,0.0,242.0,471.0,False,1
739825455302385664,fisv,2016-06-06 14:25:00,fisv fiserv named fortune 500 stock news alerts app,0.0,0.0,1217.0,10.0,False,1
739825253593972739,fisv,2016-06-06 14:24:00,fisv fiserv named fortune 500,0.0,0.0,27.0,39.0,False,0
739806393771950080,fisv,2016-06-06 13:09:00,fisv bancorpsouth inc dollars 62000 stake fiserv inc,0.0,0.0,636.0,5.0,False,1
739806283256242176,fisv,2016-06-06 13:08:00,fisv bancorpsouth inc dollars 62000 stake fiserv inc,0.0,0.0,170.0,0.0,False,1
739778334595424256,fisv,2016-06-06 11:17:00,woodstock corp holds stake fiserv inc fisv,0.0,0.0,2215.0,11.0,False,0
739741838068875264,fisv,2016-06-06 08:52:00,fiserv inc fisv insider sells dollars 003601.03 stock,0.0,0.0,999.0,0.0,False,1
739741834394632192,fisv,2016-06-06 08:52:00,fiserv inc fisv insider sells dollars 003601.03 stock,0.0,0.0,999.0,0.0,False,1
739444093558751234,fisv,2016-06-05 13:09:00,,0.0,0.0,274.0,40.0,False,1
739367348700893184,fisv,2016-06-05 08:04:00,prudential financial inc dollars 06269000 position fiserv inc fisv,0.0,0.0,422.0,10.0,False,1
739352318349594624,fisv,2016-06-05 07:05:00,fiserv inc fisv receives dollars 7.27 consensus target price brokerages,0.0,0.0,999.0,0.0,False,1
739126107958575104,fisv,2016-06-04 16:06:00,fisv company fiserv inc submited new sec filing,0.0,0.0,37.0,0.0,False,1
739039615361949696,fisv,2016-06-04 10:22:00,fiserv inc fisv reaches new 12 month high dollars 06.29,0.0,0.0,1077.0,11.0,False,1
739039149089492992,fisv,2016-06-04 10:20:00,fiserv inc fisv reaches new 12 month high dollars 06.29,0.0,0.0,6323.0,2292.0,False,0
739013017157939204,fisv,2016-06-04 08:36:00,fiserv inc fisv shares bought pacad investment ltd,0.0,0.0,2208.0,11.0,False,1
739008604376858624,fisv,2016-06-04 08:19:00,los angeles capital management equity research inc sells 101688 shares fiserv inc fisv,0.0,0.0,998.0,0.0,False,1
738889339577507840,fisv,2016-06-04 00:25:00,keltner,0.0,0.0,4804.0,2533.0,False,1
738848109191532544,fisv,2016-06-03 21:41:00,,0.0,0.0,274.0,40.0,False,1
738842494855700480,fisv,2016-06-03 21:19:00,fisv company fiserv inc submited new sec filing,0.0,0.0,36.0,0.0,False,1
738796162501730304,fisv,2016-06-03 18:15:00,old national bancorp maintains position fiserv inc fisv,0.0,0.0,765.0,8.0,False,1
738788983489105929,fisv,2016-06-03 17:46:00,fisv fiserv named newsweek 2016 green rankings stock news alerts app,0.0,0.0,1204.0,10.0,False,1
738762117625610241,fisv,2016-06-03 15:59:00,fisv 3 open suited signals indicate continued price increase 8 days,0.0,0.0,241.0,471.0,False,1
738734399966044160,fisv,2016-06-03 14:09:00,fiserv inc fisv stake maintained united american securities inc b uas asset management,0.0,0.0,517.0,6.0,False,1
738734144641961984,fisv,2016-06-03 14:08:00,fiserv inc fisv stake maintained united american securities inc b uas asset management,0.0,0.0,1165.0,58.0,False,1
738731582618537984,fisv,2016-06-03 13:58:00,fiserv inc fisv stake reduced dubuque bank trust co,0.0,0.0,1076.0,11.0,False,1
738731326132658176,fisv,2016-06-03 13:57:00,fiserv inc fisv stake reduced dubuque bank trust co,0.0,0.0,6319.0,2292.0,False,1
738728584513236992,fisv,2016-06-03 13:46:00,fiserv hits 1 year high,0.0,0.0,53.0,3.0,False,1
738672146440978432,fisv,2016-06-03 10:02:00,weekly nasdaq100 trend dish ulta vrtx incy viab alxn wfm bmrn regn trip amgn ca celg fisv,0.0,0.0,870.0,7.0,False,1
738653380793540608,fisv,2016-06-03 08:47:00,rahul gupta sells 28603 shares fiserv inc fisv stock,0.0,0.0,420.0,10.0,False,1
738653337172774912,fisv,2016-06-03 08:47:00,rt chters added following today payx unh mdt trip current trades trailing stops amat low mxl ca fis…,0.0,1.0,40.0,102.0,True,1
738611124937981952,fisv,2016-06-03 05:59:00,,0.0,0.0,117.0,40.0,False,0
738570500293550080,fisv,2016-06-03 03:18:00,stock watch greater greater greater amsf bcov cash crl ctxs fisv fivn shen spnc,0.0,0.0,53193.0,52602.0,False,1
738540427536519168,fisv,2016-06-03 01:18:00,chters added following today payx unh mdt trip current trades trailing stops amat low mxl ca fisv qqq tasr tmo etc,4.0,1.0,6842.0,1253.0,False,1
738513131484422144,fisv,2016-06-02 23:30:00,keltner,0.0,0.0,4802.0,2533.0,False,1
738491674456784896,fisv,2016-06-02 22:05:00,well interesting fisv,0.0,0.0,12997.0,12791.0,False,1
738491419082379269,fisv,2016-06-02 22:04:00,well interesting fisv,0.0,0.0,4459.0,4.0,False,1
738491418973347840,fisv,2016-06-02 22:04:00,fisv chart well interesting,0.0,0.0,297.0,91.0,False,1
738460201616068608,fisv,2016-06-02 20:00:00,nasdaq100 trend bmrn dish alxn celg trip vrtx wfm amgn esrx ctxs fisv mnst ulta incy,0.0,0.0,871.0,7.0,False,0
738443965528219648,fisv,2016-06-02 18:55:00,fiserv inc fisv receives consensus rating “hold” analysts,0.0,0.0,514.0,6.0,False,1
738443551583899648,fisv,2016-06-02 18:53:00,fiserv inc fisv receives consensus rating “hold” analysts,0.0,0.0,1164.0,58.0,False,0
738429906195996672,fisv,2016-06-02 17:59:00,fiserv inc fisv reaches new 12 month high dollars 06.29,0.0,0.0,1072.0,11.0,False,1
738429456516321280,fisv,2016-06-02 17:57:00,fiserv inc fisv reaches new 12 month high dollars 06.29,0.0,0.0,6319.0,2292.0,False,1
738406589032341504,fisv,2016-06-02 16:27:00,rt semiconductor oriented technology stocks fisvklaclrcx breaking above resistance extending intermediate uptrends …,0.0,1.0,1194.0,2055.0,True,1
738406554144104448,fisv,2016-06-02 16:26:00,semiconductor oriented technology stocks fisvklaclrcx breaking above resistance extending intermediate uptrends,0.0,1.0,2068.0,343.0,False,1
738403521133875200,fisv,2016-06-02 16:14:00,technical action p 500 stocks noon bullish breakouts rl abbv aet cah esrx humunh watrtn fisv klac lrcx,1.0,0.0,2068.0,343.0,False,0
738397745959034882,fisv,2016-06-02 15:51:00,nasdaq100 trend bmrn dish alxn esrx amgn mnst wfm ulta wdc vrtx biib dltr fisv lrcx regn,0.0,0.0,870.0,7.0,False,0
738395620122054656,fisv,2016-06-02 15:43:00,52 week high alert trading today’s movement fiserv fisv,0.0,0.0,2290.0,2.0,False,1
738383862280097793,fisv,2016-06-02 14:56:00,fiserv inc stock testing highs fisv,0.0,0.0,195.0,6.0,False,1
738367188176932866,fisv,2016-06-02 13:50:00,carderock capital management inc sells 572 shares fiserv inc fisv,0.0,0.0,2204.0,11.0,False,1
738366949508456449,fisv,2016-06-02 13:49:00,fiserv hits 1 year high,0.0,0.0,51.0,3.0,False,0
738366845502291968,fisv,2016-06-02 13:49:00,northern oak wealth management inc dollars 149000 stake fiserv inc fisv,0.0,0.0,766.0,8.0,False,0
738350483224571904,fisv,2016-06-02 12:44:00,manchester capital management llc dollars 26000 position fiserv inc fisv,0.0,0.0,415.0,10.0,False,1
738262636781916161,fisv,2016-06-02 06:55:00,ty 4 rt greater rt stock watch greater burl eght fisv fn nvee nvro orbk osur sanm simo tech ulta wb,0.0,0.0,53125.0,52337.0,False,1
738232217655074816,fisv,2016-06-02 04:54:00,rthx greater stock watch greater burl eght fisv fn nvee nvro orbk osur sanm simo tech ulta wb,2.0,0.0,53119.0,52236.0,False,0
738189013467570176,fisv,2016-06-02 02:02:00,nothing see fisv,0.0,0.0,4450.0,4.0,False,0
738189013350113280,fisv,2016-06-02 02:02:00,fisv chart nothing see,0.0,0.0,295.0,91.0,False,0
738186225379512320,fisv,2016-06-02 01:51:00,rt stock watch greater burl eght fisv fn nvee nvro orbk osur sanm simo tech ulta wb,0.0,2.0,106.0,60.0,True,0
738184412064587778,fisv,2016-06-02 01:44:00,cmf improving,0.0,0.0,4794.0,2533.0,False,1
738171121363623937,fisv,2016-06-02 00:51:00,rt stock watch greater burl eght fisv fn nvee nvro orbk osur sanm simo tech ulta wb,0.0,1.0,576.0,523.0,True,1
738170528632995843,fisv,2016-06-02 00:49:00,stock watch greater burl eght fisv fn nvee nvro orbk osur sanm simo tech ulta wb,3.0,2.0,53116.0,52235.0,False,1
738151632832102400,fisv,2016-06-01 23:33:00,fiserv inc fisv insider rahul gupta sells 28603 shares,0.0,0.0,764.0,8.0,False,1
738143251262279681,fisv,2016-06-01 23:00:00,fisv insider trading latest insider trasanction gupta rahul group president,0.0,0.0,5.0,0.0,False,1
738140217685614592,fisv,2016-06-01 22:48:00,fisv insider trading latest insider trasanction gupta rahul group president,0.0,0.0,5.0,0.0,False,0
738123267882504192,fisv,2016-06-01 21:41:00,fisv new insider transaction fisv group president,0.0,0.0,512.0,0.0,False,0
738035365785767936,fisv,2016-06-01 15:51:00,nasdaq100 trend wfm dish vrtx ulta esrx mdlz cern amzn cmcsa biib dltr regn mxim ca fisv,0.0,0.0,870.0,7.0,False,1
738009633072291840,fisv,2016-06-01 14:09:00,fiserv inc fisv shares bought nisa investment advisors l l c,0.0,0.0,415.0,10.0,False,1
738008672060747777,fisv,2016-06-01 14:05:00,boussard gavaudan investment management llp decreases position fiserv inc fisv,0.0,0.0,1159.0,58.0,False,0
738008017732505600,fisv,2016-06-01 14:03:00,boussard gavaudan investment management llp decreases position fiserv inc fisv,0.0,0.0,506.0,6.0,False,1
738005499451461632,fisv,2016-06-01 13:53:00,fiserv inc fisv shares sold btc capital management inc,0.0,0.0,415.0,10.0,False,0
738003657065701376,fisv,2016-06-01 13:45:00,fisv fiserv inc shares sold btc capital management inc,0.0,0.0,632.0,5.0,False,1
738003526891233280,fisv,2016-06-01 13:45:00,fisv fiserv inc shares sold btc capital management inc,0.0,0.0,165.0,0.0,False,1
737994693896704000,fisv,2016-06-01 13:10:00,fisv fiserv present bairds 2016 global consumer technology services conference stock news alerts app,0.0,0.0,1193.0,10.0,False,0
737974361244631041,fisv,2016-06-01 11:49:00,latest triggered trades review,2.0,0.0,6836.0,1253.0,False,1
737829480752783360,fisv,2016-06-01 02:13:00,stock watch greater greater greater aeis cprt dltr ebs eri fisv mmc msci orbk ppbi sanm,0.0,0.0,53021.0,52354.0,False,1
737776214392340480,fisv,2016-05-31 22:42:00,parabolic sar buy,0.0,0.0,4790.0,2535.0,False,1
737750492084723712,fisv,2016-05-31 20:59:00,monthly recap 28 long positions acgl atr azo bcr bdx bf b brk casy chd cni dhr ecl enb fisv gww,0.0,0.0,11140.0,26.0,False,1
737735389016936448,fisv,2016-05-31 19:59:00,nasdaq100 trend vrtx biib mu dltr dish amgn ebay celg fisv ulta viab wdc amzn nxpi regn,0.0,0.0,866.0,7.0,False,0
737727613314072580,fisv,2016-05-31 19:29:00,,0.0,0.0,272.0,40.0,False,1
737703608695803904,fisv,2016-05-31 17:53:00,fisv 3 open suited signals indicate continued price increase 11 days,0.0,0.0,242.0,471.0,False,1
737685496185376768,fisv,2016-05-31 16:41:00,texas permanent school fund sells 4052 shares fiserv inc fisv,0.0,0.0,502.0,6.0,False,1
737685105343377408,fisv,2016-05-31 16:40:00,texas permanent school fund sells 4052 shares fiserv inc fisv,0.0,0.0,1156.0,58.0,False,1
737672958584442880,fisv,2016-05-31 15:51:00,nasdaq100 trend vrtx mu biib dltr bmrn cern dish alxn akam ebay amgn celg viab fisv ulta,0.0,0.0,865.0,7.0,False,0
737668489847181312,fisv,2016-05-31 15:34:00,jag capital management llc dollars 049000 position fiserv inc fisv,0.0,0.0,986.0,0.0,False,1
737656811130654720,fisv,2016-05-31 14:47:00,buffington mohr mcneal dollars 979000 stake fiserv inc fisv,0.0,0.0,2190.0,11.0,False,1
737656136732704769,fisv,2016-05-31 14:45:00,5711 shares fiserv inc fisv acquired mn services vermogensbeheer b v,0.0,0.0,986.0,0.0,False,1
737577078569107456,fisv,2016-05-31 09:30:00,fiserv inc fisv director sells dollars 31563.76 stock,0.0,0.0,502.0,6.0,False,1
737576997061197825,fisv,2016-05-31 09:30:00,fiserv inc fisv director sells dollars 31563.76 stock,0.0,0.0,1156.0,58.0,False,1
737525820470616064,fisv,2016-05-31 06:07:00,,0.0,0.0,267.0,40.0,False,1
737298957135536128,fisv,2016-05-30 15:05:00,23600 shares fiserv inc fisv acquired new century investment management inc,0.0,0.0,987.0,0.0,False,1
737290840381476865,fisv,2016-05-30 14:33:00,fiserv inc fisv position lowered albert mason inc,0.0,0.0,987.0,0.0,False,1
737290572159946752,fisv,2016-05-30 14:32:00,arvest bank trust division raises stake fiserv inc fisv,0.0,0.0,755.0,8.0,False,1
736957848215638016,fisv,2016-05-29 16:30:00,,0.0,0.0,113.0,40.0,False,1
736862622268686336,fisv,2016-05-29 10:11:00,hills bank trust co dollars 010000 stake fiserv inc fisv,0.0,0.0,1151.0,58.0,False,1
736858324478623744,fisv,2016-05-29 09:54:00,hills bank trust co dollars 010000 stake fiserv inc fisv,0.0,0.0,499.0,6.0,False,1
736849281659883520,fisv,2016-05-29 09:18:00,chesley taft associates llc dollars 560000 stake fiserv inc fisv,0.0,0.0,412.0,10.0,False,0
736849204115431424,fisv,2016-05-29 09:18:00,fisv chesley taft associates llc dollars 560000 stake fiserv inc,0.0,0.0,631.0,5.0,False,1
736849075773935616,fisv,2016-05-29 09:18:00,fisv chesley taft associates llc dollars 560000 stake fiserv inc,0.0,0.0,164.0,0.0,False,1
736339002693799936,fisv,2016-05-27 23:31:00,,0.0,0.0,267.0,40.0,False,1
736323886162272260,fisv,2016-05-27 22:31:00,nomura asset management co ltd sells 1474 shares fiserv inc fisv,0.0,0.0,755.0,8.0,False,0
736235302570708992,fisv,2016-05-27 16:39:00,rt j donald sherman acquires 2000 shares fiserv inc fisv stock,0.0,1.0,1285.0,542.0,True,1
736235262569644032,fisv,2016-05-27 16:38:00,rt wendell david associates inc dollars 0659000 position fiserv inc fisv,0.0,1.0,1285.0,542.0,True,0
736235233830264833,fisv,2016-05-27 16:38:00,rt peddock capital advisors llc dollars 278000 position fiserv inc fisv,0.0,1.0,1285.0,542.0,True,0
736235186392694786,fisv,2016-05-27 16:38:00,rt fiserv inc fisv director kim robak sells 5096 shares stock,0.0,1.0,1285.0,542.0,True,0
736235137893990401,fisv,2016-05-27 16:38:00,rt wilbanks smith thomas asset management llc lowers stake fiserv inc fisv,0.0,1.0,1285.0,542.0,True,1
736235127580168192,fisv,2016-05-27 16:38:00,rt douglas lane associates llc purchases shares 3875 fiserv inc fisv,0.0,1.0,1285.0,542.0,True,0
736219481794596864,fisv,2016-05-27 15:36:00,douglas lane associates llc purchases shares 3875 fiserv inc fisv,0.0,1.0,2192.0,11.0,False,1
736219472118353920,fisv,2016-05-27 15:36:00,duncker streett co inc dollars 858000 position fiserv inc fisv,0.0,0.0,2191.0,11.0,False,1
736210823274766336,fisv,2016-05-27 15:01:00,wilbanks smith thomas asset management llc lowers stake fiserv inc fisv,0.0,1.0,756.0,8.0,False,1
736207605698334720,fisv,2016-05-27 14:49:00,fiserv inc fisv director kim robak sells 5096 shares stock,0.0,1.0,982.0,0.0,False,0
736207604125437953,fisv,2016-05-27 14:49:00,fiserv inc fisv director kim robak sells 5096 shares stock,0.0,0.0,982.0,0.0,False,1
735970340443193344,fisv,2016-05-26 23:06:00,fisv new insider transaction fisv director,0.0,0.0,505.0,0.0,False,1
735968855911223297,fisv,2016-05-26 23:00:00,fisv new sec documents fiserv inc stock news alerts app,0.0,0.0,1180.0,10.0,False,1
735954080212750341,fisv,2016-05-26 22:01:00,,0.0,0.0,264.0,40.0,False,0
735867434515718145,fisv,2016-05-26 16:17:00,sadoff investment management llc lowers position fiserv inc fisv,0.0,0.0,1052.0,11.0,False,0
735857243116081152,fisv,2016-05-26 15:36:00,lcnb national bank selects cafn cachet financial solutions’ easy secure mobile deposit solution,0.0,0.0,1286.0,541.0,False,1
735648923323400193,fisv,2016-05-26 01:49:00,stifel financial corp sells 7511 shares fiserv inc fisv,0.0,0.0,755.0,8.0,False,0
735567392198131713,fisv,2016-05-25 20:25:00,hrl trending today following cfo resignation tel fisv eqix chtr,0.0,0.0,13318.0,742.0,False,1
735567269544230913,fisv,2016-05-25 20:24:00,hrl trending today following cfo resignation tel fisv eqix chtr,0.0,0.0,302.0,13.0,False,1
735557781973913600,fisv,2016-05-25 19:46:00,jd sinking sec probe baba pxd hrl tel fisv,0.0,0.0,13318.0,742.0,False,0
735557737267011585,fisv,2016-05-25 19:46:00,jd sinking sec probe baba pxd hrl tel fisv,0.0,0.0,302.0,13.0,False,1
735536431247073280,fisv,2016-05-25 18:22:00,umb bank n mo dollars 478000 position fiserv inc fisv,0.0,0.0,502.0,6.0,False,1
735530050590756864,fisv,2016-05-25 17:56:00,cohen lawrence b dollars 13000 stake fiserv inc fisv,0.0,0.0,408.0,10.0,False,1
735528293793927173,fisv,2016-05-25 17:49:00,umb bank n mo dollars 478000 position fiserv inc fisv,0.0,0.0,1148.0,58.0,False,0
735519442323537922,fisv,2016-05-25 17:14:00,fiserv inc fisv legacy private trust co ’s 9 largest position,0.0,0.0,981.0,0.0,False,0
735420535434149888,fisv,2016-05-25 10:41:00,,0.0,0.0,113.0,40.0,False,1
735408826191622145,fisv,2016-05-25 09:55:00,fisv wall street analysts bullish fisvs earnings growth,0.0,0.0,277.0,0.0,False,0
735299527544967170,fisv,2016-05-25 02:40:00,fisv one steadiest charts market days im waiting another 200 simple moving average pullback alert set,0.0,0.0,5085.0,523.0,False,1
735262890614259712,fisv,2016-05-25 00:15:00,norges bank acquires new position fiserv inc fisv,0.0,0.0,499.0,6.0,False,1
735262480516153344,fisv,2016-05-25 00:13:00,norges bank acquires new position fiserv inc fisv,0.0,0.0,1149.0,58.0,False,1
735241100802306048,fisv,2016-05-24 22:48:00,dnb asset management dollars 700000 position fiserv inc fisv,0.0,0.0,6302.0,2292.0,False,1
735237968877752320,fisv,2016-05-24 22:36:00,dnb asset management dollars 700000 position fiserv inc fisv,0.0,0.0,1047.0,11.0,False,1
735203457242521600,fisv,2016-05-24 20:18:00,no trades today currently 183.6 percent net long…ended day up 2.40 percent thanks casy positive 3.4 percent jjsf positive 2.6 percent azo positive 2.5 percent fisv positive 2.5 percent,1.0,0.0,11144.0,25.0,False,1
735189088538480644,fisv,2016-05-24 19:21:00,calls still sit oi fisv,0.0,0.0,4335.0,4.0,False,1
735189088412667904,fisv,2016-05-24 19:21:00,fisv chart calls still sit oi,0.0,0.0,279.0,87.0,False,0
