Tweet Id,Ticker,Datetime,Text,Favs,RTs,Followers,Following,Is a RT,Sentiment
730482197103321088,fisv,2016-05-11 19:38:00,rt legacy vs emerging data processors vs marketplace lenders 1 year performance fis fisv gpn lc ondk ht…,0.0,1.0,36.0,60.0,True,1
730479554238808064,fisv,2016-05-11 19:27:00,q3 2016 eps estimates fiserv inc increased jefferies group fisv,0.0,0.0,1027.0,11.0,False,0
730473163012759553,fisv,2016-05-11 19:02:00,stc fisv june 100 95 1 times 2 ps 15 calls positive 23 calls put closer june trade,0.0,0.0,27179.0,253.0,False,1
730471265090347008,fisv,2016-05-11 18:54:00,fisv 100 puts buying activity expiring 17 jun volume 399,0.0,0.0,1336.0,30.0,False,1
730461059975360512,fisv,2016-05-11 18:14:00,fis stock keeps building breakout ceo comments guidance lead upgrade,0.0,0.0,771.0,81.0,False,1
730460468800794624,fisv,2016-05-11 18:12:00,fisv bullish analyst action argus research fiserv,0.0,0.0,289.0,0.0,False,1
730438622550183936,fisv,2016-05-11 16:45:00,rt 3 best performing p 500 technology stocks ytd traditional data processors fis positive 21.9 percent fisv positive 15.4 percent …,0.0,2.0,12507.0,3310.0,True,1
730425135325454336,fisv,2016-05-11 15:51:00,nasdaq100 trend ea amzn esrx tmus adbe chtr fisv trip mdlz ctsh cmcsa disca vrtx intu,0.0,0.0,854.0,7.0,False,1
730424777752596480,fisv,2016-05-11 15:50:00,years founded fidelity national fis 1968 fiserv fisv 1984 global payments gpn 1967 lendingclub lc 2006 deck ondk 2006,0.0,0.0,827.0,619.0,False,1
730423847657279488,fisv,2016-05-11 15:46:00,legacy vs emerging data processors vs marketplace lenders 1 year performance fis fisv gpn lc ondk,2.0,1.0,832.0,619.0,False,1
730420091117031424,fisv,2016-05-11 15:31:00,rt 3 best performing p 500 technology stocks ytd traditional data processors fis positive 21.9 percent fisv positive 15.4 percent …,0.0,1.0,2722.0,55.0,True,1
730419746907131905,fisv,2016-05-11 15:30:00,portfolio stocks high domestic sales share,0.0,0.0,2862.0,29.0,False,0
730419658810134535,fisv,2016-05-11 15:29:00,3 best performing p 500 technology stocks ytd traditional data processors fis positive 21.9 percent fisv positive 15.4 percent gpn positive 15.2 percent,1.0,2.0,831.0,619.0,False,1
730403595728883712,fisv,2016-05-11 14:26:00,fiserv inc stock testing highs fisv,0.0,0.0,182.0,6.0,False,1
730395552110784513,fisv,2016-05-11 13:54:00,fiserv hits 1 year high,0.0,0.0,36.0,3.0,False,1
730384024452075520,fisv,2016-05-11 13:08:00,fisv fiserv host annual meeting shareholders may 18 2016 stock news alerts app,0.0,0.0,1167.0,10.0,False,1
730382143780696068,fisv,2016-05-11 13:00:00,fisv prologue financials fiserv brings greater speed accuracy efficiency financial accounting stock news alerts app,0.0,0.0,1167.0,10.0,False,1
730370995379445760,fisv,2016-05-11 12:16:00,rt trades ideas may 11 spx ea swhc pii cp tsn fisv rcl ctrp gild wfm ba rai moneyflip,0.0,1.0,1114.0,120.0,True,0
730367375334313984,fisv,2016-05-11 12:02:00,spx ea swhc pii cp tsn fisv rcl ctrp gild wfm ba rai,0.0,0.0,374.0,113.0,False,1
730362064070414336,fisv,2016-05-11 11:41:00,rt 5 stocks rsi above 40 great increase relative strength psa ess spg avb fisv,0.0,4.0,1176.0,2172.0,True,1
730337283455471616,fisv,2016-05-11 10:02:00,weekly p500 trend jec disca mlm vrtx dnb luk ctsh fisv cb exr mac iff ess nwl cpb,0.0,0.0,854.0,7.0,False,1
730337142484942848,fisv,2016-05-11 10:01:00,weekly nasdaq100 trend disca vrtx ctsh fisv amzn mdlz tmus cmcsa esrx payx trip mnst adbe,0.0,0.0,854.0,7.0,False,1
730337073350230016,fisv,2016-05-11 10:01:00,weekly nasdaq100 performance disca vrtx ctsh fisv ilmn atvi wfm amzn mnst googl ntes,0.0,0.0,854.0,7.0,False,1
730328465145245696,fisv,2016-05-11 09:27:00,q2 2016 eps estimates fiserv inc lifted analyst fisv,0.0,0.0,403.0,10.0,False,0
730328444937117696,fisv,2016-05-11 09:27:00,q2 2016 earnings forecast fiserv inc issued first analysis fisv,0.0,0.0,1025.0,11.0,False,1
730328443443937280,fisv,2016-05-11 09:27:00,q2 2016 earnings forecast fiserv inc issued first analysis fisv,0.0,0.0,1025.0,11.0,False,0
730245406534291456,fisv,2016-05-11 03:57:00,rt todays time new highs dollars .00 closed up least 1.10 times adv50 ►►► incl jnj am…,0.0,1.0,7304.0,2895.0,True,1
730243633664786432,fisv,2016-05-11 03:50:00,todays time new highs dollars .00 closed up least 1.10 times adv50 ►►► incl jnj amzn fisv bdx etc,0.0,1.0,51231.0,50565.0,False,0
730243561686454273,fisv,2016-05-11 03:50:00,rt 5 stocks rsi above 40 great increase relative strength psa ess spg avb fisv,0.0,3.0,91.0,266.0,True,1
730236343058575360,fisv,2016-05-11 03:21:00,trades ideas may 11 spx ea swhc pii cp tsn fisv rcl ctrp gild wfm ba rai moneyflip,0.0,1.0,375.0,113.0,False,1
730204829902098435,fisv,2016-05-11 01:16:00,fisv closed up 1.86 percent making long top picks yesterday see recent,0.0,0.0,92.0,185.0,False,1
730195095539093504,fisv,2016-05-11 00:37:00,rt 5 stocks rsi above 40 great increase relative strength psa ess spg avb fisv,0.0,2.0,385.0,605.0,True,0
730189184774836224,fisv,2016-05-11 00:14:00,fisv bullish analyst action argus research fiserv,0.0,0.0,290.0,0.0,False,0
730187502334685185,fisv,2016-05-11 00:07:00,ascending ttb,0.0,0.0,4642.0,2563.0,False,1
730175646710763524,fisv,2016-05-10 23:20:00,rt 5 stocks rsi above 40 great increase relative strength psa ess spg avb fisv,0.0,1.0,362.0,1072.0,True,1
730174491511263232,fisv,2016-05-10 23:15:00,5 stocks rsi above 40 great increase relative strength psa ess spg avb fisv,1.0,4.0,14692.0,1417.0,False,0
730166883220099072,fisv,2016-05-10 22:45:00,fisv us fiserv inc fisv stake held eulav asset management inc,0.0,0.0,2748.0,276.0,False,1
730166803029213184,fisv,2016-05-10 22:45:00,fisv new sec documents fiserv inc stock news alerts app,0.0,0.0,1167.0,10.0,False,1
730163497213014016,fisv,2016-05-10 22:31:00,fisv new insider transaction fisv director,0.0,0.0,485.0,0.0,False,0
730140382013444100,fisv,2016-05-10 21:00:00,bullish big mac bullish occurred 0 pm may 10 dollars 05.56 fiserv inc fisv fisv,0.0,0.0,132.0,3.0,False,1
730132135156318209,fisv,2016-05-10 20:27:00,rt no trades today currently 165.1 percent net long…ended day up 1.69 percent thanks enb positive 3.8 percent cni positive 2.4 percent fisv positive 1.9 percent a…,0.0,1.0,33.0,2129.0,True,1
730131532879265792,fisv,2016-05-10 20:24:00,no trades today currently 165.1 percent net long…ended day up 1.69 percent thanks enb positive 3.8 percent cni positive 2.4 percent fisv positive 1.9 percent rop positive 1.6 percent,0.0,1.0,11142.0,25.0,False,1
730105079441833984,fisv,2016-05-10 18:39:00,robert w baird reiterates “hold” rating fiserv inc fisv,0.0,0.0,928.0,0.0,False,1
730067495135121408,fisv,2016-05-10 16:10:00,qtwo quick look multiples jkhy fisv shows nice future second quarter maintain high level execution thus far,0.0,0.0,64.0,225.0,False,1
730049804458295296,fisv,2016-05-10 15:00:00,bullish big mac bullish occurred 5 may 10 dollars 04.91 fiserv inc fisv fisv,0.0,0.0,132.0,3.0,False,1
730037064750628865,fisv,2016-05-10 14:09:00,stocks hitting 52 week highs mlm algn crvl fisv,0.0,0.0,134.0,145.0,False,0
730032012099239937,fisv,2016-05-10 13:49:00,fiserv hits 1 year high,0.0,0.0,34.0,3.0,False,1
730025731133181953,fisv,2016-05-10 13:24:00,fiserv inc post third quarter 2016 earnings dollars .15 per share northcoast research forecasts fisv,0.0,0.0,930.0,0.0,False,0
730024955233062914,fisv,2016-05-10 13:21:00,suntrust weighs fiserv inc’s third quarter 2016 earnings fisv,0.0,0.0,1010.0,11.0,False,1
730024954318704640,fisv,2016-05-10 13:21:00,suntrust weighs fiserv inc’s third quarter 2016 earnings fisv,0.0,0.0,1010.0,11.0,False,1
730021221270753280,fisv,2016-05-10 13:06:00,top performing p 500 stocks 2016 fis positive 18.3 percent fb positive 13.9 percent fisv positive 13.3 percent gpn positive 13.2 percent yhoo positive 11.8 percent acn positive 10.5 percent pypl positive 9.5 percent,1.0,0.0,825.0,618.0,False,1
730013371093889024,fisv,2016-05-10 12:35:00,cubist systematic strategies llc acquires 62695 shares fiserv inc fisv,0.0,0.0,396.0,10.0,False,1
729994722433851392,fisv,2016-05-10 11:21:00,,0.0,0.0,104.0,40.0,False,0
729974917257691136,fisv,2016-05-10 10:02:00,weekly p500 trend jec hcn exr atvi hcp ice vrtx vmc udr mac ess aiv fisv avb pki,0.0,0.0,853.0,7.0,False,1
729974773812498433,fisv,2016-05-10 10:02:00,weekly nasdaq100 trend atvi vrtx fisv dltr rost amzn mdlz ctsh esrx mnst alxn fb trip,0.0,0.0,853.0,7.0,False,0
729974704224804865,fisv,2016-05-10 10:01:00,weekly nasdaq100 performance atvi vrtx fisv wfm ilmn ctsh ea alxn googl yhoo dltr lmca,0.0,0.0,853.0,7.0,False,1
729972977593421824,fisv,2016-05-10 09:54:00,fiserv inc fisv post second quarter 2016 earnings dollars .09 per share first analysis forecasts,0.0,0.0,931.0,0.0,False,1
729972866909876225,fisv,2016-05-10 09:54:00,fiserv inc fisv post second quarter 2016 earnings dollars .09 per share first analysis forecasts,0.0,0.0,711.0,8.0,False,1
729938917714202624,fisv,2016-05-10 07:39:00,fiserv inc fisv upgraded buy argus,0.0,0.0,712.0,8.0,False,1
729930630050484225,fisv,2016-05-10 07:06:00,fiserv inc fisv stake held eulav asset management,0.0,0.0,1008.0,11.0,False,0
729930117653377024,fisv,2016-05-10 07:04:00,fiserv inc fisv stake held eulav asset management,0.0,0.0,6221.0,2293.0,False,1
729929975659409412,fisv,2016-05-10 07:04:00,fisv bullish analyst action argus research fiserv,0.0,0.0,290.0,0.0,False,1
729868578430832641,fisv,2016-05-10 03:00:00,sell signal detected 10 stocks ggp fisv cinf eix wec vrtx lb cpb clf jwn,0.0,0.0,219.0,192.0,False,1
729835617941630976,fisv,2016-05-10 00:49:00,letting winners run less heavy value like names fisv hrl bcr not equal wtd,0.0,0.0,26.0,91.0,False,0
729826159186206720,fisv,2016-05-10 00:11:00,10 moving average 50 moving average bull crossover es fisv hst,0.0,0.0,89.0,60.0,False,1
729808692997193728,fisv,2016-05-09 23:02:00,nasdaq100 trend vrtx rost dltr fisv atvi amzn mdlz esrx ctsh mnst alxn trip fb intu,0.0,0.0,853.0,7.0,False,1
729807596102791168,fisv,2016-05-09 22:57:00,stochastic overbought,0.0,0.0,4642.0,2565.0,False,1
729789568069808129,fisv,2016-05-09 21:46:00,fisv fintech worth look,0.0,0.0,452.0,1086.0,False,1
729780684424945666,fisv,2016-05-09 21:10:00,rt krispy kreme leads top stocks new high ground,0.0,1.0,2085.0,1998.0,True,0
729779515753410562,fisv,2016-05-09 21:06:00,krispy kreme leads top stocks new high ground,0.0,1.0,942.0,66.0,False,1
729770249889796096,fisv,2016-05-09 20:29:00,analyst upgrades,0.0,0.0,4643.0,2565.0,False,0
729765110969937921,fisv,2016-05-09 20:08:00,fiserv inc fisv hits new 12 month high dollars 04.21,0.0,0.0,1009.0,11.0,False,1
729764533426921472,fisv,2016-05-09 20:06:00,fiserv inc fisv hits new 12 month high dollars 04.21,0.0,0.0,6217.0,2293.0,False,1
729762797542903809,fisv,2016-05-09 19:59:00,nasdaq100 trend vrtx rost amzn dltr fisv ctsh atvi mdlz esrx nxpi mnst fb alxn trip,0.0,0.0,853.0,7.0,False,1
729757891071090688,fisv,2016-05-09 19:40:00,analyst upgrades,0.0,0.0,4644.0,2565.0,False,0
729748277122445313,fisv,2016-05-09 19:02:00,fisv bullish analyst action argus research fiserv,0.0,0.0,290.0,0.0,False,1
729739102073982978,fisv,2016-05-09 18:25:00,analyst upgrades,0.0,0.0,4644.0,2565.0,False,1
729730452735598593,fisv,2016-05-09 17:51:00,fisv 102.64 fiserv inc fisv added watch list right fisv watching last price 102.64 h,0.0,0.0,903.0,441.0,False,1
729715716237168640,fisv,2016-05-09 16:52:00,fiserv hits 1 year high,0.0,0.0,33.0,3.0,False,1
729710479665324032,fisv,2016-05-09 16:31:00,52 week high alert trading today’s movement fiserv fisv,0.0,0.0,2300.0,2.0,False,1
729704172669538304,fisv,2016-05-09 16:06:00,time highs note amt bcr bdx bgs chd fisv lmt mcd noc spg tmo wm,0.0,0.0,548.0,128.0,False,0
729702511490170885,fisv,2016-05-09 16:00:00,bullish big mac bullish occurred 5 may 09 dollars 03.86 fiserv inc fisv fisv,0.0,0.0,131.0,3.0,False,1
729700543669665796,fisv,2016-05-09 15:52:00,p500 trend hcp trip emc tsn hcn jec nwl stz fis cvs bcr bdx fisv syy pfe ice mdt,0.0,0.0,852.0,7.0,False,1
729700400119611393,fisv,2016-05-09 15:51:00,nasdaq100 trend trip fisv dltr atvi chtr mdlz vrtx esrx ctsh fb cmcsa mnst nxpi rost,0.0,0.0,852.0,7.0,False,0
729700056601788416,fisv,2016-05-09 15:50:00,rt analyst upgrades,0.0,1.0,944.0,3254.0,True,1
729699830994505729,fisv,2016-05-09 15:49:00,1 star analyst stephen biggar argus research upgraded rating fisv buy stephen negative 4.5 percent avg rtrn,0.0,0.0,290.0,106.0,False,1
729697467273379840,fisv,2016-05-09 15:40:00,analyst upgrades,1.0,1.0,4643.0,2566.0,False,1
729690341079691264,fisv,2016-05-09 15:11:00,fiserv inc fisv position increased kcg holdings inc,0.0,0.0,932.0,0.0,False,0
729688657796292609,fisv,2016-05-09 15:05:00,fisv breaking above dollars 03.53 positive earnings target dollars 09.55,0.0,0.0,155.0,5.0,False,0
729688592281440256,fisv,2016-05-09 15:04:00,ndaqsystems results fisv opened long dollars 8.50 closed todays dollars 02.85 positive 4.42 percent,0.0,0.0,3691.0,3369.0,False,1
729680881728643072,fisv,2016-05-09 14:34:00,analyst upgrades,0.0,0.0,4643.0,2566.0,False,0
729678297395646464,fisv,2016-05-09 14:23:00,technicals p 500 stocks 5 bullish breakouts stz tsn amt ctas cci acn emc fisv breakdowns mpc nbr,0.0,0.0,2023.0,343.0,False,1
729661066490220544,fisv,2016-05-09 13:15:00,analyst upgrades,0.0,0.0,4643.0,2567.0,False,1
729657677467418624,fisv,2016-05-09 13:02:00,watch list apol clne rlyp sina fisv byd glng aria bidu gold jd ha holx clvs jble mygn dis x,0.0,0.0,17.0,2.0,False,1
729655627576795137,fisv,2016-05-09 12:53:00,may 9 analyst upgrades downgrades depo fisv mo pcar cnp fis ulta fang wday vale bbt,0.0,0.0,1338.0,44.0,False,1
729654429356425217,fisv,2016-05-09 12:49:00,top upgrades amg bncn bokf cma cnp cof comm cwst depo eog fis fisv glng hbhc,0.0,0.0,19177.0,243.0,False,1
729643340740763649,fisv,2016-05-09 12:05:00,three top four performing p 500 technology stocks ytd traditional data processors fis fisv gpn,0.0,0.0,823.0,618.0,False,1
729639724944654336,fisv,2016-05-09 11:50:00,rt snn cnp depo comm wec fis glng cof pcar oke fisv mo cma hbhc bokf pb zion msl tcbi bncn …,0.0,1.0,214815.0,10799.0,True,0
729639344210763778,fisv,2016-05-09 11:49:00,snn cnp depo comm wec fis glng cof pcar oke fisv mo cma hbhc bokf pb zion msl tcbi bncn cwst,4.0,1.0,15820.0,332.0,False,1
729638317533204482,fisv,2016-05-09 11:45:00,fiserv inc upgrade argus ranked 13 buy fisv,0.0,0.0,544.0,45.0,False,1
729638314068746240,fisv,2016-05-09 11:45:00,p 500 tech sector ytd negative 3.3 percent best fis positive 17.6 percent fb positive 14.2 percent gpn positive 12.9 percent fisv positive 12.2 percent worst stx negative 48.0 percent wdc negative 37.9 percent mu negative 29.4 percent ads negative 26.3 percent,0.0,0.0,823.0,618.0,False,1
729636898390605824,fisv,2016-05-09 11:39:00,fiserv upgraded argus buy,0.0,0.0,4158.0,0.0,False,0
729636317504507904,fisv,2016-05-09 11:37:00,tech industry hot lately fisv,0.0,0.0,141.0,316.0,False,1
729634475475357697,fisv,2016-05-09 11:29:00,fiserv upgraded argus buy,0.0,0.0,4546.0,2839.0,False,1
729633703740223489,fisv,2016-05-09 11:26:00,fiserv remains top fintech pick,1.0,0.0,1054.0,30.0,False,1
729633678045876224,fisv,2016-05-09 11:26:00,rt seekingalpha fiserv remains top fintech pick,0.0,0.0,8604.0,4.0,False,0
729629206540226560,fisv,2016-05-09 11:08:00,bullish macd price greater 20.00 21 dma volume greater 500 thousand ½ gis fisv avy tdc kar stag masi spb ibp pam cce evhc mcd xray pki,0.0,0.0,733.0,62.0,False,1
729617724784181248,fisv,2016-05-09 10:23:00,northcoast research comments fiserv inc’s third quarter 2016 earnings fisv,0.0,0.0,1004.0,11.0,False,1
729617722867384320,fisv,2016-05-09 10:23:00,northcoast research comments fiserv inc’s third quarter 2016 earnings fisv,0.0,0.0,1004.0,11.0,False,0
729617256292962304,fisv,2016-05-09 10:21:00,northcoast research comments fiserv inc’s third quarter 2016 earnings fisv,0.0,0.0,6217.0,2293.0,False,1
729617249586315264,fisv,2016-05-09 10:21:00,northcoast research comments fiserv inc’s third quarter 2016 earnings fisv,0.0,0.0,6217.0,2293.0,False,0
729612517182418944,fisv,2016-05-09 10:02:00,weekly p500 trend tdc oke atvi jec pki syy aiv vtr avb ess kim mlm fisv ggp spg,0.0,0.0,852.0,7.0,False,1
729612373540130817,fisv,2016-05-09 10:02:00,weekly nasdaq100 trend atvi fisv mnst ctsh fb vrtx ntes amzn esrx disca tmus ulta nxpi,0.0,0.0,852.0,7.0,False,1
729612303688159232,fisv,2016-05-09 10:01:00,weekly nasdaq100 performance atvi lmca fisv ilmn ctsh disca ea wfm mnst googl mdlz amzn,0.0,0.0,852.0,7.0,False,1
729580898295877632,fisv,2016-05-09 07:56:00,fisv first analysis weighs fiserv incs second quarter 2016 earnings,0.0,0.0,6218.0,2293.0,False,0
729580826661404672,fisv,2016-05-09 07:56:00,research analysts set expectations fiserv inc’s second quarter 2016 earnings fisv,0.0,0.0,934.0,0.0,False,1
729333412083978240,fisv,2016-05-08 15:33:00,rt weekly weekend watchlist review,0.0,2.0,231.0,215.0,True,1
729322224281387008,fisv,2016-05-08 14:49:00,fisv wall street analysts bullish fisvs earnings growth,0.0,0.0,263.0,0.0,False,1
729309319196487680,fisv,2016-05-08 13:57:00,fisv,0.0,0.0,22.0,61.0,False,1
729290664790228992,fisv,2016-05-08 12:43:00,weekly weekend watchlist review,4.0,2.0,6774.0,1249.0,False,1
729139571766665216,fisv,2016-05-08 02:43:00,turn 💲500 💲5000💥 join ⤵ 📧 pennystockhotline com fisv flr fprx,0.0,0.0,2271.0,5001.0,False,1
729080872926875648,fisv,2016-05-07 22:50:00,fisv buy signal 98.96 may 04 16,0.0,0.0,319.0,5.0,False,0
729049637470896129,fisv,2016-05-07 20:45:00,,0.0,0.0,258.0,40.0,False,0
728948775050432512,fisv,2016-05-07 14:05:00,fisv us fiserv inc fisv shares bought qs investors llc inc,0.0,0.0,3350.0,248.0,False,1
728887819700178944,fisv,2016-05-07 10:02:00,weekly p500 trend tdc oke atvi jec pki syy aiv vtr avb mac ess kim mlm fisv ggp,0.0,0.0,852.0,7.0,False,0
728887649986068480,fisv,2016-05-07 10:02:00,weekly nasdaq100 trend atvi fisv mnst ctsh fb nxpi vrtx ntes amzn disca tmus yhoo mdlz,0.0,0.0,852.0,7.0,False,1
728887581149147136,fisv,2016-05-07 10:01:00,weekly nasdaq100 performance atvi lmca fisv ilmn ctsh disca ea wfm mnst googl mdlz amzn,0.0,0.0,852.0,7.0,False,1
728775659347058689,fisv,2016-05-07 02:37:00,biggest gainers today large caps atvi 8.48 percent dish 5.92 percent ctsh 5.14 percent fcx 4.43 percent pbr 4.01 percent nem 3.86 percent pbr 3.68 percent bsmx 3.51 percent fisv 3.42 percent,1.0,0.0,178.0,29.0,False,0
728741425391640576,fisv,2016-05-07 00:21:00,momentum stock watch mon dct fisv jec sncr yelp,0.0,0.0,231.0,117.0,False,0
728727075104927744,fisv,2016-05-06 23:24:00,well fisv ctsh body slammed cern go cws,1.0,0.0,26.0,91.0,False,0
728723664531787776,fisv,2016-05-06 23:10:00,rt nasdaq100 performance atvi dish ctsh fisv ea amzn disca vrtx nflx tsla mnst ctrp googl,0.0,1.0,816.0,2.0,True,1
728723635037409280,fisv,2016-05-06 23:10:00,rt p500 performance atvi tdc pki rig ctsh nrg fcx jec nwsa sni nem fisv chrw ea luk,0.0,1.0,571.0,11.0,True,1
728723380258639872,fisv,2016-05-06 23:09:00,voya investment management llc dollars 5141000 stake fiserv inc fisv,0.0,0.0,1011.0,11.0,False,1
728722919841538055,fisv,2016-05-06 23:07:00,voya investment management llc dollars 5141000 stake fiserv inc fisv,0.0,0.0,6220.0,2293.0,False,1
728721694244933633,fisv,2016-05-06 23:02:00,p500 trend atvi tdc pki jec fisv oke irm chd ecl mac mlm ess tss kim aiv ctas,0.0,0.0,853.0,7.0,False,1
728721622744629248,fisv,2016-05-06 23:02:00,p500 performance atvi tdc pki rig ctsh nrg fcx jec nwsa sni nem fisv chrw ea luk,0.0,1.0,853.0,7.0,False,1
728721550992642048,fisv,2016-05-06 23:02:00,nasdaq100 trend atvi fisv mnst ctsh fb nxpi vrtx ntes amzn disca tmus yhoo ctxs chtr,0.0,0.0,853.0,7.0,False,0
728721481224564736,fisv,2016-05-06 23:01:00,nasdaq100 performance atvi dish ctsh fisv ea amzn disca vrtx nflx tsla mnst ctrp googl,0.0,1.0,853.0,7.0,False,1
728719649681084416,fisv,2016-05-06 22:54:00,fiserv inc fisv trading up 3.1 percent following strong earnings,0.0,0.0,1011.0,11.0,False,0
728719082330165249,fisv,2016-05-06 22:52:00,fiserv inc fisv trading up 3.1 percent following strong earnings,0.0,0.0,6220.0,2293.0,False,1
728710290527891456,fisv,2016-05-06 22:17:00,ichimoku,0.0,0.0,4636.0,2572.0,False,1
728683557858648064,fisv,2016-05-06 20:31:00,no trades since …currently 167.1 percent net long ended day up 1.31 percent thanks fisv positive 3.4 percent chd positive 1.8 percent ecl positive 1.7 percent bf b positive 1.3 percent,0.0,0.0,11143.0,25.0,False,1
728683322793058304,fisv,2016-05-06 20:30:00,fiserv inc reiterated rating robert w baird ranked 18 hold fisv,0.0,0.0,545.0,45.0,False,1
728682168906620929,fisv,2016-05-06 20:25:00,fiservs hold rating reiterated robert w baird,0.0,0.0,4156.0,0.0,False,1
728681635948933121,fisv,2016-05-06 20:23:00,fiserv inc fisv stock rating reaffirmed robert w baird,0.0,0.0,375.0,10.0,False,1
728676823400337408,fisv,2016-05-06 20:04:00,fisv new sec filing fisv form 10 q no 0000798354 16 000008,0.0,0.0,134.0,6.0,False,1
728676575818842112,fisv,2016-05-06 20:03:00,quarterly report sections 13 15 days,0.0,0.0,290.0,27.0,False,1
728675943745761284,fisv,2016-05-06 20:00:00,fisv new sec documents fiserv inc stock news alerts app,0.0,0.0,1166.0,10.0,False,1
728675780327256064,fisv,2016-05-06 20:00:00,rt nasdaq100 performance atvi dish ctsh fisv ea ilmn amzn disca vrtx tsla ctrp nflx ntap,0.0,1.0,810.0,2.0,True,1
728675729504907265,fisv,2016-05-06 20:00:00,p500 performance tdc atvi pki rig ctsh fcx nrg nwsa sni jec nem fisv chrw luk nfx,0.0,0.0,853.0,7.0,False,0
728675656796622848,fisv,2016-05-06 19:59:00,nasdaq100 trend atvi fisv mnst ctsh fb nxpi mdlz ntes amzn disca tmus yhoo siri ctxs,0.0,0.0,853.0,7.0,False,0
728675587351564288,fisv,2016-05-06 19:59:00,nasdaq100 performance atvi dish ctsh fisv ea ilmn amzn disca vrtx tsla ctrp nflx ntap,1.0,1.0,853.0,7.0,False,1
728670348128993281,fisv,2016-05-06 19:38:00,fiserv inc fisv stock price up 3.1 percent earnings beat,0.0,0.0,375.0,10.0,False,0
728663887814508544,fisv,2016-05-06 19:13:00,fisv 1 million runaway 4 positive 3 percent .2 percent offhi newsearn alltfs trdvol 2 times 1 times tlm 2.0 ilm 1.4 opop positive 1.1 percent 1 week hi dyvol 1.47 million 1.1 times 1.3 times,0.0,0.0,6784.0,271.0,False,1
728649317376892928,fisv,2016-05-06 18:15:00,ctsh gpor nwsa sni fisv luk,0.0,0.0,305.0,361.0,False,1
728641960815284226,fisv,2016-05-06 17:45:00,fiserv hits 1 year high,0.0,0.0,34.0,2.0,False,0
728641228150026240,fisv,2016-05-06 17:43:00,fiserv inc fisv updates fy16 earnings guidance,0.0,0.0,1138.0,40.0,False,1
728613943686643712,fisv,2016-05-06 15:54:00,p500 performance tdc pki rig atvi fcx nem swn nfx ctsh nrg dvn sni mro fisv apc,0.0,0.0,853.0,7.0,False,1
728613873255911424,fisv,2016-05-06 15:54:00,nasdaq100 trend atvi fisv nxpi yhoo mnst fast chtr esrx mdlz vrtx disca fb ntes viab,0.0,0.0,853.0,7.0,False,1
728613804158930944,fisv,2016-05-06 15:54:00,nasdaq100 performance atvi ctsh dish fisv ilmn ntap ea fb mnst payx adp googl amzn,0.0,0.0,853.0,7.0,False,1
728607368230002689,fisv,2016-05-06 15:28:00,cant find bullish charts entire ndx 100 maybe fb fisv eqix krft viacom wfm pretty gross,0.0,0.0,44.0,84.0,False,1
728602721604014081,fisv,2016-05-06 15:10:00,fisv buy signal 98.96 may 04 16,0.0,0.0,316.0,5.0,False,1
728589821866713088,fisv,2016-05-06 14:18:00,fiserv fisv marked barbarian gate fisv,0.0,0.0,2250.0,1223.0,False,0
728587331654045696,fisv,2016-05-06 14:08:00,kidder stephen w purchases 7990 shares fiserv inc fisv,0.0,0.0,375.0,10.0,False,1
728577218335531008,fisv,2016-05-06 13:28:00,unusual call buying fisv 37 times average volume bax 11 times hcn 8 times lb 5 times trip 5 times aa 5 times abc 5 times cl 5 times,0.0,0.0,359.0,266.0,False,1
728569969227739136,fisv,2016-05-06 12:59:00,morning brief stephens releases research reports exp egn ens esv eog epe feye fisv fred,0.0,0.0,2070.0,466.0,False,0
728553414309728256,fisv,2016-05-06 11:54:00,large call buying,0.0,0.0,4627.0,2573.0,False,1
728512771831283712,fisv,2016-05-06 09:12:00,fiserv inc fisv announces earnings results beats expectations dollars .04 eps,0.0,0.0,942.0,0.0,False,0
728427809220104192,fisv,2016-05-06 03:34:00,large call buying,0.0,0.0,4626.0,2573.0,False,1
728418433486995456,fisv,2016-05-06 02:57:00,fiserv inc fisv updates fy16 earnings guidance,0.0,0.0,941.0,0.0,False,0
728417678550048769,fisv,2016-05-06 02:54:00,fiserv inc fisv updates fy16 earnings guidance,0.0,0.0,1013.0,11.0,False,0
728409998687088640,fisv,2016-05-06 02:24:00,fiserv inc fisv posts quarterly earnings results,0.0,0.0,1013.0,11.0,False,0
728406090371764225,fisv,2016-05-06 02:08:00,state tennessee treasury department raises stake fiserv inc fisv,0.0,0.0,374.0,10.0,False,1
728398603652304896,fisv,2016-05-06 01:38:00,fisv state tennessee treasury department raises stake fiserv inc,0.0,0.0,622.0,5.0,False,1
728398499004465152,fisv,2016-05-06 01:38:00,fisv state tennessee treasury department raises stake fiserv inc,0.0,0.0,159.0,0.0,False,1
728395589700882432,fisv,2016-05-06 01:26:00,,0.0,0.0,257.0,40.0,False,0
728376797134520320,fisv,2016-05-06 00:12:00,fiserv inc fisv updates fy16 earnings guidance,0.0,0.0,717.0,8.0,False,1
728365142161817600,fisv,2016-05-05 23:25:00,large call buying,0.0,0.0,4625.0,2574.0,False,0
728361428713910273,fisv,2016-05-05 23:11:00,50 day resistance,0.0,0.0,4625.0,2574.0,False,1
728351911200460800,fisv,2016-05-05 22:33:00,unusual option activity alert bax 40 times average daily volume fisv 28 times xme 22 times vrx 11 times abc 9 times trip 6 times wfm 6 times,0.0,0.0,359.0,266.0,False,1
728350130974265344,fisv,2016-05-05 22:26:00,fisv said internal revenue growth 4 percent first quarter 16 adjusted eps free cash flow per share grew 19 percent,0.0,0.0,348.0,18.0,False,0
728343277166977024,fisv,2016-05-05 21:59:00,fisv fiserv beats dollars .04 reports first quarter 1.33 billion rev line guides fy16 eps line,0.0,0.0,150.0,54.0,False,1
